    1 0.000000000 153.90.128.120 → 172.31.26.111 TCP 66 52812 → 22 [ACK] Seq=1 Ack=1 Win=1444 Len=0 TSval=970872924 TSecr=401225378
    2 0.000020649 153.90.128.120 → 172.31.26.111 TCP 66 52812 → 22 [ACK] Seq=1 Ack=61 Win=1444 Len=0 TSval=970872924 TSecr=401225378
    3 0.000043149 153.90.128.120 → 172.31.26.111 TCP 66 52812 → 22 [ACK] Seq=1 Ack=97 Win=1444 Len=0 TSval=970872924 TSecr=401225378
    4 0.000076585 153.90.128.120 → 172.31.26.111 TCP 66 52812 → 22 [ACK] Seq=1 Ack=349 Win=1443 Len=0 TSval=970872924 TSecr=401225378
    5 0.000094046 153.90.128.120 → 172.31.26.111 TCP 66 52812 → 22 [ACK] Seq=1 Ack=385 Win=1443 Len=0 TSval=970872924 TSecr=401225378
    6 0.006866755 172.31.26.111 → 34.215.93.126 SSL 168 Continuation Data
    7 0.010056411 172.31.26.111 → 153.90.128.120 SSH 126 Server: Encrypted packet (len=60)
    8 0.010445285 34.215.23.149 → 172.31.26.111 TCP 261 [TCP segment of a reassembled PDU]
    9 0.010456764 54.201.255.128 → 172.31.26.111 TCP 261 [TCP segment of a reassembled PDU]
   10 0.014355551 34.219.173.151 → 172.31.26.111 TCP 261 [TCP segment of a reassembled PDU]
   11 0.014689900 35.166.223.130 → 172.31.26.111 TCP 261 [TCP segment of a reassembled PDU]
   12 0.022988567 34.215.93.126 → 172.31.26.111 TCP 261 [TCP segment of a reassembled PDU]
   13 0.025814176 172.31.26.111 → 34.215.23.149 SSL 168 Continuation Data
   14 0.025980785 172.31.26.111 → 54.201.255.128 SSL 168 Continuation Data
   15 0.029530639 172.31.26.111 → 34.219.173.151 SSL 168 Continuation Data
   16 0.029862681 172.31.26.111 → 35.166.223.130 SSL 168 Continuation Data
   17 0.038182734 172.31.26.111 → 34.215.93.126 SSL 168 Continuation Data
   18 0.041965495 34.215.23.149 → 172.31.26.111 TCP 261 46238 → 27017 [PSH, ACK] Seq=196 Ack=103 Win=219 Len=195 TSval=1002822948 TSecr=3585029152 [TCP segment of a reassembled PDU]
   19 0.042021628 54.201.255.128 → 172.31.26.111 TCP 261 58264 → 27017 [PSH, ACK] Seq=196 Ack=103 Win=219 Len=195 TSval=1082796725 TSecr=1211567069 [TCP segment of a reassembled PDU]
   20 0.045483794 34.219.173.151 → 172.31.26.111 TCP 261 37944 → 27017 [PSH, ACK] Seq=196 Ack=103 Win=219 Len=195 TSval=1681513522 TSecr=910153217 [TCP segment of a reassembled PDU]
   21 0.045940040 35.166.223.130 → 172.31.26.111 TCP 261 34234 → 27017 [PSH, ACK] Seq=196 Ack=103 Win=219 Len=195 TSval=3970093615 TSecr=3598504578 [TCP segment of a reassembled PDU]
   22 0.054261320 34.215.93.126 → 172.31.26.111 TCP 261 36858 → 27017 [PSH, ACK] Seq=196 Ack=205 Win=219 Len=195 TSval=2681060190 TSecr=2712094939 [TCP segment of a reassembled PDU]
   23 0.057192655 172.31.26.111 → 34.215.23.149 SSL 168 Continuation Data
   24 0.057197582 172.31.26.111 → 54.201.255.128 SSL 168 Continuation Data
   25 0.058945888 153.90.128.120 → 172.31.26.111 TCP 66 52812 → 22 [ACK] Seq=1 Ack=445 Win=1444 Len=0 TSval=970872983 TSecr=401225437
   26 0.060675896 172.31.26.111 → 34.219.173.151 SSL 168 Continuation Data
   27 0.061131265 172.31.26.111 → 35.166.223.130 SSL 168 Continuation Data
   28 0.069452821 172.31.26.111 → 34.215.93.126 SSL 168 Continuation Data
   29 0.073225695 54.201.255.128 → 172.31.26.111 TCP 261 58264 → 27017 [PSH, ACK] Seq=391 Ack=205 Win=219 Len=195 TSval=1082796756 TSecr=1211567100 [TCP segment of a reassembled PDU]
   30 0.073301174 34.215.23.149 → 172.31.26.111 TCP 261 46238 → 27017 [PSH, ACK] Seq=391 Ack=205 Win=219 Len=195 TSval=1002822979 TSecr=3585029183 [TCP segment of a reassembled PDU]
   31 0.076744122 34.219.173.151 → 172.31.26.111 TCP 261 37944 → 27017 [PSH, ACK] Seq=391 Ack=205 Win=219 Len=195 TSval=1681513553 TSecr=910153249 [TCP segment of a reassembled PDU]
   32 0.077192397 35.166.223.130 → 172.31.26.111 TCP 261 34234 → 27017 [PSH, ACK] Seq=391 Ack=205 Win=219 Len=195 TSval=3970093646 TSecr=3598504609 [TCP segment of a reassembled PDU]
   33 0.085281605 34.215.93.126 → 172.31.26.111 TCP 261 36858 → 27017 [PSH, ACK] Seq=391 Ack=307 Win=219 Len=195 TSval=2681060221 TSecr=2712094970 [TCP segment of a reassembled PDU]
   34 0.088560760 172.31.26.111 → 34.215.23.149 SSL 168 Continuation Data
   35 0.088565396 172.31.26.111 → 54.201.255.128 SSL 168 Continuation Data
   36 0.091946958 172.31.26.111 → 34.219.173.151 SSL 168 Continuation Data
   37 0.092383094 172.31.26.111 → 35.166.223.130 SSL 168 Continuation Data
   38 0.100473137 172.31.26.111 → 34.215.93.126 SSL 168 Continuation Data
   39 0.104643966 54.201.255.128 → 172.31.26.111 TCP 261 58264 → 27017 [PSH, ACK] Seq=586 Ack=307 Win=219 Len=195 TSval=1082796788 TSecr=1211567132 [TCP segment of a reassembled PDU]
   40 0.104706394 34.215.23.149 → 172.31.26.111 TCP 261 46238 → 27017 [PSH, ACK] Seq=586 Ack=307 Win=219 Len=195 TSval=1002823011 TSecr=3585029214 [TCP segment of a reassembled PDU]
   41 0.107919851 34.219.173.151 → 172.31.26.111 TCP 261 37944 → 27017 [PSH, ACK] Seq=586 Ack=307 Win=219 Len=195 TSval=1681513584 TSecr=910153280 [TCP segment of a reassembled PDU]
   42 0.108479868 35.166.223.130 → 172.31.26.111 TCP 261 34234 → 27017 [PSH, ACK] Seq=586 Ack=307 Win=219 Len=195 TSval=3970093678 TSecr=3598504640 [TCP segment of a reassembled PDU]
   43 0.116382872 34.215.93.126 → 172.31.26.111 TCP 261 36858 → 27017 [PSH, ACK] Seq=586 Ack=409 Win=219 Len=195 TSval=2681060252 TSecr=2712095001 [TCP segment of a reassembled PDU]
   44 0.120026407 172.31.26.111 → 34.215.23.149 SSL 168 Continuation Data
   45 0.120194431 172.31.26.111 → 54.201.255.128 SSL 168 Continuation Data
   46 0.123121927 172.31.26.111 → 34.219.173.151 SSL 168 Continuation Data
   47 0.123680631 172.31.26.111 → 35.166.223.130 SSL 168 Continuation Data
   48 0.131599153 172.31.26.111 → 34.215.93.126 SSL 168 Continuation Data
   49 0.136209688 34.215.23.149 → 172.31.26.111 TCP 261 46238 → 27017 [PSH, ACK] Seq=781 Ack=409 Win=219 Len=195 TSval=1002823042 TSecr=3585029246 [TCP segment of a reassembled PDU]
   50 0.136226375 54.201.255.128 → 172.31.26.111 TCP 261 58264 → 27017 [PSH, ACK] Seq=781 Ack=409 Win=219 Len=195 TSval=1082796819 TSecr=1211567163 [TCP segment of a reassembled PDU]
   51 0.139036190 34.219.173.151 → 172.31.26.111 TCP 261 37944 → 27017 [PSH, ACK] Seq=781 Ack=409 Win=219 Len=195 TSval=1681513615 TSecr=910153311 [TCP segment of a reassembled PDU]
   52 0.139684408 35.166.223.130 → 172.31.26.111 TCP 261 34234 → 27017 [PSH, ACK] Seq=781 Ack=409 Win=219 Len=195 TSval=3970093709 TSecr=3598504672 [TCP segment of a reassembled PDU]
   53 0.147811677 34.215.93.126 → 172.31.26.111 TCP 261 36858 → 27017 [PSH, ACK] Seq=781 Ack=511 Win=219 Len=195 TSval=2681060283 TSecr=2712095032 [TCP segment of a reassembled PDU]
   54 0.151567377 172.31.26.111 → 34.215.23.149 SSL 168 Continuation Data
   55 0.151736687 172.31.26.111 → 54.201.255.128 SSL 168 Continuation Data
   56 0.154247360 172.31.26.111 → 34.219.173.151 SSL 168 Continuation Data
   57 0.154890118 172.31.26.111 → 35.166.223.130 SSL 168 Continuation Data
   58 0.163091879 172.31.26.111 → 34.215.93.126 SSL 168 Continuation Data
   59 0.167669647 54.201.255.128 → 172.31.26.111 TCP 261 58264 → 27017 [PSH, ACK] Seq=976 Ack=511 Win=219 Len=195 TSval=1082796851 TSecr=1211567195 [TCP segment of a reassembled PDU]
   60 0.167708595 34.215.23.149 → 172.31.26.111 TCP 261 46238 → 27017 [PSH, ACK] Seq=976 Ack=511 Win=219 Len=195 TSval=1002823074 TSecr=3585029277 [TCP segment of a reassembled PDU]
   61 0.170086253 34.219.173.151 → 172.31.26.111 TCP 261 37944 → 27017 [PSH, ACK] Seq=976 Ack=511 Win=219 Len=195 TSval=1681513646 TSecr=910153342 [TCP segment of a reassembled PDU]
   62 0.170975668 35.166.223.130 → 172.31.26.111 TCP 261 34234 → 27017 [PSH, ACK] Seq=976 Ack=511 Win=219 Len=195 TSval=3970093740 TSecr=3598504703 [TCP segment of a reassembled PDU]
   63 0.179222406 34.215.93.126 → 172.31.26.111 TCP 261 36858 → 27017 [PSH, ACK] Seq=976 Ack=613 Win=219 Len=195 TSval=2681060315 TSecr=2712095064 [TCP segment of a reassembled PDU]
   64 0.183014991 172.31.26.111 → 34.215.23.149 SSL 168 Continuation Data
   65 0.183182775 172.31.26.111 → 54.201.255.128 SSL 168 Continuation Data
   66 0.185287534 172.31.26.111 → 34.219.173.151 SSL 168 Continuation Data
   67 0.186173256 172.31.26.111 → 35.166.223.130 SSL 168 Continuation Data
   68 0.194465956 172.31.26.111 → 34.215.93.126 SSL 168 Continuation Data
   69 0.199199980 34.215.23.149 → 172.31.26.111 TCP 261 46238 → 27017 [PSH, ACK] Seq=1171 Ack=613 Win=219 Len=195 TSval=1002823105 TSecr=3585029309 [TCP segment of a reassembled PDU]
   70 0.199365792 54.201.255.128 → 172.31.26.111 TCP 261 58264 → 27017 [PSH, ACK] Seq=1171 Ack=613 Win=219 Len=195 TSval=1082796882 TSecr=1211567226 [TCP segment of a reassembled PDU]
   71 0.201499645 34.219.173.151 → 172.31.26.111 TCP 261 37944 → 27017 [PSH, ACK] Seq=1171 Ack=613 Win=219 Len=195 TSval=1681513678 TSecr=910153373 [TCP segment of a reassembled PDU]
   72 0.202296838 35.166.223.130 → 172.31.26.111 TCP 261 34234 → 27017 [PSH, ACK] Seq=1171 Ack=613 Win=219 Len=195 TSval=3970093772 TSecr=3598504734 [TCP segment of a reassembled PDU]
   73 0.210438813 34.215.93.126 → 172.31.26.111 TCP 261 36858 → 27017 [PSH, ACK] Seq=1171 Ack=715 Win=219 Len=195 TSval=2681060346 TSecr=2712095095 [TCP segment of a reassembled PDU]
   74 0.214558119 172.31.26.111 → 34.215.23.149 SSL 168 Continuation Data
   75 0.214725436 172.31.26.111 → 54.201.255.128 SSL 168 Continuation Data
   76 0.216676287 172.31.26.111 → 34.219.173.151 SSL 168 Continuation Data
   77 0.217500921 172.31.26.111 → 35.166.223.130 SSL 168 Continuation Data
   78 0.225679646 172.31.26.111 → 34.215.93.126 SSL 168 Continuation Data
   79 0.230820104 34.215.23.149 → 172.31.26.111 TCP 261 46238 → 27017 [PSH, ACK] Seq=1366 Ack=715 Win=219 Len=195 TSval=1002823137 TSecr=3585029340 [TCP segment of a reassembled PDU]
   80 0.230980978 54.201.255.128 → 172.31.26.111 TCP 261 58264 → 27017 [PSH, ACK] Seq=1366 Ack=715 Win=219 Len=195 TSval=1082796914 TSecr=1211567258 [TCP segment of a reassembled PDU]
   81 0.232660311 34.219.173.151 → 172.31.26.111 TCP 261 37944 → 27017 [PSH, ACK] Seq=1366 Ack=715 Win=219 Len=195 TSval=1681513709 TSecr=910153405 [TCP segment of a reassembled PDU]
   82 0.233635994 35.166.223.130 → 172.31.26.111 TCP 261 34234 → 27017 [PSH, ACK] Seq=1366 Ack=715 Win=219 Len=195 TSval=3970093803 TSecr=3598504765 [TCP segment of a reassembled PDU]
   83 0.241740295 34.215.93.126 → 172.31.26.111 TCP 261 36858 → 27017 [PSH, ACK] Seq=1366 Ack=817 Win=219 Len=195 TSval=2681060377 TSecr=2712095127 [TCP segment of a reassembled PDU]
   84 0.246186574 172.31.26.111 → 34.215.23.149 SSL 168 Continuation Data
   85 0.246191505 172.31.26.111 → 54.201.255.128 SSL 168 Continuation Data
   86 0.247837229 172.31.26.111 → 34.219.173.151 SSL 168 Continuation Data
   87 0.248832076 172.31.26.111 → 35.166.223.130 SSL 168 Continuation Data
   88 0.256937406 172.31.26.111 → 34.215.93.126 SSL 168 Continuation Data
   89 0.262470219 54.201.255.128 → 172.31.26.111 TCP 261 58264 → 27017 [PSH, ACK] Seq=1561 Ack=817 Win=219 Len=195 TSval=1082796945 TSecr=1211567289 [TCP segment of a reassembled PDU]
   90 0.262484232 34.215.23.149 → 172.31.26.111 TCP 261 46238 → 27017 [PSH, ACK] Seq=1561 Ack=817 Win=219 Len=195 TSval=1002823168 TSecr=3585029372 [TCP segment of a reassembled PDU]
   91 0.263786670 34.219.173.151 → 172.31.26.111 TCP 261 37944 → 27017 [PSH, ACK] Seq=1561 Ack=817 Win=219 Len=195 TSval=1681513740 TSecr=910153436 [TCP segment of a reassembled PDU]
   92 0.264917604 35.166.223.130 → 172.31.26.111 TCP 261 34234 → 27017 [PSH, ACK] Seq=1561 Ack=817 Win=219 Len=195 TSval=3970093834 TSecr=3598504797 [TCP segment of a reassembled PDU]
   93 0.272888284 34.215.93.126 → 172.31.26.111 TCP 261 36858 → 27017 [PSH, ACK] Seq=1561 Ack=919 Win=219 Len=195 TSval=2681060408 TSecr=2712095158 [TCP segment of a reassembled PDU]
   94 0.277785834 172.31.26.111 → 34.215.23.149 SSL 168 Continuation Data
   95 0.277791149 172.31.26.111 → 54.201.255.128 SSL 168 Continuation Data
   96 0.278976805 172.31.26.111 → 34.219.173.151 SSL 168 Continuation Data
   97 0.280087041 172.31.26.111 → 35.166.223.130 SSL 168 Continuation Data
   98 0.288086966 172.31.26.111 → 34.215.93.126 SSL 168 Continuation Data
   99 0.293901733 34.215.23.149 → 172.31.26.111 TCP 261 46238 → 27017 [PSH, ACK] Seq=1756 Ack=919 Win=219 Len=195 TSval=1002823200 TSecr=3585029404 [TCP segment of a reassembled PDU]
  100 0.293964264 54.201.255.128 → 172.31.26.111 TCP 261 58264 → 27017 [PSH, ACK] Seq=1756 Ack=919 Win=219 Len=195 TSval=1082796977 TSecr=1211567321 [TCP segment of a reassembled PDU]
  101 0.294926165 34.219.173.151 → 172.31.26.111 TCP 261 37944 → 27017 [PSH, ACK] Seq=1756 Ack=919 Win=219 Len=195 TSval=1681513771 TSecr=910153467 [TCP segment of a reassembled PDU]
  102 0.296143053 35.166.223.130 → 172.31.26.111 TCP 261 34234 → 27017 [PSH, ACK] Seq=1756 Ack=919 Win=219 Len=195 TSval=3970093865 TSecr=3598504828 [TCP segment of a reassembled PDU]
  103 0.304097253 34.215.93.126 → 172.31.26.111 TCP 261 36858 → 27017 [PSH, ACK] Seq=1756 Ack=1021 Win=219 Len=195 TSval=2681060440 TSecr=2712095189 [TCP segment of a reassembled PDU]
  104 0.309226132 172.31.26.111 → 34.215.23.149 SSL 168 Continuation Data
  105 0.309393230 172.31.26.111 → 54.201.255.128 SSL 168 Continuation Data
  106 0.310102002 172.31.26.111 → 34.219.173.151 SSL 168 Continuation Data
  107 0.311311408 172.31.26.111 → 35.166.223.130 SSL 168 Continuation Data
  108 0.319306837 172.31.26.111 → 34.215.93.126 SSL 168 Continuation Data
  109 0.325393778 34.215.23.149 → 172.31.26.111 TCP 261 46238 → 27017 [PSH, ACK] Seq=1951 Ack=1021 Win=219 Len=195 TSval=1002823231 TSecr=3585029435 [TCP segment of a reassembled PDU]
  110 0.325414560 54.201.255.128 → 172.31.26.111 TCP 261 58264 → 27017 [PSH, ACK] Seq=1951 Ack=1021 Win=219 Len=195 TSval=1082797008 TSecr=1211567352 [TCP segment of a reassembled PDU]
  111 0.326200774 34.219.173.151 → 172.31.26.111 TCP 261 37944 → 27017 [PSH, ACK] Seq=1951 Ack=1021 Win=219 Len=195 TSval=1681513803 TSecr=910153498 [TCP segment of a reassembled PDU]
  112 0.327452322 35.166.223.130 → 172.31.26.111 TCP 261 34234 → 27017 [PSH, ACK] Seq=1951 Ack=1021 Win=219 Len=195 TSval=3970093897 TSecr=3598504859 [TCP segment of a reassembled PDU]
  113 0.335409695 34.215.93.126 → 172.31.26.111 TCP 261 36858 → 27017 [PSH, ACK] Seq=1951 Ack=1123 Win=219 Len=195 TSval=2681060471 TSecr=2712095220 [TCP segment of a reassembled PDU]
  114 0.340674431 172.31.26.111 → 34.215.23.149 SSL 168 Continuation Data
  115 0.340680228 172.31.26.111 → 54.201.255.128 SSL 168 Continuation Data
  116 0.341371283 172.31.26.111 → 34.219.173.151 SSL 168 Continuation Data
  117 0.342625845 172.31.26.111 → 35.166.223.130 SSL 168 Continuation Data
  118 0.350621735 172.31.26.111 → 34.215.93.126 SSL 168 Continuation Data
  119 0.356849165 34.215.23.149 → 172.31.26.111 TCP 261 46238 → 27017 [PSH, ACK] Seq=2146 Ack=1123 Win=219 Len=195 TSval=1002823263 TSecr=3585029467 [TCP segment of a reassembled PDU]
  120 0.356865204 54.201.255.128 → 172.31.26.111 TCP 261 58264 → 27017 [PSH, ACK] Seq=2146 Ack=1123 Win=219 Len=195 TSval=1082797040 TSecr=1211567384 [TCP segment of a reassembled PDU]
  121 0.357431457 34.219.173.151 → 172.31.26.111 TCP 261 37944 → 27017 [PSH, ACK] Seq=2146 Ack=1123 Win=219 Len=195 TSval=1681513834 TSecr=910153529 [TCP segment of a reassembled PDU]
  122 0.358772496 35.166.223.130 → 172.31.26.111 TCP 261 34234 → 27017 [PSH, ACK] Seq=2146 Ack=1123 Win=219 Len=195 TSval=3970093928 TSecr=3598504891 [TCP segment of a reassembled PDU]
  123 0.366686905 34.215.93.126 → 172.31.26.111 TCP 261 36858 → 27017 [PSH, ACK] Seq=2146 Ack=1225 Win=219 Len=195 TSval=2681060502 TSecr=2712095252 [TCP segment of a reassembled PDU]
  124 0.372195913 172.31.26.111 → 34.215.23.149 SSL 168 Continuation Data
  125 0.372363186 172.31.26.111 → 54.201.255.128 SSL 168 Continuation Data
  126 0.372609611 172.31.26.111 → 34.219.173.151 SSL 168 Continuation Data
  127 0.373949321 172.31.26.111 → 35.166.223.130 SSL 168 Continuation Data
  128 0.381896818 172.31.26.111 → 34.215.93.126 SSL 168 Continuation Data
  129 0.388323711 34.215.23.149 → 172.31.26.111 TCP 261 46238 → 27017 [PSH, ACK] Seq=2341 Ack=1225 Win=219 Len=195 TSval=1002823294 TSecr=3585029498 [TCP segment of a reassembled PDU]
  130 0.388429759 54.201.255.128 → 172.31.26.111 TCP 261 58264 → 27017 [PSH, ACK] Seq=2341 Ack=1225 Win=219 Len=195 TSval=1082797071 TSecr=1211567415 [TCP segment of a reassembled PDU]
  131 0.388622547 34.219.173.151 → 172.31.26.111 TCP 261 37944 → 27017 [PSH, ACK] Seq=2341 Ack=1225 Win=219 Len=195 TSval=1681513865 TSecr=910153561 [TCP segment of a reassembled PDU]
  132 0.390023290 35.166.223.130 → 172.31.26.111 TCP 261 34234 → 27017 [PSH, ACK] Seq=2341 Ack=1225 Win=219 Len=195 TSval=3970093959 TSecr=3598504922 [TCP segment of a reassembled PDU]
  133 0.397876655 34.215.93.126 → 172.31.26.111 TCP 261 36858 → 27017 [PSH, ACK] Seq=2341 Ack=1327 Win=219 Len=195 TSval=2681060533 TSecr=2712095283 [TCP segment of a reassembled PDU]
  134 0.403644929 172.31.26.111 → 34.215.23.149 SSL 168 Continuation Data
  135 0.403814144 172.31.26.111 → 34.219.173.151 SSL 168 Continuation Data
  136 0.403818302 172.31.26.111 → 54.201.255.128 SSL 168 Continuation Data
  137 0.405194292 172.31.26.111 → 35.166.223.130 SSL 168 Continuation Data
  138 0.413141986 172.31.26.111 → 34.215.93.126 SSL 168 Continuation Data
  139 0.419731177 34.219.173.151 → 172.31.26.111 TCP 261 37944 → 27017 [PSH, ACK] Seq=2536 Ack=1327 Win=219 Len=195 TSval=1681513896 TSecr=910153592 [TCP segment of a reassembled PDU]
  140 0.419765930 34.215.23.149 → 172.31.26.111 TCP 261 46238 → 27017 [PSH, ACK] Seq=2536 Ack=1327 Win=219 Len=195 TSval=1002823326 TSecr=3585029530 [TCP segment of a reassembled PDU]
  141 0.419909527 54.201.255.128 → 172.31.26.111 TCP 261 58264 → 27017 [PSH, ACK] Seq=2536 Ack=1327 Win=219 Len=195 TSval=1082797103 TSecr=1211567447 [TCP segment of a reassembled PDU]
  142 0.421268618 35.166.223.130 → 172.31.26.111 TCP 261 34234 → 27017 [PSH, ACK] Seq=2536 Ack=1327 Win=219 Len=195 TSval=3970093991 TSecr=3598504953 [TCP segment of a reassembled PDU]
  143 0.429096039 34.215.93.126 → 172.31.26.111 TCP 261 36858 → 27017 [PSH, ACK] Seq=2536 Ack=1429 Win=219 Len=195 TSval=2681060565 TSecr=2712095314 [TCP segment of a reassembled PDU]
  144 0.435103748 172.31.26.111 → 34.219.173.151 SSL 168 Continuation Data
  145 0.435109223 172.31.26.111 → 34.215.23.149 SSL 168 Continuation Data
  146 0.435272976 172.31.26.111 → 54.201.255.128 SSL 168 Continuation Data
  147 0.436444937 172.31.26.111 → 35.166.223.130 SSL 168 Continuation Data
  148 0.444294593 172.31.26.111 → 34.215.93.126 SSL 168 Continuation Data
  149 0.451055910 34.219.173.151 → 172.31.26.111 TCP 261 37944 → 27017 [PSH, ACK] Seq=2731 Ack=1429 Win=219 Len=195 TSval=1681513927 TSecr=910153623 [TCP segment of a reassembled PDU]
  150 0.451231767 34.215.23.149 → 172.31.26.111 TCP 261 46238 → 27017 [PSH, ACK] Seq=2731 Ack=1429 Win=219 Len=195 TSval=1002823357 TSecr=3585029561 [TCP segment of a reassembled PDU]
  151 0.451299587 54.201.255.128 → 172.31.26.111 TCP 261 58264 → 27017 [PSH, ACK] Seq=2731 Ack=1429 Win=219 Len=195 TSval=1082797134 TSecr=1211567478 [TCP segment of a reassembled PDU]
  152 0.452604917 35.166.223.130 → 172.31.26.111 TCP 261 34234 → 27017 [PSH, ACK] Seq=2731 Ack=1429 Win=219 Len=195 TSval=3970094022 TSecr=3598504984 [TCP segment of a reassembled PDU]
  153 0.460215760 34.215.93.126 → 172.31.26.111 TCP 261 36858 → 27017 [PSH, ACK] Seq=2731 Ack=1531 Win=219 Len=195 TSval=2681060596 TSecr=2712095345 [TCP segment of a reassembled PDU]
  154 0.466395458 172.31.26.111 → 34.219.173.151 SSL 168 Continuation Data
  155 0.466563127 172.31.26.111 → 34.215.23.149 SSL 168 Continuation Data
  156 0.466566824 172.31.26.111 → 54.201.255.128 SSL 168 Continuation Data
  157 0.467789971 172.31.26.111 → 35.166.223.130 SSL 168 Continuation Data
  158 0.475429933 172.31.26.111 → 34.215.93.126 SSL 168 Continuation Data
  159 0.482368468 34.219.173.151 → 172.31.26.111 TCP 261 37944 → 27017 [PSH, ACK] Seq=2926 Ack=1531 Win=219 Len=195 TSval=1681513959 TSecr=910153654 [TCP segment of a reassembled PDU]
  160 0.482706594 54.201.255.128 → 172.31.26.111 TCP 261 58264 → 27017 [PSH, ACK] Seq=2926 Ack=1531 Win=219 Len=195 TSval=1082797166 TSecr=1211567510 [TCP segment of a reassembled PDU]
  161 0.483181893 34.215.23.149 → 172.31.26.111 TCP 261 46238 → 27017 [PSH, ACK] Seq=2926 Ack=1531 Win=219 Len=195 TSval=1002823389 TSecr=3585029592 [TCP segment of a reassembled PDU]
  162 0.483925010 35.166.223.130 → 172.31.26.111 TCP 261 34234 → 27017 [PSH, ACK] Seq=2926 Ack=1531 Win=219 Len=195 TSval=3970094053 TSecr=3598505016 [TCP segment of a reassembled PDU]
  163 0.491520531 34.215.93.126 → 172.31.26.111 TCP 261 36858 → 27017 [PSH, ACK] Seq=2926 Ack=1633 Win=219 Len=195 TSval=2681060627 TSecr=2712095376 [TCP segment of a reassembled PDU]
  164 0.497733281 172.31.26.111 → 34.219.173.151 SSL 168 Continuation Data
  165 0.497902234 172.31.26.111 → 54.201.255.128 SSL 168 Continuation Data
  166 0.498381313 172.31.26.111 → 34.215.23.149 SSL 168 Continuation Data
  167 0.499130193 172.31.26.111 → 35.166.223.130 SSL 168 Continuation Data
  168 0.506723156 172.31.26.111 → 34.215.93.126 SSL 168 Continuation Data
  169 0.513809971 34.219.173.151 → 172.31.26.111 TCP 261 37944 → 27017 [PSH, ACK] Seq=3121 Ack=1633 Win=219 Len=195 TSval=1681513990 TSecr=910153686 [TCP segment of a reassembled PDU]
  170 0.513884181 54.201.255.128 → 172.31.26.111 TCP 261 58264 → 27017 [PSH, ACK] Seq=3121 Ack=1633 Win=219 Len=195 TSval=1082797197 TSecr=1211567541 [TCP segment of a reassembled PDU]
  171 0.514640959 34.215.23.149 → 172.31.26.111 TCP 261 46238 → 27017 [PSH, ACK] Seq=3121 Ack=1633 Win=219 Len=195 TSval=1002823421 TSecr=3585029624 [TCP segment of a reassembled PDU]
  172 0.515229159 35.166.223.130 → 172.31.26.111 TCP 261 34234 → 27017 [PSH, ACK] Seq=3121 Ack=1633 Win=219 Len=195 TSval=3970094085 TSecr=3598505047 [TCP segment of a reassembled PDU]
  173 0.518157483 172.31.26.111 → 153.90.128.120 SSH 110 Server: Encrypted packet (len=44)
  174 0.522733000 34.215.93.126 → 172.31.26.111 TCP 261 36858 → 27017 [PSH, ACK] Seq=3121 Ack=1735 Win=219 Len=195 TSval=2681060658 TSecr=2712095408 [TCP segment of a reassembled PDU]
  175 0.529155247 172.31.26.111 → 34.219.173.151 SSL 168 Continuation Data
  176 0.529321830 172.31.26.111 → 54.201.255.128 SSL 168 Continuation Data
  177 0.529810413 172.31.26.111 → 34.215.23.149 SSL 168 Continuation Data
  178 0.530419118 172.31.26.111 → 35.166.223.130 SSL 168 Continuation Data
  179 0.537936678 172.31.26.111 → 34.215.93.126 SSL 168 Continuation Data
  180 0.545118072 34.219.173.151 → 172.31.26.111 TCP 261 37944 → 27017 [PSH, ACK] Seq=3316 Ack=1735 Win=219 Len=195 TSval=1681514021 TSecr=910153717 [TCP segment of a reassembled PDU]
  181 0.545408437 54.201.255.128 → 172.31.26.111 TCP 261 58264 → 27017 [PSH, ACK] Seq=3316 Ack=1735 Win=219 Len=195 TSval=1082797228 TSecr=1211567572 [TCP segment of a reassembled PDU]
  182 0.545876625 34.215.23.149 → 172.31.26.111 TCP 261 46238 → 27017 [PSH, ACK] Seq=3316 Ack=1735 Win=219 Len=195 TSval=1002823452 TSecr=3585029656 [TCP segment of a reassembled PDU]
  183 0.546532597 35.166.223.130 → 172.31.26.111 TCP 261 34234 → 27017 [PSH, ACK] Seq=3316 Ack=1735 Win=219 Len=195 TSval=3970094116 TSecr=3598505078 [TCP segment of a reassembled PDU]
  184 0.553896657 34.215.93.126 → 172.31.26.111 TCP 261 36858 → 27017 [PSH, ACK] Seq=3316 Ack=1837 Win=219 Len=195 TSval=2681060689 TSecr=2712095439 [TCP segment of a reassembled PDU]
  185 0.560508754 172.31.26.111 → 34.219.173.151 SSL 168 Continuation Data
  186 0.560521159 172.31.26.111 → 54.201.255.128 SSL 168 Continuation Data
  187 0.561043547 172.31.26.111 → 34.215.23.149 SSL 168 Continuation Data
  188 0.561701469 172.31.26.111 → 35.166.223.130 SSL 168 Continuation Data
  189 0.567133799 153.90.128.120 → 172.31.26.111 TCP 66 52812 → 22 [ACK] Seq=1 Ack=489 Win=1444 Len=0 TSval=970873491 TSecr=401225945
  190 0.569157157 172.31.26.111 → 34.215.93.126 SSL 168 Continuation Data
  191 0.576485692 34.219.173.151 → 172.31.26.111 TCP 261 37944 → 27017 [PSH, ACK] Seq=3511 Ack=1837 Win=219 Len=195 TSval=1681514053 TSecr=910153748 [TCP segment of a reassembled PDU]
  192 0.576714125 54.201.255.128 → 172.31.26.111 TCP 261 58264 → 27017 [PSH, ACK] Seq=3511 Ack=1837 Win=219 Len=195 TSval=1082797260 TSecr=1211567603 [TCP segment of a reassembled PDU]
  193 0.577210728 34.215.23.149 → 172.31.26.111 TCP 261 46238 → 27017 [PSH, ACK] Seq=3511 Ack=1837 Win=219 Len=195 TSval=1002823483 TSecr=3585029687 [TCP segment of a reassembled PDU]
  194 0.577831081 35.166.223.130 → 172.31.26.111 TCP 261 34234 → 27017 [PSH, ACK] Seq=3511 Ack=1837 Win=219 Len=195 TSval=3970094147 TSecr=3598505110 [TCP segment of a reassembled PDU]
  195 0.585102240 34.215.93.126 → 172.31.26.111 TCP 261 36858 → 27017 [PSH, ACK] Seq=3511 Ack=1939 Win=219 Len=195 TSval=2681060720 TSecr=2712095470 [TCP segment of a reassembled PDU]
  196 0.591821108 172.31.26.111 → 34.219.173.151 SSL 168 Continuation Data
  197 0.591988218 172.31.26.111 → 54.201.255.128 SSL 168 Continuation Data
  198 0.592411309 172.31.26.111 → 34.215.23.149 SSL 168 Continuation Data
  199 0.593004977 172.31.26.111 → 35.166.223.130 SSL 168 Continuation Data
  200 0.600306305 172.31.26.111 → 34.215.93.126 SSL 168 Continuation Data
  201 0.607753360 34.219.173.151 → 172.31.26.111 TCP 261 37944 → 27017 [PSH, ACK] Seq=3706 Ack=1939 Win=219 Len=195 TSval=1681514084 TSecr=910153780 [TCP segment of a reassembled PDU]
  202 0.607946486 54.201.255.128 → 172.31.26.111 TCP 261 58264 → 27017 [PSH, ACK] Seq=3706 Ack=1939 Win=219 Len=195 TSval=1082797291 TSecr=1211567635 [TCP segment of a reassembled PDU]
  203 0.608502331 34.215.23.149 → 172.31.26.111 TCP 261 46238 → 27017 [PSH, ACK] Seq=3706 Ack=1939 Win=219 Len=195 TSval=1002823514 TSecr=3585029718 [TCP segment of a reassembled PDU]
  204 0.609174017 35.166.223.130 → 172.31.26.111 TCP 261 34234 → 27017 [PSH, ACK] Seq=3706 Ack=1939 Win=219 Len=195 TSval=3970094178 TSecr=3598505141 [TCP segment of a reassembled PDU]
  205 0.616437343 34.215.93.126 → 172.31.26.111 TCP 261 36858 → 27017 [PSH, ACK] Seq=3706 Ack=2041 Win=219 Len=195 TSval=2681060752 TSecr=2712095501 [TCP segment of a reassembled PDU]
  206 0.623117503 172.31.26.111 → 34.219.173.151 SSL 168 Continuation Data
  207 0.623123693 172.31.26.111 → 54.201.255.128 SSL 168 Continuation Data
  208 0.623698519 172.31.26.111 → 34.215.23.149 SSL 168 Continuation Data
  209 0.624358252 172.31.26.111 → 35.166.223.130 SSL 168 Continuation Data
  210 0.631661884 172.31.26.111 → 34.215.93.126 SSL 168 Continuation Data
  211 0.639306337 34.219.173.151 → 172.31.26.111 TCP 261 37944 → 27017 [PSH, ACK] Seq=3901 Ack=2041 Win=219 Len=195 TSval=1681514116 TSecr=910153811 [TCP segment of a reassembled PDU]
  212 0.639743401 34.215.23.149 → 172.31.26.111 TCP 261 46238 → 27017 [PSH, ACK] Seq=3901 Ack=2041 Win=219 Len=195 TSval=1002823546 TSecr=3585029750 [TCP segment of a reassembled PDU]
  213 0.639906137 54.201.255.128 → 172.31.26.111 TCP 261 58264 → 27017 [PSH, ACK] Seq=3901 Ack=2041 Win=219 Len=195 TSval=1082797323 TSecr=1211567666 [TCP segment of a reassembled PDU]
  214 0.640492335 35.166.223.130 → 172.31.26.111 TCP 261 34234 → 27017 [PSH, ACK] Seq=3901 Ack=2041 Win=219 Len=195 TSval=3970094210 TSecr=3598505172 [TCP segment of a reassembled PDU]
  215 0.647724180 34.215.93.126 → 172.31.26.111 TCP 261 36858 → 27017 [PSH, ACK] Seq=3901 Ack=2143 Win=219 Len=195 TSval=2681060783 TSecr=2712095533 [TCP segment of a reassembled PDU]
  216 0.654697824 172.31.26.111 → 34.219.173.151 SSL 168 Continuation Data
  217 0.654918510 172.31.26.111 → 34.215.23.149 SSL 168 Continuation Data
  218 0.655086062 172.31.26.111 → 54.201.255.128 SSL 168 Continuation Data
  219 0.655676976 172.31.26.111 → 35.166.223.130 SSL 168 Continuation Data
  220 0.662903382 172.31.26.111 → 34.215.93.126 SSL 168 Continuation Data
  221 0.670784883 34.219.173.151 → 172.31.26.111 TCP 261 37944 → 27017 [PSH, ACK] Seq=4096 Ack=2143 Win=219 Len=195 TSval=1681514147 TSecr=910153843 [TCP segment of a reassembled PDU]
  222 0.670943553 34.215.23.149 → 172.31.26.111 TCP 261 46238 → 27017 [PSH, ACK] Seq=4096 Ack=2143 Win=219 Len=195 TSval=1002823577 TSecr=3585029781 [TCP segment of a reassembled PDU]
  223 0.671156209 54.201.255.128 → 172.31.26.111 TCP 261 58264 → 27017 [PSH, ACK] Seq=4096 Ack=2143 Win=219 Len=195 TSval=1082797354 TSecr=1211567698 [TCP segment of a reassembled PDU]
  224 0.671800121 35.166.223.130 → 172.31.26.111 TCP 261 34234 → 27017 [PSH, ACK] Seq=4096 Ack=2143 Win=219 Len=195 TSval=3970094241 TSecr=3598505204 [TCP segment of a reassembled PDU]
  225 0.674780786 54.188.89.98 → 172.31.26.111 TCP 307 [TCP segment of a reassembled PDU]
  226 0.678989805 34.215.93.126 → 172.31.26.111 TCP 261 36858 → 27017 [PSH, ACK] Seq=4096 Ack=2245 Win=219 Len=195 TSval=2681060814 TSecr=2712095564 [TCP segment of a reassembled PDU]
  227 0.686287928 172.31.26.111 → 34.215.23.149 SSL 168 Continuation Data
  228 0.686293507 172.31.26.111 → 34.219.173.151 SSL 168 Continuation Data
  229 0.686470273 172.31.26.111 → 54.201.255.128 SSL 168 Continuation Data
  230 0.686976926 172.31.26.111 → 35.166.223.130 SSL 168 Continuation Data
  231 0.690046810 172.31.26.111 → 54.188.89.98 SSL 111 Continuation Data
  232 0.694206264 172.31.26.111 → 34.215.93.126 TCP 250 [TCP segment of a reassembled PDU]
  233 0.702315703 34.215.23.149 → 172.31.26.111 TCP 261 46238 → 27017 [PSH, ACK] Seq=4291 Ack=2245 Win=219 Len=195 TSval=1002823608 TSecr=3585029812 [TCP segment of a reassembled PDU]
  234 0.702610248 54.201.255.128 → 172.31.26.111 TCP 261 58264 → 27017 [PSH, ACK] Seq=4291 Ack=2245 Win=219 Len=195 TSval=1082797386 TSecr=1211567729 [TCP segment of a reassembled PDU]
  235 0.702633525 34.219.173.151 → 172.31.26.111 TCP 261 37944 → 27017 [PSH, ACK] Seq=4291 Ack=2245 Win=219 Len=195 TSval=1681514179 TSecr=910153874 [TCP segment of a reassembled PDU]
  236 0.703132459 35.166.223.130 → 172.31.26.111 TCP 261 34234 → 27017 [PSH, ACK] Seq=4291 Ack=2245 Win=219 Len=195 TSval=3970094272 TSecr=3598505235 [TCP segment of a reassembled PDU]
  237 0.705681192 54.188.89.98 → 172.31.26.111 TCP 66 53846 → 27017 [ACK] Seq=242 Ack=46 Win=219 Len=0 TSval=1471786206 TSecr=1805215358
  238 0.706346158 54.188.89.98 → 172.31.26.111 TCP 307 53846 → 27017 [PSH, ACK] Seq=242 Ack=46 Win=219 Len=241 TSval=1471786207 TSecr=1805215358 [TCP segment of a reassembled PDU]
  239 0.710557638 34.215.93.126 → 172.31.26.111 TCP 261 36858 → 27017 [PSH, ACK] Seq=4291 Ack=2429 Win=227 Len=195 TSval=2681060846 TSecr=2712095595 [TCP segment of a reassembled PDU]
  240 0.717721702 172.31.26.111 → 34.215.23.149 TCP 250 [TCP segment of a reassembled PDU]
  241 0.717890580 172.31.26.111 → 34.219.173.151 TCP 250 [TCP segment of a reassembled PDU]
  242 0.717894436 172.31.26.111 → 54.201.255.128 TCP 250 [TCP segment of a reassembled PDU]
  243 0.718342724 172.31.26.111 → 35.166.223.130 TCP 250 [TCP segment of a reassembled PDU]
  244 0.721601206 172.31.26.111 → 54.188.89.98 SSL 111 Continuation Data
  245 0.725778167 172.31.26.111 → 34.215.93.126 TCP 250 27017 → 36858 [PSH, ACK] Seq=2429 Ack=4486 Win=1531 Len=184 TSval=2712095627 TSecr=2681060846 [TCP segment of a reassembled PDU]
  246 0.734043365 34.215.23.149 → 172.31.26.111 TCP 261 46238 → 27017 [PSH, ACK] Seq=4486 Ack=2429 Win=227 Len=195 TSval=1002823640 TSecr=3585029844 [TCP segment of a reassembled PDU]
  247 0.734060688 34.219.173.151 → 172.31.26.111 TCP 261 37944 → 27017 [PSH, ACK] Seq=4486 Ack=2429 Win=227 Len=195 TSval=1681514210 TSecr=910153906 [TCP segment of a reassembled PDU]
  248 0.734246185 54.201.255.128 → 172.31.26.111 TCP 261 58264 → 27017 [PSH, ACK] Seq=4486 Ack=2429 Win=227 Len=195 TSval=1082797417 TSecr=1211567761 [TCP segment of a reassembled PDU]
  249 0.734551329 35.166.223.130 → 172.31.26.111 TCP 261 34234 → 27017 [PSH, ACK] Seq=4486 Ack=2429 Win=227 Len=195 TSval=3970094304 TSecr=3598505266 [TCP segment of a reassembled PDU]
  250 0.737948783 54.188.89.98 → 172.31.26.111 TCP 307 53846 → 27017 [PSH, ACK] Seq=483 Ack=91 Win=219 Len=241 TSval=1471786239 TSecr=1805215389 [TCP segment of a reassembled PDU]
  251 0.741926177 34.215.93.126 → 172.31.26.111 TCP 261 36858 → 27017 [PSH, ACK] Seq=4486 Ack=2613 Win=236 Len=195 TSval=2681060877 TSecr=2712095627 [TCP segment of a reassembled PDU]
  252 0.749493629 172.31.26.111 → 34.219.173.151 TCP 250 27017 → 37944 [PSH, ACK] Seq=2429 Ack=4681 Win=1531 Len=184 TSval=910153937 TSecr=1681514210 [TCP segment of a reassembled PDU]
  253 0.749499881 172.31.26.111 → 34.215.23.149 TCP 250 27017 → 46238 [PSH, ACK] Seq=2429 Ack=4681 Win=1531 Len=184 TSval=3585029875 TSecr=1002823640 [TCP segment of a reassembled PDU]
  254 0.749664183 172.31.26.111 → 54.201.255.128 TCP 250 27017 → 58264 [PSH, ACK] Seq=2429 Ack=4681 Win=1531 Len=184 TSval=1211567793 TSecr=1082797417 [TCP segment of a reassembled PDU]
  255 0.749668266 172.31.26.111 → 35.166.223.130 TCP 250 27017 → 34234 [PSH, ACK] Seq=2429 Ack=4681 Win=1531 Len=184 TSval=3598505298 TSecr=3970094304 [TCP segment of a reassembled PDU]
  256 0.753199008 172.31.26.111 → 54.188.89.98 SSL 111 Continuation Data
  257 0.757136200 172.31.26.111 → 34.215.93.126 TCP 250 27017 → 36858 [PSH, ACK] Seq=2613 Ack=4681 Win=1531 Len=184 TSval=2712095658 TSecr=2681060877 [TCP segment of a reassembled PDU]
  258 0.765592775 34.219.173.151 → 172.31.26.111 TCP 261 37944 → 27017 [PSH, ACK] Seq=4681 Ack=2613 Win=236 Len=195 TSval=1681514242 TSecr=910153937 [TCP segment of a reassembled PDU]
  259 0.765769024 34.215.23.149 → 172.31.26.111 TCP 261 46238 → 27017 [PSH, ACK] Seq=4681 Ack=2613 Win=236 Len=195 TSval=1002823672 TSecr=3585029875 [TCP segment of a reassembled PDU]
  260 0.765890947 54.201.255.128 → 172.31.26.111 TCP 261 58264 → 27017 [PSH, ACK] Seq=4681 Ack=2613 Win=236 Len=195 TSval=1082797449 TSecr=1211567793 [TCP segment of a reassembled PDU]
  261 0.766028535 35.166.223.130 → 172.31.26.111 TCP 261 34234 → 27017 [PSH, ACK] Seq=4681 Ack=2613 Win=236 Len=195 TSval=3970094335 TSecr=3598505298 [TCP segment of a reassembled PDU]
  262 0.769564578 54.188.89.98 → 172.31.26.111 TCP 307 53846 → 27017 [PSH, ACK] Seq=724 Ack=136 Win=219 Len=241 TSval=1471786270 TSecr=1805215421 [TCP segment of a reassembled PDU]
  263 0.773255351 34.215.93.126 → 172.31.26.111 TCP 261 36858 → 27017 [PSH, ACK] Seq=4681 Ack=2797 Win=244 Len=195 TSval=2681060909 TSecr=2712095658 [TCP segment of a reassembled PDU]
  264 0.781072850 172.31.26.111 → 34.215.23.149 TCP 250 27017 → 46238 [PSH, ACK] Seq=2613 Ack=4876 Win=1531 Len=184 TSval=3585029907 TSecr=1002823672 [TCP segment of a reassembled PDU]
  265 0.781240898 172.31.26.111 → 35.166.223.130 TCP 250 27017 → 34234 [PSH, ACK] Seq=2613 Ack=4876 Win=1531 Len=184 TSval=3598505329 TSecr=3970094335 [TCP segment of a reassembled PDU]
  266 0.781244618 172.31.26.111 → 34.219.173.151 TCP 250 27017 → 37944 [PSH, ACK] Seq=2613 Ack=4876 Win=1531 Len=184 TSval=910153969 TSecr=1681514242 [TCP segment of a reassembled PDU]
  267 0.781413944 172.31.26.111 → 54.201.255.128 TCP 250 27017 → 58264 [PSH, ACK] Seq=2613 Ack=4876 Win=1531 Len=184 TSval=1211567824 TSecr=1082797449 [TCP segment of a reassembled PDU]
  268 0.784789606 172.31.26.111 → 54.188.89.98 SSL 111 Continuation Data
  269 0.788465591 172.31.26.111 → 34.215.93.126 TCP 250 27017 → 36858 [PSH, ACK] Seq=2797 Ack=4876 Win=1531 Len=184 TSval=2712095689 TSecr=2681060909 [TCP segment of a reassembled PDU]
  270 0.797387434 34.215.23.149 → 172.31.26.111 TCP 261 46238 → 27017 [PSH, ACK] Seq=4876 Ack=2797 Win=244 Len=195 TSval=1002823703 TSecr=3585029907 [TCP segment of a reassembled PDU]
  271 0.797448504 54.201.255.128 → 172.31.26.111 TCP 261 58264 → 27017 [PSH, ACK] Seq=4876 Ack=2797 Win=244 Len=195 TSval=1082797481 TSecr=1211567824 [TCP segment of a reassembled PDU]
  272 0.797539260 35.166.223.130 → 172.31.26.111 TCP 261 34234 → 27017 [PSH, ACK] Seq=4876 Ack=2797 Win=244 Len=195 TSval=3970094367 TSecr=3598505329 [TCP segment of a reassembled PDU]
  273 0.798791730 34.219.173.151 → 172.31.26.111 TCP 261 37944 → 27017 [PSH, ACK] Seq=4876 Ack=2797 Win=244 Len=195 TSval=1681514275 TSecr=910153969 [TCP segment of a reassembled PDU]
  274 0.800960561 54.188.89.98 → 172.31.26.111 TCP 307 53846 → 27017 [PSH, ACK] Seq=965 Ack=181 Win=219 Len=241 TSval=1471786302 TSecr=1805215453 [TCP segment of a reassembled PDU]
  275 0.804666845 34.215.93.126 → 172.31.26.111 TCP 261 36858 → 27017 [PSH, ACK] Seq=4876 Ack=2981 Win=252 Len=195 TSval=2681060940 TSecr=2712095689 [TCP segment of a reassembled PDU]
  276 0.812856842 172.31.26.111 → 35.166.223.130 TCP 250 27017 → 34234 [PSH, ACK] Seq=2797 Ack=5071 Win=1531 Len=184 TSval=3598505361 TSecr=3970094367 [TCP segment of a reassembled PDU]
  277 0.812862328 172.31.26.111 → 34.215.23.149 TCP 250 27017 → 46238 [PSH, ACK] Seq=2797 Ack=5071 Win=1531 Len=184 TSval=3585029939 TSecr=1002823703 [TCP segment of a reassembled PDU]
  278 0.813026894 172.31.26.111 → 54.201.255.128 TCP 250 27017 → 58264 [PSH, ACK] Seq=2797 Ack=5071 Win=1531 Len=184 TSval=1211567856 TSecr=1082797481 [TCP segment of a reassembled PDU]
  279 0.813966416 172.31.26.111 → 34.219.173.151 TCP 250 27017 → 37944 [PSH, ACK] Seq=2797 Ack=5071 Win=1531 Len=184 TSval=910154002 TSecr=1681514275 [TCP segment of a reassembled PDU]
  280 0.816174033 172.31.26.111 → 54.188.89.98 SSL 111 Continuation Data
  281 0.819871075 172.31.26.111 → 34.215.93.126 TCP 250 27017 → 36858 [PSH, ACK] Seq=2981 Ack=5071 Win=1531 Len=184 TSval=2712095721 TSecr=2681060940 [TCP segment of a reassembled PDU]
  282 0.829017627 35.166.223.130 → 172.31.26.111 TCP 261 34234 → 27017 [PSH, ACK] Seq=5071 Ack=2981 Win=252 Len=195 TSval=3970094398 TSecr=3598505361 [TCP segment of a reassembled PDU]
  283 0.829165593 34.215.23.149 → 172.31.26.111 TCP 261 46238 → 27017 [PSH, ACK] Seq=5071 Ack=2981 Win=252 Len=195 TSval=1002823735 TSecr=3585029939 [TCP segment of a reassembled PDU]
  284 0.829175388 54.201.255.128 → 172.31.26.111 TCP 261 58264 → 27017 [PSH, ACK] Seq=5071 Ack=2981 Win=252 Len=195 TSval=1082797512 TSecr=1211567856 [TCP segment of a reassembled PDU]
  285 0.830068474 34.219.173.151 → 172.31.26.111 TCP 261 37944 → 27017 [PSH, ACK] Seq=5071 Ack=2981 Win=252 Len=195 TSval=1681514306 TSecr=910154002 [TCP segment of a reassembled PDU]
  286 0.832327248 54.188.89.98 → 172.31.26.111 TCP 307 53846 → 27017 [PSH, ACK] Seq=1206 Ack=226 Win=219 Len=241 TSval=1471786333 TSecr=1805215484 [TCP segment of a reassembled PDU]
  287 0.835886870 34.215.93.126 → 172.31.26.111 TCP 261 36858 → 27017 [PSH, ACK] Seq=5071 Ack=3165 Win=261 Len=195 TSval=2681060971 TSecr=2712095721 [TCP segment of a reassembled PDU]
  288 0.844383353 172.31.26.111 → 35.166.223.130 TCP 250 27017 → 34234 [PSH, ACK] Seq=2981 Ack=5266 Win=1531 Len=184 TSval=3598505392 TSecr=3970094398 [TCP segment of a reassembled PDU]
  289 0.844563966 172.31.26.111 → 34.215.23.149 TCP 250 27017 → 46238 [PSH, ACK] Seq=2981 Ack=5266 Win=1531 Len=184 TSval=3585029970 TSecr=1002823735 [TCP segment of a reassembled PDU]
  290 0.844568095 172.31.26.111 → 54.201.255.128 TCP 250 27017 → 58264 [PSH, ACK] Seq=2981 Ack=5266 Win=1531 Len=184 TSval=1211567887 TSecr=1082797512 [TCP segment of a reassembled PDU]
  291 0.845248044 172.31.26.111 → 34.219.173.151 TCP 250 27017 → 37944 [PSH, ACK] Seq=2981 Ack=5266 Win=1531 Len=184 TSval=910154033 TSecr=1681514306 [TCP segment of a reassembled PDU]
  292 0.847530267 172.31.26.111 → 54.188.89.98 SSL 111 Continuation Data
  293 0.851067696 172.31.26.111 → 34.215.93.126 TCP 250 27017 → 36858 [PSH, ACK] Seq=3165 Ack=5266 Win=1531 Len=184 TSval=2712095752 TSecr=2681060971 [TCP segment of a reassembled PDU]
  294 0.860699301 35.166.223.130 → 172.31.26.111 TCP 261 34234 → 27017 [PSH, ACK] Seq=5266 Ack=3165 Win=261 Len=195 TSval=3970094430 TSecr=3598505392 [TCP segment of a reassembled PDU]
  295 0.860726723 34.215.23.149 → 172.31.26.111 TCP 261 46238 → 27017 [PSH, ACK] Seq=5266 Ack=3165 Win=261 Len=195 TSval=1002823767 TSecr=3585029970 [TCP segment of a reassembled PDU]
