    1 0.000000000 35.166.223.130 → 172.31.26.111 TCP 261 [TCP segment of a reassembled PDU]
    2 0.000131642 34.215.93.126 → 172.31.26.111 TCP 261 [TCP segment of a reassembled PDU]
    3 0.001656989 172.31.26.111 → 153.90.128.120 SSH 126 Server: Encrypted packet (len=60)
    4 0.006448920 54.201.255.128 → 172.31.26.111 TCP 261 [TCP segment of a reassembled PDU]
    5 0.015373829 172.31.26.111 → 35.166.223.130 SSL 168 Continuation Data
    6 0.015540461 172.31.26.111 → 34.215.93.126 SSL 168 Continuation Data
    7 0.021647245 172.31.26.111 → 54.201.255.128 SSL 168 Continuation Data
    8 0.031427086 35.166.223.130 → 172.31.26.111 TCP 261 34226 → 27017 [PSH, ACK] Seq=196 Ack=103 Win=219 Len=195 TSval=3969865870 TSecr=3598276820 [TCP segment of a reassembled PDU]
    9 0.031603152 34.215.93.126 → 172.31.26.111 TCP 261 36846 → 27017 [PSH, ACK] Seq=196 Ack=103 Win=219 Len=195 TSval=2680832426 TSecr=2711867173 [TCP segment of a reassembled PDU]
   10 0.037770105 54.201.255.128 → 172.31.26.111 TCP 261 58256 → 27017 [PSH, ACK] Seq=196 Ack=103 Win=219 Len=195 TSval=1082568983 TSecr=1211339321 [TCP segment of a reassembled PDU]
   11 0.046753324 172.31.26.111 → 35.166.223.130 SSL 168 Continuation Data
   12 0.046952147 172.31.26.111 → 34.215.93.126 SSL 168 Continuation Data
   13 0.050588050 153.90.128.120 → 172.31.26.111 TCP 66 52812 → 22 [ACK] Seq=1 Ack=61 Win=1444 Len=0 TSval=970645240 TSecr=400997685
   14 0.052952467 172.31.26.111 → 54.201.255.128 SSL 168 Continuation Data
   15 0.062850194 35.166.223.130 → 172.31.26.111 TCP 261 34226 → 27017 [PSH, ACK] Seq=391 Ack=205 Win=219 Len=195 TSval=3969865902 TSecr=3598276852 [TCP segment of a reassembled PDU]
   16 0.062967469 34.215.93.126 → 172.31.26.111 TCP 261 36846 → 27017 [PSH, ACK] Seq=391 Ack=205 Win=219 Len=195 TSval=2680832458 TSecr=2711867205 [TCP segment of a reassembled PDU]
   17 0.068945524 54.201.255.128 → 172.31.26.111 TCP 261 58256 → 27017 [PSH, ACK] Seq=391 Ack=205 Win=219 Len=195 TSval=1082569014 TSecr=1211339353 [TCP segment of a reassembled PDU]
   18 0.078227638 172.31.26.111 → 35.166.223.130 SSL 168 Continuation Data
   19 0.078395296 172.31.26.111 → 34.215.93.126 SSL 168 Continuation Data
   20 0.084156286 172.31.26.111 → 54.201.255.128 SSL 168 Continuation Data
   21 0.094178473 35.166.223.130 → 172.31.26.111 TCP 261 34226 → 27017 [PSH, ACK] Seq=586 Ack=307 Win=219 Len=195 TSval=3969865933 TSecr=3598276883 [TCP segment of a reassembled PDU]
   22 0.094294606 34.215.93.126 → 172.31.26.111 TCP 261 36846 → 27017 [PSH, ACK] Seq=586 Ack=307 Win=219 Len=195 TSval=2680832489 TSecr=2711867236 [TCP segment of a reassembled PDU]
   23 0.100243037 54.201.255.128 → 172.31.26.111 TCP 261 58256 → 27017 [PSH, ACK] Seq=586 Ack=307 Win=219 Len=195 TSval=1082569046 TSecr=1211339384 [TCP segment of a reassembled PDU]
   24 0.109533421 172.31.26.111 → 35.166.223.130 SSL 168 Continuation Data
   25 0.109544298 172.31.26.111 → 34.215.93.126 SSL 168 Continuation Data
   26 0.115457882 172.31.26.111 → 54.201.255.128 SSL 168 Continuation Data
   27 0.125607262 34.215.93.126 → 172.31.26.111 TCP 261 36846 → 27017 [PSH, ACK] Seq=781 Ack=409 Win=219 Len=195 TSval=2680832520 TSecr=2711867267 [TCP segment of a reassembled PDU]
   28 0.125617022 35.166.223.130 → 172.31.26.111 TCP 261 34226 → 27017 [PSH, ACK] Seq=781 Ack=409 Win=219 Len=195 TSval=3969865965 TSecr=3598276914 [TCP segment of a reassembled PDU]
   29 0.131437002 54.201.255.128 → 172.31.26.111 TCP 261 58256 → 27017 [PSH, ACK] Seq=781 Ack=409 Win=219 Len=195 TSval=1082569077 TSecr=1211339415 [TCP segment of a reassembled PDU]
   30 0.140872128 172.31.26.111 → 35.166.223.130 SSL 168 Continuation Data
   31 0.140877863 172.31.26.111 → 34.215.93.126 SSL 168 Continuation Data
   32 0.146655256 172.31.26.111 → 54.201.255.128 SSL 168 Continuation Data
   33 0.156888479 35.166.223.130 → 172.31.26.111 TCP 261 34226 → 27017 [PSH, ACK] Seq=976 Ack=511 Win=219 Len=195 TSval=3969865996 TSecr=3598276946 [TCP segment of a reassembled PDU]
   34 0.158608589 34.215.93.126 → 172.31.26.111 TCP 261 36846 → 27017 [PSH, ACK] Seq=976 Ack=511 Win=219 Len=195 TSval=2680832552 TSecr=2711867299 [TCP segment of a reassembled PDU]
   35 0.162825880 54.201.255.128 → 172.31.26.111 TCP 261 58256 → 27017 [PSH, ACK] Seq=976 Ack=511 Win=219 Len=195 TSval=1082569108 TSecr=1211339446 [TCP segment of a reassembled PDU]
   36 0.172140288 172.31.26.111 → 35.166.223.130 SSL 168 Continuation Data
   37 0.173814489 172.31.26.111 → 34.215.93.126 SSL 168 Continuation Data
   38 0.178033648 172.31.26.111 → 54.201.255.128 SSL 168 Continuation Data
   39 0.188304847 35.166.223.130 → 172.31.26.111 TCP 261 34226 → 27017 [PSH, ACK] Seq=1171 Ack=613 Win=219 Len=195 TSval=3969866027 TSecr=3598276977 [TCP segment of a reassembled PDU]
   40 0.189872777 34.215.93.126 → 172.31.26.111 TCP 261 36846 → 27017 [PSH, ACK] Seq=1171 Ack=613 Win=219 Len=195 TSval=2680832585 TSecr=2711867332 [TCP segment of a reassembled PDU]
   41 0.194239307 54.201.255.128 → 172.31.26.111 TCP 261 58256 → 27017 [PSH, ACK] Seq=1171 Ack=613 Win=219 Len=195 TSval=1082569140 TSecr=1211339478 [TCP segment of a reassembled PDU]
   42 0.203694795 172.31.26.111 → 35.166.223.130 SSL 168 Continuation Data
   43 0.205088092 172.31.26.111 → 34.215.93.126 SSL 168 Continuation Data
   44 0.209456828 172.31.26.111 → 54.201.255.128 SSL 168 Continuation Data
   45 0.219782149 35.166.223.130 → 172.31.26.111 TCP 261 34226 → 27017 [PSH, ACK] Seq=1366 Ack=715 Win=219 Len=195 TSval=3969866059 TSecr=3598277009 [TCP segment of a reassembled PDU]
   46 0.221926009 34.215.93.126 → 172.31.26.111 TCP 261 36846 → 27017 [PSH, ACK] Seq=1366 Ack=715 Win=219 Len=195 TSval=2680832617 TSecr=2711867363 [TCP segment of a reassembled PDU]
   47 0.225461374 54.201.255.128 → 172.31.26.111 TCP 261 58256 → 27017 [PSH, ACK] Seq=1366 Ack=715 Win=219 Len=195 TSval=1082569171 TSecr=1211339509 [TCP segment of a reassembled PDU]
   48 0.235171607 172.31.26.111 → 35.166.223.130 SSL 168 Continuation Data
   49 0.237129578 172.31.26.111 → 34.215.93.126 SSL 168 Continuation Data
   50 0.240661844 172.31.26.111 → 54.201.255.128 SSL 168 Continuation Data
   51 0.251243814 35.166.223.130 → 172.31.26.111 TCP 261 34226 → 27017 [PSH, ACK] Seq=1561 Ack=817 Win=219 Len=195 TSval=3969866090 TSecr=3598277040 [TCP segment of a reassembled PDU]
   52 0.253827433 34.215.93.126 → 172.31.26.111 TCP 261 36846 → 27017 [PSH, ACK] Seq=1561 Ack=817 Win=219 Len=195 TSval=2680832648 TSecr=2711867395 [TCP segment of a reassembled PDU]
   53 0.256650303 54.201.255.128 → 172.31.26.111 TCP 261 58256 → 27017 [PSH, ACK] Seq=1561 Ack=817 Win=219 Len=195 TSval=1082569202 TSecr=1211339541 [TCP segment of a reassembled PDU]
   54 0.266577186 172.31.26.111 → 35.166.223.130 SSL 168 Continuation Data
   55 0.269025755 172.31.26.111 → 34.215.93.126 SSL 168 Continuation Data
   56 0.271849972 172.31.26.111 → 54.201.255.128 SSL 168 Continuation Data
   57 0.282631858 35.166.223.130 → 172.31.26.111 TCP 261 34226 → 27017 [PSH, ACK] Seq=1756 Ack=919 Win=219 Len=195 TSval=3969866122 TSecr=3598277071 [TCP segment of a reassembled PDU]
   58 0.285047441 34.215.93.126 → 172.31.26.111 TCP 261 36846 → 27017 [PSH, ACK] Seq=1756 Ack=919 Win=219 Len=195 TSval=2680832680 TSecr=2711867427 [TCP segment of a reassembled PDU]
   59 0.287923412 54.201.255.128 → 172.31.26.111 TCP 261 58256 → 27017 [PSH, ACK] Seq=1756 Ack=919 Win=219 Len=195 TSval=1082569233 TSecr=1211339572 [TCP segment of a reassembled PDU]
   60 0.297845635 172.31.26.111 → 35.166.223.130 SSL 168 Continuation Data
   61 0.300239175 172.31.26.111 → 34.215.93.126 SSL 168 Continuation Data
   62 0.303105032 172.31.26.111 → 54.201.255.128 SSL 168 Continuation Data
   63 0.313991458 35.166.223.130 → 172.31.26.111 TCP 261 34226 → 27017 [PSH, ACK] Seq=1951 Ack=1021 Win=219 Len=195 TSval=3969866153 TSecr=3598277103 [TCP segment of a reassembled PDU]
   64 0.316282549 34.215.93.126 → 172.31.26.111 TCP 261 36846 → 27017 [PSH, ACK] Seq=1951 Ack=1021 Win=219 Len=195 TSval=2680832711 TSecr=2711867458 [TCP segment of a reassembled PDU]
   65 0.319115573 54.201.255.128 → 172.31.26.111 TCP 261 58256 → 27017 [PSH, ACK] Seq=1951 Ack=1021 Win=219 Len=195 TSval=1082569265 TSecr=1211339603 [TCP segment of a reassembled PDU]
   66 0.329281802 172.31.26.111 → 35.166.223.130 SSL 168 Continuation Data
   67 0.331487925 172.31.26.111 → 34.215.93.126 SSL 168 Continuation Data
   68 0.334315994 172.31.26.111 → 54.201.255.128 SSL 168 Continuation Data
   69 0.345291892 35.166.223.130 → 172.31.26.111 TCP 261 34226 → 27017 [PSH, ACK] Seq=2146 Ack=1123 Win=219 Len=195 TSval=3969866184 TSecr=3598277134 [TCP segment of a reassembled PDU]
   70 0.347521949 34.215.93.126 → 172.31.26.111 TCP 261 36846 → 27017 [PSH, ACK] Seq=2146 Ack=1123 Win=219 Len=195 TSval=2680832742 TSecr=2711867489 [TCP segment of a reassembled PDU]
   71 0.350454836 54.201.255.128 → 172.31.26.111 TCP 261 58256 → 27017 [PSH, ACK] Seq=2146 Ack=1123 Win=219 Len=195 TSval=1082569296 TSecr=1211339634 [TCP segment of a reassembled PDU]
   72 0.360605543 172.31.26.111 → 35.166.223.130 SSL 168 Continuation Data
   73 0.362724938 172.31.26.111 → 34.215.93.126 SSL 168 Continuation Data
   74 0.365632098 172.31.26.111 → 54.201.255.128 SSL 168 Continuation Data
   75 0.376702599 35.166.223.130 → 172.31.26.111 TCP 261 34226 → 27017 [PSH, ACK] Seq=2341 Ack=1225 Win=219 Len=195 TSval=3969866216 TSecr=3598277165 [TCP segment of a reassembled PDU]
   76 0.378892468 34.215.93.126 → 172.31.26.111 TCP 261 36846 → 27017 [PSH, ACK] Seq=2341 Ack=1225 Win=219 Len=195 TSval=2680832774 TSecr=2711867521 [TCP segment of a reassembled PDU]
   77 0.381642015 54.201.255.128 → 172.31.26.111 TCP 261 58256 → 27017 [PSH, ACK] Seq=2341 Ack=1225 Win=219 Len=195 TSval=1082569327 TSecr=1211339666 [TCP segment of a reassembled PDU]
   78 0.391956266 172.31.26.111 → 35.166.223.130 SSL 168 Continuation Data
   79 0.394090980 172.31.26.111 → 34.215.93.126 SSL 168 Continuation Data
   80 0.396834183 172.31.26.111 → 54.201.255.128 SSL 168 Continuation Data
   81 0.408147515 35.166.223.130 → 172.31.26.111 TCP 261 34226 → 27017 [PSH, ACK] Seq=2536 Ack=1327 Win=219 Len=195 TSval=3969866247 TSecr=3598277197 [TCP segment of a reassembled PDU]
   82 0.410285851 34.215.93.126 → 172.31.26.111 TCP 261 36846 → 27017 [PSH, ACK] Seq=2536 Ack=1327 Win=219 Len=195 TSval=2680832805 TSecr=2711867552 [TCP segment of a reassembled PDU]
   83 0.413208095 54.201.255.128 → 172.31.26.111 TCP 261 58256 → 27017 [PSH, ACK] Seq=2536 Ack=1327 Win=219 Len=195 TSval=1082569359 TSecr=1211339697 [TCP segment of a reassembled PDU]
   84 0.423392743 172.31.26.111 → 35.166.223.130 SSL 168 Continuation Data
   85 0.425490067 172.31.26.111 → 34.215.93.126 SSL 168 Continuation Data
   86 0.428410876 172.31.26.111 → 54.201.255.128 SSL 168 Continuation Data
   87 0.439454617 35.166.223.130 → 172.31.26.111 TCP 261 34226 → 27017 [PSH, ACK] Seq=2731 Ack=1429 Win=219 Len=195 TSval=3969866278 TSecr=3598277228 [TCP segment of a reassembled PDU]
   88 0.441645134 34.215.93.126 → 172.31.26.111 TCP 261 36846 → 27017 [PSH, ACK] Seq=2731 Ack=1429 Win=219 Len=195 TSval=2680832836 TSecr=2711867583 [TCP segment of a reassembled PDU]
   89 0.444603055 54.201.255.128 → 172.31.26.111 TCP 261 58256 → 27017 [PSH, ACK] Seq=2731 Ack=1429 Win=219 Len=195 TSval=1082569390 TSecr=1211339728 [TCP segment of a reassembled PDU]
   90 0.454800162 172.31.26.111 → 35.166.223.130 SSL 168 Continuation Data
   91 0.456906621 172.31.26.111 → 34.215.93.126 SSL 168 Continuation Data
   92 0.459801171 172.31.26.111 → 54.201.255.128 SSL 168 Continuation Data
   93 0.470950224 35.166.223.130 → 172.31.26.111 TCP 261 34226 → 27017 [PSH, ACK] Seq=2926 Ack=1531 Win=219 Len=195 TSval=3969866310 TSecr=3598277260 [TCP segment of a reassembled PDU]
   94 0.472975786 34.215.93.126 → 172.31.26.111 TCP 261 36846 → 27017 [PSH, ACK] Seq=2926 Ack=1531 Win=219 Len=195 TSval=2680832868 TSecr=2711867615 [TCP segment of a reassembled PDU]
   95 0.475952757 54.201.255.128 → 172.31.26.111 TCP 261 58256 → 27017 [PSH, ACK] Seq=2926 Ack=1531 Win=219 Len=195 TSval=1082569421 TSecr=1211339760 [TCP segment of a reassembled PDU]
   96 0.486329521 172.31.26.111 → 35.166.223.130 SSL 168 Continuation Data
   97 0.488181102 172.31.26.111 → 34.215.93.126 SSL 168 Continuation Data
   98 0.491149645 172.31.26.111 → 54.201.255.128 SSL 168 Continuation Data
   99 0.502483482 35.166.223.130 → 172.31.26.111 TCP 261 34226 → 27017 [PSH, ACK] Seq=3121 Ack=1633 Win=219 Len=195 TSval=3969866341 TSecr=3598277291 [TCP segment of a reassembled PDU]
  100 0.504159633 34.215.93.126 → 172.31.26.111 TCP 261 36846 → 27017 [PSH, ACK] Seq=3121 Ack=1633 Win=219 Len=195 TSval=2680832899 TSecr=2711867646 [TCP segment of a reassembled PDU]
  101 0.507235663 54.201.255.128 → 172.31.26.111 TCP 261 58256 → 27017 [PSH, ACK] Seq=3121 Ack=1633 Win=219 Len=195 TSval=1082569453 TSecr=1211339791 [TCP segment of a reassembled PDU]
  102 0.512367071 172.31.26.111 → 153.90.128.120 SSH 110 Server: Encrypted packet (len=44)
  103 0.517817802 172.31.26.111 → 35.166.223.130 SSL 168 Continuation Data
  104 0.519356704 172.31.26.111 → 34.215.93.126 SSL 168 Continuation Data
  105 0.522405086 172.31.26.111 → 54.201.255.128 SSL 168 Continuation Data
  106 0.533872912 35.166.223.130 → 172.31.26.111 TCP 261 34226 → 27017 [PSH, ACK] Seq=3316 Ack=1735 Win=219 Len=195 TSval=3969866373 TSecr=3598277323 [TCP segment of a reassembled PDU]
  107 0.535228353 34.215.93.126 → 172.31.26.111 TCP 261 36846 → 27017 [PSH, ACK] Seq=3316 Ack=1735 Win=219 Len=195 TSval=2680832930 TSecr=2711867677 [TCP segment of a reassembled PDU]
  108 0.538464835 54.201.255.128 → 172.31.26.111 TCP 261 58256 → 27017 [PSH, ACK] Seq=3316 Ack=1735 Win=219 Len=195 TSval=1082569484 TSecr=1211339822 [TCP segment of a reassembled PDU]
  109 0.549211062 172.31.26.111 → 35.166.223.130 SSL 168 Continuation Data
  110 0.550431951 172.31.26.111 → 34.215.93.126 SSL 168 Continuation Data
  111 0.553645812 172.31.26.111 → 54.201.255.128 SSL 168 Continuation Data
  112 0.561378769 153.90.128.120 → 172.31.26.111 TCP 66 52812 → 22 [ACK] Seq=1 Ack=105 Win=1444 Len=0 TSval=970645751 TSecr=400998196
  113 0.565370431 35.166.223.130 → 172.31.26.111 TCP 261 34226 → 27017 [PSH, ACK] Seq=3511 Ack=1837 Win=219 Len=195 TSval=3969866404 TSecr=3598277354 [TCP segment of a reassembled PDU]
  114 0.566278553 34.215.93.126 → 172.31.26.111 TCP 261 36846 → 27017 [PSH, ACK] Seq=3511 Ack=1837 Win=219 Len=195 TSval=2680832961 TSecr=2711867708 [TCP segment of a reassembled PDU]
  115 0.569823636 54.201.255.128 → 172.31.26.111 TCP 261 58256 → 27017 [PSH, ACK] Seq=3511 Ack=1837 Win=219 Len=195 TSval=1082569515 TSecr=1211339854 [TCP segment of a reassembled PDU]
  116 0.580637578 172.31.26.111 → 35.166.223.130 SSL 168 Continuation Data
  117 0.581483380 172.31.26.111 → 34.215.93.126 SSL 168 Continuation Data
  118 0.585054020 172.31.26.111 → 54.201.255.128 SSL 168 Continuation Data
  119 0.596760958 35.166.223.130 → 172.31.26.111 TCP 261 34226 → 27017 [PSH, ACK] Seq=3706 Ack=1939 Win=219 Len=195 TSval=3969866436 TSecr=3598277385 [TCP segment of a reassembled PDU]
  120 0.597336633 34.215.93.126 → 172.31.26.111 TCP 261 36846 → 27017 [PSH, ACK] Seq=3706 Ack=1939 Win=219 Len=195 TSval=2680832992 TSecr=2711867739 [TCP segment of a reassembled PDU]
  121 0.601201915 54.201.255.128 → 172.31.26.111 TCP 261 58256 → 27017 [PSH, ACK] Seq=3706 Ack=1939 Win=219 Len=195 TSval=1082569547 TSecr=1211339885 [TCP segment of a reassembled PDU]
  122 0.612080037 172.31.26.111 → 35.166.223.130 SSL 168 Continuation Data
  123 0.612558298 172.31.26.111 → 34.215.93.126 SSL 168 Continuation Data
  124 0.616414906 172.31.26.111 → 54.201.255.128 SSL 168 Continuation Data
  125 0.628226387 35.166.223.130 → 172.31.26.111 TCP 261 34226 → 27017 [PSH, ACK] Seq=3901 Ack=2041 Win=219 Len=195 TSval=3969866467 TSecr=3598277417 [TCP segment of a reassembled PDU]
  126 0.628637436 34.215.93.126 → 172.31.26.111 TCP 261 36846 → 27017 [PSH, ACK] Seq=3901 Ack=2041 Win=219 Len=195 TSval=2680833023 TSecr=2711867770 [TCP segment of a reassembled PDU]
  127 0.632547496 54.201.255.128 → 172.31.26.111 TCP 261 58256 → 27017 [PSH, ACK] Seq=3901 Ack=2041 Win=219 Len=195 TSval=1082569578 TSecr=1211339916 [TCP segment of a reassembled PDU]
  128 0.643535236 172.31.26.111 → 35.166.223.130 SSL 168 Continuation Data
  129 0.643817484 172.31.26.111 → 34.215.93.126 SSL 168 Continuation Data
  130 0.647748319 172.31.26.111 → 54.201.255.128 SSL 168 Continuation Data
  131 0.659760851 34.215.93.126 → 172.31.26.111 TCP 261 36846 → 27017 [PSH, ACK] Seq=4096 Ack=2143 Win=219 Len=195 TSval=2680833055 TSecr=2711867802 [TCP segment of a reassembled PDU]
  132 0.659775423 35.166.223.130 → 172.31.26.111 TCP 261 34226 → 27017 [PSH, ACK] Seq=4096 Ack=2143 Win=219 Len=195 TSval=3969866499 TSecr=3598277448 [TCP segment of a reassembled PDU]
  133 0.663983837 54.201.255.128 → 172.31.26.111 TCP 261 58256 → 27017 [PSH, ACK] Seq=4096 Ack=2143 Win=219 Len=195 TSval=1082569609 TSecr=1211339948 [TCP segment of a reassembled PDU]
  134 0.675090264 172.31.26.111 → 34.215.93.126 SSL 168 Continuation Data
  135 0.675098143 172.31.26.111 → 35.166.223.130 SSL 168 Continuation Data
  136 0.679199253 172.31.26.111 → 54.201.255.128 SSL 168 Continuation Data
  137 0.691228748 34.215.93.126 → 172.31.26.111 TCP 261 36846 → 27017 [PSH, ACK] Seq=4291 Ack=2245 Win=219 Len=195 TSval=2680833086 TSecr=2711867833 [TCP segment of a reassembled PDU]
  138 0.691286338 35.166.223.130 → 172.31.26.111 TCP 261 34226 → 27017 [PSH, ACK] Seq=4291 Ack=2245 Win=219 Len=195 TSval=3969866530 TSecr=3598277480 [TCP segment of a reassembled PDU]
  139 0.695360377 54.201.255.128 → 172.31.26.111 TCP 261 58256 → 27017 [PSH, ACK] Seq=4291 Ack=2245 Win=219 Len=195 TSval=1082569641 TSecr=1211339979 [TCP segment of a reassembled PDU]
  140 0.706615503 172.31.26.111 → 34.215.93.126 SSL 168 Continuation Data
  141 0.706782111 172.31.26.111 → 35.166.223.130 SSL 168 Continuation Data
  142 0.710539331 172.31.26.111 → 54.201.255.128 SSL 168 Continuation Data
  143 0.722629665 34.215.93.126 → 172.31.26.111 TCP 261 36846 → 27017 [PSH, ACK] Seq=4486 Ack=2347 Win=219 Len=195 TSval=2680833117 TSecr=2711867864 [TCP segment of a reassembled PDU]
  144 0.722720199 35.166.223.130 → 172.31.26.111 TCP 261 34226 → 27017 [PSH, ACK] Seq=4486 Ack=2347 Win=219 Len=195 TSval=3969866562 TSecr=3598277512 [TCP segment of a reassembled PDU]
  145 0.726635454 54.201.255.128 → 172.31.26.111 TCP 261 58256 → 27017 [PSH, ACK] Seq=4486 Ack=2347 Win=219 Len=195 TSval=1082569672 TSecr=1211340010 [TCP segment of a reassembled PDU]
  146 0.737890739 172.31.26.111 → 34.215.93.126 SSL 168 Continuation Data
  147 0.737896561 172.31.26.111 → 35.166.223.130 SSL 168 Continuation Data
  148 0.741828935 172.31.26.111 → 54.201.255.128 SSL 168 Continuation Data
  149 0.753958547 34.215.93.126 → 172.31.26.111 TCP 261 36846 → 27017 [PSH, ACK] Seq=4681 Ack=2449 Win=219 Len=195 TSval=2680833149 TSecr=2711867896 [TCP segment of a reassembled PDU]
  150 0.753984906 35.166.223.130 → 172.31.26.111 TCP 261 34226 → 27017 [PSH, ACK] Seq=4681 Ack=2449 Win=219 Len=195 TSval=3969866593 TSecr=3598277543 [TCP segment of a reassembled PDU]
  151 0.757840582 54.201.255.128 → 172.31.26.111 TCP 261 58256 → 27017 [PSH, ACK] Seq=4681 Ack=2449 Win=219 Len=195 TSval=1082569703 TSecr=1211340042 [TCP segment of a reassembled PDU]
  152 0.769325244 172.31.26.111 → 34.215.93.126 SSL 168 Continuation Data
  153 0.769494318 172.31.26.111 → 35.166.223.130 SSL 168 Continuation Data
  154 0.773230300 172.31.26.111 → 54.201.255.128 SSL 168 Continuation Data
  155 0.785233689 34.215.93.126 → 172.31.26.111 TCP 261 36846 → 27017 [PSH, ACK] Seq=4876 Ack=2551 Win=219 Len=195 TSval=2680833180 TSecr=2711867927 [TCP segment of a reassembled PDU]
  156 0.785370820 35.166.223.130 → 172.31.26.111 TCP 261 34226 → 27017 [PSH, ACK] Seq=4876 Ack=2551 Win=219 Len=195 TSval=3969866624 TSecr=3598277574 [TCP segment of a reassembled PDU]
  157 0.789220369 54.201.255.128 → 172.31.26.111 TCP 261 58256 → 27017 [PSH, ACK] Seq=4876 Ack=2551 Win=219 Len=195 TSval=1082569735 TSecr=1211340073 [TCP segment of a reassembled PDU]
  158 0.800612689 172.31.26.111 → 34.215.93.126 SSL 168 Continuation Data
  159 0.800779141 172.31.26.111 → 35.166.223.130 SSL 168 Continuation Data
  160 0.804393596 172.31.26.111 → 54.201.255.128 SSL 168 Continuation Data
  161 0.816782664 35.166.223.130 → 172.31.26.111 TCP 261 34226 → 27017 [PSH, ACK] Seq=5071 Ack=2653 Win=219 Len=195 TSval=3969866656 TSecr=3598277606 [TCP segment of a reassembled PDU]
  162 0.817689309 34.215.93.126 → 172.31.26.111 TCP 261 36846 → 27017 [PSH, ACK] Seq=5071 Ack=2653 Win=219 Len=195 TSval=2680833211 TSecr=2711867958 [TCP segment of a reassembled PDU]
  163 0.820383932 54.201.255.128 → 172.31.26.111 TCP 261 58256 → 27017 [PSH, ACK] Seq=5071 Ack=2653 Win=219 Len=195 TSval=1082569766 TSecr=1211340104 [TCP segment of a reassembled PDU]
  164 0.832072877 172.31.26.111 → 35.166.223.130 SSL 168 Continuation Data
  165 0.832893392 172.31.26.111 → 34.215.93.126 SSL 168 Continuation Data
  166 0.835580966 172.31.26.111 → 54.201.255.128 SSL 168 Continuation Data
  167 0.847959415 35.166.223.130 → 172.31.26.111 TCP 261 34226 → 27017 [PSH, ACK] Seq=5266 Ack=2755 Win=219 Len=195 TSval=3969866687 TSecr=3598277637 [TCP segment of a reassembled PDU]
  168 0.848731852 34.215.93.126 → 172.31.26.111 TCP 261 36846 → 27017 [PSH, ACK] Seq=5266 Ack=2755 Win=219 Len=195 TSval=2680833244 TSecr=2711867991 [TCP segment of a reassembled PDU]
  169 0.851831538 54.201.255.128 → 172.31.26.111 TCP 261 58256 → 27017 [PSH, ACK] Seq=5266 Ack=2755 Win=219 Len=195 TSval=1082569797 TSecr=1211340135 [TCP segment of a reassembled PDU]
  170 0.863211687 172.31.26.111 → 35.166.223.130 SSL 168 Continuation Data
  171 0.863936598 172.31.26.111 → 34.215.93.126 SSL 168 Continuation Data
  172 0.867023742 172.31.26.111 → 54.201.255.128 SSL 168 Continuation Data
  173 0.879291920 35.166.223.130 → 172.31.26.111 TCP 261 34226 → 27017 [PSH, ACK] Seq=5461 Ack=2857 Win=219 Len=195 TSval=3969866718 TSecr=3598277668 [TCP segment of a reassembled PDU]
  174 0.880660744 34.215.93.126 → 172.31.26.111 TCP 261 36846 → 27017 [PSH, ACK] Seq=5461 Ack=2857 Win=219 Len=195 TSval=2680833275 TSecr=2711868022 [TCP segment of a reassembled PDU]
  175 0.883235120 54.201.255.128 → 172.31.26.111 TCP 261 58256 → 27017 [PSH, ACK] Seq=5461 Ack=2857 Win=219 Len=195 TSval=1082569829 TSecr=1211340167 [TCP segment of a reassembled PDU]
  176 0.894537712 172.31.26.111 → 35.166.223.130 SSL 168 Continuation Data
  177 0.895864033 172.31.26.111 → 34.215.93.126 SSL 168 Continuation Data
  178 0.898408601 172.31.26.111 → 54.201.255.128 SSL 168 Continuation Data
  179 0.910555136 35.166.223.130 → 172.31.26.111 TCP 261 34226 → 27017 [PSH, ACK] Seq=5656 Ack=2959 Win=219 Len=195 TSval=3969866750 TSecr=3598277699 [TCP segment of a reassembled PDU]
  180 0.912028349 34.215.93.126 → 172.31.26.111 TCP 261 36846 → 27017 [PSH, ACK] Seq=5656 Ack=2959 Win=219 Len=195 TSval=2680833307 TSecr=2711868054 [TCP segment of a reassembled PDU]
  181 0.914638820 54.201.255.128 → 172.31.26.111 TCP 261 58256 → 27017 [PSH, ACK] Seq=5656 Ack=2959 Win=219 Len=195 TSval=1082569860 TSecr=1211340198 [TCP segment of a reassembled PDU]
  182 0.925864008 172.31.26.111 → 35.166.223.130 SSL 168 Continuation Data
  183 0.927259879 172.31.26.111 → 34.215.93.126 SSL 168 Continuation Data
  184 0.929887162 172.31.26.111 → 54.201.255.128 SSL 168 Continuation Data
  185 0.942016810 35.166.223.130 → 172.31.26.111 TCP 261 34226 → 27017 [PSH, ACK] Seq=5851 Ack=3061 Win=219 Len=195 TSval=3969866781 TSecr=3598277731 [TCP segment of a reassembled PDU]
  186 0.943351672 34.215.93.126 → 172.31.26.111 TCP 261 36846 → 27017 [PSH, ACK] Seq=5851 Ack=3061 Win=219 Len=195 TSval=2680833338 TSecr=2711868085 [TCP segment of a reassembled PDU]
  187 0.946093949 54.201.255.128 → 172.31.26.111 TCP 261 58256 → 27017 [PSH, ACK] Seq=5851 Ack=3061 Win=219 Len=195 TSval=1082569892 TSecr=1211340230 [TCP segment of a reassembled PDU]
  188 0.957381006 172.31.26.111 → 35.166.223.130 SSL 168 Continuation Data
  189 0.958540515 172.31.26.111 → 34.215.93.126 SSL 168 Continuation Data
  190 0.961278288 172.31.26.111 → 54.201.255.128 SSL 168 Continuation Data
  191 0.973439092 35.166.223.130 → 172.31.26.111 TCP 261 34226 → 27017 [PSH, ACK] Seq=6046 Ack=3163 Win=219 Len=195 TSval=3969866812 TSecr=3598277762 [TCP segment of a reassembled PDU]
  192 0.974561120 34.215.93.126 → 172.31.26.111 TCP 261 36846 → 27017 [PSH, ACK] Seq=6046 Ack=3163 Win=219 Len=195 TSval=2680833369 TSecr=2711868116 [TCP segment of a reassembled PDU]
  193 0.977593660 54.201.255.128 → 172.31.26.111 TCP 261 58256 → 27017 [PSH, ACK] Seq=6046 Ack=3163 Win=219 Len=195 TSval=1082569923 TSecr=1211340261 [TCP segment of a reassembled PDU]
  194 0.988784820 172.31.26.111 → 35.166.223.130 SSL 168 Continuation Data
  195 0.989748430 172.31.26.111 → 34.215.93.126 SSL 168 Continuation Data
  196 0.992779332 172.31.26.111 → 54.201.255.128 SSL 168 Continuation Data
  197 1.004741283 35.166.223.130 → 172.31.26.111 TCP 261 34226 → 27017 [PSH, ACK] Seq=6241 Ack=3265 Win=219 Len=195 TSval=3969866844 TSecr=3598277794 [TCP segment of a reassembled PDU]
  198 1.005921621 34.215.93.126 → 172.31.26.111 TCP 261 36846 → 27017 [PSH, ACK] Seq=6241 Ack=3265 Win=219 Len=195 TSval=2680833401 TSecr=2711868148 [TCP segment of a reassembled PDU]
  199 1.008880012 54.201.255.128 → 172.31.26.111 TCP 261 58256 → 27017 [PSH, ACK] Seq=6241 Ack=3265 Win=219 Len=195 TSval=1082569954 TSecr=1211340293 [TCP segment of a reassembled PDU]
  200 1.020099148 172.31.26.111 → 35.166.223.130 SSL 168 Continuation Data
  201 1.021124308 172.31.26.111 → 34.215.93.126 SSL 168 Continuation Data
  202 1.024699103 172.31.26.111 → 153.90.128.120 SSH 110 Server: Encrypted packet (len=44)
  203 1.024866375 172.31.26.111 → 54.201.255.128 SSL 168 Continuation Data
  204 1.036212762 35.166.223.130 → 172.31.26.111 TCP 261 34226 → 27017 [PSH, ACK] Seq=6436 Ack=3367 Win=219 Len=195 TSval=3969866875 TSecr=3598277825 [TCP segment of a reassembled PDU]
  205 1.037383778 34.215.93.126 → 172.31.26.111 TCP 261 36846 → 27017 [PSH, ACK] Seq=6436 Ack=3367 Win=219 Len=195 TSval=2680833432 TSecr=2711868179 [TCP segment of a reassembled PDU]
  206 1.041066483 54.201.255.128 → 172.31.26.111 TCP 261 58256 → 27017 [PSH, ACK] Seq=6436 Ack=3367 Win=219 Len=195 TSval=1082569986 TSecr=1211340325 [TCP segment of a reassembled PDU]
  207 1.051563299 172.31.26.111 → 35.166.223.130 SSL 168 Continuation Data
  208 1.052579105 172.31.26.111 → 34.215.93.126 SSL 168 Continuation Data
  209 1.056277251 172.31.26.111 → 54.201.255.128 SSL 168 Continuation Data
  210 1.067566575 35.166.223.130 → 172.31.26.111 TCP 261 34226 → 27017 [PSH, ACK] Seq=6631 Ack=3469 Win=219 Len=195 TSval=3969866907 TSecr=3598277856 [TCP segment of a reassembled PDU]
  211 1.068617900 34.215.93.126 → 172.31.26.111 TCP 261 36846 → 27017 [PSH, ACK] Seq=6631 Ack=3469 Win=219 Len=195 TSval=2680833463 TSecr=2711868210 [TCP segment of a reassembled PDU]
  212 1.072428654 54.201.255.128 → 172.31.26.111 TCP 261 58256 → 27017 [PSH, ACK] Seq=6631 Ack=3469 Win=219 Len=195 TSval=1082570018 TSecr=1211340356 [TCP segment of a reassembled PDU]
  213 1.073783858 153.90.128.120 → 172.31.26.111 TCP 66 52812 → 22 [ACK] Seq=1 Ack=149 Win=1444 Len=0 TSval=970646263 TSecr=400998709
  214 1.082960342 172.31.26.111 → 35.166.223.130 SSL 168 Continuation Data
  215 1.083831937 172.31.26.111 → 34.215.93.126 SSL 168 Continuation Data
  216 1.087611997 172.31.26.111 → 54.201.255.128 SSL 168 Continuation Data
  217 1.098989431 35.166.223.130 → 172.31.26.111 TCP 261 34226 → 27017 [PSH, ACK] Seq=6826 Ack=3571 Win=219 Len=195 TSval=3969866938 TSecr=3598277888 [TCP segment of a reassembled PDU]
  218 1.099924078 34.215.93.126 → 172.31.26.111 TCP 261 36846 → 27017 [PSH, ACK] Seq=6826 Ack=3571 Win=219 Len=195 TSval=2680833495 TSecr=2711868242 [TCP segment of a reassembled PDU]
  219 1.103764860 54.201.255.128 → 172.31.26.111 TCP 261 58256 → 27017 [PSH, ACK] Seq=6826 Ack=3571 Win=219 Len=195 TSval=1082570049 TSecr=1211340388 [TCP segment of a reassembled PDU]
  220 1.114344839 172.31.26.111 → 35.166.223.130 SSL 168 Continuation Data
  221 1.115137945 172.31.26.111 → 34.215.93.126 SSL 168 Continuation Data
  222 1.118986812 172.31.26.111 → 54.201.255.128 SSL 168 Continuation Data
  223 1.130320244 35.166.223.130 → 172.31.26.111 TCP 261 34226 → 27017 [PSH, ACK] Seq=7021 Ack=3673 Win=219 Len=195 TSval=3969866969 TSecr=3598277919 [TCP segment of a reassembled PDU]
  224 1.131036819 34.215.93.126 → 172.31.26.111 TCP 261 36846 → 27017 [PSH, ACK] Seq=7021 Ack=3673 Win=219 Len=195 TSval=2680833526 TSecr=2711868273 [TCP segment of a reassembled PDU]
  225 1.135060284 54.201.255.128 → 172.31.26.111 TCP 261 58256 → 27017 [PSH, ACK] Seq=7021 Ack=3673 Win=219 Len=195 TSval=1082570081 TSecr=1211340419 [TCP segment of a reassembled PDU]
  226 1.145560690 172.31.26.111 → 35.166.223.130 SSL 168 Continuation Data
  227 1.146237845 172.31.26.111 → 34.215.93.126 SSL 168 Continuation Data
  228 1.150261403 172.31.26.111 → 54.201.255.128 SSL 168 Continuation Data
  229 1.161536283 35.166.223.130 → 172.31.26.111 TCP 261 34226 → 27017 [PSH, ACK] Seq=7216 Ack=3775 Win=219 Len=195 TSval=3969867001 TSecr=3598277950 [TCP segment of a reassembled PDU]
  230 1.162323027 34.215.93.126 → 172.31.26.111 TCP 261 36846 → 27017 [PSH, ACK] Seq=7216 Ack=3775 Win=219 Len=195 TSval=2680833557 TSecr=2711868304 [TCP segment of a reassembled PDU]
  231 1.166301356 54.201.255.128 → 172.31.26.111 TCP 261 58256 → 27017 [PSH, ACK] Seq=7216 Ack=3775 Win=219 Len=195 TSval=1082570112 TSecr=1211340450 [TCP segment of a reassembled PDU]
  232 1.176809244 172.31.26.111 → 35.166.223.130 SSL 168 Continuation Data
  233 1.177561971 172.31.26.111 → 34.215.93.126 SSL 168 Continuation Data
  234 1.181590238 172.31.26.111 → 54.201.255.128 SSL 168 Continuation Data
  235 1.192813550 35.166.223.130 → 172.31.26.111 TCP 261 34226 → 27017 [PSH, ACK] Seq=7411 Ack=3877 Win=219 Len=195 TSval=3969867032 TSecr=3598277982 [TCP segment of a reassembled PDU]
  236 1.193630011 34.215.93.126 → 172.31.26.111 TCP 261 36846 → 27017 [PSH, ACK] Seq=7411 Ack=3877 Win=219 Len=195 TSval=2680833588 TSecr=2711868335 [TCP segment of a reassembled PDU]
  237 1.197795667 54.201.255.128 → 172.31.26.111 TCP 261 58256 → 27017 [PSH, ACK] Seq=7411 Ack=3877 Win=219 Len=195 TSval=1082570143 TSecr=1211340481 [TCP segment of a reassembled PDU]
  238 1.208155345 172.31.26.111 → 35.166.223.130 SSL 168 Continuation Data
  239 1.208837338 172.31.26.111 → 34.215.93.126 SSL 168 Continuation Data
  240 1.213005939 172.31.26.111 → 54.201.255.128 SSL 168 Continuation Data
  241 1.224040418 35.166.223.130 → 172.31.26.111 TCP 261 34226 → 27017 [PSH, ACK] Seq=7606 Ack=3979 Win=219 Len=195 TSval=3969867063 TSecr=3598278013 [TCP segment of a reassembled PDU]
  242 1.224851530 34.215.93.126 → 172.31.26.111 TCP 261 36846 → 27017 [PSH, ACK] Seq=7606 Ack=3979 Win=219 Len=195 TSval=2680833620 TSecr=2711868367 [TCP segment of a reassembled PDU]
  243 1.229111981 54.201.255.128 → 172.31.26.111 TCP 261 58256 → 27017 [PSH, ACK] Seq=7606 Ack=3979 Win=219 Len=195 TSval=1082570175 TSecr=1211340513 [TCP segment of a reassembled PDU]
  244 1.239344617 172.31.26.111 → 35.166.223.130 SSL 168 Continuation Data
  245 1.240061396 172.31.26.111 → 34.215.93.126 SSL 168 Continuation Data
  246 1.244319989 172.31.26.111 → 54.201.255.128 SSL 168 Continuation Data
  247 1.255422260 35.166.223.130 → 172.31.26.111 TCP 261 34226 → 27017 [PSH, ACK] Seq=7801 Ack=4081 Win=219 Len=195 TSval=3969867094 TSecr=3598278044 [TCP segment of a reassembled PDU]
  248 1.255953461 34.215.93.126 → 172.31.26.111 TCP 261 36846 → 27017 [PSH, ACK] Seq=7801 Ack=4081 Win=219 Len=195 TSval=2680833651 TSecr=2711868398 [TCP segment of a reassembled PDU]
  249 1.260324258 54.201.255.128 → 172.31.26.111 TCP 261 58256 → 27017 [PSH, ACK] Seq=7801 Ack=4081 Win=219 Len=195 TSval=1082570206 TSecr=1211340544 [TCP segment of a reassembled PDU]
  250 1.270707672 172.31.26.111 → 35.166.223.130 SSL 168 Continuation Data
  251 1.271165652 172.31.26.111 → 34.215.93.126 SSL 168 Continuation Data
  252 1.275583932 172.31.26.111 → 54.201.255.128 SSL 168 Continuation Data
  253 1.286839893 35.166.223.130 → 172.31.26.111 TCP 261 34226 → 27017 [PSH, ACK] Seq=7996 Ack=4183 Win=219 Len=195 TSval=3969867126 TSecr=3598278076 [TCP segment of a reassembled PDU]
  254 1.287229341 34.215.93.126 → 172.31.26.111 TCP 261 36846 → 27017 [PSH, ACK] Seq=7996 Ack=4183 Win=219 Len=195 TSval=2680833682 TSecr=2711868429 [TCP segment of a reassembled PDU]
  255 1.291544963 54.201.255.128 → 172.31.26.111 TCP 261 58256 → 27017 [PSH, ACK] Seq=7996 Ack=4183 Win=219 Len=195 TSval=1082570237 TSecr=1211340575 [TCP segment of a reassembled PDU]
  256 1.302201685 172.31.26.111 → 35.166.223.130 SSL 168 Continuation Data
  257 1.302405475 172.31.26.111 → 34.215.93.126 SSL 168 Continuation Data
  258 1.306728686 172.31.26.111 → 54.201.255.128 SSL 168 Continuation Data
  259 1.318225115 35.166.223.130 → 172.31.26.111 TCP 261 34226 → 27017 [PSH, ACK] Seq=8191 Ack=4285 Win=219 Len=195 TSval=3969867157 TSecr=3598278107 [TCP segment of a reassembled PDU]
  260 1.318436287 34.215.93.126 → 172.31.26.111 TCP 261 36846 → 27017 [PSH, ACK] Seq=8191 Ack=4285 Win=219 Len=195 TSval=2680833713 TSecr=2711868460 [TCP segment of a reassembled PDU]
  261 1.321261493 54.188.89.98 → 172.31.26.111 TCP 74 40502 → 22 [SYN] Seq=0 Win=26883 Len=0 MSS=1460 SACK_PERM=1 TSval=1471559091 TSecr=0 WS=128
  262 1.322662894 54.201.255.128 → 172.31.26.111 TCP 261 58256 → 27017 [PSH, ACK] Seq=8191 Ack=4285 Win=219 Len=195 TSval=1082570268 TSecr=1211340607 [TCP segment of a reassembled PDU]
  263 1.333672470 172.31.26.111 → 34.215.93.126 SSL 168 Continuation Data
  264 1.333679667 172.31.26.111 → 35.166.223.130 SSL 168 Continuation Data
  265 1.336360699 172.31.26.111 → 54.188.89.98 TCP 74 22 → 40502 [SYN, ACK] Seq=0 Ack=1 Win=26847 Len=0 MSS=8961 SACK_PERM=1 TSval=1804988261 TSecr=1471559091 WS=128
  266 1.337862906 172.31.26.111 → 54.201.255.128 SSL 168 Continuation Data
  267 1.349623607 34.215.93.126 → 172.31.26.111 TCP 261 36846 → 27017 [PSH, ACK] Seq=8386 Ack=4387 Win=219 Len=195 TSval=2680833744 TSecr=2711868492 [TCP segment of a reassembled PDU]
  268 1.349643827 35.166.223.130 → 172.31.26.111 TCP 261 34226 → 27017 [PSH, ACK] Seq=8386 Ack=4387 Win=219 Len=195 TSval=3969867189 TSecr=3598278139 [TCP segment of a reassembled PDU]
  269 1.351936984 54.188.89.98 → 172.31.26.111 TCP 66 40502 → 22 [ACK] Seq=1 Ack=1 Win=27008 Len=0 TSval=1471559122 TSecr=1804988261
  270 1.352068037 54.188.89.98 → 172.31.26.111 SSH 107 Client: Protocol (SSH-2.0-OpenSSH_7.6p1 Ubuntu-4ubuntu0.2)
  271 1.353679817 54.201.255.128 → 172.31.26.111 TCP 261 58256 → 27017 [PSH, ACK] Seq=8386 Ack=4387 Win=219 Len=195 TSval=1082570299 TSecr=1211340638 [TCP segment of a reassembled PDU]
  272 1.365027496 172.31.26.111 → 34.215.93.126 SSL 168 Continuation Data
  273 1.365203461 172.31.26.111 → 35.166.223.130 SSL 168 Continuation Data
  274 1.367137197 172.31.26.111 → 54.188.89.98 TCP 66 22 → 40502 [ACK] Seq=1 Ack=42 Win=26880 Len=0 TSval=1804988292 TSecr=1471559122
  275 1.371767989 172.31.26.111 → 54.188.89.98 SSHv2 107 Server: Protocol (SSH-2.0-OpenSSH_7.6p1 Ubuntu-4ubuntu0.2)
  276 1.372121681 172.31.26.111 → 54.201.255.128 SSL 168 Continuation Data
  277 1.381055704 34.215.93.126 → 172.31.26.111 TCP 261 36846 → 27017 [PSH, ACK] Seq=8581 Ack=4489 Win=219 Len=195 TSval=2680833776 TSecr=2711868523 [TCP segment of a reassembled PDU]
  278 1.381212910 35.166.223.130 → 172.31.26.111 TCP 261 34226 → 27017 [PSH, ACK] Seq=8581 Ack=4489 Win=219 Len=195 TSval=3969867220 TSecr=3598278170 [TCP segment of a reassembled PDU]
  279 1.387285333 54.188.89.98 → 172.31.26.111 TCP 66 40502 → 22 [ACK] Seq=42 Ack=42 Win=27008 Len=0 TSval=1471559157 TSecr=1804988297
  280 1.387648275 54.188.89.98 → 172.31.26.111 SSHv2 1426 Client: Key Exchange Init
  281 1.388149818 54.201.255.128 → 172.31.26.111 TCP 261 58256 → 27017 [PSH, ACK] Seq=8581 Ack=4489 Win=219 Len=195 TSval=1082570334 TSecr=1211340672 [TCP segment of a reassembled PDU]
  282 1.396440327 172.31.26.111 → 34.215.93.126 SSL 168 Continuation Data
  283 1.396608316 172.31.26.111 → 35.166.223.130 SSL 168 Continuation Data
  284 1.402404256 172.31.26.111 → 54.188.89.98 SSHv2 1146 Server: Key Exchange Init
  285 1.403353021 172.31.26.111 → 54.201.255.128 SSL 168 Continuation Data
  286 1.412400055 34.215.93.126 → 172.31.26.111 TCP 261 36846 → 27017 [PSH, ACK] Seq=8776 Ack=4591 Win=219 Len=195 TSval=2680833807 TSecr=2711868554 [TCP segment of a reassembled PDU]
  287 1.413115808 35.166.223.130 → 172.31.26.111 TCP 261 34226 → 27017 [PSH, ACK] Seq=8776 Ack=4591 Win=219 Len=195 TSval=3969867252 TSecr=3598278201 [TCP segment of a reassembled PDU]
  288 1.421111928 54.201.255.128 → 172.31.26.111 TCP 261 58256 → 27017 [PSH, ACK] Seq=8776 Ack=4591 Win=219 Len=195 TSval=1082570365 TSecr=1211340703 [TCP segment of a reassembled PDU]
  289 1.427728049 172.31.26.111 → 34.215.93.126 SSL 168 Continuation Data
  290 1.428329850 172.31.26.111 → 35.166.223.130 SSL 168 Continuation Data
  291 1.436388503 172.31.26.111 → 54.201.255.128 SSL 168 Continuation Data
  292 1.443624134 34.215.93.126 → 172.31.26.111 TCP 261 36846 → 27017 [PSH, ACK] Seq=8971 Ack=4693 Win=219 Len=195 TSval=2680833838 TSecr=2711868586 [TCP segment of a reassembled PDU]
  293 1.444443066 35.166.223.130 → 172.31.26.111 TCP 261 34226 → 27017 [PSH, ACK] Seq=8971 Ack=4693 Win=219 Len=195 TSval=3969867283 TSecr=3598278233 [TCP segment of a reassembled PDU]
  294 1.445042719 172.31.26.111 → 54.188.89.98 TCP 66 22 → 40502 [ACK] Seq=1122 Ack=1402 Win=29568 Len=0 TSval=1804988370 TSecr=1471559158
  295 1.452520429 54.201.255.128 → 172.31.26.111 TCP 261 58256 → 27017 [PSH, ACK] Seq=8971 Ack=4693 Win=219 Len=195 TSval=1082570398 TSecr=1211340736 [TCP segment of a reassembled PDU]
  296 1.458971530 172.31.26.111 → 34.215.93.126 SSL 168 Continuation Data
  297 1.459634678 172.31.26.111 → 35.166.223.130 SSL 168 Continuation Data
  298 1.460655285 54.188.89.98 → 172.31.26.111 SSHv2 114 Client: Diffie-Hellman Key Exchange Init
  299 1.467731810 172.31.26.111 → 54.201.255.128 SSL 168 Continuation Data
  300 1.474979005 34.215.93.126 → 172.31.26.111 TCP 261 36846 → 27017 [PSH, ACK] Seq=9166 Ack=4795 Win=219 Len=195 TSval=2680833870 TSecr=2711868617 [TCP segment of a reassembled PDU]
  301 1.475750091 172.31.26.111 → 54.188.89.98 TCP 66 22 → 40502 [ACK] Seq=1122 Ack=1450 Win=29568 Len=0 TSval=1804988401 TSecr=1471559231
  302 1.475758252 35.166.223.130 → 172.31.26.111 TCP 261 34226 → 27017 [PSH, ACK] Seq=9166 Ack=4795 Win=219 Len=195 TSval=3969867315 TSecr=3598278265 [TCP segment of a reassembled PDU]
  303 1.480122990 172.31.26.111 → 54.188.89.98 SSHv2 518 Server: Diffie-Hellman Key Exchange Reply, New Keys, Encrypted packet (len=172)
  304 1.483630170 54.201.255.128 → 172.31.26.111 TCP 261 58256 → 27017 [PSH, ACK] Seq=9166 Ack=4795 Win=219 Len=195 TSval=1082570429 TSecr=1211340768 [TCP segment of a reassembled PDU]
  305 1.490308465 172.31.26.111 → 34.215.93.126 SSL 168 Continuation Data
  306 1.491025478 172.31.26.111 → 35.166.223.130 SSL 168 Continuation Data
  307 1.498494675 54.188.89.98 → 172.31.26.111 SSHv2 82 Client: New Keys
  308 1.498813880 172.31.26.111 → 54.201.255.128 SSL 168 Continuation Data
  309 1.506267935 34.215.93.126 → 172.31.26.111 TCP 261 36846 → 27017 [PSH, ACK] Seq=9361 Ack=4897 Win=219 Len=195 TSval=2680833901 TSecr=2711868648 [TCP segment of a reassembled PDU]
  310 1.509118700 35.166.223.130 → 172.31.26.111 TCP 261 34226 → 27017 [PSH, ACK] Seq=9361 Ack=4897 Win=219 Len=195 TSval=3969867348 TSecr=3598278296 [TCP segment of a reassembled PDU]
  311 1.514819236 54.201.255.128 → 172.31.26.111 TCP 261 58256 → 27017 [PSH, ACK] Seq=9361 Ack=4897 Win=219 Len=195 TSval=1082570460 TSecr=1211340799 [TCP segment of a reassembled PDU]
