    1 0.000000000 153.90.128.120 → 172.31.26.111 TCP 66 52812 → 22 [ACK] Seq=1 Ack=1 Win=1444 Len=0 TSval=970807967 TSecr=401160418
    2 0.000006970 153.90.128.120 → 172.31.26.111 TCP 66 52812 → 22 [ACK] Seq=1 Ack=61 Win=1444 Len=0 TSval=970807967 TSecr=401160419
    3 0.001009359 172.31.26.111 → 34.215.93.126 SSL 168 Continuation Data
    4 0.001014485 172.31.26.111 → 35.166.223.130 SSL 168 Continuation Data
    5 0.003446411 153.90.128.120 → 172.31.26.111 TCP 66 52812 → 22 [ACK] Seq=1 Ack=97 Win=1444 Len=0 TSval=970807970 TSecr=401160419
    6 0.003452490 153.90.128.120 → 172.31.26.111 TCP 66 52812 → 22 [ACK] Seq=1 Ack=349 Win=1444 Len=0 TSval=970807970 TSecr=401160419
    7 0.003496893 153.90.128.120 → 172.31.26.111 TCP 66 52812 → 22 [ACK] Seq=1 Ack=385 Win=1444 Len=0 TSval=970807970 TSecr=401160419
    8 0.008394728 172.31.26.111 → 54.201.255.128 SSL 168 Continuation Data
    9 0.008398852 172.31.26.111 → 153.90.128.120 SSH 126 Server: Encrypted packet (len=60)
   10 0.012265806 172.31.26.111 → 34.219.173.151 SSL 168 Continuation Data
   11 0.016857392 34.215.93.126 → 172.31.26.111 TCP 261 [TCP segment of a reassembled PDU]
   12 0.016873647 35.166.223.130 → 172.31.26.111 TCP 261 [TCP segment of a reassembled PDU]
   13 0.024592437 54.201.255.128 → 172.31.26.111 TCP 261 [TCP segment of a reassembled PDU]
   14 0.029060010 34.219.173.151 → 172.31.26.111 TCP 261 [TCP segment of a reassembled PDU]
   15 0.032124118 172.31.26.111 → 34.215.93.126 SSL 168 Continuation Data
   16 0.032292321 172.31.26.111 → 35.166.223.130 SSL 168 Continuation Data
   17 0.039797948 172.31.26.111 → 54.201.255.128 SSL 168 Continuation Data
   18 0.044269466 172.31.26.111 → 34.219.173.151 SSL 168 Continuation Data
   19 0.048073662 34.215.93.126 → 172.31.26.111 TCP 261 36854 → 27017 [PSH, ACK] Seq=196 Ack=205 Win=219 Len=195 TSval=2680995225 TSecr=2712029974 [TCP segment of a reassembled PDU]
   20 0.048263429 35.166.223.130 → 172.31.26.111 TCP 261 34230 → 27017 [PSH, ACK] Seq=196 Ack=205 Win=219 Len=195 TSval=3970028662 TSecr=3598439621 [TCP segment of a reassembled PDU]
   21 0.056016390 54.201.255.128 → 172.31.26.111 TCP 261 58260 → 27017 [PSH, ACK] Seq=196 Ack=205 Win=219 Len=195 TSval=1082731781 TSecr=1211502123 [TCP segment of a reassembled PDU]
   22 0.057281885 153.90.128.120 → 172.31.26.111 TCP 66 52812 → 22 [ACK] Seq=1 Ack=445 Win=1444 Len=0 TSval=970808024 TSecr=401160476
   23 0.060488667 34.219.173.151 → 172.31.26.111 TCP 261 37940 → 27017 [PSH, ACK] Seq=196 Ack=205 Win=219 Len=195 TSval=1681448580 TSecr=910088273 [TCP segment of a reassembled PDU]
   24 0.063324698 172.31.26.111 → 34.215.93.126 SSL 168 Continuation Data
   25 0.063492492 172.31.26.111 → 35.166.223.130 SSL 168 Continuation Data
   26 0.071226187 172.31.26.111 → 54.201.255.128 SSL 168 Continuation Data
   27 0.075680285 172.31.26.111 → 34.219.173.151 SSL 168 Continuation Data
   28 0.079208064 34.215.93.126 → 172.31.26.111 TCP 261 36854 → 27017 [PSH, ACK] Seq=391 Ack=307 Win=219 Len=195 TSval=2680995256 TSecr=2712030005 [TCP segment of a reassembled PDU]
   29 0.079300891 35.166.223.130 → 172.31.26.111 TCP 261 34230 → 27017 [PSH, ACK] Seq=391 Ack=307 Win=219 Len=195 TSval=3970028693 TSecr=3598439652 [TCP segment of a reassembled PDU]
   30 0.087385098 54.201.255.128 → 172.31.26.111 TCP 261 58260 → 27017 [PSH, ACK] Seq=391 Ack=307 Win=219 Len=195 TSval=1082731812 TSecr=1211502155 [TCP segment of a reassembled PDU]
   31 0.092271784 34.219.173.151 → 172.31.26.111 TCP 261 37940 → 27017 [PSH, ACK] Seq=391 Ack=307 Win=219 Len=195 TSval=1681448612 TSecr=910088304 [TCP segment of a reassembled PDU]
   32 0.094544355 172.31.26.111 → 34.215.93.126 SSL 168 Continuation Data
   33 0.094711546 172.31.26.111 → 35.166.223.130 SSL 168 Continuation Data
   34 0.102561047 172.31.26.111 → 54.201.255.128 SSL 168 Continuation Data
   35 0.107451796 172.31.26.111 → 34.219.173.151 SSL 168 Continuation Data
   36 0.110370313 34.215.93.126 → 172.31.26.111 TCP 261 36854 → 27017 [PSH, ACK] Seq=586 Ack=409 Win=219 Len=195 TSval=2680995287 TSecr=2712030036 [TCP segment of a reassembled PDU]
   37 0.110540278 35.166.223.130 → 172.31.26.111 TCP 261 34230 → 27017 [PSH, ACK] Seq=586 Ack=409 Win=219 Len=195 TSval=3970028724 TSecr=3598439683 [TCP segment of a reassembled PDU]
   38 0.118717967 54.201.255.128 → 172.31.26.111 TCP 261 58260 → 27017 [PSH, ACK] Seq=586 Ack=409 Win=219 Len=195 TSval=1082731844 TSecr=1211502186 [TCP segment of a reassembled PDU]
   39 0.123612985 34.219.173.151 → 172.31.26.111 TCP 261 37940 → 27017 [PSH, ACK] Seq=586 Ack=409 Win=219 Len=195 TSval=1681448643 TSecr=910088336 [TCP segment of a reassembled PDU]
   40 0.125715211 172.31.26.111 → 34.215.93.126 SSL 168 Continuation Data
   41 0.125720628 172.31.26.111 → 35.166.223.130 SSL 168 Continuation Data
   42 0.133942300 172.31.26.111 → 54.201.255.128 SSL 168 Continuation Data
   43 0.138852493 172.31.26.111 → 34.219.173.151 SSL 168 Continuation Data
   44 0.141647060 35.166.223.130 → 172.31.26.111 TCP 261 34230 → 27017 [PSH, ACK] Seq=781 Ack=511 Win=219 Len=195 TSval=3970028755 TSecr=3598439714 [TCP segment of a reassembled PDU]
   45 0.141709697 34.215.93.126 → 172.31.26.111 TCP 261 36854 → 27017 [PSH, ACK] Seq=781 Ack=511 Win=219 Len=195 TSval=2680995318 TSecr=2712030067 [TCP segment of a reassembled PDU]
   46 0.150081466 54.201.255.128 → 172.31.26.111 TCP 261 58260 → 27017 [PSH, ACK] Seq=781 Ack=511 Win=219 Len=195 TSval=1082731875 TSecr=1211502217 [TCP segment of a reassembled PDU]
   47 0.155262461 34.219.173.151 → 172.31.26.111 TCP 261 37940 → 27017 [PSH, ACK] Seq=781 Ack=511 Win=219 Len=195 TSval=1681448675 TSecr=910088367 [TCP segment of a reassembled PDU]
   48 0.156989286 172.31.26.111 → 35.166.223.130 SSL 168 Continuation Data
   49 0.157228084 172.31.26.111 → 34.215.93.126 SSL 168 Continuation Data
   50 0.165320813 172.31.26.111 → 54.201.255.128 SSL 168 Continuation Data
   51 0.170461102 172.31.26.111 → 34.219.173.151 SSL 168 Continuation Data
   52 0.172881772 35.166.223.130 → 172.31.26.111 TCP 261 34230 → 27017 [PSH, ACK] Seq=976 Ack=613 Win=219 Len=195 TSval=3970028786 TSecr=3598439745 [TCP segment of a reassembled PDU]
   53 0.173051051 34.215.93.126 → 172.31.26.111 TCP 261 36854 → 27017 [PSH, ACK] Seq=976 Ack=613 Win=219 Len=195 TSval=2680995350 TSecr=2712030099 [TCP segment of a reassembled PDU]
   54 0.181603604 54.201.255.128 → 172.31.26.111 TCP 261 58260 → 27017 [PSH, ACK] Seq=976 Ack=613 Win=219 Len=195 TSval=1082731907 TSecr=1211502249 [TCP segment of a reassembled PDU]
   55 0.186637714 34.219.173.151 → 172.31.26.111 TCP 261 37940 → 27017 [PSH, ACK] Seq=976 Ack=613 Win=219 Len=195 TSval=1681448706 TSecr=910088399 [TCP segment of a reassembled PDU]
   56 0.188170876 172.31.26.111 → 35.166.223.130 SSL 168 Continuation Data
   57 0.188338228 172.31.26.111 → 34.215.93.126 SSL 168 Continuation Data
   58 0.196825937 172.31.26.111 → 54.201.255.128 SSL 168 Continuation Data
   59 0.201816209 172.31.26.111 → 34.219.173.151 SSL 168 Continuation Data
   60 0.204020751 35.166.223.130 → 172.31.26.111 TCP 261 34230 → 27017 [PSH, ACK] Seq=1171 Ack=715 Win=219 Len=195 TSval=3970028818 TSecr=3598439777 [TCP segment of a reassembled PDU]
   61 0.204184471 34.215.93.126 → 172.31.26.111 TCP 261 36854 → 27017 [PSH, ACK] Seq=1171 Ack=715 Win=219 Len=195 TSval=2680995381 TSecr=2712030130 [TCP segment of a reassembled PDU]
   62 0.213012351 54.201.255.128 → 172.31.26.111 TCP 261 58260 → 27017 [PSH, ACK] Seq=1171 Ack=715 Win=219 Len=195 TSval=1082731938 TSecr=1211502280 [TCP segment of a reassembled PDU]
   63 0.213284480 172.31.26.111 → 104.131.139.195 NTP 90 NTP Version 4, client
   64 0.213289485 172.31.26.111 → 45.33.103.94 NTP 90 NTP Version 4, client
   65 0.213290650 172.31.26.111 → 208.75.89.4  NTP 90 NTP Version 4, client
   66 0.213291674 172.31.26.111 → 129.250.35.251 NTP 90 NTP Version 4, client
   67 0.213292694 172.31.26.111 → 204.2.134.163 NTP 90 NTP Version 4, client
   68 0.218014938 34.219.173.151 → 172.31.26.111 TCP 261 37940 → 27017 [PSH, ACK] Seq=1171 Ack=715 Win=219 Len=195 TSval=1681448738 TSecr=910088430 [TCP segment of a reassembled PDU]
   69 0.219283793 172.31.26.111 → 35.166.223.130 SSL 168 Continuation Data
   70 0.219450337 172.31.26.111 → 34.215.93.126 SSL 168 Continuation Data
   71 0.219477147 129.250.35.251 → 172.31.26.111 NTP 90 NTP Version 4, server
   72 0.228231477 172.31.26.111 → 54.201.255.128 SSL 168 Continuation Data
   73 0.233213501 172.31.26.111 → 34.219.173.151 SSL 168 Continuation Data
   74 0.235151247 35.166.223.130 → 172.31.26.111 TCP 261 34230 → 27017 [PSH, ACK] Seq=1366 Ack=817 Win=219 Len=195 TSval=3970028849 TSecr=3598439808 [TCP segment of a reassembled PDU]
   75 0.235312829 34.215.93.126 → 172.31.26.111 TCP 261 36854 → 27017 [PSH, ACK] Seq=1366 Ack=817 Win=219 Len=195 TSval=2680995412 TSecr=2712030161 [TCP segment of a reassembled PDU]
   76 0.236207150 104.131.139.195 → 172.31.26.111 NTP 90 NTP Version 4, server
   77 0.242494398  208.75.89.4 → 172.31.26.111 NTP 90 NTP Version 4, server
   78 0.242995787 204.2.134.163 → 172.31.26.111 NTP 90 NTP Version 4, server
   79 0.244329666 54.201.255.128 → 172.31.26.111 TCP 261 58260 → 27017 [PSH, ACK] Seq=1366 Ack=817 Win=219 Len=195 TSval=1082731969 TSecr=1211502312 [TCP segment of a reassembled PDU]
   80 0.249337131 34.219.173.151 → 172.31.26.111 TCP 261 37940 → 27017 [PSH, ACK] Seq=1366 Ack=817 Win=219 Len=195 TSval=1681448769 TSecr=910088462 [TCP segment of a reassembled PDU]
   81 0.250440852 172.31.26.111 → 35.166.223.130 SSL 168 Continuation Data
   82 0.250446276 172.31.26.111 → 34.215.93.126 SSL 168 Continuation Data
   83 0.259547623 172.31.26.111 → 54.201.255.128 SSL 168 Continuation Data
   84 0.264552261 172.31.26.111 → 34.219.173.151 SSL 168 Continuation Data
   85 0.266275414 35.166.223.130 → 172.31.26.111 TCP 261 34230 → 27017 [PSH, ACK] Seq=1561 Ack=919 Win=219 Len=195 TSval=3970028880 TSecr=3598439839 [TCP segment of a reassembled PDU]
   86 0.266357313 34.215.93.126 → 172.31.26.111 TCP 261 36854 → 27017 [PSH, ACK] Seq=1561 Ack=919 Win=219 Len=195 TSval=2680995443 TSecr=2712030192 [TCP segment of a reassembled PDU]
   87 0.275697099 54.201.255.128 → 172.31.26.111 TCP 261 58260 → 27017 [PSH, ACK] Seq=1561 Ack=919 Win=219 Len=195 TSval=1082732001 TSecr=1211502343 [TCP segment of a reassembled PDU]
   88 0.281586832 172.31.26.111 → 34.215.93.126 SSL 168 Continuation Data
   89 0.281591380 172.31.26.111 → 35.166.223.130 SSL 168 Continuation Data
   90 0.281727747 34.219.173.151 → 172.31.26.111 TCP 261 37940 → 27017 [PSH, ACK] Seq=1561 Ack=919 Win=219 Len=195 TSval=1681448802 TSecr=910088493 [TCP segment of a reassembled PDU]
   91 0.290897198 172.31.26.111 → 54.201.255.128 SSL 168 Continuation Data
   92 0.296925517 172.31.26.111 → 34.219.173.151 SSL 168 Continuation Data
   93 0.297612282 34.215.93.126 → 172.31.26.111 TCP 261 36854 → 27017 [PSH, ACK] Seq=1756 Ack=1021 Win=219 Len=195 TSval=2680995474 TSecr=2712030223 [TCP segment of a reassembled PDU]
   94 0.297667303 35.166.223.130 → 172.31.26.111 TCP 261 34230 → 27017 [PSH, ACK] Seq=1756 Ack=1021 Win=219 Len=195 TSval=3970028911 TSecr=3598439870 [TCP segment of a reassembled PDU]
   95 0.307077987 54.201.255.128 → 172.31.26.111 TCP 261 58260 → 27017 [PSH, ACK] Seq=1756 Ack=1021 Win=219 Len=195 TSval=1082732032 TSecr=1211502374 [TCP segment of a reassembled PDU]
   96 0.312842800 172.31.26.111 → 34.215.93.126 SSL 168 Continuation Data
   97 0.313009348 172.31.26.111 → 35.166.223.130 SSL 168 Continuation Data
   98 0.313105250 34.219.173.151 → 172.31.26.111 TCP 261 37940 → 27017 [PSH, ACK] Seq=1756 Ack=1021 Win=219 Len=195 TSval=1681448833 TSecr=910088525 [TCP segment of a reassembled PDU]
   99 0.322289266 172.31.26.111 → 54.201.255.128 SSL 168 Continuation Data
  100 0.325757363 45.33.103.94 → 172.31.26.111 NTP 90 NTP Version 4, server
  101 0.328274204 172.31.26.111 → 34.219.173.151 SSL 168 Continuation Data
  102 0.331966837 34.215.93.126 → 172.31.26.111 TCP 261 36854 → 27017 [PSH, ACK] Seq=1951 Ack=1123 Win=219 Len=195 TSval=2680995509 TSecr=2712030254 [TCP segment of a reassembled PDU]
  103 0.332001387 35.166.223.130 → 172.31.26.111 TCP 261 34230 → 27017 [PSH, ACK] Seq=1951 Ack=1123 Win=219 Len=195 TSval=3970028946 TSecr=3598439901 [TCP segment of a reassembled PDU]
  104 0.338380542 54.201.255.128 → 172.31.26.111 TCP 261 58260 → 27017 [PSH, ACK] Seq=1951 Ack=1123 Win=219 Len=195 TSval=1082732064 TSecr=1211502406 [TCP segment of a reassembled PDU]
  105 0.347209139 172.31.26.111 → 34.215.93.126 SSL 168 Continuation Data
  106 0.347375517 172.31.26.111 → 35.166.223.130 SSL 168 Continuation Data
  107 0.348988333 34.219.173.151 → 172.31.26.111 TCP 261 37940 → 27017 [PSH, ACK] Seq=1951 Ack=1123 Win=219 Len=195 TSval=1681448864 TSecr=910088557 [TCP segment of a reassembled PDU]
  108 0.353570076 172.31.26.111 → 54.201.255.128 SSL 168 Continuation Data
  109 0.363087431 34.215.93.126 → 172.31.26.111 TCP 261 36854 → 27017 [PSH, ACK] Seq=2146 Ack=1225 Win=219 Len=195 TSval=2680995540 TSecr=2712030289 [TCP segment of a reassembled PDU]
  110 0.363152268 35.166.223.130 → 172.31.26.111 TCP 261 34230 → 27017 [PSH, ACK] Seq=2146 Ack=1225 Win=219 Len=195 TSval=3970028977 TSecr=3598439936 [TCP segment of a reassembled PDU]
  111 0.364188235 172.31.26.111 → 34.219.173.151 SSL 168 Continuation Data
  112 0.369670934 54.201.255.128 → 172.31.26.111 TCP 261 58260 → 27017 [PSH, ACK] Seq=2146 Ack=1225 Win=219 Len=195 TSval=1082732095 TSecr=1211502437 [TCP segment of a reassembled PDU]
  113 0.378311228 172.31.26.111 → 34.215.93.126 SSL 168 Continuation Data
  114 0.378315668 172.31.26.111 → 35.166.223.130 SSL 168 Continuation Data
  115 0.380508975 34.219.173.151 → 172.31.26.111 TCP 261 37940 → 27017 [PSH, ACK] Seq=2146 Ack=1225 Win=219 Len=195 TSval=1681448900 TSecr=910088593 [TCP segment of a reassembled PDU]
  116 0.384861158 172.31.26.111 → 54.201.255.128 SSL 168 Continuation Data
  117 0.394228379 34.215.93.126 → 172.31.26.111 TCP 261 36854 → 27017 [PSH, ACK] Seq=2341 Ack=1327 Win=219 Len=195 TSval=2680995571 TSecr=2712030320 [TCP segment of a reassembled PDU]
  118 0.394235562 35.166.223.130 → 172.31.26.111 TCP 261 34230 → 27017 [PSH, ACK] Seq=2341 Ack=1327 Win=219 Len=195 TSval=3970029008 TSecr=3598439967 [TCP segment of a reassembled PDU]
  119 0.395702483 172.31.26.111 → 34.219.173.151 SSL 168 Continuation Data
  120 0.400925982 54.201.255.128 → 172.31.26.111 TCP 261 58260 → 27017 [PSH, ACK] Seq=2341 Ack=1327 Win=219 Len=195 TSval=1082732126 TSecr=1211502468 [TCP segment of a reassembled PDU]
  121 0.409434077 172.31.26.111 → 34.215.93.126 SSL 168 Continuation Data
  122 0.409440725 172.31.26.111 → 35.166.223.130 SSL 168 Continuation Data
  123 0.411906728 34.219.173.151 → 172.31.26.111 TCP 261 37940 → 27017 [PSH, ACK] Seq=2341 Ack=1327 Win=219 Len=195 TSval=1681448932 TSecr=910088624 [TCP segment of a reassembled PDU]
  124 0.416117427 172.31.26.111 → 54.201.255.128 SSL 168 Continuation Data
  125 0.425268543 34.215.93.126 → 172.31.26.111 TCP 261 36854 → 27017 [PSH, ACK] Seq=2536 Ack=1429 Win=219 Len=195 TSval=2680995602 TSecr=2712030351 [TCP segment of a reassembled PDU]
  126 0.425315784 35.166.223.130 → 172.31.26.111 TCP 261 34230 → 27017 [PSH, ACK] Seq=2536 Ack=1429 Win=219 Len=195 TSval=3970029039 TSecr=3598439998 [TCP segment of a reassembled PDU]
  127 0.427195902 172.31.26.111 → 34.219.173.151 SSL 168 Continuation Data
  128 0.432306974 54.201.255.128 → 172.31.26.111 TCP 261 58260 → 27017 [PSH, ACK] Seq=2536 Ack=1429 Win=219 Len=195 TSval=1082732157 TSecr=1211502500 [TCP segment of a reassembled PDU]
  129 0.440518845 172.31.26.111 → 34.215.93.126 SSL 168 Continuation Data
  130 0.440685621 172.31.26.111 → 35.166.223.130 SSL 168 Continuation Data
  131 0.443371473 34.219.173.151 → 172.31.26.111 TCP 261 37940 → 27017 [PSH, ACK] Seq=2536 Ack=1429 Win=219 Len=195 TSval=1681448963 TSecr=910088656 [TCP segment of a reassembled PDU]
  132 0.447508850 172.31.26.111 → 54.201.255.128 SSL 168 Continuation Data
  133 0.456465967 34.215.93.126 → 172.31.26.111 TCP 261 36854 → 27017 [PSH, ACK] Seq=2731 Ack=1531 Win=219 Len=195 TSval=2680995633 TSecr=2712030382 [TCP segment of a reassembled PDU]
  134 0.456707107 35.166.223.130 → 172.31.26.111 TCP 261 34230 → 27017 [PSH, ACK] Seq=2731 Ack=1531 Win=219 Len=195 TSval=3970029070 TSecr=3598440029 [TCP segment of a reassembled PDU]
  135 0.458589306 172.31.26.111 → 34.219.173.151 SSL 168 Continuation Data
  136 0.463654763 54.201.255.128 → 172.31.26.111 TCP 261 58260 → 27017 [PSH, ACK] Seq=2731 Ack=1531 Win=219 Len=195 TSval=1082732189 TSecr=1211502531 [TCP segment of a reassembled PDU]
  137 0.471672440 172.31.26.111 → 34.215.93.126 SSL 168 Continuation Data
  138 0.471872134 172.31.26.111 → 35.166.223.130 SSL 168 Continuation Data
  139 0.474778608 34.219.173.151 → 172.31.26.111 TCP 261 37940 → 27017 [PSH, ACK] Seq=2731 Ack=1531 Win=219 Len=195 TSval=1681448995 TSecr=910088687 [TCP segment of a reassembled PDU]
  140 0.478850782 172.31.26.111 → 54.201.255.128 SSL 168 Continuation Data
  141 0.487502124 34.215.93.126 → 172.31.26.111 TCP 261 36854 → 27017 [PSH, ACK] Seq=2926 Ack=1633 Win=219 Len=195 TSval=2680995664 TSecr=2712030413 [TCP segment of a reassembled PDU]
  142 0.487731042 35.166.223.130 → 172.31.26.111 TCP 261 34230 → 27017 [PSH, ACK] Seq=2926 Ack=1633 Win=219 Len=195 TSval=3970029101 TSecr=3598440060 [TCP segment of a reassembled PDU]
  143 0.489966016 172.31.26.111 → 34.219.173.151 SSL 168 Continuation Data
  144 0.495094550 54.201.255.128 → 172.31.26.111 TCP 261 58260 → 27017 [PSH, ACK] Seq=2926 Ack=1633 Win=219 Len=195 TSval=1082732220 TSecr=1211502562 [TCP segment of a reassembled PDU]
  145 0.502707991 172.31.26.111 → 34.215.93.126 SSL 168 Continuation Data
  146 0.502898459 172.31.26.111 → 35.166.223.130 SSL 168 Continuation Data
  147 0.506136674 34.219.173.151 → 172.31.26.111 TCP 261 37940 → 27017 [PSH, ACK] Seq=2926 Ack=1633 Win=219 Len=195 TSval=1681449026 TSecr=910088718 [TCP segment of a reassembled PDU]
  148 0.510280707 172.31.26.111 → 54.201.255.128 SSL 168 Continuation Data
  149 0.516403980 172.31.26.111 → 153.90.128.120 SSH 110 Server: Encrypted packet (len=44)
  150 0.518700254 34.215.93.126 → 172.31.26.111 TCP 261 36854 → 27017 [PSH, ACK] Seq=3121 Ack=1735 Win=219 Len=195 TSval=2680995695 TSecr=2712030444 [TCP segment of a reassembled PDU]
  151 0.518716536 35.166.223.130 → 172.31.26.111 TCP 261 34230 → 27017 [PSH, ACK] Seq=3121 Ack=1735 Win=219 Len=195 TSval=3970029132 TSecr=3598440091 [TCP segment of a reassembled PDU]
  152 0.521354089 172.31.26.111 → 34.219.173.151 SSL 168 Continuation Data
  153 0.528061048 54.201.255.128 → 172.31.26.111 TCP 261 58260 → 27017 [PSH, ACK] Seq=3121 Ack=1735 Win=219 Len=195 TSval=1082732253 TSecr=1211502594 [TCP segment of a reassembled PDU]
  154 0.534003538 172.31.26.111 → 34.215.93.126 SSL 168 Continuation Data
  155 0.534008316 172.31.26.111 → 35.166.223.130 SSL 168 Continuation Data
  156 0.538364930 34.219.173.151 → 172.31.26.111 TCP 261 37940 → 27017 [PSH, ACK] Seq=3121 Ack=1735 Win=219 Len=195 TSval=1681449058 TSecr=910088750 [TCP segment of a reassembled PDU]
  157 0.543267009 172.31.26.111 → 54.201.255.128 SSL 168 Continuation Data
  158 0.549887524 34.215.93.126 → 172.31.26.111 TCP 261 36854 → 27017 [PSH, ACK] Seq=3316 Ack=1837 Win=219 Len=195 TSval=2680995727 TSecr=2712030475 [TCP segment of a reassembled PDU]
  159 0.549945911 35.166.223.130 → 172.31.26.111 TCP 261 34230 → 27017 [PSH, ACK] Seq=3316 Ack=1837 Win=219 Len=195 TSval=3970029163 TSecr=3598440122 [TCP segment of a reassembled PDU]
  160 0.553574094 172.31.26.111 → 34.219.173.151 SSL 168 Continuation Data
  161 0.559439574 54.201.255.128 → 172.31.26.111 TCP 261 58260 → 27017 [PSH, ACK] Seq=3316 Ack=1837 Win=219 Len=195 TSval=1082732285 TSecr=1211502627 [TCP segment of a reassembled PDU]
  162 0.565104098 172.31.26.111 → 34.215.93.126 SSL 168 Continuation Data
  163 0.565109065 172.31.26.111 → 35.166.223.130 SSL 168 Continuation Data
  164 0.565374967 153.90.128.120 → 172.31.26.111 TCP 66 52812 → 22 [ACK] Seq=1 Ack=489 Win=1444 Len=0 TSval=970808532 TSecr=401160984
  165 0.569689148 34.219.173.151 → 172.31.26.111 TCP 261 37940 → 27017 [PSH, ACK] Seq=3316 Ack=1837 Win=219 Len=195 TSval=1681449090 TSecr=910088782 [TCP segment of a reassembled PDU]
  166 0.574630641 172.31.26.111 → 54.201.255.128 SSL 168 Continuation Data
  167 0.581069230 34.215.93.126 → 172.31.26.111 TCP 261 36854 → 27017 [PSH, ACK] Seq=3511 Ack=1939 Win=219 Len=195 TSval=2680995758 TSecr=2712030507 [TCP segment of a reassembled PDU]
  168 0.581076887 35.166.223.130 → 172.31.26.111 TCP 261 34230 → 27017 [PSH, ACK] Seq=3511 Ack=1939 Win=219 Len=195 TSval=3970029194 TSecr=3598440154 [TCP segment of a reassembled PDU]
  169 0.584904746 172.31.26.111 → 34.219.173.151 SSL 168 Continuation Data
  170 0.590831335 54.201.255.128 → 172.31.26.111 TCP 261 58260 → 27017 [PSH, ACK] Seq=3511 Ack=1939 Win=219 Len=195 TSval=1082732316 TSecr=1211502658 [TCP segment of a reassembled PDU]
  171 0.596264179 172.31.26.111 → 35.166.223.130 SSL 168 Continuation Data
  172 0.596430389 172.31.26.111 → 34.215.93.126 SSL 168 Continuation Data
  173 0.601253587 34.219.173.151 → 172.31.26.111 TCP 261 37940 → 27017 [PSH, ACK] Seq=3511 Ack=1939 Win=219 Len=195 TSval=1681449121 TSecr=910088813 [TCP segment of a reassembled PDU]
  174 0.606004659 172.31.26.111 → 54.201.255.128 SSL 168 Continuation Data
  175 0.612149457 35.166.223.130 → 172.31.26.111 TCP 261 34230 → 27017 [PSH, ACK] Seq=3706 Ack=2041 Win=219 Len=195 TSval=3970029226 TSecr=3598440185 [TCP segment of a reassembled PDU]
  176 0.612341286 34.215.93.126 → 172.31.26.111 TCP 261 36854 → 27017 [PSH, ACK] Seq=3706 Ack=2041 Win=219 Len=195 TSval=2680995789 TSecr=2712030538 [TCP segment of a reassembled PDU]
  177 0.616446568 172.31.26.111 → 34.219.173.151 SSL 168 Continuation Data
  178 0.622132357 54.201.255.128 → 172.31.26.111 TCP 261 58260 → 27017 [PSH, ACK] Seq=3706 Ack=2041 Win=219 Len=195 TSval=1082732347 TSecr=1211502689 [TCP segment of a reassembled PDU]
  179 0.627414936 172.31.26.111 → 35.166.223.130 SSL 168 Continuation Data
  180 0.627582275 172.31.26.111 → 34.215.93.126 SSL 168 Continuation Data
  181 0.632595770 34.219.173.151 → 172.31.26.111 TCP 261 37940 → 27017 [PSH, ACK] Seq=3706 Ack=2041 Win=219 Len=195 TSval=1681449152 TSecr=910088845 [TCP segment of a reassembled PDU]
  182 0.637357579 172.31.26.111 → 54.201.255.128 SSL 168 Continuation Data
  183 0.643333313 35.166.223.130 → 172.31.26.111 TCP 261 34230 → 27017 [PSH, ACK] Seq=3901 Ack=2143 Win=219 Len=195 TSval=3970029257 TSecr=3598440216 [TCP segment of a reassembled PDU]
  184 0.643741863 34.215.93.126 → 172.31.26.111 TCP 261 36854 → 27017 [PSH, ACK] Seq=3901 Ack=2143 Win=219 Len=195 TSval=2680995820 TSecr=2712030569 [TCP segment of a reassembled PDU]
  185 0.647810652 172.31.26.111 → 34.219.173.151 SSL 168 Continuation Data
  186 0.653506362 54.201.255.128 → 172.31.26.111 TCP 261 58260 → 27017 [PSH, ACK] Seq=3901 Ack=2143 Win=219 Len=195 TSval=1082732379 TSecr=1211502721 [TCP segment of a reassembled PDU]
  187 0.658538412 172.31.26.111 → 35.166.223.130 SSL 168 Continuation Data
  188 0.658947920 172.31.26.111 → 34.215.93.126 SSL 168 Continuation Data
  189 0.663947710 34.219.173.151 → 172.31.26.111 TCP 261 37940 → 27017 [PSH, ACK] Seq=3901 Ack=2143 Win=219 Len=195 TSval=1681449184 TSecr=910088876 [TCP segment of a reassembled PDU]
  190 0.668690959 172.31.26.111 → 54.201.255.128 SSL 168 Continuation Data
  191 0.674516388 35.166.223.130 → 172.31.26.111 TCP 261 34230 → 27017 [PSH, ACK] Seq=4096 Ack=2245 Win=219 Len=195 TSval=3970029288 TSecr=3598440247 [TCP segment of a reassembled PDU]
  192 0.674842300 34.215.93.126 → 172.31.26.111 TCP 261 36854 → 27017 [PSH, ACK] Seq=4096 Ack=2245 Win=219 Len=195 TSval=2680995851 TSecr=2712030600 [TCP segment of a reassembled PDU]
  193 0.679178264 172.31.26.111 → 34.219.173.151 SSL 168 Continuation Data
  194 0.684885523 54.201.255.128 → 172.31.26.111 TCP 261 58260 → 27017 [PSH, ACK] Seq=4096 Ack=2245 Win=219 Len=195 TSval=1082732410 TSecr=1211502752 [TCP segment of a reassembled PDU]
  195 0.689735446 172.31.26.111 → 35.166.223.130 SSL 168 Continuation Data
  196 0.690021229 172.31.26.111 → 34.215.93.126 SSL 168 Continuation Data
  197 0.695401051 34.219.173.151 → 172.31.26.111 TCP 261 37940 → 27017 [PSH, ACK] Seq=4096 Ack=2245 Win=219 Len=195 TSval=1681449215 TSecr=910088908 [TCP segment of a reassembled PDU]
  198 0.700065929 172.31.26.111 → 54.201.255.128 SSL 168 Continuation Data
  199 0.705605452 35.166.223.130 → 172.31.26.111 TCP 261 34230 → 27017 [PSH, ACK] Seq=4291 Ack=2347 Win=219 Len=195 TSval=3970029319 TSecr=3598440278 [TCP segment of a reassembled PDU]
  200 0.706042139 34.215.93.126 → 172.31.26.111 TCP 261 36854 → 27017 [PSH, ACK] Seq=4291 Ack=2347 Win=219 Len=195 TSval=2680995883 TSecr=2712030631 [TCP segment of a reassembled PDU]
  201 0.710603852 172.31.26.111 → 34.219.173.151 SSL 168 Continuation Data
  202 0.716195495 54.201.255.128 → 172.31.26.111 TCP 261 58260 → 27017 [PSH, ACK] Seq=4291 Ack=2347 Win=219 Len=195 TSval=1082732441 TSecr=1211502784 [TCP segment of a reassembled PDU]
  203 0.720803878 172.31.26.111 → 35.166.223.130 SSL 168 Continuation Data
  204 0.721251221 172.31.26.111 → 34.215.93.126 SSL 168 Continuation Data
  205 0.726707126 34.219.173.151 → 172.31.26.111 TCP 261 37940 → 27017 [PSH, ACK] Seq=4291 Ack=2347 Win=219 Len=195 TSval=1681449247 TSecr=910088939 [TCP segment of a reassembled PDU]
  206 0.731410558 172.31.26.111 → 54.201.255.128 SSL 168 Continuation Data
  207 0.736235618 54.188.89.98 → 172.31.26.111 TCP 307 [TCP segment of a reassembled PDU]
  208 0.736699816 35.166.223.130 → 172.31.26.111 TCP 261 34230 → 27017 [PSH, ACK] Seq=4486 Ack=2449 Win=219 Len=195 TSval=3970029350 TSecr=3598440309 [TCP segment of a reassembled PDU]
  209 0.737116628 34.215.93.126 → 172.31.26.111 TCP 261 36854 → 27017 [PSH, ACK] Seq=4486 Ack=2449 Win=219 Len=195 TSval=2680995914 TSecr=2712030663 [TCP segment of a reassembled PDU]
  210 0.741920258 172.31.26.111 → 34.219.173.151 SSL 168 Continuation Data
  211 0.747475460 54.201.255.128 → 172.31.26.111 TCP 261 58260 → 27017 [PSH, ACK] Seq=4486 Ack=2449 Win=219 Len=195 TSval=1082732473 TSecr=1211502815 [TCP segment of a reassembled PDU]
  212 0.751519025 172.31.26.111 → 54.188.89.98 SSL 111 Continuation Data
  213 0.751934643 172.31.26.111 → 35.166.223.130 TCP 250 [TCP segment of a reassembled PDU]
  214 0.752323540 172.31.26.111 → 34.215.93.126 TCP 250 [TCP segment of a reassembled PDU]
  215 0.758073619 34.219.173.151 → 172.31.26.111 TCP 261 37940 → 27017 [PSH, ACK] Seq=4486 Ack=2449 Win=219 Len=195 TSval=1681449278 TSecr=910088970 [TCP segment of a reassembled PDU]
  216 0.762679915 172.31.26.111 → 54.201.255.128 TCP 250 [TCP segment of a reassembled PDU]
  217 0.767076815 54.188.89.98 → 172.31.26.111 TCP 66 53846 → 27017 [ACK] Seq=242 Ack=46 Win=219 Len=0 TSval=1471721312 TSecr=1805150460
  218 0.767781829 54.188.89.98 → 172.31.26.111 TCP 307 53846 → 27017 [PSH, ACK] Seq=242 Ack=46 Win=219 Len=241 TSval=1471721313 TSecr=1805150460 [TCP segment of a reassembled PDU]
  219 0.768204179 35.166.223.130 → 172.31.26.111 TCP 261 34230 → 27017 [PSH, ACK] Seq=4681 Ack=2633 Win=227 Len=195 TSval=3970029382 TSecr=3598440340 [TCP segment of a reassembled PDU]
  220 0.768514915 34.215.93.126 → 172.31.26.111 TCP 261 36854 → 27017 [PSH, ACK] Seq=4681 Ack=2633 Win=227 Len=195 TSval=2680995945 TSecr=2712030694 [TCP segment of a reassembled PDU]
  221 0.773315700 172.31.26.111 → 34.219.173.151 TCP 250 [TCP segment of a reassembled PDU]
  222 0.779128941 54.201.255.128 → 172.31.26.111 TCP 261 58260 → 27017 [PSH, ACK] Seq=4681 Ack=2633 Win=227 Len=195 TSval=1082732504 TSecr=1211502846 [TCP segment of a reassembled PDU]
  223 0.782958506 172.31.26.111 → 54.188.89.98 SSL 111 Continuation Data
  224 0.783399482 172.31.26.111 → 35.166.223.130 TCP 250 27017 → 34230 [PSH, ACK] Seq=2633 Ack=4876 Win=1531 Len=184 TSval=3598440372 TSecr=3970029382 [TCP segment of a reassembled PDU]
  225 0.783681240 172.31.26.111 → 34.215.93.126 TCP 250 27017 → 36854 [PSH, ACK] Seq=2633 Ack=4876 Win=1531 Len=184 TSval=2712030725 TSecr=2680995945 [TCP segment of a reassembled PDU]
  226 0.789931113 34.219.173.151 → 172.31.26.111 TCP 261 37940 → 27017 [PSH, ACK] Seq=4681 Ack=2633 Win=227 Len=195 TSval=1681449310 TSecr=910089002 [TCP segment of a reassembled PDU]
  227 0.794330939 172.31.26.111 → 54.201.255.128 TCP 250 27017 → 58260 [PSH, ACK] Seq=2633 Ack=4876 Win=1531 Len=184 TSval=1211502878 TSecr=1082732504 [TCP segment of a reassembled PDU]
  228 0.799096675 54.188.89.98 → 172.31.26.111 TCP 307 53846 → 27017 [PSH, ACK] Seq=483 Ack=91 Win=219 Len=241 TSval=1471721344 TSecr=1805150491 [TCP segment of a reassembled PDU]
  229 0.799372440 35.166.223.130 → 172.31.26.111 TCP 261 34230 → 27017 [PSH, ACK] Seq=4876 Ack=2817 Win=236 Len=195 TSval=3970029413 TSecr=3598440372 [TCP segment of a reassembled PDU]
  230 0.799657690 34.215.93.126 → 172.31.26.111 TCP 261 36854 → 27017 [PSH, ACK] Seq=4876 Ack=2817 Win=236 Len=195 TSval=2680995976 TSecr=2712030725 [TCP segment of a reassembled PDU]
  231 0.805138564 172.31.26.111 → 34.219.173.151 TCP 250 27017 → 37940 [PSH, ACK] Seq=2633 Ack=4876 Win=1531 Len=184 TSval=910089034 TSecr=1681449310 [TCP segment of a reassembled PDU]
  232 0.810709573 54.201.255.128 → 172.31.26.111 TCP 261 58260 → 27017 [PSH, ACK] Seq=4876 Ack=2817 Win=236 Len=195 TSval=1082732536 TSecr=1211502878 [TCP segment of a reassembled PDU]
  233 0.814281467 172.31.26.111 → 54.188.89.98 SSL 111 Continuation Data
  234 0.814541626 172.31.26.111 → 35.166.223.130 TCP 250 27017 → 34230 [PSH, ACK] Seq=2817 Ack=5071 Win=1531 Len=184 TSval=3598440403 TSecr=3970029413 [TCP segment of a reassembled PDU]
  235 0.814838263 172.31.26.111 → 34.215.93.126 TCP 250 27017 → 36854 [PSH, ACK] Seq=2817 Ack=5071 Win=1531 Len=184 TSval=2712030756 TSecr=2680995976 [TCP segment of a reassembled PDU]
  236 0.821449674 34.219.173.151 → 172.31.26.111 TCP 261 37940 → 27017 [PSH, ACK] Seq=4876 Ack=2817 Win=236 Len=195 TSval=1681449341 TSecr=910089034 [TCP segment of a reassembled PDU]
  237 0.825911279 172.31.26.111 → 54.201.255.128 TCP 250 27017 → 58260 [PSH, ACK] Seq=2817 Ack=5071 Win=1531 Len=184 TSval=1211502909 TSecr=1082732536 [TCP segment of a reassembled PDU]
  238 0.830362458 54.188.89.98 → 172.31.26.111 TCP 307 53846 → 27017 [PSH, ACK] Seq=724 Ack=136 Win=219 Len=241 TSval=1471721375 TSecr=1805150523 [TCP segment of a reassembled PDU]
  239 0.830481653 35.166.223.130 → 172.31.26.111 TCP 261 34230 → 27017 [PSH, ACK] Seq=5071 Ack=3001 Win=244 Len=195 TSval=3970029444 TSecr=3598440403 [TCP segment of a reassembled PDU]
  240 0.830713242 34.215.93.126 → 172.31.26.111 TCP 261 36854 → 27017 [PSH, ACK] Seq=5071 Ack=3001 Win=244 Len=195 TSval=2680996007 TSecr=2712030756 [TCP segment of a reassembled PDU]
  241 0.836643596 172.31.26.111 → 34.219.173.151 TCP 250 27017 → 37940 [PSH, ACK] Seq=2817 Ack=5071 Win=1531 Len=184 TSval=910089065 TSecr=1681449341 [TCP segment of a reassembled PDU]
  242 0.842255057 54.201.255.128 → 172.31.26.111 TCP 261 58260 → 27017 [PSH, ACK] Seq=5071 Ack=3001 Win=244 Len=195 TSval=1082732567 TSecr=1211502909 [TCP segment of a reassembled PDU]
  243 0.845584019 172.31.26.111 → 54.188.89.98 SSL 111 Continuation Data
  244 0.845751554 172.31.26.111 → 35.166.223.130 TCP 250 27017 → 34230 [PSH, ACK] Seq=3001 Ack=5266 Win=1531 Len=184 TSval=3598440434 TSecr=3970029444 [TCP segment of a reassembled PDU]
  245 0.845918170 172.31.26.111 → 34.215.93.126 TCP 250 27017 → 36854 [PSH, ACK] Seq=3001 Ack=5266 Win=1531 Len=184 TSval=2712030787 TSecr=2680996007 [TCP segment of a reassembled PDU]
  246 0.852965959 34.219.173.151 → 172.31.26.111 TCP 261 37940 → 27017 [PSH, ACK] Seq=5071 Ack=3001 Win=244 Len=195 TSval=1681449373 TSecr=910089065 [TCP segment of a reassembled PDU]
  247 0.857444448 172.31.26.111 → 54.201.255.128 TCP 250 27017 → 58260 [PSH, ACK] Seq=3001 Ack=5266 Win=1531 Len=184 TSval=1211502941 TSecr=1082732567 [TCP segment of a reassembled PDU]
  248 0.861688692 35.166.223.130 → 172.31.26.111 TCP 261 34230 → 27017 [PSH, ACK] Seq=5266 Ack=3185 Win=252 Len=195 TSval=3970029475 TSecr=3598440434 [TCP segment of a reassembled PDU]
  249 0.861838796 54.188.89.98 → 172.31.26.111 TCP 307 53846 → 27017 [PSH, ACK] Seq=965 Ack=181 Win=219 Len=241 TSval=1471721407 TSecr=1805150554 [TCP segment of a reassembled PDU]
  250 0.861899237 34.215.93.126 → 172.31.26.111 TCP 261 36854 → 27017 [PSH, ACK] Seq=5266 Ack=3185 Win=252 Len=195 TSval=2680996039 TSecr=2712030787 [TCP segment of a reassembled PDU]
  251 0.868119583 172.31.26.111 → 34.219.173.151 TCP 250 27017 → 37940 [PSH, ACK] Seq=3001 Ack=5266 Win=1531 Len=184 TSval=910089097 TSecr=1681449373 [TCP segment of a reassembled PDU]
  252 0.873828198 54.201.255.128 → 172.31.26.111 TCP 261 58260 → 27017 [PSH, ACK] Seq=5266 Ack=3185 Win=252 Len=195 TSval=1082732599 TSecr=1211502941 [TCP segment of a reassembled PDU]
  253 0.877086213 172.31.26.111 → 54.188.89.98 SSL 111 Continuation Data
  254 0.877253666 172.31.26.111 → 34.215.93.126 TCP 250 27017 → 36854 [PSH, ACK] Seq=3185 Ack=5461 Win=1531 Len=184 TSval=2712030819 TSecr=2680996039 [TCP segment of a reassembled PDU]
  255 0.877257546 172.31.26.111 → 35.166.223.130 TCP 168 27017 → 34230 [PSH, ACK] Seq=3185 Ack=5461 Win=1531 Len=102 TSval=3598440466 TSecr=3970029475 [TCP segment of a reassembled PDU]
  256 0.884537436 34.219.173.151 → 172.31.26.111 TCP 261 37940 → 27017 [PSH, ACK] Seq=5266 Ack=3185 Win=252 Len=195 TSval=1681449404 TSecr=910089097 [TCP segment of a reassembled PDU]
  257 0.889036958 172.31.26.111 → 54.201.255.128 TCP 250 27017 → 58260 [PSH, ACK] Seq=3185 Ack=5461 Win=1531 Len=184 TSval=1211502972 TSecr=1082732599 [TCP segment of a reassembled PDU]
  258 0.893224367 35.166.223.130 → 172.31.26.111 TCP 261 34230 → 27017 [PSH, ACK] Seq=5461 Ack=3287 Win=252 Len=195 TSval=3970029507 TSecr=3598440466 [TCP segment of a reassembled PDU]
  259 0.893237324 34.215.93.126 → 172.31.26.111 TCP 261 36854 → 27017 [PSH, ACK] Seq=5461 Ack=3369 Win=261 Len=195 TSval=2680996070 TSecr=2712030819 [TCP segment of a reassembled PDU]
  260 0.893325583 54.188.89.98 → 172.31.26.111 TCP 307 53846 → 27017 [PSH, ACK] Seq=1206 Ack=226 Win=219 Len=241 TSval=1471721438 TSecr=1805150586 [TCP segment of a reassembled PDU]
  261 0.899760040 172.31.26.111 → 34.219.173.151 TCP 250 27017 → 37940 [PSH, ACK] Seq=3185 Ack=5461 Win=1531 Len=184 TSval=910089128 TSecr=1681449404 [TCP segment of a reassembled PDU]
  262 0.905436468 54.201.255.128 → 172.31.26.111 TCP 261 58260 → 27017 [PSH, ACK] Seq=5461 Ack=3369 Win=261 Len=195 TSval=1082732631 TSecr=1211502972 [TCP segment of a reassembled PDU]
  263 0.908540018 172.31.26.111 → 54.188.89.98 SSL 111 Continuation Data
  264 0.908545170 172.31.26.111 → 34.215.93.126 TCP 250 27017 → 36854 [PSH, ACK] Seq=3369 Ack=5656 Win=1531 Len=184 TSval=2712030850 TSecr=2680996070 [TCP segment of a reassembled PDU]
  265 0.908744189 172.31.26.111 → 35.166.223.130 TCP 250 27017 → 34230 [PSH, ACK] Seq=3287 Ack=5656 Win=1531 Len=184 TSval=3598440497 TSecr=3970029507 [TCP segment of a reassembled PDU]
  266 0.916127126 34.219.173.151 → 172.31.26.111 TCP 261 37940 → 27017 [PSH, ACK] Seq=5461 Ack=3369 Win=261 Len=195 TSval=1681449436 TSecr=910089128 [TCP segment of a reassembled PDU]
  267 0.920661853 172.31.26.111 → 54.201.255.128 TCP 250 27017 → 58260 [PSH, ACK] Seq=3369 Ack=5656 Win=1531 Len=184 TSval=1211503004 TSecr=1082732631 [TCP segment of a reassembled PDU]
  268 0.924561954 34.215.93.126 → 172.31.26.111 TCP 261 36854 → 27017 [PSH, ACK] Seq=5656 Ack=3553 Win=269 Len=195 TSval=2680996101 TSecr=2712030850 [TCP segment of a reassembled PDU]
  269 0.924614327 35.166.223.130 → 172.31.26.111 TCP 261 34230 → 27017 [PSH, ACK] Seq=5656 Ack=3471 Win=261 Len=195 TSval=3970029538 TSecr=3598440497 [TCP segment of a reassembled PDU]
  270 0.924695477 54.188.89.98 → 172.31.26.111 TCP 307 53846 → 27017 [PSH, ACK] Seq=1447 Ack=271 Win=219 Len=241 TSval=1471721470 TSecr=1805150617 [TCP segment of a reassembled PDU]
  271 0.931339055 172.31.26.111 → 34.219.173.151 TCP 250 27017 → 37940 [PSH, ACK] Seq=3369 Ack=5656 Win=1531 Len=184 TSval=910089160 TSecr=1681449436 [TCP segment of a reassembled PDU]
  272 0.936995518 54.201.255.128 → 172.31.26.111 TCP 261 58260 → 27017 [PSH, ACK] Seq=5656 Ack=3553 Win=269 Len=195 TSval=1082732662 TSecr=1211503004 [TCP segment of a reassembled PDU]
  273 0.939770576 172.31.26.111 → 34.215.93.126 TCP 168 27017 → 36854 [PSH, ACK] Seq=3553 Ack=5851 Win=1531 Len=102 TSval=2712030881 TSecr=2680996101 [TCP segment of a reassembled PDU]
  274 0.939937129 172.31.26.111 → 54.188.89.98 SSL 111 Continuation Data
  275 0.940101932 172.31.26.111 → 35.166.223.130 TCP 250 27017 → 34230 [PSH, ACK] Seq=3471 Ack=5851 Win=1531 Len=184 TSval=3598440528 TSecr=3970029538 [TCP segment of a reassembled PDU]
  276 0.947712944 34.219.173.151 → 172.31.26.111 TCP 261 37940 → 27017 [PSH, ACK] Seq=5656 Ack=3553 Win=269 Len=195 TSval=1681449468 TSecr=910089160 [TCP segment of a reassembled PDU]
  277 0.952200897 172.31.26.111 → 54.201.255.128 TCP 250 27017 → 58260 [PSH, ACK] Seq=3553 Ack=5851 Win=1531 Len=184 TSval=1211503036 TSecr=1082732662 [TCP segment of a reassembled PDU]
  278 0.955574863 34.215.93.126 → 172.31.26.111 TCP 261 36854 → 27017 [PSH, ACK] Seq=5851 Ack=3655 Win=269 Len=195 TSval=2680996132 TSecr=2712030881 [TCP segment of a reassembled PDU]
  279 0.956057182 54.188.89.98 → 172.31.26.111 TCP 307 53846 → 27017 [PSH, ACK] Seq=1688 Ack=316 Win=219 Len=241 TSval=1471721501 TSecr=1805150648 [TCP segment of a reassembled PDU]
  280 0.956077306 35.166.223.130 → 172.31.26.111 TCP 261 34230 → 27017 [PSH, ACK] Seq=5851 Ack=3655 Win=269 Len=195 TSval=3970029570 TSecr=3598440528 [TCP segment of a reassembled PDU]
  281 0.962912039 172.31.26.111 → 34.219.173.151 TCP 250 27017 → 37940 [PSH, ACK] Seq=3553 Ack=5851 Win=1531 Len=184 TSval=910089191 TSecr=1681449468 [TCP segment of a reassembled PDU]
  282 0.968547752 54.201.255.128 → 172.31.26.111 TCP 261 58260 → 27017 [PSH, ACK] Seq=5851 Ack=3737 Win=278 Len=195 TSval=1082732694 TSecr=1211503036 [TCP segment of a reassembled PDU]
  283 0.970783153 172.31.26.111 → 34.215.93.126 TCP 250 27017 → 36854 [PSH, ACK] Seq=3655 Ack=6046 Win=1531 Len=184 TSval=2712030912 TSecr=2680996132 [TCP segment of a reassembled PDU]
  284 0.971240625 172.31.26.111 → 54.188.89.98 SSL 111 Continuation Data
  285 0.971405136 172.31.26.111 → 35.166.223.130 TCP 250 27017 → 34230 [PSH, ACK] Seq=3655 Ack=6046 Win=1531 Len=184 TSval=3598440560 TSecr=3970029570 [TCP segment of a reassembled PDU]
  286 0.979260250 34.219.173.151 → 172.31.26.111 TCP 261 37940 → 27017 [PSH, ACK] Seq=5851 Ack=3737 Win=278 Len=195 TSval=1681449499 TSecr=910089191 [TCP segment of a reassembled PDU]
  287 0.983759431 172.31.26.111 → 54.201.255.128 TCP 250 27017 → 58260 [PSH, ACK] Seq=3737 Ack=6046 Win=1531 Len=184 TSval=1211503067 TSecr=1082732694 [TCP segment of a reassembled PDU]
  288 0.986867658 34.215.93.126 → 172.31.26.111 TCP 261 36854 → 27017 [PSH, ACK] Seq=6046 Ack=3839 Win=278 Len=195 TSval=2680996164 TSecr=2712030912 [TCP segment of a reassembled PDU]
  289 0.987355134 35.166.223.130 → 172.31.26.111 TCP 261 34230 → 27017 [PSH, ACK] Seq=6046 Ack=3839 Win=278 Len=195 TSval=3970029601 TSecr=3598440560 [TCP segment of a reassembled PDU]
  290 0.987549407 54.188.89.98 → 172.31.26.111 TCP 307 53846 → 27017 [PSH, ACK] Seq=1929 Ack=361 Win=219 Len=241 TSval=1471721532 TSecr=1805150680 [TCP segment of a reassembled PDU]
  291 0.994449529 172.31.26.111 → 34.219.173.151 TCP 250 27017 → 37940 [PSH, ACK] Seq=3737 Ack=6046 Win=1531 Len=184 TSval=910089223 TSecr=1681449499 [TCP segment of a reassembled PDU]
  292 1.000115726 54.201.255.128 → 172.31.26.111 TCP 261 58260 → 27017 [PSH, ACK] Seq=6046 Ack=3921 Win=286 Len=195 TSval=1082732725 TSecr=1211503067 [TCP segment of a reassembled PDU]
