    1 0.000000000 172.31.26.111 → 34.215.93.126 SSL 168 Continuation Data
    2 0.002178434 153.90.128.120 → 172.31.26.111 TCP 66 52812 → 22 [ACK] Seq=1 Ack=1 Win=1444 Len=0 TSval=970599736 TSecr=400952179
    3 0.002195657 153.90.128.120 → 172.31.26.111 TCP 66 52812 → 22 [ACK] Seq=1 Ack=61 Win=1444 Len=0 TSval=970599736 TSecr=400952179
    4 0.002286941 153.90.128.120 → 172.31.26.111 TCP 66 52812 → 22 [ACK] Seq=1 Ack=97 Win=1444 Len=0 TSval=970599736 TSecr=400952179
    5 0.002325815 153.90.128.120 → 172.31.26.111 TCP 66 52812 → 22 [ACK] Seq=1 Ack=349 Win=1444 Len=0 TSval=970599736 TSecr=400952179
    6 0.002354563 153.90.128.120 → 172.31.26.111 TCP 66 52812 → 22 [ACK] Seq=1 Ack=385 Win=1444 Len=0 TSval=970599736 TSecr=400952179
    7 0.002641560 35.166.223.130 → 172.31.26.111 TCP 261 [TCP segment of a reassembled PDU]
    8 0.008674047 172.31.26.111 → 153.90.128.120 SSH 126 Server: Encrypted packet (len=60)
    9 0.016226481 34.215.93.126 → 172.31.26.111 TCP 261 [TCP segment of a reassembled PDU]
   10 0.017905980 172.31.26.111 → 35.166.223.130 SSL 168 Continuation Data
   11 0.031455050 172.31.26.111 → 34.215.93.126 SSL 168 Continuation Data
   12 0.034065345 35.166.223.130 → 172.31.26.111 TCP 261 34222 → 27017 [PSH, ACK] Seq=196 Ack=103 Win=219 Len=195 TSval=3969820418 TSecr=3598231365 [TCP segment of a reassembled PDU]
   13 0.047533099 34.215.93.126 → 172.31.26.111 TCP 261 36842 → 27017 [PSH, ACK] Seq=196 Ack=205 Win=219 Len=195 TSval=2680786985 TSecr=2711821731 [TCP segment of a reassembled PDU]
   14 0.049395992 172.31.26.111 → 35.166.223.130 SSL 168 Continuation Data
   15 0.057536374 153.90.128.120 → 172.31.26.111 TCP 66 52812 → 22 [ACK] Seq=1 Ack=445 Win=1444 Len=0 TSval=970599791 TSecr=400952235
   16 0.062733199 172.31.26.111 → 34.215.93.126 SSL 168 Continuation Data
   17 0.065685835 35.166.223.130 → 172.31.26.111 TCP 261 34222 → 27017 [PSH, ACK] Seq=391 Ack=205 Win=219 Len=195 TSval=3969820449 TSecr=3598231396 [TCP segment of a reassembled PDU]
   18 0.078587066 34.215.93.126 → 172.31.26.111 TCP 261 36842 → 27017 [PSH, ACK] Seq=391 Ack=307 Win=219 Len=195 TSval=2680787016 TSecr=2711821763 [TCP segment of a reassembled PDU]
   19 0.080882544 172.31.26.111 → 35.166.223.130 SSL 168 Continuation Data
   20 0.093784359 172.31.26.111 → 34.215.93.126 SSL 168 Continuation Data
   21 0.097007292 35.166.223.130 → 172.31.26.111 TCP 261 34222 → 27017 [PSH, ACK] Seq=586 Ack=307 Win=219 Len=195 TSval=3969820481 TSecr=3598231428 [TCP segment of a reassembled PDU]
   22 0.109957948 34.215.93.126 → 172.31.26.111 TCP 261 36842 → 27017 [PSH, ACK] Seq=586 Ack=409 Win=219 Len=195 TSval=2680787047 TSecr=2711821794 [TCP segment of a reassembled PDU]
   23 0.112259367 172.31.26.111 → 35.166.223.130 SSL 168 Continuation Data
   24 0.125237132 172.31.26.111 → 34.215.93.126 SSL 168 Continuation Data
   25 0.128480100 35.166.223.130 → 172.31.26.111 TCP 261 34222 → 27017 [PSH, ACK] Seq=781 Ack=409 Win=219 Len=195 TSval=3969820512 TSecr=3598231459 [TCP segment of a reassembled PDU]
   26 0.141322349 34.215.93.126 → 172.31.26.111 TCP 261 36842 → 27017 [PSH, ACK] Seq=781 Ack=511 Win=219 Len=195 TSval=2680787079 TSecr=2711821825 [TCP segment of a reassembled PDU]
   27 0.143812410 172.31.26.111 → 35.166.223.130 SSL 168 Continuation Data
   28 0.156551776 172.31.26.111 → 34.215.93.126 SSL 168 Continuation Data
   29 0.161901667 35.166.223.130 → 172.31.26.111 TCP 261 34222 → 27017 [PSH, ACK] Seq=976 Ack=511 Win=219 Len=195 TSval=3969820544 TSecr=3598231491 [TCP segment of a reassembled PDU]
   30 0.172575913 34.215.93.126 → 172.31.26.111 TCP 261 36842 → 27017 [PSH, ACK] Seq=976 Ack=613 Win=219 Len=195 TSval=2680787110 TSecr=2711821856 [TCP segment of a reassembled PDU]
   31 0.177118544 172.31.26.111 → 35.166.223.130 SSL 168 Continuation Data
   32 0.187811063 172.31.26.111 → 34.215.93.126 SSL 168 Continuation Data
   33 0.193271368 35.166.223.130 → 172.31.26.111 TCP 261 34222 → 27017 [PSH, ACK] Seq=1171 Ack=613 Win=219 Len=195 TSval=3969820577 TSecr=3598231524 [TCP segment of a reassembled PDU]
   34 0.203700022 34.215.93.126 → 172.31.26.111 TCP 261 36842 → 27017 [PSH, ACK] Seq=1171 Ack=715 Win=219 Len=195 TSval=2680787141 TSecr=2711821888 [TCP segment of a reassembled PDU]
   35 0.208527382 172.31.26.111 → 35.166.223.130 SSL 168 Continuation Data
   36 0.218913429 172.31.26.111 → 34.215.93.126 SSL 168 Continuation Data
   37 0.224726970 35.166.223.130 → 172.31.26.111 TCP 261 34222 → 27017 [PSH, ACK] Seq=1366 Ack=715 Win=219 Len=195 TSval=3969820608 TSecr=3598231555 [TCP segment of a reassembled PDU]
   38 0.234819604 34.215.93.126 → 172.31.26.111 TCP 261 36842 → 27017 [PSH, ACK] Seq=1366 Ack=817 Win=219 Len=195 TSval=2680787172 TSecr=2711821919 [TCP segment of a reassembled PDU]
   39 0.240093866 172.31.26.111 → 35.166.223.130 SSL 168 Continuation Data
   40 0.250002225 172.31.26.111 → 34.215.93.126 SSL 168 Continuation Data
   41 0.256299304 35.166.223.130 → 172.31.26.111 TCP 261 34222 → 27017 [PSH, ACK] Seq=1561 Ack=817 Win=219 Len=195 TSval=3969820640 TSecr=3598231587 [TCP segment of a reassembled PDU]
   42 0.266096493 34.215.93.126 → 172.31.26.111 TCP 261 36842 → 27017 [PSH, ACK] Seq=1561 Ack=919 Win=219 Len=195 TSval=2680787203 TSecr=2711821950 [TCP segment of a reassembled PDU]
   43 0.271651681 172.31.26.111 → 35.166.223.130 SSL 168 Continuation Data
   44 0.281297305 172.31.26.111 → 34.215.93.126 SSL 168 Continuation Data
   45 0.287851762 35.166.223.130 → 172.31.26.111 TCP 261 34222 → 27017 [PSH, ACK] Seq=1756 Ack=919 Win=219 Len=195 TSval=3969820671 TSecr=3598231619 [TCP segment of a reassembled PDU]
   46 0.297341286 34.215.93.126 → 172.31.26.111 TCP 261 36842 → 27017 [PSH, ACK] Seq=1756 Ack=1021 Win=219 Len=195 TSval=2680787235 TSecr=2711821981 [TCP segment of a reassembled PDU]
   47 0.303196830 172.31.26.111 → 35.166.223.130 SSL 168 Continuation Data
   48 0.312557749 172.31.26.111 → 34.215.93.126 SSL 168 Continuation Data
   49 0.319291484 35.166.223.130 → 172.31.26.111 TCP 261 34222 → 27017 [PSH, ACK] Seq=1951 Ack=1021 Win=219 Len=195 TSval=3969820703 TSecr=3598231650 [TCP segment of a reassembled PDU]
   50 0.328454771 34.215.93.126 → 172.31.26.111 TCP 261 36842 → 27017 [PSH, ACK] Seq=1951 Ack=1123 Win=219 Len=195 TSval=2680787266 TSecr=2711822012 [TCP segment of a reassembled PDU]
   51 0.334601917 172.31.26.111 → 35.166.223.130 SSL 168 Continuation Data
   52 0.343670691 172.31.26.111 → 34.215.93.126 SSL 168 Continuation Data
   53 0.350731720 35.166.223.130 → 172.31.26.111 TCP 261 34222 → 27017 [PSH, ACK] Seq=2146 Ack=1123 Win=219 Len=195 TSval=3969820734 TSecr=3598231682 [TCP segment of a reassembled PDU]
   54 0.359553606 34.215.93.126 → 172.31.26.111 TCP 261 36842 → 27017 [PSH, ACK] Seq=2146 Ack=1225 Win=219 Len=195 TSval=2680787297 TSecr=2711822044 [TCP segment of a reassembled PDU]
   55 0.366102456 172.31.26.111 → 35.166.223.130 SSL 168 Continuation Data
   56 0.374864172 172.31.26.111 → 34.215.93.126 SSL 168 Continuation Data
   57 0.382159319 35.166.223.130 → 172.31.26.111 TCP 261 34222 → 27017 [PSH, ACK] Seq=2341 Ack=1225 Win=219 Len=195 TSval=3969820766 TSecr=3598231713 [TCP segment of a reassembled PDU]
   58 0.390775661 34.215.93.126 → 172.31.26.111 TCP 261 36842 → 27017 [PSH, ACK] Seq=2341 Ack=1327 Win=219 Len=195 TSval=2680787328 TSecr=2711822075 [TCP segment of a reassembled PDU]
   59 0.397424279 172.31.26.111 → 35.166.223.130 SSL 168 Continuation Data
   60 0.405986297 172.31.26.111 → 34.215.93.126 SSL 168 Continuation Data
   61 0.413452308 35.166.223.130 → 172.31.26.111 TCP 261 34222 → 27017 [PSH, ACK] Seq=2536 Ack=1327 Win=219 Len=195 TSval=3969820797 TSecr=3598231744 [TCP segment of a reassembled PDU]
   62 0.421834424 34.215.93.126 → 172.31.26.111 TCP 261 36842 → 27017 [PSH, ACK] Seq=2536 Ack=1429 Win=219 Len=195 TSval=2680787359 TSecr=2711822106 [TCP segment of a reassembled PDU]
   63 0.428692973 172.31.26.111 → 35.166.223.130 SSL 168 Continuation Data
   64 0.437116088 172.31.26.111 → 34.215.93.126 SSL 168 Continuation Data
   65 0.444774008 35.166.223.130 → 172.31.26.111 TCP 261 34222 → 27017 [PSH, ACK] Seq=2731 Ack=1429 Win=219 Len=195 TSval=3969820828 TSecr=3598231776 [TCP segment of a reassembled PDU]
   66 0.453004207 34.215.93.126 → 172.31.26.111 TCP 261 36842 → 27017 [PSH, ACK] Seq=2731 Ack=1531 Win=219 Len=195 TSval=2680787390 TSecr=2711822137 [TCP segment of a reassembled PDU]
   67 0.460035860 172.31.26.111 → 35.166.223.130 SSL 168 Continuation Data
   68 0.468252545 172.31.26.111 → 34.215.93.126 SSL 168 Continuation Data
   69 0.476240479 35.166.223.130 → 172.31.26.111 TCP 261 34222 → 27017 [PSH, ACK] Seq=2926 Ack=1531 Win=219 Len=195 TSval=3969820860 TSecr=3598231807 [TCP segment of a reassembled PDU]
   70 0.484147726 34.215.93.126 → 172.31.26.111 TCP 261 36842 → 27017 [PSH, ACK] Seq=2926 Ack=1633 Win=219 Len=195 TSval=2680787421 TSecr=2711822168 [TCP segment of a reassembled PDU]
   71 0.491599246 172.31.26.111 → 35.166.223.130 SSL 168 Continuation Data
   72 0.499336258 172.31.26.111 → 34.215.93.126 SSL 168 Continuation Data
   73 0.507778939 35.166.223.130 → 172.31.26.111 TCP 261 34222 → 27017 [PSH, ACK] Seq=3121 Ack=1633 Win=219 Len=195 TSval=3969820891 TSecr=3598231839 [TCP segment of a reassembled PDU]
   74 0.515309801 34.215.93.126 → 172.31.26.111 TCP 261 36842 → 27017 [PSH, ACK] Seq=3121 Ack=1735 Win=219 Len=195 TSval=2680787453 TSecr=2711822199 [TCP segment of a reassembled PDU]
   75 0.517313948 172.31.26.111 → 153.90.128.120 SSH 110 Server: Encrypted packet (len=44)
   76 0.523050782 172.31.26.111 → 35.166.223.130 SSL 168 Continuation Data
   77 0.530542417 172.31.26.111 → 34.215.93.126 SSL 168 Continuation Data
   78 0.539207017 35.166.223.130 → 172.31.26.111 TCP 261 34222 → 27017 [PSH, ACK] Seq=3316 Ack=1735 Win=219 Len=195 TSval=3969820923 TSecr=3598231870 [TCP segment of a reassembled PDU]
   79 0.546581989 34.215.93.126 → 172.31.26.111 TCP 261 36842 → 27017 [PSH, ACK] Seq=3316 Ack=1837 Win=219 Len=195 TSval=2680787484 TSecr=2711822230 [TCP segment of a reassembled PDU]
   80 0.554605233 172.31.26.111 → 35.166.223.130 SSL 168 Continuation Data
   81 0.561800739 172.31.26.111 → 34.215.93.126 SSL 168 Continuation Data
   82 0.566265851 153.90.128.120 → 172.31.26.111 TCP 66 52812 → 22 [ACK] Seq=1 Ack=489 Win=1444 Len=0 TSval=970600300 TSecr=400952743
   83 0.570748821 35.166.223.130 → 172.31.26.111 TCP 261 34222 → 27017 [PSH, ACK] Seq=3511 Ack=1837 Win=219 Len=195 TSval=3969820954 TSecr=3598231902 [TCP segment of a reassembled PDU]
   84 0.578002422 34.215.93.126 → 172.31.26.111 TCP 261 36842 → 27017 [PSH, ACK] Seq=3511 Ack=1939 Win=219 Len=195 TSval=2680787515 TSecr=2711822262 [TCP segment of a reassembled PDU]
   85 0.586013043 172.31.26.111 → 35.166.223.130 SSL 168 Continuation Data
   86 0.593239888 172.31.26.111 → 34.215.93.126 SSL 168 Continuation Data
   87 0.602120869 35.166.223.130 → 172.31.26.111 TCP 261 34222 → 27017 [PSH, ACK] Seq=3706 Ack=1939 Win=219 Len=195 TSval=3969820986 TSecr=3598231933 [TCP segment of a reassembled PDU]
   88 0.609130702 34.215.93.126 → 172.31.26.111 TCP 261 36842 → 27017 [PSH, ACK] Seq=3706 Ack=2041 Win=219 Len=195 TSval=2680787546 TSecr=2711822293 [TCP segment of a reassembled PDU]
   89 0.617327621 172.31.26.111 → 35.166.223.130 SSL 168 Continuation Data
   90 0.624333885 172.31.26.111 → 34.215.93.126 SSL 168 Continuation Data
   91 0.633395277 35.166.223.130 → 172.31.26.111 TCP 261 34222 → 27017 [PSH, ACK] Seq=3901 Ack=2041 Win=219 Len=195 TSval=3969821017 TSecr=3598231964 [TCP segment of a reassembled PDU]
   92 0.640123853 34.215.93.126 → 172.31.26.111 TCP 261 36842 → 27017 [PSH, ACK] Seq=3901 Ack=2143 Win=219 Len=195 TSval=2680787577 TSecr=2711822324 [TCP segment of a reassembled PDU]
   93 0.648603525 172.31.26.111 → 35.166.223.130 SSL 168 Continuation Data
   94 0.655327578 172.31.26.111 → 34.215.93.126 SSL 168 Continuation Data
   95 0.664920498 35.166.223.130 → 172.31.26.111 TCP 261 34222 → 27017 [PSH, ACK] Seq=4096 Ack=2143 Win=219 Len=195 TSval=3969821049 TSecr=3598231996 [TCP segment of a reassembled PDU]
   96 0.671284513 34.215.93.126 → 172.31.26.111 TCP 261 36842 → 27017 [PSH, ACK] Seq=4096 Ack=2245 Win=219 Len=195 TSval=2680787609 TSecr=2711822355 [TCP segment of a reassembled PDU]
   97 0.680250629 172.31.26.111 → 35.166.223.130 SSL 168 Continuation Data
   98 0.686568133 172.31.26.111 → 34.215.93.126 SSL 168 Continuation Data
   99 0.696343787 35.166.223.130 → 172.31.26.111 TCP 261 34222 → 27017 [PSH, ACK] Seq=4291 Ack=2245 Win=219 Len=195 TSval=3969821080 TSecr=3598232027 [TCP segment of a reassembled PDU]
  100 0.702456367 34.215.93.126 → 172.31.26.111 TCP 261 36842 → 27017 [PSH, ACK] Seq=4291 Ack=2347 Win=219 Len=195 TSval=2680787640 TSecr=2711822387 [TCP segment of a reassembled PDU]
  101 0.711609501 172.31.26.111 → 35.166.223.130 SSL 168 Continuation Data
  102 0.717662730 172.31.26.111 → 34.215.93.126 SSL 168 Continuation Data
  103 0.727741542 35.166.223.130 → 172.31.26.111 TCP 261 34222 → 27017 [PSH, ACK] Seq=4486 Ack=2347 Win=219 Len=195 TSval=3969821111 TSecr=3598232059 [TCP segment of a reassembled PDU]
  104 0.733601931 34.215.93.126 → 172.31.26.111 TCP 261 36842 → 27017 [PSH, ACK] Seq=4486 Ack=2449 Win=219 Len=195 TSval=2680787671 TSecr=2711822418 [TCP segment of a reassembled PDU]
  105 0.742943487 172.31.26.111 → 35.166.223.130 SSL 168 Continuation Data
  106 0.748796139 172.31.26.111 → 34.215.93.126 SSL 168 Continuation Data
  107 0.759137521 35.166.223.130 → 172.31.26.111 TCP 261 34222 → 27017 [PSH, ACK] Seq=4681 Ack=2449 Win=219 Len=195 TSval=3969821143 TSecr=3598232090 [TCP segment of a reassembled PDU]
  108 0.764687032 34.215.93.126 → 172.31.26.111 TCP 261 36842 → 27017 [PSH, ACK] Seq=4681 Ack=2551 Win=219 Len=195 TSval=2680787702 TSecr=2711822449 [TCP segment of a reassembled PDU]
  109 0.774359434 172.31.26.111 → 35.166.223.130 SSL 168 Continuation Data
  110 0.779873989 172.31.26.111 → 34.215.93.126 SSL 168 Continuation Data
  111 0.790353301 35.166.223.130 → 172.31.26.111 TCP 261 34222 → 27017 [PSH, ACK] Seq=4876 Ack=2551 Win=219 Len=195 TSval=3969821174 TSecr=3598232121 [TCP segment of a reassembled PDU]
  112 0.795943226 34.215.93.126 → 172.31.26.111 TCP 261 36842 → 27017 [PSH, ACK] Seq=4876 Ack=2653 Win=219 Len=195 TSval=2680787733 TSecr=2711822480 [TCP segment of a reassembled PDU]
  113 0.805559354 172.31.26.111 → 35.166.223.130 SSL 168 Continuation Data
  114 0.811123386 172.31.26.111 → 34.215.93.126 SSL 168 Continuation Data
  115 0.821687443 35.166.223.130 → 172.31.26.111 TCP 261 34222 → 27017 [PSH, ACK] Seq=5071 Ack=2653 Win=219 Len=195 TSval=3969821205 TSecr=3598232153 [TCP segment of a reassembled PDU]
  116 0.827010908 34.215.93.126 → 172.31.26.111 TCP 261 36842 → 27017 [PSH, ACK] Seq=5071 Ack=2755 Win=219 Len=195 TSval=2680787764 TSecr=2711822511 [TCP segment of a reassembled PDU]
  117 0.836921983 172.31.26.111 → 35.166.223.130 SSL 168 Continuation Data
  118 0.842193586 172.31.26.111 → 34.215.93.126 SSL 168 Continuation Data
  119 0.853058325 35.166.223.130 → 172.31.26.111 TCP 261 34222 → 27017 [PSH, ACK] Seq=5266 Ack=2755 Win=219 Len=195 TSval=3969821237 TSecr=3598232184 [TCP segment of a reassembled PDU]
  120 0.858079360 34.215.93.126 → 172.31.26.111 TCP 261 36842 → 27017 [PSH, ACK] Seq=5266 Ack=2857 Win=219 Len=195 TSval=2680787795 TSecr=2711822542 [TCP segment of a reassembled PDU]
  121 0.868269148 172.31.26.111 → 35.166.223.130 SSL 168 Continuation Data
  122 0.873277616 172.31.26.111 → 34.215.93.126 SSL 168 Continuation Data
  123 0.884362433 35.166.223.130 → 172.31.26.111 TCP 261 34222 → 27017 [PSH, ACK] Seq=5461 Ack=2857 Win=219 Len=195 TSval=3969821268 TSecr=3598232215 [TCP segment of a reassembled PDU]
  124 0.889178705 34.215.93.126 → 172.31.26.111 TCP 261 36842 → 27017 [PSH, ACK] Seq=5461 Ack=2959 Win=219 Len=195 TSval=2680787826 TSecr=2711822573 [TCP segment of a reassembled PDU]
  125 0.899590474 172.31.26.111 → 35.166.223.130 SSL 168 Continuation Data
  126 0.904369593 172.31.26.111 → 34.215.93.126 SSL 168 Continuation Data
  127 0.915706108 35.166.223.130 → 172.31.26.111 TCP 261 34222 → 27017 [PSH, ACK] Seq=5656 Ack=2959 Win=219 Len=195 TSval=3969821299 TSecr=3598232247 [TCP segment of a reassembled PDU]
  128 0.920333286 34.215.93.126 → 172.31.26.111 TCP 261 36842 → 27017 [PSH, ACK] Seq=5656 Ack=3061 Win=219 Len=195 TSval=2680787858 TSecr=2711822604 [TCP segment of a reassembled PDU]
  129 0.930925962 172.31.26.111 → 35.166.223.130 SSL 168 Continuation Data
  130 0.935610424 172.31.26.111 → 34.215.93.126 SSL 168 Continuation Data
  131 0.947110084 35.166.223.130 → 172.31.26.111 TCP 261 34222 → 27017 [PSH, ACK] Seq=5851 Ack=3061 Win=219 Len=195 TSval=3969821331 TSecr=3598232278 [TCP segment of a reassembled PDU]
  132 0.951524328 34.215.93.126 → 172.31.26.111 TCP 261 36842 → 27017 [PSH, ACK] Seq=5851 Ack=3163 Win=219 Len=195 TSval=2680787889 TSecr=2711822636 [TCP segment of a reassembled PDU]
  133 0.962325343 172.31.26.111 → 35.166.223.130 SSL 168 Continuation Data
  134 0.966777401 172.31.26.111 → 34.215.93.126 SSL 168 Continuation Data
  135 0.978431660 35.166.223.130 → 172.31.26.111 TCP 261 34222 → 27017 [PSH, ACK] Seq=6046 Ack=3163 Win=219 Len=195 TSval=3969821362 TSecr=3598232309 [TCP segment of a reassembled PDU]
  136 0.982706128 34.215.93.126 → 172.31.26.111 TCP 261 36842 → 27017 [PSH, ACK] Seq=6046 Ack=3265 Win=219 Len=195 TSval=2680787920 TSecr=2711822667 [TCP segment of a reassembled PDU]
  137 0.993660108 172.31.26.111 → 35.166.223.130 SSL 168 Continuation Data
  138 0.997912895 172.31.26.111 → 34.215.93.126 SSL 168 Continuation Data
  139 1.009856358 35.166.223.130 → 172.31.26.111 TCP 261 34222 → 27017 [PSH, ACK] Seq=6241 Ack=3265 Win=219 Len=195 TSval=3969821393 TSecr=3598232341 [TCP segment of a reassembled PDU]
  140 1.013769075 34.215.93.126 → 172.31.26.111 TCP 261 36842 → 27017 [PSH, ACK] Seq=6241 Ack=3367 Win=219 Len=195 TSval=2680787951 TSecr=2711822698 [TCP segment of a reassembled PDU]
  141 1.025088186 172.31.26.111 → 35.166.223.130 SSL 168 Continuation Data
  142 1.029584394 172.31.26.111 → 153.90.128.120 SSH 110 Server: Encrypted packet (len=44)
  143 1.029766829 172.31.26.111 → 34.215.93.126 SSL 168 Continuation Data
  144 1.041186421 35.166.223.130 → 172.31.26.111 TCP 261 34222 → 27017 [PSH, ACK] Seq=6436 Ack=3367 Win=219 Len=195 TSval=3969821425 TSecr=3598232372 [TCP segment of a reassembled PDU]
  145 1.045758518 34.215.93.126 → 172.31.26.111 TCP 261 36842 → 27017 [PSH, ACK] Seq=6436 Ack=3469 Win=219 Len=195 TSval=2680787983 TSecr=2711822730 [TCP segment of a reassembled PDU]
  146 1.056443750 172.31.26.111 → 35.166.223.130 SSL 168 Continuation Data
  147 1.060964001 172.31.26.111 → 34.215.93.126 SSL 168 Continuation Data
  148 1.072541326 35.166.223.130 → 172.31.26.111 TCP 261 34222 → 27017 [PSH, ACK] Seq=6631 Ack=3469 Win=219 Len=195 TSval=3969821456 TSecr=3598232403 [TCP segment of a reassembled PDU]
  149 1.076833175 34.215.93.126 → 172.31.26.111 TCP 261 36842 → 27017 [PSH, ACK] Seq=6631 Ack=3571 Win=219 Len=195 TSval=2680788014 TSecr=2711822761 [TCP segment of a reassembled PDU]
  150 1.078440105 153.90.128.120 → 172.31.26.111 TCP 66 52812 → 22 [ACK] Seq=1 Ack=533 Win=1444 Len=0 TSval=970600812 TSecr=400953256
  151 1.087769522 172.31.26.111 → 35.166.223.130 SSL 168 Continuation Data
  152 1.092058396 172.31.26.111 → 34.215.93.126 SSL 168 Continuation Data
  153 1.103957462 35.166.223.130 → 172.31.26.111 TCP 261 34222 → 27017 [PSH, ACK] Seq=6826 Ack=3571 Win=219 Len=195 TSval=3969821488 TSecr=3598232435 [TCP segment of a reassembled PDU]
  154 1.107964018 34.215.93.126 → 172.31.26.111 TCP 261 36842 → 27017 [PSH, ACK] Seq=6826 Ack=3673 Win=219 Len=195 TSval=2680788045 TSecr=2711822792 [TCP segment of a reassembled PDU]
  155 1.119169353 172.31.26.111 → 35.166.223.130 SSL 168 Continuation Data
  156 1.123271374 172.31.26.111 → 34.215.93.126 SSL 168 Continuation Data
  157 1.135255016 35.166.223.130 → 172.31.26.111 TCP 261 34222 → 27017 [PSH, ACK] Seq=7021 Ack=3673 Win=219 Len=195 TSval=3969821519 TSecr=3598232466 [TCP segment of a reassembled PDU]
  158 1.139146261 34.215.93.126 → 172.31.26.111 TCP 261 36842 → 27017 [PSH, ACK] Seq=7021 Ack=3775 Win=219 Len=195 TSval=2680788076 TSecr=2711822823 [TCP segment of a reassembled PDU]
  159 1.150569408 172.31.26.111 → 35.166.223.130 SSL 168 Continuation Data
  160 1.154360580 172.31.26.111 → 34.215.93.126 SSL 168 Continuation Data
  161 1.166744770 35.166.223.130 → 172.31.26.111 TCP 261 34222 → 27017 [PSH, ACK] Seq=7216 Ack=3775 Win=219 Len=195 TSval=3969821550 TSecr=3598232497 [TCP segment of a reassembled PDU]
  162 1.170218227 34.215.93.126 → 172.31.26.111 TCP 261 36842 → 27017 [PSH, ACK] Seq=7216 Ack=3877 Win=219 Len=195 TSval=2680788108 TSecr=2711822854 [TCP segment of a reassembled PDU]
  163 1.182152590 172.31.26.111 → 35.166.223.130 SSL 168 Continuation Data
  164 1.185537746 172.31.26.111 → 34.215.93.126 SSL 168 Continuation Data
  165 1.198217849 35.166.223.130 → 172.31.26.111 TCP 261 34222 → 27017 [PSH, ACK] Seq=7411 Ack=3877 Win=219 Len=195 TSval=3969821582 TSecr=3598232529 [TCP segment of a reassembled PDU]
  166 1.201473510 34.215.93.126 → 172.31.26.111 TCP 261 36842 → 27017 [PSH, ACK] Seq=7411 Ack=3979 Win=219 Len=195 TSval=2680788139 TSecr=2711822885 [TCP segment of a reassembled PDU]
  167 1.213446550 172.31.26.111 → 35.166.223.130 SSL 168 Continuation Data
  168 1.216671804 172.31.26.111 → 34.215.93.126 SSL 168 Continuation Data
  169 1.229611866 35.166.223.130 → 172.31.26.111 TCP 261 34222 → 27017 [PSH, ACK] Seq=7606 Ack=3979 Win=219 Len=195 TSval=3969821613 TSecr=3598232560 [TCP segment of a reassembled PDU]
  170 1.232558164 34.215.93.126 → 172.31.26.111 TCP 261 36842 → 27017 [PSH, ACK] Seq=7606 Ack=4081 Win=219 Len=195 TSval=2680788170 TSecr=2711822917 [TCP segment of a reassembled PDU]
  171 1.242959855 54.188.89.98 → 172.31.26.111 TCP 74 53846 → 27017 [SYN] Seq=0 Win=26883 Len=0 MSS=1460 SACK_PERM=1 TSval=1471513557 TSecr=0 WS=128
  172 1.244994334 172.31.26.111 → 35.166.223.130 SSL 168 Continuation Data
  173 1.247761775 172.31.26.111 → 34.215.93.126 SSL 168 Continuation Data
  174 1.258064092 172.31.26.111 → 54.188.89.98 TCP 74 27017 → 53846 [SYN, ACK] Seq=0 Ack=1 Win=26847 Len=0 MSS=8961 SACK_PERM=1 TSval=1804942725 TSecr=1471513557 WS=128
  175 1.261168788 35.166.223.130 → 172.31.26.111 TCP 261 34222 → 27017 [PSH, ACK] Seq=7801 Ack=4081 Win=219 Len=195 TSval=3969821645 TSecr=3598232592 [TCP segment of a reassembled PDU]
  176 1.263618579 34.215.93.126 → 172.31.26.111 TCP 261 36842 → 27017 [PSH, ACK] Seq=7801 Ack=4183 Win=219 Len=195 TSval=2680788201 TSecr=2711822948 [TCP segment of a reassembled PDU]
  177 1.273630011 54.188.89.98 → 172.31.26.111 TCP 66 53846 → 27017 [ACK] Seq=1 Ack=1 Win=27008 Len=0 TSval=1471513588 TSecr=1804942725
  178 1.273774724 54.188.89.98 → 172.31.26.111 SSL 336 Continuation Data
  179 1.276537648 172.31.26.111 → 35.166.223.130 SSL 168 Continuation Data
  180 1.278802717 172.31.26.111 → 34.215.93.126 SSL 168 Continuation Data
  181 1.288866301 172.31.26.111 → 54.188.89.98 TCP 66 27017 → 53846 [ACK] Seq=1 Ack=271 Win=28032 Len=0 TSval=1804942756 TSecr=1471513588
  182 1.289046116 172.31.26.111 → 54.188.89.98 TCP 305 [TCP segment of a reassembled PDU]
  183 1.292695774 35.166.223.130 → 172.31.26.111 TCP 261 34222 → 27017 [PSH, ACK] Seq=7996 Ack=4183 Win=219 Len=195 TSval=3969821676 TSecr=3598232623 [TCP segment of a reassembled PDU]
  184 1.294740441 34.215.93.126 → 172.31.26.111 TCP 261 36842 → 27017 [PSH, ACK] Seq=7996 Ack=4285 Win=219 Len=195 TSval=2680788232 TSecr=2711822979 [TCP segment of a reassembled PDU]
  185 1.304629980 54.188.89.98 → 172.31.26.111 TCP 66 53846 → 27017 [ACK] Seq=271 Ack=240 Win=28032 Len=0 TSval=1471513619 TSecr=1804942756
  186 1.304781723 54.188.89.98 → 172.31.26.111 TCP 307 [TCP segment of a reassembled PDU]
  187 1.307988077 172.31.26.111 → 35.166.223.130 SSL 168 Continuation Data
  188 1.309948095 172.31.26.111 → 34.215.93.126 SSL 168 Continuation Data
  189 1.320068429 172.31.26.111 → 54.188.89.98 TCP 111 27017 → 53846 [PSH, ACK] Seq=240 Ack=512 Win=29056 Len=45 TSval=1804942787 TSecr=1471513619 [TCP segment of a reassembled PDU]
  190 1.324129169 35.166.223.130 → 172.31.26.111 TCP 261 34222 → 27017 [PSH, ACK] Seq=8191 Ack=4285 Win=219 Len=195 TSval=3969821708 TSecr=3598232655 [TCP segment of a reassembled PDU]
  191 1.325876803 34.215.93.126 → 172.31.26.111 TCP 261 36842 → 27017 [PSH, ACK] Seq=8191 Ack=4387 Win=219 Len=195 TSval=2680788263 TSecr=2711823010 [TCP segment of a reassembled PDU]
  192 1.336486685 54.188.89.98 → 172.31.26.111 TCP 307 53846 → 27017 [PSH, ACK] Seq=512 Ack=285 Win=28032 Len=241 TSval=1471513651 TSecr=1804942787 [TCP segment of a reassembled PDU]
  193 1.339388504 172.31.26.111 → 35.166.223.130 TCP 250 [TCP segment of a reassembled PDU]
  194 1.341095605 172.31.26.111 → 34.215.93.126 TCP 250 [TCP segment of a reassembled PDU]
  195 1.351720311 172.31.26.111 → 54.188.89.98 TCP 111 27017 → 53846 [PSH, ACK] Seq=285 Ack=753 Win=30080 Len=45 TSval=1804942819 TSecr=1471513651 [TCP segment of a reassembled PDU]
  196 1.355791256 35.166.223.130 → 172.31.26.111 TCP 261 34222 → 27017 [PSH, ACK] Seq=8386 Ack=4469 Win=227 Len=195 TSval=3969821739 TSecr=3598232686 [TCP segment of a reassembled PDU]
  197 1.357215784 34.215.93.126 → 172.31.26.111 TCP 261 36842 → 27017 [PSH, ACK] Seq=8386 Ack=4571 Win=227 Len=195 TSval=2680788295 TSecr=2711823041 [TCP segment of a reassembled PDU]
  198 1.367836021 54.188.89.98 → 172.31.26.111 TCP 307 53846 → 27017 [PSH, ACK] Seq=753 Ack=330 Win=28032 Len=241 TSval=1471513682 TSecr=1804942819 [TCP segment of a reassembled PDU]
  199 1.373543844 172.31.26.111 → 35.166.223.130 TCP 250 27017 → 34222 [PSH, ACK] Seq=4469 Ack=8581 Win=830 Len=184 TSval=3598232718 TSecr=3969821739 [TCP segment of a reassembled PDU]
  200 1.373556943 172.31.26.111 → 34.215.93.126 TCP 250 27017 → 36842 [PSH, ACK] Seq=4571 Ack=8581 Win=853 Len=184 TSval=2711823072 TSecr=2680788295 [TCP segment of a reassembled PDU]
  201 1.383083511 172.31.26.111 → 54.188.89.98 TCP 111 27017 → 53846 [PSH, ACK] Seq=330 Ack=994 Win=31232 Len=45 TSval=1804942850 TSecr=1471513682 [TCP segment of a reassembled PDU]
  202 1.390326148 35.166.223.130 → 172.31.26.111 TCP 261 34222 → 27017 [PSH, ACK] Seq=8581 Ack=4653 Win=236 Len=195 TSval=3969821774 TSecr=3598232718 [TCP segment of a reassembled PDU]
  203 1.399584542 54.188.89.98 → 172.31.26.111 TCP 307 53846 → 27017 [PSH, ACK] Seq=994 Ack=375 Win=28032 Len=241 TSval=1471513714 TSecr=1804942850 [TCP segment of a reassembled PDU]
  204 1.400877680 34.215.93.126 → 172.31.26.111 TCP 261 36842 → 27017 [PSH, ACK] Seq=8581 Ack=4755 Win=236 Len=195 TSval=2680788338 TSecr=2711823072 [TCP segment of a reassembled PDU]
  205 1.405729547 172.31.26.111 → 35.166.223.130 TCP 250 27017 → 34222 [PSH, ACK] Seq=4653 Ack=8776 Win=838 Len=184 TSval=3598232753 TSecr=3969821774 [TCP segment of a reassembled PDU]
  206 1.414886566 172.31.26.111 → 54.188.89.98 TCP 111 27017 → 53846 [PSH, ACK] Seq=375 Ack=1235 Win=32256 Len=45 TSval=1804942882 TSecr=1471513714 [TCP segment of a reassembled PDU]
  207 1.416136660 172.31.26.111 → 34.215.93.126 TCP 250 27017 → 36842 [PSH, ACK] Seq=4755 Ack=8776 Win=853 Len=184 TSval=2711823116 TSecr=2680788338 [TCP segment of a reassembled PDU]
  208 1.422084780 35.166.223.130 → 172.31.26.111 TCP 261 34222 → 27017 [PSH, ACK] Seq=8776 Ack=4837 Win=244 Len=195 TSval=3969821806 TSecr=3598232753 [TCP segment of a reassembled PDU]
  209 1.431282389 54.188.89.98 → 172.31.26.111 TCP 307 53846 → 27017 [PSH, ACK] Seq=1235 Ack=420 Win=28032 Len=241 TSval=1471513746 TSecr=1804942882 [TCP segment of a reassembled PDU]
  210 1.432401087 34.215.93.126 → 172.31.26.111 TCP 261 36842 → 27017 [PSH, ACK] Seq=8776 Ack=4939 Win=244 Len=195 TSval=2680788370 TSecr=2711823116 [TCP segment of a reassembled PDU]
  211 1.437412567 172.31.26.111 → 35.166.223.130 TCP 250 27017 → 34222 [PSH, ACK] Seq=4837 Ack=8971 Win=847 Len=184 TSval=3598232784 TSecr=3969821806 [TCP segment of a reassembled PDU]
  212 1.446624751 172.31.26.111 → 54.188.89.98 TCP 111 27017 → 53846 [PSH, ACK] Seq=420 Ack=1476 Win=33280 Len=45 TSval=1804942914 TSecr=1471513746 [TCP segment of a reassembled PDU]
  213 1.447657930 172.31.26.111 → 34.215.93.126 TCP 250 27017 → 36842 [PSH, ACK] Seq=4939 Ack=8971 Win=853 Len=184 TSval=2711823148 TSecr=2680788370 [TCP segment of a reassembled PDU]
  214 1.450581963 172.31.26.111 → 91.189.89.198 NTP 90 NTP Version 4, client
  215 1.453733876 35.166.223.130 → 172.31.26.111 TCP 261 34222 → 27017 [PSH, ACK] Seq=8971 Ack=5021 Win=252 Len=195 TSval=3969821837 TSecr=3598232784 [TCP segment of a reassembled PDU]
  216 1.454004764 172.31.26.111 → 69.164.213.136 NTP 90 NTP Version 4, client
  217 1.454012776 172.31.26.111 → 208.67.72.50 NTP 90 NTP Version 4, client
  218 1.462977881 54.188.89.98 → 172.31.26.111 TCP 307 53846 → 27017 [PSH, ACK] Seq=1476 Ack=465 Win=28032 Len=241 TSval=1471513777 TSecr=1804942914 [TCP segment of a reassembled PDU]
  219 1.463945022 34.215.93.126 → 172.31.26.111 TCP 261 36842 → 27017 [PSH, ACK] Seq=8971 Ack=5123 Win=252 Len=195 TSval=2680788401 TSecr=2711823148 [TCP segment of a reassembled PDU]
  220 1.469092254 172.31.26.111 → 35.166.223.130 TCP 250 27017 → 34222 [PSH, ACK] Seq=5021 Ack=9166 Win=853 Len=184 TSval=3598232816 TSecr=3969821837 [TCP segment of a reassembled PDU]
  221 1.478216748 172.31.26.111 → 54.188.89.98 TCP 111 27017 → 53846 [PSH, ACK] Seq=465 Ack=1717 Win=34432 Len=45 TSval=1804942945 TSecr=1471513777 [TCP segment of a reassembled PDU]
  222 1.479167756 172.31.26.111 → 34.215.93.126 TCP 250 27017 → 36842 [PSH, ACK] Seq=5123 Ack=9166 Win=853 Len=184 TSval=2711823179 TSecr=2680788401 [TCP segment of a reassembled PDU]
  223 1.485463560 35.166.223.130 → 172.31.26.111 TCP 261 34222 → 27017 [PSH, ACK] Seq=9166 Ack=5205 Win=261 Len=195 TSval=3969821869 TSecr=3598232816 [TCP segment of a reassembled PDU]
  224 1.494554604 54.188.89.98 → 172.31.26.111 TCP 307 53846 → 27017 [PSH, ACK] Seq=1717 Ack=510 Win=28032 Len=241 TSval=1471513809 TSecr=1804942945 [TCP segment of a reassembled PDU]
  225 1.495528717 34.215.93.126 → 172.31.26.111 TCP 261 36842 → 27017 [PSH, ACK] Seq=9166 Ack=5307 Win=261 Len=195 TSval=2680788433 TSecr=2711823179 [TCP segment of a reassembled PDU]
  226 1.500725336 172.31.26.111 → 35.166.223.130 TCP 250 27017 → 34222 [PSH, ACK] Seq=5205 Ack=9361 Win=853 Len=184 TSval=3598232848 TSecr=3969821869 [TCP segment of a reassembled PDU]
  227 1.509781458 172.31.26.111 → 54.188.89.98 TCP 111 27017 → 53846 [PSH, ACK] Seq=510 Ack=1958 Win=35456 Len=45 TSval=1804942977 TSecr=1471513809 [TCP segment of a reassembled PDU]
  228 1.510733195 172.31.26.111 → 34.215.93.126 TCP 250 27017 → 36842 [PSH, ACK] Seq=5307 Ack=9361 Win=853 Len=184 TSval=2711823211 TSecr=2680788433 [TCP segment of a reassembled PDU]
  229 1.517059889 35.166.223.130 → 172.31.26.111 TCP 261 34222 → 27017 [PSH, ACK] Seq=9361 Ack=5389 Win=269 Len=195 TSval=3969821901 TSecr=3598232848 [TCP segment of a reassembled PDU]
  230 1.526091997 54.188.89.98 → 172.31.26.111 TCP 307 53846 → 27017 [PSH, ACK] Seq=1958 Ack=555 Win=28032 Len=241 TSval=1471513841 TSecr=1804942977 [TCP segment of a reassembled PDU]
  231 1.527128936 34.215.93.126 → 172.31.26.111 TCP 261 36842 → 27017 [PSH, ACK] Seq=9361 Ack=5491 Win=269 Len=195 TSval=2680788464 TSecr=2711823211 [TCP segment of a reassembled PDU]
  232 1.530708097 69.164.213.136 → 172.31.26.111 NTP 90 NTP Version 4, server
  233 1.532349609 172.31.26.111 → 35.166.223.130 TCP 250 27017 → 34222 [PSH, ACK] Seq=5389 Ack=9556 Win=853 Len=184 TSval=3598232879 TSecr=3969821901 [TCP segment of a reassembled PDU]
  234 1.537246115 208.67.72.50 → 172.31.26.111 NTP 90 NTP Version 4, server
  235 1.541458054 172.31.26.111 → 153.90.128.120 SSH 110 Server: Encrypted packet (len=44)
  236 1.541623488 172.31.26.111 → 54.188.89.98 TCP 111 27017 → 53846 [PSH, ACK] Seq=555 Ack=2199 Win=36608 Len=45 TSval=1804943009 TSecr=1471513841 [TCP segment of a reassembled PDU]
  237 1.542327618 172.31.26.111 → 34.215.93.126 TCP 250 27017 → 36842 [PSH, ACK] Seq=5491 Ack=9556 Win=853 Len=184 TSval=2711823242 TSecr=2680788464 [TCP segment of a reassembled PDU]
  238 1.548658435 35.166.223.130 → 172.31.26.111 TCP 261 34222 → 27017 [PSH, ACK] Seq=9556 Ack=5573 Win=278 Len=195 TSval=3969821932 TSecr=3598232879 [TCP segment of a reassembled PDU]
  239 1.557842890 54.188.89.98 → 172.31.26.111 TCP 307 53846 → 27017 [PSH, ACK] Seq=2199 Ack=600 Win=28032 Len=241 TSval=1471513872 TSecr=1804943009 [TCP segment of a reassembled PDU]
  240 1.558612139 34.215.93.126 → 172.31.26.111 TCP 261 36842 → 27017 [PSH, ACK] Seq=9556 Ack=5675 Win=278 Len=195 TSval=2680788496 TSecr=2711823242 [TCP segment of a reassembled PDU]
  241 1.563958749 172.31.26.111 → 35.166.223.130 TCP 250 27017 → 34222 [PSH, ACK] Seq=5573 Ack=9751 Win=853 Len=184 TSval=3598232911 TSecr=3969821932 [TCP segment of a reassembled PDU]
  242 1.573090808 172.31.26.111 → 54.188.89.98 TCP 111 27017 → 53846 [PSH, ACK] Seq=600 Ack=2440 Win=37632 Len=45 TSval=1804943040 TSecr=1471513872 [TCP segment of a reassembled PDU]
  243 1.573825285 172.31.26.111 → 34.215.93.126 TCP 250 27017 → 36842 [PSH, ACK] Seq=5675 Ack=9751 Win=853 Len=184 TSval=2711823274 TSecr=2680788496 [TCP segment of a reassembled PDU]
  244 1.580247738 35.166.223.130 → 172.31.26.111 TCP 261 34222 → 27017 [PSH, ACK] Seq=9751 Ack=5757 Win=286 Len=195 TSval=3969821964 TSecr=3598232911 [TCP segment of a reassembled PDU]
  245 1.589200665 54.188.89.98 → 172.31.26.111 TCP 307 53846 → 27017 [PSH, ACK] Seq=2440 Ack=645 Win=28032 Len=241 TSval=1471513904 TSecr=1804943040 [TCP segment of a reassembled PDU]
  246 1.589736588 34.215.93.126 → 172.31.26.111 TCP 261 36842 → 27017 [PSH, ACK] Seq=9751 Ack=5859 Win=286 Len=195 TSval=2680788527 TSecr=2711823274 [TCP segment of a reassembled PDU]
  247 1.590384626 153.90.128.120 → 172.31.26.111 TCP 66 52812 → 22 [ACK] Seq=1 Ack=577 Win=1444 Len=0 TSval=970601324 TSecr=400953767
  248 1.595467427 172.31.26.111 → 35.166.223.130 TCP 250 27017 → 34222 [PSH, ACK] Seq=5757 Ack=9946 Win=853 Len=184 TSval=3598232942 TSecr=3969821964 [TCP segment of a reassembled PDU]
  249 1.601690604 91.189.89.198 → 172.31.26.111 NTP 90 NTP Version 4, server
  250 1.604393537 172.31.26.111 → 54.188.89.98 TCP 111 27017 → 53846 [PSH, ACK] Seq=645 Ack=2681 Win=38656 Len=45 TSval=1804943071 TSecr=1471513904 [TCP segment of a reassembled PDU]
  251 1.604929579 172.31.26.111 → 34.215.93.126 TCP 250 27017 → 36842 [PSH, ACK] Seq=5859 Ack=9946 Win=853 Len=184 TSval=2711823305 TSecr=2680788527 [TCP segment of a reassembled PDU]
  252 1.611829874 35.166.223.130 → 172.31.26.111 TCP 261 34222 → 27017 [PSH, ACK] Seq=9946 Ack=5941 Win=294 Len=195 TSval=3969821995 TSecr=3598232942 [TCP segment of a reassembled PDU]
  253 1.620415443 54.188.89.98 → 172.31.26.111 TCP 307 53846 → 27017 [PSH, ACK] Seq=2681 Ack=690 Win=28032 Len=241 TSval=1471513935 TSecr=1804943071 [TCP segment of a reassembled PDU]
  254 1.621160380 34.215.93.126 → 172.31.26.111 TCP 261 36842 → 27017 [PSH, ACK] Seq=9946 Ack=6043 Win=294 Len=195 TSval=2680788558 TSecr=2711823305 [TCP segment of a reassembled PDU]
  255 1.627067051 172.31.26.111 → 35.166.223.130 TCP 250 27017 → 34222 [PSH, ACK] Seq=5941 Ack=10141 Win=853 Len=184 TSval=3598232974 TSecr=3969821995 [TCP segment of a reassembled PDU]
  256 1.635622143 172.31.26.111 → 54.188.89.98 TCP 111 27017 → 53846 [PSH, ACK] Seq=690 Ack=2922 Win=39808 Len=45 TSval=1804943103 TSecr=1471513935 [TCP segment of a reassembled PDU]
  257 1.636357863 172.31.26.111 → 34.215.93.126 TCP 250 27017 → 36842 [PSH, ACK] Seq=6043 Ack=10141 Win=853 Len=184 TSval=2711823336 TSecr=2680788558 [TCP segment of a reassembled PDU]
  258 1.643461112 35.166.223.130 → 172.31.26.111 TCP 261 34222 → 27017 [PSH, ACK] Seq=10141 Ack=6125 Win=303 Len=195 TSval=3969822027 TSecr=3598232974 [TCP segment of a reassembled PDU]
  259 1.651669889 54.188.89.98 → 172.31.26.111 TCP 307 53846 → 27017 [PSH, ACK] Seq=2922 Ack=735 Win=28032 Len=241 TSval=1471513966 TSecr=1804943103 [TCP segment of a reassembled PDU]
  260 1.652353890 34.215.93.126 → 172.31.26.111 TCP 261 36842 → 27017 [PSH, ACK] Seq=10141 Ack=6227 Win=303 Len=195 TSval=2680788590 TSecr=2711823336 [TCP segment of a reassembled PDU]
  261 1.658693647 172.31.26.111 → 35.166.223.130 TCP 250 27017 → 34222 [PSH, ACK] Seq=6125 Ack=10336 Win=853 Len=184 TSval=3598233006 TSecr=3969822027 [TCP segment of a reassembled PDU]
  262 1.666884247 172.31.26.111 → 54.188.89.98 TCP 111 27017 → 53846 [PSH, ACK] Seq=735 Ack=3163 Win=40832 Len=45 TSval=1804943134 TSecr=1471513966 [TCP segment of a reassembled PDU]
  263 1.667560453 172.31.26.111 → 34.215.93.126 TCP 250 27017 → 36842 [PSH, ACK] Seq=6227 Ack=10336 Win=853 Len=184 TSval=2711823368 TSecr=2680788590 [TCP segment of a reassembled PDU]
  264 1.674980319 35.166.223.130 → 172.31.26.111 TCP 261 34222 → 27017 [PSH, ACK] Seq=10336 Ack=6309 Win=311 Len=195 TSval=3969822059 TSecr=3598233006 [TCP segment of a reassembled PDU]
  265 1.683069527 54.188.89.98 → 172.31.26.111 TCP 307 53846 → 27017 [PSH, ACK] Seq=3163 Ack=780 Win=28032 Len=241 TSval=1471513998 TSecr=1804943134 [TCP segment of a reassembled PDU]
  266 1.683721435 34.215.93.126 → 172.31.26.111 TCP 261 36842 → 27017 [PSH, ACK] Seq=10336 Ack=6411 Win=311 Len=195 TSval=2680788621 TSecr=2711823368 [TCP segment of a reassembled PDU]
  267 1.690220109 172.31.26.111 → 35.166.223.130 TCP 250 27017 → 34222 [PSH, ACK] Seq=6309 Ack=10531 Win=853 Len=184 TSval=3598233037 TSecr=3969822059 [TCP segment of a reassembled PDU]
  268 1.698290592 172.31.26.111 → 54.188.89.98 TCP 111 27017 → 53846 [PSH, ACK] Seq=780 Ack=3404 Win=41856 Len=45 TSval=1804943165 TSecr=1471513998 [TCP segment of a reassembled PDU]
  269 1.698923857 172.31.26.111 → 34.215.93.126 TCP 250 27017 → 36842 [PSH, ACK] Seq=6411 Ack=10531 Win=853 Len=184 TSval=2711823399 TSecr=2680788621 [TCP segment of a reassembled PDU]
  270 1.706541662 35.166.223.130 → 172.31.26.111 TCP 261 34222 → 27017 [PSH, ACK] Seq=10531 Ack=6493 Win=319 Len=195 TSval=3969822090 TSecr=3598233037 [TCP segment of a reassembled PDU]
  271 1.714387107 54.188.89.98 → 172.31.26.111 TCP 307 53846 → 27017 [PSH, ACK] Seq=3404 Ack=825 Win=28032 Len=241 TSval=1471514029 TSecr=1804943165 [TCP segment of a reassembled PDU]
  272 1.715254266 34.215.93.126 → 172.31.26.111 TCP 261 36842 → 27017 [PSH, ACK] Seq=10531 Ack=6595 Win=319 Len=195 TSval=2680788653 TSecr=2711823399 [TCP segment of a reassembled PDU]
  273 1.721756956 172.31.26.111 → 35.166.223.130 TCP 250 27017 → 34222 [PSH, ACK] Seq=6493 Ack=10726 Win=853 Len=184 TSval=3598233069 TSecr=3969822090 [TCP segment of a reassembled PDU]
  274 1.729582843 172.31.26.111 → 54.188.89.98 TCP 111 27017 → 53846 [PSH, ACK] Seq=825 Ack=3645 Win=43008 Len=45 TSval=1804943197 TSecr=1471514029 [TCP segment of a reassembled PDU]
  275 1.730448987 172.31.26.111 → 34.215.93.126 TCP 250 27017 → 36842 [PSH, ACK] Seq=6595 Ack=10726 Win=853 Len=184 TSval=2711823430 TSecr=2680788653 [TCP segment of a reassembled PDU]
  276 1.738054501 35.166.223.130 → 172.31.26.111 TCP 261 34222 → 27017 [PSH, ACK] Seq=10726 Ack=6677 Win=328 Len=195 TSval=3969822122 TSecr=3598233069 [TCP segment of a reassembled PDU]
  277 1.745622508 54.188.89.98 → 172.31.26.111 TCP 307 53846 → 27017 [PSH, ACK] Seq=3645 Ack=870 Win=28032 Len=241 TSval=1471514060 TSecr=1804943197 [TCP segment of a reassembled PDU]
  278 1.746628301 34.215.93.126 → 172.31.26.111 TCP 261 36842 → 27017 [PSH, ACK] Seq=10726 Ack=6779 Win=328 Len=195 TSval=2680788684 TSecr=2711823430 [TCP segment of a reassembled PDU]
  279 1.753304766 172.31.26.111 → 35.166.223.130 TCP 250 27017 → 34222 [PSH, ACK] Seq=6677 Ack=10921 Win=853 Len=184 TSval=3598233100 TSecr=3969822122 [TCP segment of a reassembled PDU]
  280 1.760828896 172.31.26.111 → 54.188.89.98 TCP 111 27017 → 53846 [PSH, ACK] Seq=870 Ack=3886 Win=44032 Len=45 TSval=1804943228 TSecr=1471514060 [TCP segment of a reassembled PDU]
