   20 3.450395421 54.188.89.98 → 172.31.26.111 TCP 74 53760 → 27017 [SYN] Seq=0 Win=26883 Len=0 MSS=1460 SACK_PERM=1 TSval=1470542733 TSecr=0 WS=128
   21 3.465514769 172.31.26.111 → 54.188.89.98 TCP 74 27017 → 53760 [SYN, ACK] Seq=0 Ack=1 Win=26847 Len=0 MSS=8961 SACK_PERM=1 TSval=1803971848 TSecr=1470542733 WS=128
   22 3.481166913 54.188.89.98 → 172.31.26.111 TCP 66 53760 → 27017 [ACK] Seq=1 Ack=1 Win=27008 Len=0 TSval=1470542764 TSecr=1803971848
   23 3.481289245 54.188.89.98 → 172.31.26.111 SSL 336 Continuation Data
   24 3.496392218 172.31.26.111 → 54.188.89.98 TCP 66 27017 → 53760 [ACK] Seq=1 Ack=271 Win=28032 Len=0 TSval=1803971879 TSecr=1470542764
   25 3.496622621 172.31.26.111 → 54.188.89.98 TCP 305 [TCP segment of a reassembled PDU]
   26 3.512173903 54.188.89.98 → 172.31.26.111 TCP 66 53760 → 27017 [ACK] Seq=271 Ack=240 Win=28032 Len=0 TSval=1470542795 TSecr=1803971879
   27 3.512378402 54.188.89.98 → 172.31.26.111 TCP 276 [TCP segment of a reassembled PDU]
   28 3.527726510 172.31.26.111 → 54.188.89.98 TCP 111 27017 → 53760 [PSH, ACK] Seq=240 Ack=481 Win=29056 Len=45 TSval=1803971910 TSecr=1470542795 [TCP segment of a reassembled PDU]
   29 3.544043432 54.188.89.98 → 172.31.26.111 TCP 277 53760 → 27017 [PSH, ACK] Seq=481 Ack=285 Win=28032 Len=211 TSval=1470542827 TSecr=1803971910 [TCP segment of a reassembled PDU]
   30 3.559383110 172.31.26.111 → 54.188.89.98 TCP 111 27017 → 53760 [PSH, ACK] Seq=285 Ack=692 Win=30080 Len=45 TSval=1803971942 TSecr=1470542827 [TCP segment of a reassembled PDU]
   31 3.575679711 54.188.89.98 → 172.31.26.111 TCP 279 53760 → 27017 [PSH, ACK] Seq=692 Ack=330 Win=28032 Len=213 TSval=1470542858 TSecr=1803971942 [TCP segment of a reassembled PDU]
   32 3.590964804 172.31.26.111 → 54.188.89.98 TCP 111 27017 → 53760 [PSH, ACK] Seq=330 Ack=905 Win=31232 Len=45 TSval=1803971973 TSecr=1470542858 [TCP segment of a reassembled PDU]
   34 3.607060725 54.188.89.98 → 172.31.26.111 TCP 283 53760 → 27017 [PSH, ACK] Seq=905 Ack=375 Win=28032 Len=217 TSval=1470542890 TSecr=1803971973 [TCP segment of a reassembled PDU]
   35 3.622360214 172.31.26.111 → 54.188.89.98 TCP 111 27017 → 53760 [PSH, ACK] Seq=375 Ack=1122 Win=32256 Len=45 TSval=1803972005 TSecr=1470542890 [TCP segment of a reassembled PDU]
   36 3.638515343 54.188.89.98 → 172.31.26.111 TCP 291 53760 → 27017 [PSH, ACK] Seq=1122 Ack=420 Win=28032 Len=225 TSval=1470542921 TSecr=1803972005 [TCP segment of a reassembled PDU]
   38 3.653850980 172.31.26.111 → 54.188.89.98 TCP 111 27017 → 53760 [PSH, ACK] Seq=420 Ack=1347 Win=33280 Len=45 TSval=1803972036 TSecr=1470542921 [TCP segment of a reassembled PDU]
   39 3.670008411 54.188.89.98 → 172.31.26.111 TCP 307 53760 → 27017 [PSH, ACK] Seq=1347 Ack=465 Win=28032 Len=241 TSval=1470542953 TSecr=1803972036 [TCP segment of a reassembled PDU]
   40 3.685260065 172.31.26.111 → 54.188.89.98 TCP 111 27017 → 53760 [PSH, ACK] Seq=465 Ack=1588 Win=34432 Len=45 TSval=1803972068 TSecr=1470542953 [TCP segment of a reassembled PDU]
   41 3.701514910 54.188.89.98 → 172.31.26.111 TCP 339 53760 → 27017 [PSH, ACK] Seq=1588 Ack=510 Win=28032 Len=273 TSval=1470542984 TSecr=1803972068 [TCP segment of a reassembled PDU]
   42 3.716852024 172.31.26.111 → 54.188.89.98 TCP 111 27017 → 53760 [PSH, ACK] Seq=510 Ack=1861 Win=35456 Len=45 TSval=1803972099 TSecr=1470542984 [TCP segment of a reassembled PDU]
   43 3.733227806 54.188.89.98 → 172.31.26.111 TCP 403 53760 → 27017 [PSH, ACK] Seq=1861 Ack=555 Win=28032 Len=337 TSval=1470543016 TSecr=1803972099 [TCP segment of a reassembled PDU]
   44 3.748473686 172.31.26.111 → 54.188.89.98 TCP 111 27017 → 53760 [PSH, ACK] Seq=555 Ack=2198 Win=36608 Len=45 TSval=1803972131 TSecr=1470543016 [TCP segment of a reassembled PDU]
   45 3.764530298 54.188.89.98 → 172.31.26.111 TCP 531 53760 → 27017 [PSH, ACK] Seq=2198 Ack=600 Win=28032 Len=465 TSval=1470543047 TSecr=1803972131 [TCP segment of a reassembled PDU]
   46 3.779816020 172.31.26.111 → 54.188.89.98 TCP 111 27017 → 53760 [PSH, ACK] Seq=600 Ack=2663 Win=37632 Len=45 TSval=1803972162 TSecr=1470543047 [TCP segment of a reassembled PDU]
   47 3.795827696 54.188.89.98 → 172.31.26.111 TCP 787 53760 → 27017 [PSH, ACK] Seq=2663 Ack=645 Win=28032 Len=721 TSval=1470543078 TSecr=1803972162 [TCP segment of a reassembled PDU]
   48 3.811158210 172.31.26.111 → 54.188.89.98 TCP 111 27017 → 53760 [PSH, ACK] Seq=645 Ack=3384 Win=39040 Len=45 TSval=1803972194 TSecr=1470543078 [TCP segment of a reassembled PDU]
   49 3.827219255 54.188.89.98 → 172.31.26.111 TCP 1299 53760 → 27017 [PSH, ACK] Seq=3384 Ack=690 Win=28032 Len=1233 TSval=1470543110 TSecr=1803972194 [TCP segment of a reassembled PDU]
   50 3.842511022 172.31.26.111 → 54.188.89.98 TCP 111 27017 → 53760 [PSH, ACK] Seq=690 Ack=4617 Win=41600 Len=45 TSval=1803972225 TSecr=1470543110 [TCP segment of a reassembled PDU]
   51 3.858801563 54.188.89.98 → 172.31.26.111 TCP 1514 53760 → 27017 [ACK] Seq=4617 Ack=735 Win=28032 Len=1448 TSval=1470543141 TSecr=1803972225 [TCP segment of a reassembled PDU]
   52 3.858824565 54.188.89.98 → 172.31.26.111 TCP 875 53760 → 27017 [PSH, ACK] Seq=6065 Ack=735 Win=28032 Len=809 TSval=1470543141 TSecr=1803972225 [TCP segment of a reassembled PDU]
   53 3.873907700 172.31.26.111 → 54.188.89.98 TCP 66 27017 → 53760 [ACK] Seq=735 Ack=6874 Win=47360 Len=0 TSval=1803972256 TSecr=1470543141
   54 3.874082495 172.31.26.111 → 54.188.89.98 TCP 111 27017 → 53760 [PSH, ACK] Seq=735 Ack=6874 Win=47360 Len=45 TSval=1803972257 TSecr=1470543141 [TCP segment of a reassembled PDU]
   55 3.890202251 54.188.89.98 → 172.31.26.111 TCP 2962 53760 → 27017 [ACK] Seq=6874 Ack=780 Win=28032 Len=2896 TSval=1470543173 TSecr=1803972257 [TCP segment of a reassembled PDU]
   56 3.905325674 172.31.26.111 → 54.188.89.98 TCP 66 27017 → 53760 [ACK] Seq=780 Ack=9770 Win=53120 Len=0 TSval=1803972288 TSecr=1470543173
   65 6.010312395 54.188.89.98 → 172.31.26.111 TCP 1475 53760 → 27017 [PSH, ACK] Seq=9770 Ack=780 Win=28032 Len=1409 TSval=1470543173 TSecr=1803972257 [TCP segment of a reassembled PDU]
   66 6.025713765 172.31.26.111 → 54.188.89.98 TCP 111 27017 → 53760 [PSH, ACK] Seq=780 Ack=11179 Win=56064 Len=45 TSval=1803974408 TSecr=1470543173 [TCP segment of a reassembled PDU]
   67 6.043527966 54.188.89.98 → 172.31.26.111 TCP 2962 53760 → 27017 [ACK] Seq=11179 Ack=825 Win=28032 Len=2896 TSval=1470545326 TSecr=1803974408 [TCP segment of a reassembled PDU]
   68 6.058639179 172.31.26.111 → 54.188.89.98 TCP 66 27017 → 53760 [ACK] Seq=825 Ack=14075 Win=61824 Len=0 TSval=1803974441 TSecr=1470545326
   77 8.010281203 54.188.89.98 → 172.31.26.111 TCP 2962 53760 → 27017 [ACK] Seq=14075 Ack=825 Win=28032 Len=2896 TSval=1470545326 TSecr=1803974408 [TCP segment of a reassembled PDU]
   78 8.011601241 54.188.89.98 → 172.31.26.111 TCP 2675 53760 → 27017 [PSH, ACK] Seq=16971 Ack=825 Win=28032 Len=2609 TSval=1470545326 TSecr=1803974408 [TCP segment of a reassembled PDU]
   79 8.025381754 172.31.26.111 → 54.188.89.98 TCP 66 27017 → 53760 [ACK] Seq=825 Ack=16971 Win=67584 Len=0 TSval=1803976408 TSecr=1470545326
   80 8.026692163 172.31.26.111 → 54.188.89.98 TCP 66 27017 → 53760 [ACK] Seq=825 Ack=19580 Win=72832 Len=0 TSval=1803976409 TSecr=1470545326
   81 8.026965620 172.31.26.111 → 54.188.89.98 TCP 111 27017 → 53760 [PSH, ACK] Seq=825 Ack=19580 Win=72832 Len=45 TSval=1803976410 TSecr=1470545326 [TCP segment of a reassembled PDU]
   82 8.043219426 54.188.89.98 → 172.31.26.111 SSLv2 2962 Encrypted Data
   83 8.058326569 172.31.26.111 → 54.188.89.98 TCP 66 27017 → 53760 [ACK] Seq=870 Ack=22476 Win=78592 Len=0 TSval=1803976441 TSecr=1470547326
   84 8.058875873 54.188.89.98 → 172.31.26.111 TCP 2962 53760 → 27017 [ACK] Seq=22476 Ack=870 Win=28032 Len=2896 TSval=1470547326 TSecr=1803976410
   85 8.060525533 54.188.89.98 → 172.31.26.111 TCP 2962 53760 → 27017 [ACK] Seq=25372 Ack=870 Win=28032 Len=2896 TSval=1470547326 TSecr=1803976410
   86 8.073969831 172.31.26.111 → 54.188.89.98 TCP 66 27017 → 53760 [ACK] Seq=870 Ack=25372 Win=84352 Len=0 TSval=1803976457 TSecr=1470547326
   87 8.073978550 54.188.89.98 → 172.31.26.111 TCP 2179 [TCP Previous segment not captured] 53760 → 27017 [PSH, ACK] Seq=34060 Ack=870 Win=28032 Len=2113 TSval=1470547356 TSecr=1803976441
   88 8.075616446 172.31.26.111 → 54.188.89.98 TCP 66 27017 → 53760 [ACK] Seq=870 Ack=28268 Win=90240 Len=0 TSval=1803976458 TSecr=1470547326
   89 8.089088313 172.31.26.111 → 54.188.89.98 TCP 78 [TCP Window Update] 27017 → 53760 [ACK] Seq=870 Ack=28268 Win=94464 Len=0 TSval=1803976472 TSecr=1470547326 SLE=34060 SRE=36173
   90 8.104709384 54.188.89.98 → 172.31.26.111 TCP 2962 [TCP Out-Of-Order] 53760 → 27017 [ACK] Seq=28268 Ack=870 Win=28032 Len=2896 TSval=1470547387 TSecr=1803976472
   91 8.119826162 172.31.26.111 → 54.188.89.98 TCP 78 27017 → 53760 [ACK] Seq=870 Ack=31164 Win=100224 Len=0 TSval=1803976502 TSecr=1470547387 SLE=34060 SRE=36173
   92 8.135496436 54.188.89.98 → 172.31.26.111 TCP 2962 [TCP Retransmission] 53760 → 27017 [ACK] Seq=31164 Ack=870 Win=28032 Len=2896 TSval=1470547418 TSecr=1803976502
   93 8.150620661 172.31.26.111 → 54.188.89.98 TCP 66 27017 → 53760 [ACK] Seq=870 Ack=36173 Win=105984 Len=0 TSval=1803976533 TSecr=1470547418
   94 8.150854039 172.31.26.111 → 54.188.89.98 TCP 111 27017 → 53760 [PSH, ACK] Seq=870 Ack=36173 Win=105984 Len=45 TSval=1803976533 TSecr=1470547418 [TCP segment of a reassembled PDU]
   95 8.167184503 54.188.89.98 → 172.31.26.111 TCP 2962 [TCP segment of a reassembled PDU]
   96 8.182282753 172.31.26.111 → 54.188.89.98 TCP 66 27017 → 53760 [ACK] Seq=915 Ack=39069 Win=109184 Len=0 TSval=1803976565 TSecr=1470547450
   97 8.182810058 54.188.89.98 → 172.31.26.111 TCP 2962 53760 → 27017 [ACK] Seq=39069 Ack=915 Win=28032 Len=2896 TSval=1470547450 TSecr=1803976533 [TCP segment of a reassembled PDU]
   98 8.184415000 54.188.89.98 → 172.31.26.111 TCP 2962 53760 → 27017 [ACK] Seq=41965 Ack=915 Win=28032 Len=2896 TSval=1470547450 TSecr=1803976533 [TCP segment of a reassembled PDU]
   99 8.197904435 172.31.26.111 → 54.188.89.98 TCP 66 27017 → 53760 [ACK] Seq=915 Ack=41965 Win=109184 Len=0 TSval=1803976581 TSecr=1470547450
  100 8.198375318 54.188.89.98 → 172.31.26.111 TCP 2962 [TCP Previous segment not captured] 53760 → 27017 [ACK] Seq=46309 Ack=915 Win=28032 Len=2896 TSval=1470547480 TSecr=1803976565 [TCP segment of a reassembled PDU]
  101 8.199507157 172.31.26.111 → 54.188.89.98 TCP 66 27017 → 53760 [ACK] Seq=915 Ack=44861 Win=109184 Len=0 TSval=1803976582 TSecr=1470547450
  103 8.213446147 172.31.26.111 → 54.188.89.98 TCP 78 [TCP Dup ACK 101#1] 27017 → 53760 [ACK] Seq=915 Ack=44861 Win=109184 Len=0 TSval=1803976596 TSecr=1470547450 SLE=46309 SRE=49205
  104 8.213485802 54.188.89.98 → 172.31.26.111 TCP 1514 53760 → 27017 [ACK] Seq=49205 Ack=915 Win=28032 Len=1448 TSval=1470547496 TSecr=1803976581 [TCP segment of a reassembled PDU]
  105 8.213528560 54.188.89.98 → 172.31.26.111 TCP 1514 53760 → 27017 [ACK] Seq=50653 Ack=915 Win=28032 Len=1448 TSval=1470547496 TSecr=1803976581 [TCP segment of a reassembled PDU]
  106 8.215234077 54.188.89.98 → 172.31.26.111 TCP 2962 53760 → 27017 [ACK] Seq=52101 Ack=915 Win=28032 Len=2896 TSval=1470547497 TSecr=1803976582 [TCP segment of a reassembled PDU]
  107 8.216364572 54.188.89.98 → 172.31.26.111 TCP 1514 53760 → 27017 [ACK] Seq=54997 Ack=915 Win=28032 Len=1448 TSval=1470547497 TSecr=1803976582 [TCP segment of a reassembled PDU]
  108 8.228591233 172.31.26.111 → 54.188.89.98 TCP 78 [TCP Dup ACK 101#2] 27017 → 53760 [ACK] Seq=915 Ack=44861 Win=109184 Len=0 TSval=1803976611 TSecr=1470547450 SLE=46309 SRE=50653
  109 8.228600779 172.31.26.111 → 54.188.89.98 TCP 78 [TCP Dup ACK 101#3] 27017 → 53760 [ACK] Seq=915 Ack=44861 Win=109184 Len=0 TSval=1803976611 TSecr=1470547450 SLE=46309 SRE=52101
  110 8.228993796 54.188.89.98 → 172.31.26.111 TCP 1514 [TCP Fast Retransmission] 53760 → 27017 [ACK] Seq=44861 Ack=915 Win=28032 Len=1448 TSval=1470547511 TSecr=1803976596 [TCP segment of a reassembled PDU]
  111 8.230303839 172.31.26.111 → 54.188.89.98 TCP 78 [TCP Dup ACK 101#4] 27017 → 53760 [ACK] Seq=915 Ack=44861 Win=109184 Len=0 TSval=1803976613 TSecr=1470547450 SLE=46309 SRE=54997
  112 8.231453446 172.31.26.111 → 54.188.89.98 TCP 78 [TCP Dup ACK 101#5] 27017 → 53760 [ACK] Seq=915 Ack=44861 Win=109184 Len=0 TSval=1803976614 TSecr=1470547450 SLE=46309 SRE=56445
  113 8.244099485 172.31.26.111 → 54.188.89.98 TCP 66 27017 → 53760 [ACK] Seq=915 Ack=56445 Win=99072 Len=0 TSval=1803976627 TSecr=1470547511
  114 8.244258621 54.188.89.98 → 172.31.26.111 SSLv2 1514 Encrypted Data
  115 8.245843936 54.188.89.98 → 172.31.26.111 TCP 2962 53760 → 27017 [ACK] Seq=57893 Ack=915 Win=28032 Len=2896 TSval=1470547528 TSecr=1803976613
  116 8.247034631 54.188.89.98 → 172.31.26.111 TCP 1514 53760 → 27017 [ACK] Seq=60789 Ack=915 Win=28032 Len=1448 TSval=1470547529 TSecr=1803976614
  118 8.259366224 172.31.26.111 → 54.188.89.98 TCP 66 27017 → 53760 [ACK] Seq=915 Ack=57893 Win=112128 Len=0 TSval=1803976642 TSecr=1470547527
  119 8.259662487 54.188.89.98 → 172.31.26.111 TCP 1514 53760 → 27017 [ACK] Seq=62237 Ack=915 Win=28032 Len=1448 TSval=1470547542 TSecr=1803976627
  120 8.260929858 172.31.26.111 → 54.188.89.98 TCP 66 27017 → 53760 [ACK] Seq=915 Ack=60789 Win=117888 Len=0 TSval=1803976644 TSecr=1470547528
  121 8.262141821 172.31.26.111 → 54.188.89.98 TCP 66 27017 → 53760 [ACK] Seq=915 Ack=62237 Win=120832 Len=0 TSval=1803976645 TSecr=1470547529
  122 8.274766972 172.31.26.111 → 54.188.89.98 TCP 66 27017 → 53760 [ACK] Seq=915 Ack=63685 Win=123648 Len=0 TSval=1803976657 TSecr=1470547542
  123 8.275095462 54.188.89.98 → 172.31.26.111 TCP 1514 53760 → 27017 [ACK] Seq=63685 Ack=915 Win=28032 Len=1448 TSval=1470547557 TSecr=1803976642
  124 8.276563069 54.188.89.98 → 172.31.26.111 TCP 2962 53760 → 27017 [ACK] Seq=65133 Ack=915 Win=28032 Len=2896 TSval=1470547559 TSecr=1803976644
  125 8.277720452 54.188.89.98 → 172.31.26.111 TCP 1187 53760 → 27017 [PSH, ACK] Seq=68029 Ack=915 Win=28032 Len=1121 TSval=1470547560 TSecr=1803976645
  126 8.290190508 172.31.26.111 → 54.188.89.98 TCP 66 27017 → 53760 [ACK] Seq=915 Ack=65133 Win=126592 Len=0 TSval=1803976673 TSecr=1470547557
  127 8.291668132 172.31.26.111 → 54.188.89.98 TCP 66 27017 → 53760 [ACK] Seq=915 Ack=68029 Win=132352 Len=0 TSval=1803976674 TSecr=1470547559
  128 8.292809558 172.31.26.111 → 54.188.89.98 TCP 66 27017 → 53760 [ACK] Seq=915 Ack=69150 Win=135296 Len=0 TSval=1803976675 TSecr=1470547560
  129 8.293051998 172.31.26.111 → 54.188.89.98 TCP 111 27017 → 53760 [PSH, ACK] Seq=915 Ack=69150 Win=135296 Len=45 TSval=1803976676 TSecr=1470547560 [TCP segment of a reassembled PDU]
  130 8.309558673 54.188.89.98 → 172.31.26.111 TCP 2962 [TCP segment of a reassembled PDU]
  131 8.324664888 172.31.26.111 → 54.188.89.98 TCP 66 27017 → 53760 [ACK] Seq=960 Ack=72046 Win=141056 Len=0 TSval=1803976707 TSecr=1470547592
  132 8.325273217 54.188.89.98 → 172.31.26.111 TCP 2962 53760 → 27017 [ACK] Seq=72046 Ack=960 Win=28032 Len=2896 TSval=1470547592 TSecr=1803976676 [TCP segment of a reassembled PDU]
  133 8.326891046 54.188.89.98 → 172.31.26.111 TCP 2962 53760 → 27017 [ACK] Seq=74942 Ack=960 Win=28032 Len=2896 TSval=1470547592 TSecr=1803976676 [TCP segment of a reassembled PDU]
  134 8.340368648 172.31.26.111 → 54.188.89.98 TCP 66 27017 → 53760 [ACK] Seq=960 Ack=74942 Win=146816 Len=0 TSval=1803976723 TSecr=1470547592
  135 8.340483724 54.188.89.98 → 172.31.26.111 TCP 1514 53760 → 27017 [ACK] Seq=77838 Ack=960 Win=28032 Len=1448 TSval=1470547623 TSecr=1803976707 [TCP segment of a reassembled PDU]
  136 8.340500590 54.188.89.98 → 172.31.26.111 TCP 1514 53760 → 27017 [ACK] Seq=79286 Ack=960 Win=28032 Len=1448 TSval=1470547623 TSecr=1803976707 [TCP segment of a reassembled PDU]
  137 8.341995016 172.31.26.111 → 54.188.89.98 TCP 66 27017 → 53760 [ACK] Seq=960 Ack=77838 Win=152576 Len=0 TSval=1803976725 TSecr=1470547592
  138 8.355605348 172.31.26.111 → 54.188.89.98 TCP 66 27017 → 53760 [ACK] Seq=960 Ack=80734 Win=158464 Len=0 TSval=1803976738 TSecr=1470547623
  139 8.355964962 54.188.89.98 → 172.31.26.111 TCP 2962 53760 → 27017 [ACK] Seq=80734 Ack=960 Win=28032 Len=2896 TSval=1470547638 TSecr=1803976723 [TCP segment of a reassembled PDU]
  140 8.357599907 54.188.89.98 → 172.31.26.111 TCP 1514 53760 → 27017 [ACK] Seq=83630 Ack=960 Win=28032 Len=1448 TSval=1470547640 TSecr=1803976725 [TCP segment of a reassembled PDU]
  141 8.357625459 54.188.89.98 → 172.31.26.111 TCP 1514 53760 → 27017 [ACK] Seq=85078 Ack=960 Win=28032 Len=1448 TSval=1470547640 TSecr=1803976725 [TCP segment of a reassembled PDU]
  142 8.371056354 172.31.26.111 → 54.188.89.98 TCP 66 27017 → 53760 [ACK] Seq=960 Ack=83630 Win=164224 Len=0 TSval=1803976754 TSecr=1470547638
  143 8.371175710 54.188.89.98 → 172.31.26.111 TCP 2962 53760 → 27017 [ACK] Seq=86526 Ack=960 Win=28032 Len=2896 TSval=1470547654 TSecr=1803976738 [TCP segment of a reassembled PDU]
  144 8.372723358 172.31.26.111 → 54.188.89.98 TCP 66 27017 → 53760 [ACK] Seq=960 Ack=86526 Win=169984 Len=0 TSval=1803976755 TSecr=1470547640
  145 8.386285416 172.31.26.111 → 54.188.89.98 TCP 66 27017 → 53760 [ACK] Seq=960 Ack=89422 Win=175744 Len=0 TSval=1803976769 TSecr=1470547654
  146 8.386736222 54.188.89.98 → 172.31.26.111 SSLv2 2962 Encrypted Data
  147 8.389166748 54.188.89.98 → 172.31.26.111 TCP 2962 53760 → 27017 [ACK] Seq=92318 Ack=960 Win=28032 Len=2896 TSval=1470547671 TSecr=1803976755
  148 8.401851786 172.31.26.111 → 54.188.89.98 TCP 66 27017 → 53760 [ACK] Seq=960 Ack=92318 Win=181632 Len=0 TSval=1803976784 TSecr=1470547669
  149 8.401914089 54.188.89.98 → 172.31.26.111 TCP 1514 53760 → 27017 [ACK] Seq=95214 Ack=960 Win=28032 Len=1448 TSval=1470547684 TSecr=1803976769
  150 8.401959800 54.188.89.98 → 172.31.26.111 TCP 1514 53760 → 27017 [ACK] Seq=96662 Ack=960 Win=28032 Len=1448 TSval=1470547684 TSecr=1803976769
  151 8.404256599 172.31.26.111 → 54.188.89.98 TCP 66 27017 → 53760 [ACK] Seq=960 Ack=95214 Win=187392 Len=0 TSval=1803976787 TSecr=1470547671
  152 8.417064030 172.31.26.111 → 54.188.89.98 TCP 66 27017 → 53760 [ACK] Seq=960 Ack=98110 Win=193152 Len=0 TSval=1803976800 TSecr=1470547684
  153 8.417495401 54.188.89.98 → 172.31.26.111 TCP 2962 53760 → 27017 [ACK] Seq=98110 Ack=960 Win=28032 Len=2896 TSval=1470547700 TSecr=1803976784
  154 8.419875069 54.188.89.98 → 172.31.26.111 TCP 2962 53760 → 27017 [ACK] Seq=101006 Ack=960 Win=28032 Len=2896 TSval=1470547702 TSecr=1803976787
  155 8.432583075 172.31.26.111 → 54.188.89.98 TCP 66 27017 → 53760 [ACK] Seq=960 Ack=101006 Win=198912 Len=0 TSval=1803976815 TSecr=1470547700
  156 8.432594260 54.188.89.98 → 172.31.26.111 TCP 2962 53760 → 27017 [ACK] Seq=103902 Ack=960 Win=28032 Len=2896 TSval=1470547715 TSecr=1803976800
  157 8.435048254 172.31.26.111 → 54.188.89.98 TCP 66 27017 → 53760 [ACK] Seq=960 Ack=103902 Win=204800 Len=0 TSval=1803976818 TSecr=1470547702
  158 8.447689853 172.31.26.111 → 54.188.89.98 TCP 66 27017 → 53760 [ACK] Seq=960 Ack=106798 Win=210560 Len=0 TSval=1803976830 TSecr=1470547715
  159 8.448101628 54.188.89.98 → 172.31.26.111 TCP 2962 53760 → 27017 [ACK] Seq=106798 Ack=960 Win=28032 Len=2896 TSval=1470547731 TSecr=1803976815
  160 8.450588097 54.188.89.98 → 172.31.26.111 TCP 2962 53760 → 27017 [ACK] Seq=109694 Ack=960 Win=28032 Len=2896 TSval=1470547733 TSecr=1803976818
  161 8.451038826 54.188.89.98 → 172.31.26.111 TCP 1514 53760 → 27017 [ACK] Seq=112590 Ack=960 Win=28032 Len=1448 TSval=1470547733 TSecr=1803976818
  162 8.463221758 172.31.26.111 → 54.188.89.98 TCP 66 27017 → 53760 [ACK] Seq=960 Ack=109694 Win=216320 Len=0 TSval=1803976846 TSecr=1470547731
  163 8.463272347 54.188.89.98 → 172.31.26.111 TCP 1514 53760 → 27017 [ACK] Seq=114038 Ack=960 Win=28032 Len=1448 TSval=1470547746 TSecr=1803976830
  164 8.463324767 54.188.89.98 → 172.31.26.111 TCP 1514 53760 → 27017 [ACK] Seq=115486 Ack=960 Win=28032 Len=1448 TSval=1470547746 TSecr=1803976830
  165 8.465677946 172.31.26.111 → 54.188.89.98 TCP 66 27017 → 53760 [ACK] Seq=960 Ack=112590 Win=222080 Len=0 TSval=1803976848 TSecr=1470547733
  166 8.478361708 172.31.26.111 → 54.188.89.98 TCP 66 27017 → 53760 [ACK] Seq=960 Ack=115486 Win=227968 Len=0 TSval=1803976861 TSecr=1470547733
  167 8.478878845 54.188.89.98 → 172.31.26.111 TCP 2962 53760 → 27017 [ACK] Seq=116934 Ack=960 Win=28032 Len=2896 TSval=1470547761 TSecr=1803976846
  168 8.481220284 54.188.89.98 → 172.31.26.111 TCP 2962 53760 → 27017 [ACK] Seq=119830 Ack=960 Win=28032 Len=2896 TSval=1470547764 TSecr=1803976848
  169 8.493958947 172.31.26.111 → 54.188.89.98 TCP 66 27017 → 53760 [ACK] Seq=960 Ack=119830 Win=236672 Len=0 TSval=1803976877 TSecr=1470547746
  170 8.493969312 54.188.89.98 → 172.31.26.111 TCP 2962 53760 → 27017 [ACK] Seq=122726 Ack=960 Win=28032 Len=2896 TSval=1470547776 TSecr=1803976861
  171 8.496313679 172.31.26.111 → 54.188.89.98 TCP 66 27017 → 53760 [ACK] Seq=960 Ack=122726 Win=242432 Len=0 TSval=1803976879 TSecr=1470547764
  172 8.509039695 172.31.26.111 → 54.188.89.98 TCP 66 27017 → 53760 [ACK] Seq=960 Ack=125622 Win=248192 Len=0 TSval=1803976892 TSecr=1470547776
  173 8.509546466 54.188.89.98 → 172.31.26.111 TCP 2962 53760 → 27017 [ACK] Seq=125622 Ack=960 Win=28032 Len=2896 TSval=1470547792 TSecr=1803976877
  174 8.511192092 54.188.89.98 → 172.31.26.111 TCP 2962 53760 → 27017 [ACK] Seq=128518 Ack=960 Win=28032 Len=2896 TSval=1470547792 TSecr=1803976877
  175 8.513624141 54.188.89.98 → 172.31.26.111 TCP 2962 53760 → 27017 [ACK] Seq=131414 Ack=960 Win=28032 Len=2896 TSval=1470547794 TSecr=1803976879
  176 8.524595652 54.188.89.98 → 172.31.26.111 TCP 651 53760 → 27017 [PSH, ACK] Seq=134310 Ack=960 Win=28032 Len=585 TSval=1470547807 TSecr=1803976892
  177 8.524617009 172.31.26.111 → 54.188.89.98 TCP 66 27017 → 53760 [ACK] Seq=960 Ack=128518 Win=253952 Len=0 TSval=1803976907 TSecr=1470547792
  178 8.526265809 172.31.26.111 → 54.188.89.98 TCP 66 27017 → 53760 [ACK] Seq=960 Ack=131414 Win=259840 Len=0 TSval=1803976909 TSecr=1470547792
  179 8.528731761 172.31.26.111 → 54.188.89.98 TCP 66 27017 → 53760 [ACK] Seq=960 Ack=134310 Win=265600 Len=0 TSval=1803976911 TSecr=1470547794
  180 8.540034248 172.31.26.111 → 54.188.89.98 TCP 111 27017 → 53760 [PSH, ACK] Seq=960 Ack=134895 Win=268416 Len=45 TSval=1803976923 TSecr=1470547807 [TCP segment of a reassembled PDU]
  181 8.556630369 54.188.89.98 → 172.31.26.111 TCP 2962 [TCP segment of a reassembled PDU]
  182 8.571732074 172.31.26.111 → 54.188.89.98 TCP 66 27017 → 53760 [ACK] Seq=1005 Ack=137791 Win=274304 Len=0 TSval=1803976954 TSecr=1470547839
  183 8.572264271 54.188.89.98 → 172.31.26.111 TCP 2962 53760 → 27017 [ACK] Seq=137791 Ack=1005 Win=28032 Len=2896 TSval=1470547839 TSecr=1803976923 [TCP segment of a reassembled PDU]
  184 8.573896802 54.188.89.98 → 172.31.26.111 TCP 2962 53760 → 27017 [ACK] Seq=140687 Ack=1005 Win=28032 Len=2896 TSval=1470547839 TSecr=1803976923 [TCP segment of a reassembled PDU]
  185 8.587350830 172.31.26.111 → 54.188.89.98 TCP 66 27017 → 53760 [ACK] Seq=1005 Ack=140687 Win=280064 Len=0 TSval=1803976970 TSecr=1470547839
  186 8.587401954 54.188.89.98 → 172.31.26.111 TCP 1514 [TCP Previous segment not captured] 53760 → 27017 [ACK] Seq=146479 Ack=1005 Win=28032 Len=1448 TSval=1470547870 TSecr=1803976954 [TCP segment of a reassembled PDU]
  187 8.587440500 54.188.89.98 → 172.31.26.111 TCP 1514 53760 → 27017 [ACK] Seq=147927 Ack=1005 Win=28032 Len=1448 TSval=1470547870 TSecr=1803976954 [TCP segment of a reassembled PDU]
  188 8.588965602 172.31.26.111 → 54.188.89.98 TCP 66 27017 → 53760 [ACK] Seq=1005 Ack=143583 Win=285824 Len=0 TSval=1803976972 TSecr=1470547839
  189 8.602494392 172.31.26.111 → 54.188.89.98 TCP 78 [TCP Window Update] 27017 → 53760 [ACK] Seq=1005 Ack=143583 Win=288768 Len=0 TSval=1803976985 TSecr=1470547839 SLE=146479 SRE=147927
  190 8.602927930 54.188.89.98 → 172.31.26.111 TCP 2962 53760 → 27017 [ACK] Seq=149375 Ack=1005 Win=28032 Len=2896 TSval=1470547885 TSecr=1803976970 [TCP segment of a reassembled PDU]
  191 8.602945790 172.31.26.111 → 54.188.89.98 TCP 78 [TCP Window Update] 27017 → 53760 [ACK] Seq=1005 Ack=143583 Win=291584 Len=0 TSval=1803976985 TSecr=1470547839 SLE=146479 SRE=149375
  192 8.604480668 54.188.89.98 → 172.31.26.111 TCP 2962 53760 → 27017 [ACK] Seq=152271 Ack=1005 Win=28032 Len=2896 TSval=1470547887 TSecr=1803976972 [TCP segment of a reassembled PDU]
  193 8.618031541 172.31.26.111 → 54.188.89.98 TCP 78 [TCP Window Update] 27017 → 53760 [ACK] Seq=1005 Ack=143583 Win=297472 Len=0 TSval=1803977001 TSecr=1470547839 SLE=146479 SRE=152271
  194 8.618060514 54.188.89.98 → 172.31.26.111 TCP 1514 [TCP Out-Of-Order] 53760 → 27017 [ACK] Seq=143583 Ack=1005 Win=28032 Len=1448 TSval=1470547900 TSecr=1803976985 [TCP segment of a reassembled PDU]
  195 8.618452654 54.188.89.98 → 172.31.26.111 TCP 1514 [TCP Out-Of-Order] 53760 → 27017 [ACK] Seq=145031 Ack=1005 Win=28032 Len=1448 TSval=1470547901 TSecr=1803976985 [TCP segment of a reassembled PDU]
  196 8.619566477 172.31.26.111 → 54.188.89.98 TCP 78 [TCP Window Update] 27017 → 53760 [ACK] Seq=1005 Ack=143583 Win=303232 Len=0 TSval=1803977002 TSecr=1470547839 SLE=146479 SRE=155167
  197 8.633152101 172.31.26.111 → 54.188.89.98 TCP 78 27017 → 53760 [ACK] Seq=1005 Ack=145031 Win=306176 Len=0 TSval=1803977016 TSecr=1470547900 SLE=146479 SRE=155167
  198 8.633587731 172.31.26.111 → 54.188.89.98 TCP 66 27017 → 53760 [ACK] Seq=1005 Ack=155167 Win=308992 Len=0 TSval=1803977016 TSecr=1470547901
  199 8.633593609 54.188.89.98 → 172.31.26.111 SSLv2 1514 Client Master Key
  200 8.633614355 54.188.89.98 → 172.31.26.111 TCP 1514 53760 → 27017 [ACK] Seq=156615 Ack=1005 Win=28032 Len=1448 TSval=1470547916 TSecr=1803977001
  201 8.635190611 54.188.89.98 → 172.31.26.111 TCP 2962 53760 → 27017 [ACK] Seq=158063 Ack=1005 Win=28032 Len=2896 TSval=1470547918 TSecr=1803977002
  202 8.648684097 172.31.26.111 → 54.188.89.98 TCP 66 27017 → 53760 [ACK] Seq=1005 Ack=156615 Win=311936 Len=0 TSval=1803977031 TSecr=1470547916
  203 8.648689249 172.31.26.111 → 54.188.89.98 TCP 66 27017 → 53760 [ACK] Seq=1005 Ack=158063 Win=314752 Len=0 TSval=1803977031 TSecr=1470547916
  204 8.648695452 54.188.89.98 → 172.31.26.111 TCP 1514 53760 → 27017 [ACK] Seq=160959 Ack=1005 Win=28032 Len=1448 TSval=1470547931 TSecr=1803977016
  205 8.649078515 54.188.89.98 → 172.31.26.111 TCP 1514 53760 → 27017 [ACK] Seq=162407 Ack=1005 Win=28032 Len=1448 TSval=1470547932 TSecr=1803977016
  206 8.650293321 172.31.26.111 → 54.188.89.98 TCP 66 27017 → 53760 [ACK] Seq=1005 Ack=160959 Win=320640 Len=0 TSval=1803977033 TSecr=1470547918
  207 8.663787234 172.31.26.111 → 54.188.89.98 TCP 66 27017 → 53760 [ACK] Seq=1005 Ack=162407 Win=323456 Len=0 TSval=1803977046 TSecr=1470547931
  208 8.664182066 172.31.26.111 → 54.188.89.98 TCP 66 27017 → 53760 [ACK] Seq=1005 Ack=163855 Win=326400 Len=0 TSval=1803977047 TSecr=1470547932
  209 8.664256809 54.188.89.98 → 172.31.26.111 TCP 1514 53760 → 27017 [ACK] Seq=163855 Ack=1005 Win=28032 Len=1448 TSval=1470547947 TSecr=1803977031
  210 8.665892578 54.188.89.98 → 172.31.26.111 TCP 2962 53760 → 27017 [ACK] Seq=165303 Ack=1005 Win=28032 Len=2896 TSval=1470547948 TSecr=1803977033
  211 8.679361057 172.31.26.111 → 54.188.89.98 TCP 66 27017 → 53760 [ACK] Seq=1005 Ack=165303 Win=329344 Len=0 TSval=1803977062 TSecr=1470547947
  212 8.679430455 54.188.89.98 → 172.31.26.111 TCP 1514 53760 → 27017 [ACK] Seq=168199 Ack=1005 Win=28032 Len=1448 TSval=1470547962 TSecr=1803977046
  213 8.679472743 54.188.89.98 → 172.31.26.111 TCP 1514 53760 → 27017 [ACK] Seq=169647 Ack=1005 Win=28032 Len=1448 TSval=1470547962 TSecr=1803977046
  214 8.680984861 172.31.26.111 → 54.188.89.98 TCP 66 27017 → 53760 [ACK] Seq=1005 Ack=168199 Win=328576 Len=0 TSval=1803977064 TSecr=1470547948
  215 8.681068233 54.188.89.98 → 172.31.26.111 TCP 2962 53760 → 27017 [ACK] Seq=171095 Ack=1005 Win=28032 Len=2896 TSval=1470547962 TSecr=1803977047
  216 8.694513619 172.31.26.111 → 54.188.89.98 TCP 66 27017 → 53760 [ACK] Seq=1005 Ack=169647 Win=331008 Len=0 TSval=1803977077 TSecr=1470547962
  217 8.694520086 172.31.26.111 → 54.188.89.98 TCP 66 27017 → 53760 [ACK] Seq=1005 Ack=171095 Win=331008 Len=0 TSval=1803977077 TSecr=1470547962
  218 8.694903145 54.188.89.98 → 172.31.26.111 TCP 1514 53760 → 27017 [ACK] Seq=173991 Ack=1005 Win=28032 Len=1448 TSval=1470547977 TSecr=1803977062
  219 8.696138518 172.31.26.111 → 54.188.89.98 TCP 66 27017 → 53760 [ACK] Seq=1005 Ack=173991 Win=328576 Len=0 TSval=1803977079 TSecr=1470547962
  220 8.696474061 54.188.89.98 → 172.31.26.111 TCP 1514 53760 → 27017 [ACK] Seq=175439 Ack=1005 Win=28032 Len=1448 TSval=1470547979 TSecr=1803977064
  221 8.696497049 54.188.89.98 → 172.31.26.111 TCP 1514 53760 → 27017 [ACK] Seq=176887 Ack=1005 Win=28032 Len=1448 TSval=1470547979 TSecr=1803977064
  222 8.709999945 172.31.26.111 → 54.188.89.98 TCP 66 27017 → 53760 [ACK] Seq=1005 Ack=175439 Win=331008 Len=0 TSval=1803977093 TSecr=1470547977
  223 8.710082378 54.188.89.98 → 172.31.26.111 TCP 1514 53760 → 27017 [ACK] Seq=178335 Ack=1005 Win=28032 Len=1448 TSval=1470547993 TSecr=1803977077
  224 8.711564672 172.31.26.111 → 54.188.89.98 TCP 66 27017 → 53760 [ACK] Seq=1005 Ack=176887 Win=331008 Len=0 TSval=1803977094 TSecr=1470547979
  225 8.711572760 172.31.26.111 → 54.188.89.98 TCP 66 27017 → 53760 [ACK] Seq=1005 Ack=178335 Win=331008 Len=0 TSval=1803977094 TSecr=1470547979
  226 8.711710448 54.188.89.98 → 172.31.26.111 TCP 2962 53760 → 27017 [ACK] Seq=179783 Ack=1005 Win=28032 Len=2896 TSval=1470547994 TSecr=1803977079
  228 8.725183502 172.31.26.111 → 54.188.89.98 TCP 66 27017 → 53760 [ACK] Seq=1005 Ack=179783 Win=331008 Len=0 TSval=1803977108 TSecr=1470547993
  229 8.725585008 54.188.89.98 → 172.31.26.111 TCP 2962 53760 → 27017 [ACK] Seq=182679 Ack=1005 Win=28032 Len=2896 TSval=1470548008 TSecr=1803977093
  230 8.726798407 172.31.26.111 → 54.188.89.98 TCP 66 27017 → 53760 [ACK] Seq=1005 Ack=182679 Win=328576 Len=0 TSval=1803977109 TSecr=1470547994
  231 8.727255633 54.188.89.98 → 172.31.26.111 TCP 2962 53760 → 27017 [ACK] Seq=185575 Ack=1005 Win=28032 Len=2896 TSval=1470548010 TSecr=1803977094
  232 8.740657284 172.31.26.111 → 54.188.89.98 TCP 66 27017 → 53760 [ACK] Seq=1005 Ack=185575 Win=328576 Len=0 TSval=1803977123 TSecr=1470548008
  233 8.740747280 54.188.89.98 → 172.31.26.111 TCP 1514 53760 → 27017 [ACK] Seq=188471 Ack=1005 Win=28032 Len=1448 TSval=1470548023 TSecr=1803977108
  234 8.742345157 172.31.26.111 → 54.188.89.98 TCP 66 27017 → 53760 [ACK] Seq=1005 Ack=188471 Win=328576 Len=0 TSval=1803977125 TSecr=1470548010
  235 8.742401332 54.188.89.98 → 172.31.26.111 TCP 2962 53760 → 27017 [ACK] Seq=189919 Ack=1005 Win=28032 Len=2896 TSval=1470548025 TSecr=1803977109
  236 8.755839956 172.31.26.111 → 54.188.89.98 TCP 66 27017 → 53760 [ACK] Seq=1005 Ack=189919 Win=331008 Len=0 TSval=1803977138 TSecr=1470548023
  237 8.756236909 54.188.89.98 → 172.31.26.111 TCP 2962 53760 → 27017 [ACK] Seq=192815 Ack=1005 Win=28032 Len=2896 TSval=1470548039 TSecr=1803977123
  238 8.757489442 172.31.26.111 → 54.188.89.98 TCP 66 27017 → 53760 [ACK] Seq=1005 Ack=192815 Win=328576 Len=0 TSval=1803977140 TSecr=1470548025
  239 8.757921046 54.188.89.98 → 172.31.26.111 TCP 2962 53760 → 27017 [ACK] Seq=195711 Ack=1005 Win=28032 Len=2896 TSval=1470548040 TSecr=1803977125
  241 8.771331636 172.31.26.111 → 54.188.89.98 TCP 66 27017 → 53760 [ACK] Seq=1005 Ack=195711 Win=328576 Len=0 TSval=1803977154 TSecr=1470548039
  242 8.771387196 54.188.89.98 → 172.31.26.111 TCP 1514 53760 → 27017 [ACK] Seq=198607 Ack=1005 Win=28032 Len=1448 TSval=1470548054 TSecr=1803977138
  243 8.773012021 172.31.26.111 → 54.188.89.98 TCP 66 27017 → 53760 [ACK] Seq=1005 Ack=198607 Win=328576 Len=0 TSval=1803977156 TSecr=1470548040
  244 8.773056939 54.188.89.98 → 172.31.26.111 TCP 1514 53760 → 27017 [ACK] Seq=200055 Ack=1005 Win=28032 Len=1448 TSval=1470548055 TSecr=1803977140
  245 8.773102600 54.188.89.98 → 172.31.26.111 TCP 1514 53760 → 27017 [ACK] Seq=201503 Ack=1005 Win=28032 Len=1448 TSval=1470548055 TSecr=1803977140
  246 8.786477817 172.31.26.111 → 54.188.89.98 TCP 66 27017 → 53760 [ACK] Seq=1005 Ack=200055 Win=331008 Len=0 TSval=1803977169 TSecr=1470548054
  247 8.786971628 54.188.89.98 → 172.31.26.111 TCP 2962 53760 → 27017 [ACK] Seq=202951 Ack=1005 Win=28032 Len=2896 TSval=1470548069 TSecr=1803977154
  248 8.788187988 172.31.26.111 → 54.188.89.98 TCP 66 27017 → 53760 [ACK] Seq=1005 Ack=202951 Win=331008 Len=0 TSval=1803977171 TSecr=1470548055
  249 8.788619644 54.188.89.98 → 172.31.26.111 TCP 2962 53760 → 27017 [ACK] Seq=205847 Ack=1005 Win=28032 Len=2896 TSval=1470548071 TSecr=1803977156
  250 8.802080485 172.31.26.111 → 54.188.89.98 TCP 66 27017 → 53760 [ACK] Seq=1005 Ack=205847 Win=332160 Len=0 TSval=1803977185 TSecr=1470548069
  251 8.802136926 54.188.89.98 → 172.31.26.111 TCP 1514 53760 → 27017 [ACK] Seq=208743 Ack=1005 Win=28032 Len=1448 TSval=1470548084 TSecr=1803977169
  252 8.802181787 54.188.89.98 → 172.31.26.111 TCP 1514 53760 → 27017 [ACK] Seq=210191 Ack=1005 Win=28032 Len=1448 TSval=1470548084 TSecr=1803977169
  253 8.803726167 172.31.26.111 → 54.188.89.98 TCP 66 27017 → 53760 [ACK] Seq=1005 Ack=208743 Win=332160 Len=0 TSval=1803977186 TSecr=1470548071
  254 8.803813738 54.188.89.98 → 172.31.26.111 TCP 1514 53760 → 27017 [ACK] Seq=211639 Ack=1005 Win=28032 Len=1448 TSval=1470548086 TSecr=1803977171
  255 8.803836933 54.188.89.98 → 172.31.26.111 TCP 1514 53760 → 27017 [ACK] Seq=213087 Ack=1005 Win=28032 Len=1448 TSval=1470548086 TSecr=1803977171
  256 8.817275878 172.31.26.111 → 54.188.89.98 TCP 66 27017 → 53760 [ACK] Seq=1005 Ack=211639 Win=332160 Len=0 TSval=1803977200 TSecr=1470548084
  257 8.817681569 54.188.89.98 → 172.31.26.111 TCP 2962 53760 → 27017 [ACK] Seq=214535 Ack=1005 Win=28032 Len=2896 TSval=1470548100 TSecr=1803977185
  258 8.818926811 172.31.26.111 → 54.188.89.98 TCP 66 27017 → 53760 [ACK] Seq=1005 Ack=214535 Win=332160 Len=0 TSval=1803977202 TSecr=1470548086
  259 8.819212769 54.188.89.98 → 172.31.26.111 TCP 2962 53760 → 27017 [ACK] Seq=217431 Ack=1005 Win=28032 Len=2896 TSval=1470548102 TSecr=1803977186
  260 8.832781605 172.31.26.111 → 54.188.89.98 TCP 66 27017 → 53760 [ACK] Seq=1005 Ack=217431 Win=332160 Len=0 TSval=1803977215 TSecr=1470548100
  261 8.832900315 54.188.89.98 → 172.31.26.111 TCP 2962 53760 → 27017 [ACK] Seq=220327 Ack=1005 Win=28032 Len=2896 TSval=1470548115 TSecr=1803977200
  262 8.834291090 172.31.26.111 → 54.188.89.98 TCP 66 27017 → 53760 [ACK] Seq=1005 Ack=220327 Win=332160 Len=0 TSval=1803977217 TSecr=1470548102
  263 8.834463976 54.188.89.98 → 172.31.26.111 TCP 2962 53760 → 27017 [ACK] Seq=223223 Ack=1005 Win=28032 Len=2896 TSval=1470548117 TSecr=1803977202
  264 8.847981962 172.31.26.111 → 54.188.89.98 TCP 66 27017 → 53760 [ACK] Seq=1005 Ack=223223 Win=332160 Len=0 TSval=1803977231 TSecr=1470548115
  265 8.848351695 54.188.89.98 → 172.31.26.111 TCP 2962 53760 → 27017 [ACK] Seq=226119 Ack=1005 Win=28032 Len=2896 TSval=1470548131 TSecr=1803977215
  266 8.849542504 172.31.26.111 → 54.188.89.98 TCP 66 27017 → 53760 [ACK] Seq=1005 Ack=226119 Win=332160 Len=0 TSval=1803977232 TSecr=1470548117
  267 8.849948540 54.188.89.98 → 172.31.26.111 TCP 1514 53760 → 27017 [ACK] Seq=229015 Ack=1005 Win=28032 Len=1448 TSval=1470548132 TSecr=1803977217
  268 8.849963481 54.188.89.98 → 172.31.26.111 TCP 1514 53760 → 27017 [ACK] Seq=230463 Ack=1005 Win=28032 Len=1448 TSval=1470548132 TSecr=1803977217
  269 8.863450367 172.31.26.111 → 54.188.89.98 TCP 66 27017 → 53760 [ACK] Seq=1005 Ack=229015 Win=332160 Len=0 TSval=1803977246 TSecr=1470548131
  270 8.863583036 54.188.89.98 → 172.31.26.111 TCP 1514 53760 → 27017 [ACK] Seq=231911 Ack=1005 Win=28032 Len=1448 TSval=1470548146 TSecr=1803977231
  271 8.863595174 54.188.89.98 → 172.31.26.111 TCP 1514 53760 → 27017 [ACK] Seq=233359 Ack=1005 Win=28032 Len=1448 TSval=1470548146 TSecr=1803977231
  272 8.865033405 172.31.26.111 → 54.188.89.98 TCP 66 27017 → 53760 [ACK] Seq=1005 Ack=231911 Win=332160 Len=0 TSval=1803977248 TSecr=1470548132
  273 8.865231757 54.188.89.98 → 172.31.26.111 TCP 1514 53760 → 27017 [ACK] Seq=234807 Ack=1005 Win=28032 Len=1448 TSval=1470548148 TSecr=1803977232
  274 8.865243345 54.188.89.98 → 172.31.26.111 TCP 1514 53760 → 27017 [ACK] Seq=236255 Ack=1005 Win=28032 Len=1448 TSval=1470548148 TSecr=1803977232
  275 8.878669009 172.31.26.111 → 54.188.89.98 TCP 66 27017 → 53760 [ACK] Seq=1005 Ack=234807 Win=332160 Len=0 TSval=1803977261 TSecr=1470548146
  276 8.878953487 54.188.89.98 → 172.31.26.111 TCP 2962 53760 → 27017 [ACK] Seq=237703 Ack=1005 Win=28032 Len=2896 TSval=1470548161 TSecr=1803977246
  277 8.880345925 172.31.26.111 → 54.188.89.98 TCP 66 27017 → 53760 [ACK] Seq=1005 Ack=237703 Win=332160 Len=0 TSval=1803977263 TSecr=1470548148
  278 8.880584278 54.188.89.98 → 172.31.26.111 TCP 2962 53760 → 27017 [ACK] Seq=240599 Ack=1005 Win=28032 Len=2896 TSval=1470548163 TSecr=1803977248
  279 8.894064123 172.31.26.111 → 54.188.89.98 TCP 66 27017 → 53760 [ACK] Seq=1005 Ack=240599 Win=332160 Len=0 TSval=1803977277 TSecr=1470548161
  280 8.894272720 54.188.89.98 → 172.31.26.111 TCP 2962 53760 → 27017 [ACK] Seq=243495 Ack=1005 Win=28032 Len=2896 TSval=1470548177 TSecr=1803977261
  281 8.895684580 172.31.26.111 → 54.188.89.98 TCP 66 27017 → 53760 [ACK] Seq=1005 Ack=243495 Win=332160 Len=0 TSval=1803977278 TSecr=1470548163
  282 8.895919822 54.188.89.98 → 172.31.26.111 TCP 2962 53760 → 27017 [ACK] Seq=246391 Ack=1005 Win=28032 Len=2896 TSval=1470548178 TSecr=1803977263
  283 8.909395920 172.31.26.111 → 54.188.89.98 TCP 66 27017 → 53760 [ACK] Seq=1005 Ack=246391 Win=332160 Len=0 TSval=1803977292 TSecr=1470548177
  284 8.909644362 54.188.89.98 → 172.31.26.111 TCP 2962 53760 → 27017 [ACK] Seq=249287 Ack=1005 Win=28032 Len=2896 TSval=1470548192 TSecr=1803977277
  285 8.911038540 172.31.26.111 → 54.188.89.98 TCP 66 27017 → 53760 [ACK] Seq=1005 Ack=249287 Win=332160 Len=0 TSval=1803977294 TSecr=1470548178
  286 8.911239380 54.188.89.98 → 172.31.26.111 TCP 2962 53760 → 27017 [ACK] Seq=252183 Ack=1005 Win=28032 Len=2896 TSval=1470548192 TSecr=1803977277
  287 8.913719712 54.188.89.98 → 172.31.26.111 TCP 2962 53760 → 27017 [ACK] Seq=255079 Ack=1005 Win=28032 Len=2896 TSval=1470548194 TSecr=1803977278
  288 8.924736301 172.31.26.111 → 54.188.89.98 TCP 66 27017 → 53760 [ACK] Seq=1005 Ack=252183 Win=332160 Len=0 TSval=1803977307 TSecr=1470548192
  289 8.924908170 54.188.89.98 → 172.31.26.111 TCP 2962 53760 → 27017 [ACK] Seq=257975 Ack=1005 Win=28032 Len=2896 TSval=1470548207 TSecr=1803977292
  290 8.926338079 172.31.26.111 → 54.188.89.98 TCP 66 27017 → 53760 [ACK] Seq=1005 Ack=255079 Win=332160 Len=0 TSval=1803977309 TSecr=1470548192
  291 8.926545804 54.188.89.98 → 172.31.26.111 TCP 2962 53760 → 27017 [ACK] Seq=260871 Ack=1005 Win=28032 Len=2896 TSval=1470548209 TSecr=1803977294
  292 8.928815655 172.31.26.111 → 54.188.89.98 TCP 66 27017 → 53760 [ACK] Seq=1005 Ack=257975 Win=332160 Len=0 TSval=1803977311 TSecr=1470548194
  293 8.940000081 172.31.26.111 → 54.188.89.98 TCP 66 27017 → 53760 [ACK] Seq=1005 Ack=260871 Win=332160 Len=0 TSval=1803977323 TSecr=1470548207
  294 8.940307190 54.188.89.98 → 172.31.26.111 TCP 1514 53760 → 27017 [ACK] Seq=263767 Ack=1005 Win=28032 Len=1448 TSval=1470548223 TSecr=1803977307
  295 8.940345206 54.188.89.98 → 172.31.26.111 TCP 1027 53760 → 27017 [PSH, ACK] Seq=265215 Ack=1005 Win=28032 Len=961 TSval=1470548223 TSecr=1803977307
  296 8.941645109 172.31.26.111 → 54.188.89.98 TCP 66 27017 → 53760 [ACK] Seq=1005 Ack=263767 Win=332160 Len=0 TSval=1803977324 TSecr=1470548209
  297 8.955422747 172.31.26.111 → 54.188.89.98 TCP 66 27017 → 53760 [ACK] Seq=1005 Ack=266176 Win=332160 Len=0 TSval=1803977338 TSecr=1470548223
  298 8.955846961 172.31.26.111 → 54.188.89.98 TCP 111 27017 → 53760 [PSH, ACK] Seq=1005 Ack=266176 Win=332160 Len=45 TSval=1803977339 TSecr=1470548223 [TCP segment of a reassembled PDU]
  299 8.972554616 54.188.89.98 → 172.31.26.111 TCP 2962 [TCP segment of a reassembled PDU]
  300 8.987663195 172.31.26.111 → 54.188.89.98 TCP 66 27017 → 53760 [ACK] Seq=1050 Ack=269072 Win=329344 Len=0 TSval=1803977370 TSecr=1470548255
