    1 0.000000000 71.15.203.199 → 172.31.31.226 TCP 66 39274 → 22 [ACK] Seq=1 Ack=1 Win=782 Len=0 TSval=3334091161 TSecr=4238954250
    2 0.476239590 172.31.31.226 → 71.15.203.199 SSH 110 Server: Encrypted packet (len=44)
    3 0.516430566 71.15.203.199 → 172.31.31.226 TCP 66 39274 → 22 [ACK] Seq=1 Ack=45 Win=782 Len=0 TSval=3334091669 TSecr=4238954759
    4 0.988102567 172.31.31.226 → 71.15.203.199 SSH 110 Server: Encrypted packet (len=44)
    5 1.019452479 71.15.203.199 → 172.31.31.226 TCP 66 39274 → 22 [ACK] Seq=1 Ack=89 Win=782 Len=0 TSval=3334092181 TSecr=4238955271
    6 1.500113923 172.31.31.226 → 71.15.203.199 SSH 110 Server: Encrypted packet (len=44)
    7 1.541247459 71.15.203.199 → 172.31.31.226 TCP 66 39274 → 22 [ACK] Seq=1 Ack=133 Win=782 Len=0 TSval=3334092693 TSecr=4238955783
    8 2.012214341 172.31.31.226 → 71.15.203.199 SSH 110 Server: Encrypted packet (len=44)
    9 2.057034852 71.15.203.199 → 172.31.31.226 TCP 66 39274 → 22 [ACK] Seq=1 Ack=177 Win=782 Len=0 TSval=3334093217 TSecr=4238956295
   10 2.524204148 172.31.31.226 → 71.15.203.199 SSH 110 Server: Encrypted packet (len=44)
   11 2.556269453 71.15.203.199 → 172.31.31.226 TCP 66 39274 → 22 [ACK] Seq=1 Ack=221 Win=782 Len=0 TSval=3334093717 TSecr=4238956807
   12 2.604059446 71.15.203.199 → 172.31.31.226 SSH 102 Client: Encrypted packet (len=36)
   13 2.604224414 172.31.31.226 → 71.15.203.199 SSH 102 Server: Encrypted packet (len=36)
   14 2.637751453 71.15.203.199 → 172.31.31.226 TCP 66 38964 → 22 [ACK] Seq=37 Ack=37 Win=1444 Len=0 TSval=3334093798 TSecr=4238956887
   15 3.011538304 71.15.203.199 → 172.31.31.226 SSH 102 Client: Encrypted packet (len=36)
   16 3.012394504 172.31.31.226 → 71.15.203.199 SSH 102 Server: Encrypted packet (len=36)
   17 3.014155465 172.31.31.226 → 52.32.244.218 TCP 74 37514 → 9092 [SYN] Seq=0 Win=26883 Len=0 MSS=8961 SACK_PERM=1 TSval=2247849150 TSecr=0 WS=1
   18 3.015025912 52.32.244.218 → 172.31.31.226 TCP 74 9092 → 37514 [SYN, ACK] Seq=0 Ack=1 Win=26847 Len=0 MSS=1460 SACK_PERM=1 TSval=1900226831 TSecr=2247849150 WS=2
   19 3.015042350 172.31.31.226 → 52.32.244.218 TCP 66 37514 → 9092 [ACK] Seq=1 Ack=1 Win=26883 Len=0 TSval=2247849151 TSecr=1900226831
   20 3.019004546 172.31.31.226 → 52.32.244.218 TCP 96 37514 → 9092 [PSH, ACK] Seq=1 Ack=1 Win=26883 Len=30 TSval=2247849155 TSecr=1900226831
   21 3.019848689 52.32.244.218 → 172.31.31.226 TCP 66 9092 → 37514 [ACK] Seq=1 Ack=31 Win=26848 Len=0 TSval=1900226836 TSecr=2247849155
   22 3.020450571 52.32.244.218 → 172.31.31.226 SMPP 348 SMPP Bind_transmitter
   23 3.020459778 172.31.31.226 → 52.32.244.218 TCP 66 37514 → 9092 [ACK] Seq=31 Ack=283 Win=26601 Len=0 TSval=2247849156 TSecr=1900226836
   24 3.021252879 172.31.31.226 → 52.32.244.218 TCP 109 37514 → 9092 [PSH, ACK] Seq=31 Ack=283 Win=26601 Len=43 TSval=2247849157 TSecr=1900226836
   25 3.022958761 52.32.244.218 → 172.31.31.226 TCP 188 9092 → 37514 [PSH, ACK] Seq=283 Ack=74 Win=26848 Len=122 TSval=1900226839 TSecr=2247849157
   26 3.037743811 172.31.31.226 → 71.15.203.199 SSH 110 Server: Encrypted packet (len=44)
   27 3.046776734 71.15.203.199 → 172.31.31.226 TCP 66 38964 → 22 [ACK] Seq=73 Ack=73 Win=1444 Len=0 TSval=3334094207 TSecr=4238957295
   28 3.052292304 172.31.31.226 → 71.15.203.199 SSH 102 Server: Encrypted packet (len=36)
   29 3.065527057 172.31.31.226 → 52.32.244.218 TCP 66 37514 → 9092 [ACK] Seq=74 Ack=405 Win=26479 Len=0 TSval=2247849201 TSecr=1900226839
   30 3.069071728 71.15.203.199 → 172.31.31.226 TCP 66 39274 → 22 [ACK] Seq=1 Ack=265 Win=782 Len=0 TSval=3334094230 TSecr=4238957320
   31 3.085186907 71.15.203.199 → 172.31.31.226 TCP 66 38964 → 22 [ACK] Seq=73 Ack=109 Win=1444 Len=0 TSval=3334094246 TSecr=4238957335
   32 3.515550784 71.15.203.199 → 172.31.31.226 SSH 102 Client: Encrypted packet (len=36)
   33 3.515668837 172.31.31.226 → 71.15.203.199 SSH 102 Server: Encrypted packet (len=36)
   34 3.548346166 172.31.31.226 → 71.15.203.199 SSH 110 Server: Encrypted packet (len=44)
   35 3.549363423 71.15.203.199 → 172.31.31.226 TCP 66 38964 → 22 [ACK] Seq=109 Ack=145 Win=1444 Len=0 TSval=3334094709 TSecr=4238957798
   36 3.587464514 71.15.203.199 → 172.31.31.226 TCP 66 39274 → 22 [ACK] Seq=1 Ack=309 Win=782 Len=0 TSval=3334094741 TSecr=4238957831
   37 3.763573419 71.15.203.199 → 172.31.31.226 SSH 102 Client: Encrypted packet (len=36)
   38 3.763755185 172.31.31.226 → 71.15.203.199 SSH 102 Server: Encrypted packet (len=36)
   39 3.797164928 71.15.203.199 → 172.31.31.226 TCP 66 38964 → 22 [ACK] Seq=145 Ack=181 Win=1444 Len=0 TSval=3334094958 TSecr=4238958046
   40 4.060167131 172.31.31.226 → 71.15.203.199 SSH 110 Server: Encrypted packet (len=44)
   41 4.064469252 172.31.31.226 → 52.32.244.218 SMPP 197 SMPP Replace_sm
   42 4.067037240 71.15.203.199 → 172.31.31.226 SSH 102 Client: Encrypted packet (len=36)
   43 4.067342790 172.31.31.226 → 71.15.203.199 SSH 110 Server: Encrypted packet (len=44)
   44 4.079530446 52.32.244.218 → 172.31.31.226 SMPP 124 SMPP Submit_sm[Malformed Packet]
   45 4.079543443 172.31.31.226 → 52.32.244.218 TCP 66 37514 → 9092 [ACK] Seq=205 Ack=463 Win=26421 Len=0 TSval=2247850215 TSecr=1900227895
   46 4.092108218 71.15.203.199 → 172.31.31.226 TCP 66 39274 → 22 [ACK] Seq=1 Ack=353 Win=782 Len=0 TSval=3334095253 TSecr=4238958343
   47 4.100019680 71.15.203.199 → 172.31.31.226 TCP 66 38964 → 22 [ACK] Seq=181 Ack=225 Win=1444 Len=0 TSval=3334095261 TSecr=4238958350
   48 4.517926292 71.15.203.199 → 172.31.31.226 SSH 102 Client: Encrypted packet (len=36)
   49 4.518067988 172.31.31.226 → 71.15.203.199 SSH 102 Server: Encrypted packet (len=36)
   50 4.551292344 71.15.203.199 → 172.31.31.226 TCP 66 38964 → 22 [ACK] Seq=217 Ack=261 Win=1444 Len=0 TSval=3334095712 TSecr=4238958801
   51 4.572200736 172.31.31.226 → 71.15.203.199 SSH 110 Server: Encrypted packet (len=44)
   52 4.604288281 71.15.203.199 → 172.31.31.226 TCP 66 39274 → 22 [ACK] Seq=1 Ack=397 Win=782 Len=0 TSval=3334095765 TSecr=4238958855
   53 4.748626764 71.15.203.199 → 172.31.31.226 SSH 102 Client: Encrypted packet (len=36)
   54 4.748750405 172.31.31.226 → 71.15.203.199 SSH 102 Server: Encrypted packet (len=36)
   55 4.783587296 71.15.203.199 → 172.31.31.226 TCP 66 38964 → 22 [ACK] Seq=253 Ack=297 Win=1444 Len=0 TSval=3334095942 TSecr=4238959031
   56 4.987007111 71.15.203.199 → 172.31.31.226 SSH 102 Client: Encrypted packet (len=36)
   57 4.987130614 172.31.31.226 → 71.15.203.199 SSH 102 Server: Encrypted packet (len=36)
   58 5.020076660 71.15.203.199 → 172.31.31.226 TCP 66 38964 → 22 [ACK] Seq=289 Ack=333 Win=1444 Len=0 TSval=3334096181 TSecr=4238959270
   59 5.070229004 172.31.31.226 → 52.32.244.218 TCP 198 37514 → 9092 [PSH, ACK] Seq=205 Ack=463 Win=26421 Len=132 TSval=2247851206 TSecr=1900227895
   60 5.073788434 52.32.244.218 → 172.31.31.226 TCP 124 9092 → 37514 [PSH, ACK] Seq=463 Ack=337 Win=28992 Len=58 TSval=1900228890 TSecr=2247851206
   61 5.073803577 172.31.31.226 → 52.32.244.218 TCP 66 37514 → 9092 [ACK] Seq=337 Ack=521 Win=26363 Len=0 TSval=2247851209 TSecr=1900228890
   62 5.084199679 172.31.31.226 → 71.15.203.199 SSH 110 Server: Encrypted packet (len=44)
   63 5.118026389 71.15.203.199 → 172.31.31.226 TCP 66 39274 → 22 [ACK] Seq=1 Ack=441 Win=782 Len=0 TSval=3334096277 TSecr=4238959367
   64 5.376189970 71.15.203.199 → 172.31.31.226 SSH 102 Client: Encrypted packet (len=36)
   65 5.376650146 172.31.31.226 → 71.15.203.199 SSH 110 Server: Encrypted packet (len=44)
   66 5.410029684 71.15.203.199 → 172.31.31.226 TCP 66 38964 → 22 [ACK] Seq=325 Ack=377 Win=1444 Len=0 TSval=3334096570 TSecr=4238959659
   67 5.596295034 172.31.31.226 → 71.15.203.199 SSH 110 Server: Encrypted packet (len=44)
   68 5.629420898 71.15.203.199 → 172.31.31.226 TCP 66 39274 → 22 [ACK] Seq=1 Ack=485 Win=782 Len=0 TSval=3334096789 TSecr=4238959879
   69 5.763583098 71.15.203.199 → 172.31.31.226 SSH 102 Client: Encrypted packet (len=36)
   70 5.763701239 172.31.31.226 → 71.15.203.199 SSH 102 Server: Encrypted packet (len=36)
   71 5.797073236 71.15.203.199 → 172.31.31.226 TCP 66 38964 → 22 [ACK] Seq=361 Ack=413 Win=1444 Len=0 TSval=3334096957 TSecr=4238960046
   72 5.971554730 71.15.203.199 → 172.31.31.226 SSH 102 Client: Encrypted packet (len=36)
   73 5.971671111 172.31.31.226 → 71.15.203.199 SSH 102 Server: Encrypted packet (len=36)
   74 6.005222663 71.15.203.199 → 172.31.31.226 TCP 66 38964 → 22 [ACK] Seq=397 Ack=449 Win=1444 Len=0 TSval=3334097165 TSecr=4238960254
   75 6.108239222 172.31.31.226 → 71.15.203.199 SSH 110 Server: Encrypted packet (len=44)
   76 6.141067413 71.15.203.199 → 172.31.31.226 TCP 66 39274 → 22 [ACK] Seq=1 Ack=529 Win=782 Len=0 TSval=3334097301 TSecr=4238960391
   77 6.187675185 71.15.203.199 → 172.31.31.226 SSH 102 Client: Encrypted packet (len=36)
   78 6.187793396 172.31.31.226 → 71.15.203.199 SSH 102 Server: Encrypted packet (len=36)
   79 6.220887282 71.15.203.199 → 172.31.31.226 TCP 66 38964 → 22 [ACK] Seq=433 Ack=485 Win=1444 Len=0 TSval=3334097382 TSecr=4238960470
   80 6.378606578 172.31.31.226 → 52.32.244.218 SMPP 199 SMPP Replace_sm
   81 6.382277732 52.32.244.218 → 172.31.31.226 SMPP 124 SMPP Unbind
   82 6.382298703 172.31.31.226 → 52.32.244.218 TCP 66 37514 → 9092 [ACK] Seq=470 Ack=579 Win=26305 Len=0 TSval=2247852518 TSecr=1900230198
   83 6.388112563 71.15.203.199 → 172.31.31.226 SSH 102 Client: Encrypted packet (len=36)
   84 6.388222239 172.31.31.226 → 71.15.203.199 SSH 102 Server: Encrypted packet (len=36)
   85 6.426431289 71.15.203.199 → 172.31.31.226 TCP 66 38964 → 22 [ACK] Seq=469 Ack=521 Win=1444 Len=0 TSval=3334097582 TSecr=4238960671
   86 6.620197551 172.31.31.226 → 71.15.203.199 SSH 110 Server: Encrypted packet (len=44)
   87 6.652835821 71.15.203.199 → 172.31.31.226 TCP 66 39274 → 22 [ACK] Seq=1 Ack=573 Win=782 Len=0 TSval=3334097813 TSecr=4238960903
   88 6.747318537 71.15.203.199 → 172.31.31.226 SSH 102 Client: Encrypted packet (len=36)
   89 6.748053420 172.31.31.226 → 71.15.203.199 SSH 110 Server: Encrypted packet (len=44)
   90 6.780921364 71.15.203.199 → 172.31.31.226 TCP 66 38964 → 22 [ACK] Seq=505 Ack=565 Win=1444 Len=0 TSval=3334097942 TSecr=4238961031
   91 7.078021177 71.15.203.199 → 172.31.31.226 SSH 102 Client: Encrypted packet (len=36)
   92 7.078146806 172.31.31.226 → 71.15.203.199 SSH 102 Server: Encrypted packet (len=36)
   93 7.113472685 71.15.203.199 → 172.31.31.226 TCP 66 38964 → 22 [ACK] Seq=541 Ack=601 Win=1444 Len=0 TSval=3334098272 TSecr=4238961361
   94 7.132220668 172.31.31.226 → 71.15.203.199 SSH 110 Server: Encrypted packet (len=44)
   95 7.164273831 71.15.203.199 → 172.31.31.226 TCP 66 39274 → 22 [ACK] Seq=1 Ack=617 Win=782 Len=0 TSval=3334098325 TSecr=4238961415
   96 7.283299657 71.15.203.199 → 172.31.31.226 SSH 102 Client: Encrypted packet (len=36)
   97 7.283419278 172.31.31.226 → 71.15.203.199 SSH 102 Server: Encrypted packet (len=36)
   98 7.317029799 71.15.203.199 → 172.31.31.226 TCP 66 38964 → 22 [ACK] Seq=577 Ack=637 Win=1444 Len=0 TSval=3334098477 TSecr=4238961566
   99 7.499030601 71.15.203.199 → 172.31.31.226 SSH 102 Client: Encrypted packet (len=36)
  100 7.499163092 172.31.31.226 → 71.15.203.199 SSH 102 Server: Encrypted packet (len=36)
  101 7.532044165 71.15.203.199 → 172.31.31.226 TCP 66 38964 → 22 [ACK] Seq=613 Ack=673 Win=1444 Len=0 TSval=3334098693 TSecr=4238961782
  102 7.644210091 172.31.31.226 → 71.15.203.199 SSH 110 Server: Encrypted packet (len=44)
  103 7.676786420 71.15.203.199 → 172.31.31.226 TCP 66 39274 → 22 [ACK] Seq=1 Ack=661 Win=782 Len=0 TSval=3334098837 TSecr=4238961927
  104 7.707317989 71.15.203.199 → 172.31.31.226 SSH 102 Client: Encrypted packet (len=36)
  105 7.707444017 172.31.31.226 → 71.15.203.199 SSH 102 Server: Encrypted packet (len=36)
  106 7.740928213 71.15.203.199 → 172.31.31.226 TCP 66 38964 → 22 [ACK] Seq=649 Ack=709 Win=1444 Len=0 TSval=3334098901 TSecr=4238961990
  107 7.749652936 172.31.31.226 → 52.32.244.218 TCP 200 37514 → 9092 [PSH, ACK] Seq=470 Ack=579 Win=26305 Len=134 TSval=2247853885 TSecr=1900230198
  108 7.752797814 52.32.244.218 → 172.31.31.226 TCP 124 9092 → 37514 [PSH, ACK] Seq=579 Ack=604 Win=31136 Len=58 TSval=1900231568 TSecr=2247853885
  109 7.752811619 172.31.31.226 → 52.32.244.218 TCP 66 37514 → 9092 [ACK] Seq=604 Ack=637 Win=26247 Len=0 TSval=2247853888 TSecr=1900231568
  110 7.915531013 71.15.203.199 → 172.31.31.226 SSH 102 Client: Encrypted packet (len=36)
  111 7.915644542 172.31.31.226 → 71.15.203.199 SSH 102 Server: Encrypted packet (len=36)
  112 7.949302154 71.15.203.199 → 172.31.31.226 TCP 66 38964 → 22 [ACK] Seq=685 Ack=745 Win=1444 Len=0 TSval=3334099109 TSecr=4238962198
  113 8.156337072 172.31.31.226 → 71.15.203.199 SSH 110 Server: Encrypted packet (len=44)
  114 8.163785698 71.15.203.199 → 172.31.31.226 SSH 102 Client: Encrypted packet (len=36)
  115 8.164204217 172.31.31.226 → 71.15.203.199 SSH 110 Server: Encrypted packet (len=44)
  116 8.189110056 71.15.203.199 → 172.31.31.226 TCP 66 39274 → 22 [ACK] Seq=1 Ack=705 Win=782 Len=0 TSval=3334099349 TSecr=4238962439
  117 8.197092823 71.15.203.199 → 172.31.31.226 TCP 66 38964 → 22 [ACK] Seq=721 Ack=789 Win=1444 Len=0 TSval=3334099358 TSecr=4238962447
  118 8.411054217 71.15.203.199 → 172.31.31.226 SSH 102 Client: Encrypted packet (len=36)
  119 8.411176351 172.31.31.226 → 71.15.203.199 SSH 102 Server: Encrypted packet (len=36)
  120 8.445251862 71.15.203.199 → 172.31.31.226 TCP 66 38964 → 22 [ACK] Seq=757 Ack=825 Win=1444 Len=0 TSval=3334099605 TSecr=4238962694
  121 8.611347418 71.15.203.199 → 172.31.31.226 SSH 102 Client: Encrypted packet (len=36)
  122 8.611480237 172.31.31.226 → 71.15.203.199 SSH 102 Server: Encrypted packet (len=36)
  123 8.645038043 71.15.203.199 → 172.31.31.226 TCP 66 38964 → 22 [ACK] Seq=793 Ack=861 Win=1444 Len=0 TSval=3334099805 TSecr=4238962894
  124 8.668209601 172.31.31.226 → 71.15.203.199 SSH 110 Server: Encrypted packet (len=44)
  125 8.700831768 71.15.203.199 → 172.31.31.226 TCP 66 39274 → 22 [ACK] Seq=1 Ack=749 Win=782 Len=0 TSval=3334099861 TSecr=4238962951
  126 8.811028999 71.15.203.199 → 172.31.31.226 SSH 102 Client: Encrypted packet (len=36)
  127 8.811156314 172.31.31.226 → 71.15.203.199 SSH 102 Server: Encrypted packet (len=36)
  128 8.844051495 71.15.203.199 → 172.31.31.226 TCP 66 38964 → 22 [ACK] Seq=829 Ack=897 Win=1444 Len=0 TSval=3334100005 TSecr=4238963094
  129 9.003430498 71.15.203.199 → 172.31.31.226 SSH 102 Client: Encrypted packet (len=36)
  130 9.003554542 172.31.31.226 → 71.15.203.199 SSH 102 Server: Encrypted packet (len=36)
  131 9.036300568 71.15.203.199 → 172.31.31.226 TCP 66 38964 → 22 [ACK] Seq=865 Ack=933 Win=1444 Len=0 TSval=3334100197 TSecr=4238963286
  132 9.165638665 172.31.31.226 → 52.32.244.218 SMPP 201 SMPP Replace_sm
  133 9.169883283 52.32.244.218 → 172.31.31.226 SMPP 124 SMPP Cancel_sm
  134 9.169901421 172.31.31.226 → 52.32.244.218 TCP 66 37514 → 9092 [ACK] Seq=739 Ack=695 Win=26189 Len=0 TSval=2247855306 TSecr=1900232985
  135 9.180216221 172.31.31.226 → 71.15.203.199 SSH 110 Server: Encrypted packet (len=44)
  136 9.194460130 71.15.203.199 → 172.31.31.226 SSH 102 Client: Encrypted packet (len=36)
  137 9.194551045 172.31.31.226 → 71.15.203.199 SSH 102 Server: Encrypted packet (len=36)
  138 9.215464572 71.15.203.199 → 172.31.31.226 TCP 66 39274 → 22 [ACK] Seq=1 Ack=793 Win=782 Len=0 TSval=3334100373 TSecr=4238963463
  139 9.228323798 71.15.203.199 → 172.31.31.226 TCP 66 38964 → 22 [ACK] Seq=901 Ack=969 Win=1444 Len=0 TSval=3334100388 TSecr=4238963477
  140 9.380061698 71.15.203.199 → 172.31.31.226 SSH 102 Client: Encrypted packet (len=36)
  141 9.380188982 172.31.31.226 → 71.15.203.199 SSH 102 Server: Encrypted packet (len=36)
  142 9.414058818 71.15.203.199 → 172.31.31.226 TCP 66 38964 → 22 [ACK] Seq=937 Ack=1005 Win=1444 Len=0 TSval=3334100574 TSecr=4238963663
  143 9.635257325 71.15.203.199 → 172.31.31.226 SSH 102 Client: Encrypted packet (len=36)
  144 9.635699028 172.31.31.226 → 71.15.203.199 SSH 110 Server: Encrypted packet (len=44)
  145 9.668991832 71.15.203.199 → 172.31.31.226 TCP 66 38964 → 22 [ACK] Seq=973 Ack=1049 Win=1444 Len=0 TSval=3334100829 TSecr=4238963918
  146 9.692302195 172.31.31.226 → 71.15.203.199 SSH 110 Server: Encrypted packet (len=44)
  147 9.724864236 71.15.203.199 → 172.31.31.226 TCP 66 39274 → 22 [ACK] Seq=1 Ack=837 Win=782 Len=0 TSval=3334100885 TSecr=4238963975
  148 10.204176730 172.31.31.226 → 71.15.203.199 SSH 110 Server: Encrypted packet (len=44)
  149 10.237150923 71.15.203.199 → 172.31.31.226 TCP 66 39274 → 22 [ACK] Seq=1 Ack=881 Win=782 Len=0 TSval=3334101397 TSecr=4238964487
  150 10.638751778 172.31.31.226 → 52.32.244.218 TCP 202 37514 → 9092 [PSH, ACK] Seq=739 Ack=695 Win=26189 Len=136 TSval=2247856774 TSecr=1900232985
  151 10.641939320 52.32.244.218 → 172.31.31.226 TCP 124 9092 → 37514 [PSH, ACK] Seq=695 Ack=875 Win=33280 Len=58 TSval=1900234457 TSecr=2247856774
  152 10.641956617 172.31.31.226 → 52.32.244.218 TCP 66 37514 → 9092 [ACK] Seq=875 Ack=753 Win=26131 Len=0 TSval=2247856778 TSecr=1900234457
  153 10.717876645 172.31.31.226 → 71.15.203.199 SSH 110 Server: Encrypted packet (len=44)
  154 10.749189438 71.15.203.199 → 172.31.31.226 TCP 66 39274 → 22 [ACK] Seq=1 Ack=925 Win=782 Len=0 TSval=3334101911 TSecr=4238965001
  155 11.228208233 172.31.31.226 → 71.15.203.199 SSH 110 Server: Encrypted packet (len=44)
