    8 1.234116502 54.188.89.98 → 172.31.26.111 SSL 161 Continuation Data
    9 1.249363024 172.31.26.111 → 54.188.89.98 TCP 290 [TCP segment of a reassembled PDU]
   10 1.265378691 54.188.89.98 → 172.31.26.111 TCP 66 53740 → 27017 [ACK] Seq=96 Ack=225 Win=252 Len=0 TSval=1470020405 TSecr=1803449461
   13 1.954112826 54.188.89.98 → 172.31.26.111 TCP 74 53742 → 27017 [SYN] Seq=0 Win=26883 Len=0 MSS=1460 SACK_PERM=1 TSval=1470021094 TSecr=0 WS=128
   14 1.969231973 172.31.26.111 → 54.188.89.98 TCP 74 27017 → 53742 [SYN, ACK] Seq=0 Ack=1 Win=26847 Len=0 MSS=8961 SACK_PERM=1 TSval=1803450181 TSecr=1470021094 WS=128
   15 1.984855116 54.188.89.98 → 172.31.26.111 TCP 66 53742 → 27017 [ACK] Seq=1 Ack=1 Win=27008 Len=0 TSval=1470021125 TSecr=1803450181
   16 1.985029118 54.188.89.98 → 172.31.26.111 SSL 336 Continuation Data
   17 2.000125264 172.31.26.111 → 54.188.89.98 TCP 66 27017 → 53742 [ACK] Seq=1 Ack=271 Win=28032 Len=0 TSval=1803450212 TSecr=1470021125
   18 2.000741242 172.31.26.111 → 54.188.89.98 TCP 305 [TCP segment of a reassembled PDU]
   19 2.016385818 54.188.89.98 → 172.31.26.111 TCP 66 53742 → 27017 [ACK] Seq=271 Ack=240 Win=28032 Len=0 TSval=1470021156 TSecr=1803450212
   20 2.016559502 54.188.89.98 → 172.31.26.111 TCP 307 [TCP segment of a reassembled PDU]
   21 2.031940679 172.31.26.111 → 54.188.89.98 TCP 111 27017 → 53742 [PSH, ACK] Seq=240 Ack=512 Win=29056 Len=45 TSval=1803450244 TSecr=1470021157 [TCP segment of a reassembled PDU]
   23 2.048176092 54.188.89.98 → 172.31.26.111 TCP 307 53742 → 27017 [PSH, ACK] Seq=512 Ack=285 Win=28032 Len=241 TSval=1470021188 TSecr=1803450244 [TCP segment of a reassembled PDU]
   24 2.063486370 172.31.26.111 → 54.188.89.98 TCP 111 27017 → 53742 [PSH, ACK] Seq=285 Ack=753 Win=30080 Len=45 TSval=1803450275 TSecr=1470021188 [TCP segment of a reassembled PDU]
   25 2.079484041 54.188.89.98 → 172.31.26.111 TCP 307 53742 → 27017 [PSH, ACK] Seq=753 Ack=330 Win=28032 Len=241 TSval=1470021220 TSecr=1803450275 [TCP segment of a reassembled PDU]
   27 2.094794547 172.31.26.111 → 54.188.89.98 TCP 111 27017 → 53742 [PSH, ACK] Seq=330 Ack=994 Win=31232 Len=45 TSval=1803450306 TSecr=1470021220 [TCP segment of a reassembled PDU]
   28 2.111069768 54.188.89.98 → 172.31.26.111 TCP 307 53742 → 27017 [PSH, ACK] Seq=994 Ack=375 Win=28032 Len=241 TSval=1470021251 TSecr=1803450306 [TCP segment of a reassembled PDU]
   29 2.126385089 172.31.26.111 → 54.188.89.98 TCP 111 27017 → 53742 [PSH, ACK] Seq=375 Ack=1235 Win=32256 Len=45 TSval=1803450338 TSecr=1470021251 [TCP segment of a reassembled PDU]
   30 2.142613439 54.188.89.98 → 172.31.26.111 TCP 307 53742 → 27017 [PSH, ACK] Seq=1235 Ack=420 Win=28032 Len=241 TSval=1470021283 TSecr=1803450338 [TCP segment of a reassembled PDU]
   31 2.157997306 172.31.26.111 → 54.188.89.98 TCP 111 27017 → 53742 [PSH, ACK] Seq=420 Ack=1476 Win=33280 Len=45 TSval=1803450370 TSecr=1470021283 [TCP segment of a reassembled PDU]
   32 2.174343580 54.188.89.98 → 172.31.26.111 TCP 307 53742 → 27017 [PSH, ACK] Seq=1476 Ack=465 Win=28032 Len=241 TSval=1470021314 TSecr=1803450370 [TCP segment of a reassembled PDU]
   33 2.189632283 172.31.26.111 → 54.188.89.98 TCP 111 27017 → 53742 [PSH, ACK] Seq=465 Ack=1717 Win=34432 Len=45 TSval=1803450401 TSecr=1470021314 [TCP segment of a reassembled PDU]
   34 2.205986389 54.188.89.98 → 172.31.26.111 TCP 307 53742 → 27017 [PSH, ACK] Seq=1717 Ack=510 Win=28032 Len=241 TSval=1470021346 TSecr=1803450401 [TCP segment of a reassembled PDU]
   35 2.221345539 172.31.26.111 → 54.188.89.98 TCP 111 27017 → 53742 [PSH, ACK] Seq=510 Ack=1958 Win=35456 Len=45 TSval=1803450433 TSecr=1470021346 [TCP segment of a reassembled PDU]
   36 2.237542338 54.188.89.98 → 172.31.26.111 TCP 307 53742 → 27017 [PSH, ACK] Seq=1958 Ack=555 Win=28032 Len=241 TSval=1470021378 TSecr=1803450433 [TCP segment of a reassembled PDU]
   37 2.252832348 172.31.26.111 → 54.188.89.98 TCP 111 27017 → 53742 [PSH, ACK] Seq=555 Ack=2199 Win=36608 Len=45 TSval=1803450465 TSecr=1470021378 [TCP segment of a reassembled PDU]
   38 2.269016045 54.188.89.98 → 172.31.26.111 TCP 307 53742 → 27017 [PSH, ACK] Seq=2199 Ack=600 Win=28032 Len=241 TSval=1470021409 TSecr=1803450465 [TCP segment of a reassembled PDU]
   39 2.284316097 172.31.26.111 → 54.188.89.98 TCP 111 27017 → 53742 [PSH, ACK] Seq=600 Ack=2440 Win=37632 Len=45 TSval=1803450496 TSecr=1470021409 [TCP segment of a reassembled PDU]
   40 2.300541128 54.188.89.98 → 172.31.26.111 TCP 307 53742 → 27017 [PSH, ACK] Seq=2440 Ack=645 Win=28032 Len=241 TSval=1470021441 TSecr=1803450496 [TCP segment of a reassembled PDU]
   41 2.315847507 172.31.26.111 → 54.188.89.98 TCP 111 27017 → 53742 [PSH, ACK] Seq=645 Ack=2681 Win=38656 Len=45 TSval=1803450528 TSecr=1470021441 [TCP segment of a reassembled PDU]
   42 2.332062715 54.188.89.98 → 172.31.26.111 TCP 307 53742 → 27017 [PSH, ACK] Seq=2681 Ack=690 Win=28032 Len=241 TSval=1470021472 TSecr=1803450528 [TCP segment of a reassembled PDU]
   43 2.347400711 172.31.26.111 → 54.188.89.98 TCP 111 27017 → 53742 [PSH, ACK] Seq=690 Ack=2922 Win=39808 Len=45 TSval=1803450559 TSecr=1470021472 [TCP segment of a reassembled PDU]
   44 2.363728596 54.188.89.98 → 172.31.26.111 TCP 307 53742 → 27017 [PSH, ACK] Seq=2922 Ack=735 Win=28032 Len=241 TSval=1470021504 TSecr=1803450559 [TCP segment of a reassembled PDU]
   45 2.379111212 172.31.26.111 → 54.188.89.98 TCP 111 27017 → 53742 [PSH, ACK] Seq=735 Ack=3163 Win=40832 Len=45 TSval=1803450591 TSecr=1470021504 [TCP segment of a reassembled PDU]
   46 2.395405096 54.188.89.98 → 172.31.26.111 TCP 307 53742 → 27017 [PSH, ACK] Seq=3163 Ack=780 Win=28032 Len=241 TSval=1470021535 TSecr=1803450591 [TCP segment of a reassembled PDU]
   47 2.410764614 172.31.26.111 → 54.188.89.98 TCP 111 27017 → 53742 [PSH, ACK] Seq=780 Ack=3404 Win=41856 Len=45 TSval=1803450622 TSecr=1470021535 [TCP segment of a reassembled PDU]
   48 2.427005903 54.188.89.98 → 172.31.26.111 TCP 307 53742 → 27017 [PSH, ACK] Seq=3404 Ack=825 Win=28032 Len=241 TSval=1470021567 TSecr=1803450622 [TCP segment of a reassembled PDU]
   49 2.442292776 172.31.26.111 → 54.188.89.98 TCP 111 27017 → 53742 [PSH, ACK] Seq=825 Ack=3645 Win=43008 Len=45 TSval=1803450654 TSecr=1470021567 [TCP segment of a reassembled PDU]
   50 2.458516760 54.188.89.98 → 172.31.26.111 TCP 307 53742 → 27017 [PSH, ACK] Seq=3645 Ack=870 Win=28032 Len=241 TSval=1470021598 TSecr=1803450654 [TCP segment of a reassembled PDU]
   51 2.473862152 172.31.26.111 → 54.188.89.98 TCP 111 27017 → 53742 [PSH, ACK] Seq=870 Ack=3886 Win=44032 Len=45 TSval=1803450686 TSecr=1470021598 [TCP segment of a reassembled PDU]
   52 2.490073021 54.188.89.98 → 172.31.26.111 TCP 307 53742 → 27017 [PSH, ACK] Seq=3886 Ack=915 Win=28032 Len=241 TSval=1470021630 TSecr=1803450686 [TCP segment of a reassembled PDU]
   53 2.505398872 172.31.26.111 → 54.188.89.98 TCP 111 27017 → 53742 [PSH, ACK] Seq=915 Ack=4127 Win=45184 Len=45 TSval=1803450717 TSecr=1470021630 [TCP segment of a reassembled PDU]
   54 2.521691110 54.188.89.98 → 172.31.26.111 TCP 307 53742 → 27017 [PSH, ACK] Seq=4127 Ack=960 Win=28032 Len=241 TSval=1470021662 TSecr=1803450717 [TCP segment of a reassembled PDU]
   55 2.537010330 172.31.26.111 → 54.188.89.98 TCP 111 27017 → 53742 [PSH, ACK] Seq=960 Ack=4368 Win=46208 Len=45 TSval=1803450749 TSecr=1470021662 [TCP segment of a reassembled PDU]
   56 2.553278444 54.188.89.98 → 172.31.26.111 TCP 307 53742 → 27017 [PSH, ACK] Seq=4368 Ack=1005 Win=28032 Len=241 TSval=1470021693 TSecr=1803450749 [TCP segment of a reassembled PDU]
   58 2.568623575 172.31.26.111 → 54.188.89.98 TCP 111 27017 → 53742 [PSH, ACK] Seq=1005 Ack=4609 Win=47232 Len=45 TSval=1803450780 TSecr=1470021693 [TCP segment of a reassembled PDU]
   59 2.584806309 54.188.89.98 → 172.31.26.111 TCP 307 53742 → 27017 [PSH, ACK] Seq=4609 Ack=1050 Win=28032 Len=241 TSval=1470021725 TSecr=1803450780 [TCP segment of a reassembled PDU]
   60 2.600083829 172.31.26.111 → 54.188.89.98 TCP 111 27017 → 53742 [PSH, ACK] Seq=1050 Ack=4850 Win=48384 Len=45 TSval=1803450812 TSecr=1470021725 [TCP segment of a reassembled PDU]
   62 2.616355324 54.188.89.98 → 172.31.26.111 TCP 307 53742 → 27017 [PSH, ACK] Seq=4850 Ack=1095 Win=28032 Len=241 TSval=1470021756 TSecr=1803450812 [TCP segment of a reassembled PDU]
   63 2.631679566 172.31.26.111 → 54.188.89.98 TCP 111 27017 → 53742 [PSH, ACK] Seq=1095 Ack=5091 Win=49408 Len=45 TSval=1803450843 TSecr=1470021756 [TCP segment of a reassembled PDU]
   64 2.647750981 54.188.89.98 → 172.31.26.111 TCP 307 53742 → 27017 [PSH, ACK] Seq=5091 Ack=1140 Win=28032 Len=241 TSval=1470021788 TSecr=1803450843 [TCP segment of a reassembled PDU]
   65 2.663091732 172.31.26.111 → 54.188.89.98 TCP 111 27017 → 53742 [PSH, ACK] Seq=1140 Ack=5332 Win=50432 Len=45 TSval=1803450875 TSecr=1470021788 [TCP segment of a reassembled PDU]
   66 2.679256064 54.188.89.98 → 172.31.26.111 TCP 307 53742 → 27017 [PSH, ACK] Seq=5332 Ack=1185 Win=28032 Len=241 TSval=1470021819 TSecr=1803450875 [TCP segment of a reassembled PDU]
   67 2.694619326 172.31.26.111 → 54.188.89.98 TCP 111 27017 → 53742 [PSH, ACK] Seq=1185 Ack=5573 Win=51584 Len=45 TSval=1803450906 TSecr=1470021819 [TCP segment of a reassembled PDU]
   68 2.710629387 54.188.89.98 → 172.31.26.111 TCP 307 53742 → 27017 [PSH, ACK] Seq=5573 Ack=1230 Win=28032 Len=241 TSval=1470021851 TSecr=1803450906 [TCP segment of a reassembled PDU]
   69 2.725979811 172.31.26.111 → 54.188.89.98 TCP 111 27017 → 53742 [PSH, ACK] Seq=1230 Ack=5814 Win=52608 Len=45 TSval=1803450938 TSecr=1470021851 [TCP segment of a reassembled PDU]
   70 2.742299182 54.188.89.98 → 172.31.26.111 TCP 307 53742 → 27017 [PSH, ACK] Seq=5814 Ack=1275 Win=28032 Len=241 TSval=1470021882 TSecr=1803450938 [TCP segment of a reassembled PDU]
   71 2.757637104 172.31.26.111 → 54.188.89.98 TCP 111 27017 → 53742 [PSH, ACK] Seq=1275 Ack=6055 Win=53760 Len=45 TSval=1803450969 TSecr=1470021882 [TCP segment of a reassembled PDU]
   72 2.773726343 54.188.89.98 → 172.31.26.111 TCP 307 53742 → 27017 [PSH, ACK] Seq=6055 Ack=1320 Win=28032 Len=241 TSval=1470021914 TSecr=1803450969 [TCP segment of a reassembled PDU]
   73 2.789078084 172.31.26.111 → 54.188.89.98 TCP 111 27017 → 53742 [PSH, ACK] Seq=1320 Ack=6296 Win=54784 Len=45 TSval=1803451001 TSecr=1470021914 [TCP segment of a reassembled PDU]
   74 2.805107939 54.188.89.98 → 172.31.26.111 TCP 307 53742 → 27017 [PSH, ACK] Seq=6296 Ack=1365 Win=28032 Len=241 TSval=1470021945 TSecr=1803451001 [TCP segment of a reassembled PDU]
   75 2.820445240 172.31.26.111 → 54.188.89.98 TCP 111 27017 → 53742 [PSH, ACK] Seq=1365 Ack=6537 Win=55808 Len=45 TSval=1803451032 TSecr=1470021945 [TCP segment of a reassembled PDU]
   76 2.836641860 54.188.89.98 → 172.31.26.111 TCP 307 53742 → 27017 [PSH, ACK] Seq=6537 Ack=1410 Win=28032 Len=241 TSval=1470021977 TSecr=1803451032 [TCP segment of a reassembled PDU]
   77 2.851989430 172.31.26.111 → 54.188.89.98 TCP 111 27017 → 53742 [PSH, ACK] Seq=1410 Ack=6778 Win=56960 Len=45 TSval=1803451064 TSecr=1470021977 [TCP segment of a reassembled PDU]
   78 2.868266630 54.188.89.98 → 172.31.26.111 TCP 307 53742 → 27017 [PSH, ACK] Seq=6778 Ack=1455 Win=28032 Len=241 TSval=1470022008 TSecr=1803451064 [TCP segment of a reassembled PDU]
   79 2.883612797 172.31.26.111 → 54.188.89.98 TCP 111 27017 → 53742 [PSH, ACK] Seq=1455 Ack=7019 Win=57984 Len=45 TSval=1803451095 TSecr=1470022008 [TCP segment of a reassembled PDU]
   80 2.899824010 54.188.89.98 → 172.31.26.111 TCP 307 53742 → 27017 [PSH, ACK] Seq=7019 Ack=1500 Win=28032 Len=241 TSval=1470022040 TSecr=1803451095 [TCP segment of a reassembled PDU]
   81 2.915176918 172.31.26.111 → 54.188.89.98 TCP 111 27017 → 53742 [PSH, ACK] Seq=1500 Ack=7260 Win=59008 Len=45 TSval=1803451127 TSecr=1470022040 [TCP segment of a reassembled PDU]
   82 2.931400440 54.188.89.98 → 172.31.26.111 TCP 307 53742 → 27017 [PSH, ACK] Seq=7260 Ack=1545 Win=28032 Len=241 TSval=1470022071 TSecr=1803451127 [TCP segment of a reassembled PDU]
   83 2.946751156 172.31.26.111 → 54.188.89.98 TCP 111 27017 → 53742 [PSH, ACK] Seq=1545 Ack=7501 Win=60160 Len=45 TSval=1803451158 TSecr=1470022071 [TCP segment of a reassembled PDU]
   84 2.963008179 54.188.89.98 → 172.31.26.111 TCP 307 53742 → 27017 [PSH, ACK] Seq=7501 Ack=1590 Win=28032 Len=241 TSval=1470022103 TSecr=1803451158 [TCP segment of a reassembled PDU]
   85 2.978316521 172.31.26.111 → 54.188.89.98 TCP 111 27017 → 53742 [PSH, ACK] Seq=1590 Ack=7742 Win=61184 Len=45 TSval=1803451190 TSecr=1470022103 [TCP segment of a reassembled PDU]
   86 2.994532851 54.188.89.98 → 172.31.26.111 TCP 307 53742 → 27017 [PSH, ACK] Seq=7742 Ack=1635 Win=28032 Len=241 TSval=1470022135 TSecr=1803451190 [TCP segment of a reassembled PDU]
   87 3.009793955 172.31.26.111 → 54.188.89.98 TCP 111 27017 → 53742 [PSH, ACK] Seq=1635 Ack=7983 Win=62336 Len=45 TSval=1803451221 TSecr=1470022135 [TCP segment of a reassembled PDU]
   88 3.026146326 54.188.89.98 → 172.31.26.111 TCP 307 53742 → 27017 [PSH, ACK] Seq=7983 Ack=1680 Win=28032 Len=241 TSval=1470022166 TSecr=1803451221 [TCP segment of a reassembled PDU]
   89 3.041478201 172.31.26.111 → 54.188.89.98 TCP 111 27017 → 53742 [PSH, ACK] Seq=1680 Ack=8224 Win=63360 Len=45 TSval=1803451253 TSecr=1470022166 [TCP segment of a reassembled PDU]
   90 3.057720477 54.188.89.98 → 172.31.26.111 TCP 307 53742 → 27017 [PSH, ACK] Seq=8224 Ack=1725 Win=28032 Len=241 TSval=1470022198 TSecr=1803451253 [TCP segment of a reassembled PDU]
   92 3.072964649 172.31.26.111 → 54.188.89.98 TCP 111 27017 → 53742 [PSH, ACK] Seq=1725 Ack=8465 Win=64384 Len=45 TSval=1803451285 TSecr=1470022198 [TCP segment of a reassembled PDU]
   93 3.089218420 54.188.89.98 → 172.31.26.111 TCP 307 53742 → 27017 [PSH, ACK] Seq=8465 Ack=1770 Win=28032 Len=241 TSval=1470022229 TSecr=1803451285 [TCP segment of a reassembled PDU]
   94 3.104518394 172.31.26.111 → 54.188.89.98 TCP 111 27017 → 53742 [PSH, ACK] Seq=1770 Ack=8706 Win=65536 Len=45 TSval=1803451316 TSecr=1470022229 [TCP segment of a reassembled PDU]
   96 3.120896425 54.188.89.98 → 172.31.26.111 TCP 307 53742 → 27017 [PSH, ACK] Seq=8706 Ack=1815 Win=28032 Len=241 TSval=1470022261 TSecr=1803451316 [TCP segment of a reassembled PDU]
   97 3.136203369 172.31.26.111 → 54.188.89.98 TCP 111 27017 → 53742 [PSH, ACK] Seq=1815 Ack=8947 Win=66560 Len=45 TSval=1803451348 TSecr=1470022261 [TCP segment of a reassembled PDU]
   98 3.152390972 54.188.89.98 → 172.31.26.111 TCP 307 53742 → 27017 [PSH, ACK] Seq=8947 Ack=1860 Win=28032 Len=241 TSval=1470022292 TSecr=1803451348 [TCP segment of a reassembled PDU]
   99 3.167657845 172.31.26.111 → 54.188.89.98 TCP 111 27017 → 53742 [PSH, ACK] Seq=1860 Ack=9188 Win=67584 Len=45 TSval=1803451379 TSecr=1470022292 [TCP segment of a reassembled PDU]
  100 3.184014438 54.188.89.98 → 172.31.26.111 TCP 307 53742 → 27017 [PSH, ACK] Seq=9188 Ack=1905 Win=28032 Len=241 TSval=1470022324 TSecr=1803451379 [TCP segment of a reassembled PDU]
  101 3.199267595 172.31.26.111 → 54.188.89.98 TCP 111 27017 → 53742 [PSH, ACK] Seq=1905 Ack=9429 Win=68736 Len=45 TSval=1803451411 TSecr=1470022324 [TCP segment of a reassembled PDU]
  102 3.215513344 54.188.89.98 → 172.31.26.111 TCP 307 53742 → 27017 [PSH, ACK] Seq=9429 Ack=1950 Win=28032 Len=241 TSval=1470022355 TSecr=1803451411 [TCP segment of a reassembled PDU]
  103 3.230804997 172.31.26.111 → 54.188.89.98 TCP 111 27017 → 53742 [PSH, ACK] Seq=1950 Ack=9670 Win=69760 Len=45 TSval=1803451442 TSecr=1470022355 [TCP segment of a reassembled PDU]
  104 3.246966302 54.188.89.98 → 172.31.26.111 TCP 307 53742 → 27017 [PSH, ACK] Seq=9670 Ack=1995 Win=28032 Len=241 TSval=1470022387 TSecr=1803451442 [TCP segment of a reassembled PDU]
  105 3.262231028 172.31.26.111 → 54.188.89.98 TCP 111 27017 → 53742 [PSH, ACK] Seq=1995 Ack=9911 Win=70912 Len=45 TSval=1803451474 TSecr=1470022387 [TCP segment of a reassembled PDU]
  106 3.278255499 54.188.89.98 → 172.31.26.111 TCP 307 53742 → 27017 [PSH, ACK] Seq=9911 Ack=2040 Win=28032 Len=241 TSval=1470022418 TSecr=1803451474 [TCP segment of a reassembled PDU]
  107 3.293497874 172.31.26.111 → 54.188.89.98 TCP 111 27017 → 53742 [PSH, ACK] Seq=2040 Ack=10152 Win=71936 Len=45 TSval=1803451505 TSecr=1470022418 [TCP segment of a reassembled PDU]
  108 3.309916687 54.188.89.98 → 172.31.26.111 TCP 307 53742 → 27017 [PSH, ACK] Seq=10152 Ack=2085 Win=28032 Len=241 TSval=1470022450 TSecr=1803451505 [TCP segment of a reassembled PDU]
  109 3.325215771 172.31.26.111 → 54.188.89.98 TCP 111 27017 → 53742 [PSH, ACK] Seq=2085 Ack=10393 Win=72960 Len=45 TSval=1803451537 TSecr=1470022450 [TCP segment of a reassembled PDU]
  110 3.341221229 54.188.89.98 → 172.31.26.111 TCP 307 53742 → 27017 [PSH, ACK] Seq=10393 Ack=2130 Win=28032 Len=241 TSval=1470022481 TSecr=1803451537 [TCP segment of a reassembled PDU]
  111 3.356465020 172.31.26.111 → 54.188.89.98 TCP 111 27017 → 53742 [PSH, ACK] Seq=2130 Ack=10634 Win=74112 Len=45 TSval=1803451568 TSecr=1470022481 [TCP segment of a reassembled PDU]
  112 3.372555581 54.188.89.98 → 172.31.26.111 TCP 307 53742 → 27017 [PSH, ACK] Seq=10634 Ack=2175 Win=28032 Len=241 TSval=1470022513 TSecr=1803451568 [TCP segment of a reassembled PDU]
  113 3.387836091 172.31.26.111 → 54.188.89.98 TCP 111 27017 → 53742 [PSH, ACK] Seq=2175 Ack=10875 Win=75136 Len=45 TSval=1803451600 TSecr=1470022513 [TCP segment of a reassembled PDU]
  114 3.404045213 54.188.89.98 → 172.31.26.111 TCP 307 53742 → 27017 [PSH, ACK] Seq=10875 Ack=2220 Win=28032 Len=241 TSval=1470022544 TSecr=1803451600 [TCP segment of a reassembled PDU]
  115 3.419276556 172.31.26.111 → 54.188.89.98 TCP 111 27017 → 53742 [PSH, ACK] Seq=2220 Ack=11116 Win=76160 Len=45 TSval=1803451631 TSecr=1470022544 [TCP segment of a reassembled PDU]
  116 3.435404072 54.188.89.98 → 172.31.26.111 TCP 307 53742 → 27017 [PSH, ACK] Seq=11116 Ack=2265 Win=28032 Len=241 TSval=1470022575 TSecr=1803451631 [TCP segment of a reassembled PDU]
  117 3.450700614 172.31.26.111 → 54.188.89.98 TCP 111 27017 → 53742 [PSH, ACK] Seq=2265 Ack=11357 Win=77312 Len=45 TSval=1803451662 TSecr=1470022575 [TCP segment of a reassembled PDU]
  118 3.466781971 54.188.89.98 → 172.31.26.111 TCP 307 53742 → 27017 [PSH, ACK] Seq=11357 Ack=2310 Win=28032 Len=241 TSval=1470022607 TSecr=1803451662 [TCP segment of a reassembled PDU]
  119 3.482111067 172.31.26.111 → 54.188.89.98 TCP 111 27017 → 53742 [PSH, ACK] Seq=2310 Ack=11598 Win=78336 Len=45 TSval=1803451694 TSecr=1470022607 [TCP segment of a reassembled PDU]
  120 3.498451374 54.188.89.98 → 172.31.26.111 TCP 307 53742 → 27017 [PSH, ACK] Seq=11598 Ack=2355 Win=28032 Len=241 TSval=1470022638 TSecr=1803451694 [TCP segment of a reassembled PDU]
  121 3.513776228 172.31.26.111 → 54.188.89.98 TCP 111 27017 → 53742 [PSH, ACK] Seq=2355 Ack=11839 Win=79488 Len=45 TSval=1803451725 TSecr=1470022638 [TCP segment of a reassembled PDU]
  122 3.530147646 54.188.89.98 → 172.31.26.111 TCP 307 53742 → 27017 [PSH, ACK] Seq=11839 Ack=2400 Win=28032 Len=241 TSval=1470022670 TSecr=1803451725 [TCP segment of a reassembled PDU]
  123 3.545396034 172.31.26.111 → 54.188.89.98 TCP 111 27017 → 53742 [PSH, ACK] Seq=2400 Ack=12080 Win=80512 Len=45 TSval=1803451757 TSecr=1470022670 [TCP segment of a reassembled PDU]
  124 3.561632001 54.188.89.98 → 172.31.26.111 TCP 307 53742 → 27017 [PSH, ACK] Seq=12080 Ack=2445 Win=28032 Len=241 TSval=1470022702 TSecr=1803451757 [TCP segment of a reassembled PDU]
  125 3.576874463 172.31.26.111 → 54.188.89.98 TCP 111 27017 → 53742 [PSH, ACK] Seq=2445 Ack=12321 Win=81536 Len=45 TSval=1803451789 TSecr=1470022702 [TCP segment of a reassembled PDU]
  128 3.633916785 54.188.89.98 → 172.31.26.111 TCP 66 53742 → 27017 [ACK] Seq=12321 Ack=2490 Win=28032 Len=0 TSval=1470022774 TSecr=1803451789
