    1 0.000000000 153.90.129.147 → 172.31.22.196 TCP 66 47732 → 22 [ACK] Seq=1 Ack=1 Win=1000 Len=0 TSval=2192885027 TSecr=3330225840
    2 0.000041400 153.90.129.147 → 172.31.22.196 TCP 66 47732 → 22 [ACK] Seq=1 Ack=61 Win=1000 Len=0 TSval=2192885027 TSecr=3330225840
    3 0.000061002 153.90.129.147 → 172.31.22.196 TCP 66 47732 → 22 [ACK] Seq=1 Ack=97 Win=1000 Len=0 TSval=2192885027 TSecr=3330225840
    4 0.000232404 153.90.129.147 → 172.31.22.196 TCP 66 47732 → 22 [ACK] Seq=1 Ack=349 Win=1021 Len=0 TSval=2192885027 TSecr=3330225840
    5 0.000258313 153.90.129.147 → 172.31.22.196 TCP 66 47732 → 22 [ACK] Seq=1 Ack=385 Win=1021 Len=0 TSval=2192885027 TSecr=3330225840
    6 0.009974497 172.31.22.196 → 153.90.129.147 SSH 126 Server: Encrypted packet (len=60)
    7 0.058887801 153.90.129.147 → 172.31.22.196 TCP 66 47732 → 22 [ACK] Seq=1 Ack=445 Win=1021 Len=0 TSval=2192885086 TSecr=3330225899
    8 0.116616824 180.160.3.195 → 172.31.22.196 SSH 150 Client: Encrypted packet (len=84)
    9 0.131797348 172.31.22.196 → 180.160.3.195 SSH 118 Server: Encrypted packet (len=52)
   10 0.286137616 180.160.3.195 → 172.31.22.196 SSH 150 Client: Encrypted packet (len=84)
   11 0.301310655 172.31.22.196 → 180.160.3.195 SSH 118 Server: Encrypted packet (len=52)
   12 0.454932860 180.160.3.195 → 172.31.22.196 SSH 150 Client: Encrypted packet (len=84)
   13 0.470134926 172.31.22.196 → 180.160.3.195 SSH 118 Server: Encrypted packet (len=52)
   14 0.519019579 172.31.22.196 → 153.90.129.147 SSH 110 Server: Encrypted packet (len=44)
   15 0.568014214 153.90.129.147 → 172.31.22.196 TCP 66 47732 → 22 [ACK] Seq=1 Ack=489 Win=1021 Len=0 TSval=2192885595 TSecr=3330226408
   16 0.625329967 180.160.3.195 → 172.31.22.196 SSH 150 Client: Encrypted packet (len=84)
   17 0.640569342 172.31.22.196 → 180.160.3.195 SSH 150 Server: Encrypted packet (len=84)
   18 0.641895055 172.31.22.196 → 180.160.3.195 TCP 66 22 → 31710 [FIN, ACK] Seq=241 Ack=337 Win=227 Len=0 TSval=4249374216 TSecr=104598877
   19 0.794987301 180.160.3.195 → 172.31.22.196 TCP 66 31710 → 22 [FIN, ACK] Seq=337 Ack=241 Win=589 Len=0 TSval=104598920 TSecr=4249374214
   20 0.795203675 180.160.3.195 → 172.31.22.196 TCP 66 31710 → 22 [ACK] Seq=338 Ack=242 Win=589 Len=0 TSval=104598920 TSecr=4249374216
   21 0.810116094 172.31.22.196 → 180.160.3.195 TCP 66 22 → 31710 [ACK] Seq=242 Ack=338 Win=227 Len=0 TSval=4249374384 TSecr=104598920
   22 1.030952375 172.31.22.196 → 153.90.129.147 SSH 110 Server: Encrypted packet (len=44)
   23 1.080126259 153.90.129.147 → 172.31.22.196 TCP 66 47732 → 22 [ACK] Seq=1 Ack=533 Win=1021 Len=0 TSval=2192886107 TSecr=3330226920
   24 1.542894803 172.31.22.196 → 153.90.129.147 SSH 110 Server: Encrypted packet (len=44)
   25 1.591789496 153.90.129.147 → 172.31.22.196 TCP 66 47732 → 22 [ACK] Seq=1 Ack=577 Win=1021 Len=0 TSval=2192886619 TSecr=3330227431
   26 1.873331829 153.90.129.147 → 172.31.22.196 SSH 102 Client: Encrypted packet (len=36)
   27 1.888945505 172.31.22.196 → 153.90.129.147 SSH 102 Server: Encrypted packet (len=36)
   28 1.915031091 172.31.22.196 → 35.165.72.110 TCP 74 56956 → 9092 [SYN] Seq=0 Win=26883 Len=0 MSS=8961 SACK_PERM=1 TSval=3604454991 TSecr=0 WS=128
   29 1.931100674 35.165.72.110 → 172.31.22.196 TCP 74 9092 → 56956 [SYN, ACK] Seq=0 Ack=1 Win=26847 Len=0 MSS=1460 SACK_PERM=1 TSval=2507502174 TSecr=3604454991 WS=2
   30 1.937744067 153.90.129.147 → 172.31.22.196 TCP 66 47814 → 22 [ACK] Seq=37 Ack=37 Win=537 Len=0 TSval=2192886965 TSecr=3330227778
   31 1.946208760 172.31.22.196 → 35.165.72.110 TCP 66 56956 → 9092 [ACK] Seq=1 Ack=1 Win=27008 Len=0 TSval=3604455022 TSecr=2507502174
   32 2.039765972 172.31.22.196 → 35.165.72.110 TCP 91 56956 → 9092 [PSH, ACK] Seq=1 Ack=1 Win=27008 Len=25 TSval=3604455022 TSecr=2507502174
   33 2.054869982 172.31.22.196 → 153.90.129.147 SSH 110 Server: Encrypted packet (len=44)
   34 2.055808059 35.165.72.110 → 172.31.22.196 TCP 66 9092 → 56956 [ACK] Seq=1 Ack=26 Win=26848 Len=0 TSval=2507502298 TSecr=3604455022
   35 2.056465174 35.165.72.110 → 172.31.22.196 SMPP 344 SMPP Bind_receiver
   36 2.071567929 172.31.22.196 → 35.165.72.110 TCP 66 56956 → 9092 [ACK] Seq=26 Ack=279 Win=28032 Len=0 TSval=3604455147 TSecr=2507502299
   37 2.071736100 172.31.22.196 → 35.165.72.110 TCP 99 56956 → 9092 [PSH, ACK] Seq=26 Ack=279 Win=28032 Len=33 TSval=3604455147 TSecr=2507502299
   38 2.088756853 35.165.72.110 → 172.31.22.196 TCP 176 9092 → 56956 [PSH, ACK] Seq=279 Ack=59 Win=26848 Len=110 TSval=2507502331 TSecr=3604455147
   39 2.103966776 153.90.129.147 → 172.31.22.196 TCP 66 47732 → 22 [ACK] Seq=1 Ack=621 Win=1021 Len=0 TSval=2192887131 TSecr=3330227943
   40 2.103999557 172.31.22.196 → 35.165.72.110 SMPP 192 SMPP Replace_sm
   41 2.121469256 35.165.72.110 → 172.31.22.196 SMPP 124 SMPP Query_sm
   42 2.138617503 172.31.22.196 → 153.90.129.147 SSH 134 Server: Encrypted packet (len=68)
   43 2.138624769 172.31.22.196 → 35.165.72.110 TCP 66 56956 → 9092 [FIN, ACK] Seq=185 Ack=447 Win=28032 Len=0 TSval=3604455214 TSecr=2507502364
   44 2.142151461 172.31.22.196 → 153.90.129.147 SSH 190 Server: Encrypted packet (len=124)
   45 2.154865926 35.165.72.110 → 172.31.22.196 TCP 66 9092 → 56956 [FIN, ACK] Seq=447 Ack=186 Win=26848 Len=0 TSval=2507502398 TSecr=3604455214
   46 2.169984815 172.31.22.196 → 35.165.72.110 TCP 66 56956 → 9092 [ACK] Seq=186 Ack=448 Win=28032 Len=0 TSval=3604455246 TSecr=2507502398
   47 2.187552966 153.90.129.147 → 172.31.22.196 TCP 66 47814 → 22 [ACK] Seq=37 Ack=105 Win=537 Len=0 TSval=2192887214 TSecr=3330228027
   48 2.190926884 153.90.129.147 → 172.31.22.196 TCP 66 47814 → 22 [ACK] Seq=37 Ack=229 Win=537 Len=0 TSval=2192887218 TSecr=3330228031
   49 2.545293985 153.90.129.147 → 172.31.22.196 SSH 110 Client: Encrypted packet (len=44)
   50 2.560560578 172.31.22.196 → 153.90.129.147 SSH 126 Server: Encrypted packet (len=60)
   51 2.567217567 172.31.22.196 → 153.90.129.147 SSH 110 Server: Encrypted packet (len=44)
   52 2.609484849 153.90.129.147 → 172.31.22.196 TCP 66 47814 → 22 [ACK] Seq=81 Ack=289 Win=537 Len=0 TSval=2192887636 TSecr=3330228449
   53 2.616012341 153.90.129.147 → 172.31.22.196 TCP 66 47732 → 22 [ACK] Seq=1 Ack=665 Win=1021 Len=0 TSval=2192887643 TSecr=3330228456
   54 2.944911487 153.90.129.147 → 172.31.22.196 SSH 102 Client: Encrypted packet (len=36)
   55 2.960122986 172.31.22.196 → 153.90.129.147 SSH 102 Server: Encrypted packet (len=36)
   56 2.986239224 172.31.22.196 → 35.165.72.110 TCP 74 56958 → 9092 [SYN] Seq=0 Win=26883 Len=0 MSS=8961 SACK_PERM=1 TSval=3604456062 TSecr=0 WS=128
   57 3.002271273 35.165.72.110 → 172.31.22.196 TCP 74 9092 → 56958 [SYN, ACK] Seq=0 Ack=1 Win=26847 Len=0 MSS=1460 SACK_PERM=1 TSval=2507503245 TSecr=3604456062 WS=2
   58 3.008944881 153.90.129.147 → 172.31.22.196 TCP 66 47814 → 22 [ACK] Seq=117 Ack=325 Win=537 Len=0 TSval=2192888036 TSecr=3330228849
   59 3.017382205 172.31.22.196 → 35.165.72.110 TCP 66 56958 → 9092 [ACK] Seq=1 Ack=1 Win=27008 Len=0 TSval=3604456093 TSecr=2507503245
   60 3.063793491 172.31.22.196 → 35.165.72.110 TCP 91 56958 → 9092 [PSH, ACK] Seq=1 Ack=1 Win=27008 Len=25 TSval=3604456093 TSecr=2507503245
   61 3.078878868 172.31.22.196 → 153.90.129.147 SSH 110 Server: Encrypted packet (len=44)
   62 3.079814306 35.165.72.110 → 172.31.22.196 TCP 66 9092 → 56958 [ACK] Seq=1 Ack=26 Win=26848 Len=0 TSval=2507503323 TSecr=3604456093
   63 3.081553052 35.165.72.110 → 172.31.22.196 SMPP 344 SMPP Bind_receiver
   64 3.096628427 172.31.22.196 → 35.165.72.110 TCP 66 56958 → 9092 [ACK] Seq=26 Ack=279 Win=28032 Len=0 TSval=3604456172 TSecr=2507503324
   65 3.127688357 153.90.129.147 → 172.31.22.196 TCP 66 47732 → 22 [ACK] Seq=1 Ack=709 Win=1021 Len=0 TSval=2192888154 TSecr=3330228967
   66 3.575943225 172.31.22.196 → 35.165.72.110 TCP 99 56958 → 9092 [PSH, ACK] Seq=26 Ack=279 Win=28032 Len=33 TSval=3604456172 TSecr=2507503324
   67 3.591026783 172.31.22.196 → 153.90.129.147 SSH 110 Server: Encrypted packet (len=44)
   68 3.593638843 35.165.72.110 → 172.31.22.196 TCP 176 9092 → 56958 [PSH, ACK] Seq=279 Ack=59 Win=26848 Len=110 TSval=2507503836 TSecr=3604456172
   69 3.608893157 172.31.22.196 → 35.165.72.110 SMPP 192 SMPP Replace_sm
   70 3.626840977 35.165.72.110 → 172.31.22.196 SMPP 124 SMPP Query_sm
   71 3.639916299 153.90.129.147 → 172.31.22.196 TCP 66 47732 → 22 [ACK] Seq=1 Ack=753 Win=1021 Len=0 TSval=2192888667 TSecr=3330229480
   72 3.642116421 172.31.22.196 → 153.90.129.147 SSH 126 Server: Encrypted packet (len=60)
   73 3.642122589 172.31.22.196 → 153.90.129.147 SSH 102 Server: Encrypted packet (len=36)
   74 3.644048362 172.31.22.196 → 35.165.72.110 TCP 66 56958 → 9092 [FIN, ACK] Seq=185 Ack=447 Win=28032 Len=0 TSval=3604456720 TSecr=2507503870
   75 3.647334807 172.31.22.196 → 153.90.129.147 SSH 190 Server: Encrypted packet (len=124)
   76 3.660197966 35.165.72.110 → 172.31.22.196 TCP 66 9092 → 56958 [FIN, ACK] Seq=447 Ack=186 Win=26848 Len=0 TSval=2507503903 TSecr=3604456720
   77 3.675309400 172.31.22.196 → 35.165.72.110 TCP 66 56958 → 9092 [ACK] Seq=186 Ack=448 Win=28032 Len=0 TSval=3604456751 TSecr=2507503903
   78 3.690936461 153.90.129.147 → 172.31.22.196 TCP 66 47814 → 22 [ACK] Seq=117 Ack=385 Win=537 Len=0 TSval=2192888718 TSecr=3330229531
   79 3.690948403 153.90.129.147 → 172.31.22.196 TCP 66 47814 → 22 [ACK] Seq=117 Ack=421 Win=537 Len=0 TSval=2192888718 TSecr=3330229531
   80 3.696207795 153.90.129.147 → 172.31.22.196 TCP 66 47814 → 22 [ACK] Seq=117 Ack=545 Win=537 Len=0 TSval=2192888723 TSecr=3330229536
   81 4.001193869 153.90.129.147 → 172.31.22.196 SSH 110 Client: Encrypted packet (len=44)
   82 4.016426085 172.31.22.196 → 153.90.129.147 SSH 126 Server: Encrypted packet (len=60)
   83 4.065297075 153.90.129.147 → 172.31.22.196 TCP 66 47814 → 22 [ACK] Seq=161 Ack=605 Win=537 Len=0 TSval=2192889092 TSecr=3330229905
   84 4.103089526 172.31.22.196 → 153.90.129.147 SSH 110 Server: Encrypted packet (len=44)
   85 4.152022799 153.90.129.147 → 172.31.22.196 TCP 66 47732 → 22 [ACK] Seq=1 Ack=797 Win=1021 Len=0 TSval=2192889179 TSecr=3330229992
   86 4.369201946 153.90.129.147 → 172.31.22.196 SSH 102 Client: Encrypted packet (len=36)
   87 4.384408182 172.31.22.196 → 153.90.129.147 SSH 102 Server: Encrypted packet (len=36)
   88 4.410463287 172.31.22.196 → 35.165.72.110 TCP 74 56960 → 9092 [SYN] Seq=0 Win=26883 Len=0 MSS=8961 SACK_PERM=1 TSval=3604457486 TSecr=0 WS=128
   89 4.426477233 35.165.72.110 → 172.31.22.196 TCP 74 9092 → 56960 [SYN, ACK] Seq=0 Ack=1 Win=26847 Len=0 MSS=1460 SACK_PERM=1 TSval=2507504669 TSecr=3604457486 WS=2
   90 4.433172998 153.90.129.147 → 172.31.22.196 TCP 66 47814 → 22 [ACK] Seq=197 Ack=641 Win=537 Len=0 TSval=2192889460 TSecr=3330230273
   91 4.441588960 172.31.22.196 → 35.165.72.110 TCP 66 56960 → 9092 [ACK] Seq=1 Ack=1 Win=27008 Len=0 TSval=3604457517 TSecr=2507504669
   92 4.599784537 172.31.22.196 → 35.165.72.110 TCP 91 56960 → 9092 [PSH, ACK] Seq=1 Ack=1 Win=27008 Len=25 TSval=3604457517 TSecr=2507504669
   93 4.614866511 172.31.22.196 → 153.90.129.147 SSH 110 Server: Encrypted packet (len=44)
   94 4.615765974 35.165.72.110 → 172.31.22.196 TCP 66 9092 → 56960 [ACK] Seq=1 Ack=26 Win=26848 Len=0 TSval=2507504859 TSecr=3604457517
   95 4.616331329 35.165.72.110 → 172.31.22.196 SMPP 344 SMPP Bind_receiver
   96 4.631430375 172.31.22.196 → 35.165.72.110 TCP 66 56960 → 9092 [ACK] Seq=26 Ack=279 Win=28032 Len=0 TSval=3604457707 TSecr=2507504859
   97 4.663784944 153.90.129.147 → 172.31.22.196 TCP 66 47732 → 22 [ACK] Seq=1 Ack=841 Win=1021 Len=0 TSval=2192889690 TSecr=3330230503
   98 5.111976011 172.31.22.196 → 35.165.72.110 TCP 99 56960 → 9092 [PSH, ACK] Seq=26 Ack=279 Win=28032 Len=33 TSval=3604457707 TSecr=2507504859
   99 5.127058775 172.31.22.196 → 153.90.129.147 SSH 110 Server: Encrypted packet (len=44)
  100 5.129401500 35.165.72.110 → 172.31.22.196 TCP 176 9092 → 56960 [PSH, ACK] Seq=279 Ack=59 Win=26848 Len=110 TSval=2507505372 TSecr=3604457707
  101 5.144664670 172.31.22.196 → 35.165.72.110 SMPP 192 SMPP Replace_sm
  102 5.153191246 02:ee:bb:aa:92:76 → 02:4f:3d:ac:15:1a ARP 56 Who has 172.31.22.196? Tell 172.31.16.1
  103 5.162993728 35.165.72.110 → 172.31.22.196 SMPP 124 SMPP Query_sm
  104 5.168266794 02:4f:3d:ac:15:1a → 02:ee:bb:aa:92:76 ARP 42 172.31.22.196 is at 02:4f:3d:ac:15:1a
  105 5.175924241 153.90.129.147 → 172.31.22.196 TCP 66 47732 → 22 [ACK] Seq=1 Ack=885 Win=1021 Len=0 TSval=2192890203 TSecr=3330231016
  106 5.178265238 172.31.22.196 → 153.90.129.147 SSH 126 Server: Encrypted packet (len=60)
  107 5.178270902 172.31.22.196 → 153.90.129.147 SSH 102 Server: Encrypted packet (len=36)
  108 5.180174128 172.31.22.196 → 35.165.72.110 TCP 66 56960 → 9092 [FIN, ACK] Seq=185 Ack=447 Win=28032 Len=0 TSval=3604458256 TSecr=2507505406
  109 5.183516645 172.31.22.196 → 153.90.129.147 SSH 190 Server: Encrypted packet (len=124)
  110 5.196321514 35.165.72.110 → 172.31.22.196 TCP 66 9092 → 56960 [FIN, ACK] Seq=447 Ack=186 Win=26848 Len=0 TSval=2507505439 TSecr=3604458256
  111 5.211420090 172.31.22.196 → 35.165.72.110 TCP 66 56960 → 9092 [ACK] Seq=186 Ack=448 Win=28032 Len=0 TSval=3604458287 TSecr=2507505439
  112 5.227166098 153.90.129.147 → 172.31.22.196 TCP 66 47814 → 22 [ACK] Seq=197 Ack=701 Win=537 Len=0 TSval=2192890254 TSecr=3330231067
  113 5.227177357 153.90.129.147 → 172.31.22.196 TCP 66 47814 → 22 [ACK] Seq=197 Ack=737 Win=537 Len=0 TSval=2192890254 TSecr=3330231067
  114 5.232353831 153.90.129.147 → 172.31.22.196 TCP 66 47814 → 22 [ACK] Seq=197 Ack=861 Win=537 Len=0 TSval=2192890259 TSecr=3330231072
  115 5.521294149 153.90.129.147 → 172.31.22.196 SSH 110 Client: Encrypted packet (len=44)
  116 5.536560068 172.31.22.196 → 153.90.129.147 SSH 126 Server: Encrypted packet (len=60)
  117 5.585421488 153.90.129.147 → 172.31.22.196 TCP 66 47814 → 22 [ACK] Seq=241 Ack=921 Win=537 Len=0 TSval=2192890612 TSecr=3330231425
  118 5.639115225 172.31.22.196 → 153.90.129.147 SSH 110 Server: Encrypted packet (len=44)
  119 5.687989910 153.90.129.147 → 172.31.22.196 TCP 66 47732 → 22 [ACK] Seq=1 Ack=929 Win=1021 Len=0 TSval=2192890715 TSecr=3330231528
  120 5.841085412 153.90.129.147 → 172.31.22.196 SSH 102 Client: Encrypted packet (len=36)
  121 5.856294200 172.31.22.196 → 153.90.129.147 SSH 102 Server: Encrypted packet (len=36)
  122 5.882197717 172.31.22.196 → 35.165.72.110 TCP 74 56962 → 9092 [SYN] Seq=0 Win=26883 Len=0 MSS=8961 SACK_PERM=1 TSval=3604458958 TSecr=0 WS=128
  123 5.898239743 35.165.72.110 → 172.31.22.196 TCP 74 9092 → 56962 [SYN, ACK] Seq=0 Ack=1 Win=26847 Len=0 MSS=1460 SACK_PERM=1 TSval=2507506141 TSecr=3604458958 WS=2
  124 5.905259592 153.90.129.147 → 172.31.22.196 TCP 66 47814 → 22 [ACK] Seq=277 Ack=957 Win=537 Len=0 TSval=2192890932 TSecr=3330231745
  125 5.913360771 172.31.22.196 → 35.165.72.110 TCP 66 56962 → 9092 [ACK] Seq=1 Ack=1 Win=27008 Len=0 TSval=3604458989 TSecr=2507506141
  126 6.135837994 172.31.22.196 → 35.165.72.110 TCP 91 56962 → 9092 [PSH, ACK] Seq=1 Ack=1 Win=27008 Len=25 TSval=3604458989 TSecr=2507506141
  127 6.150928000 172.31.22.196 → 153.90.129.147 SSH 110 Server: Encrypted packet (len=44)
  128 6.151848516 35.165.72.110 → 172.31.22.196 TCP 66 9092 → 56962 [ACK] Seq=1 Ack=26 Win=26848 Len=0 TSval=2507506395 TSecr=3604458989
  129 6.152546994 35.165.72.110 → 172.31.22.196 SMPP 344 SMPP Bind_receiver
  130 6.167642255 172.31.22.196 → 35.165.72.110 TCP 66 56962 → 9092 [ACK] Seq=26 Ack=279 Win=28032 Len=0 TSval=3604459243 TSecr=2507506395
  131 6.199867238 153.90.129.147 → 172.31.22.196 TCP 66 47732 → 22 [ACK] Seq=1 Ack=973 Win=1021 Len=0 TSval=2192891227 TSecr=3330232040
  132 6.647936698 172.31.22.196 → 35.165.72.110 TCP 99 56962 → 9092 [PSH, ACK] Seq=26 Ack=279 Win=28032 Len=33 TSval=3604459243 TSecr=2507506395
  133 6.663004121 172.31.22.196 → 153.90.129.147 SSH 110 Server: Encrypted packet (len=44)
  134 6.664900718 35.165.72.110 → 172.31.22.196 TCP 176 9092 → 56962 [PSH, ACK] Seq=279 Ack=59 Win=26848 Len=110 TSval=2507506908 TSecr=3604459243
  135 6.680154002 172.31.22.196 → 35.165.72.110 SMPP 192 SMPP Replace_sm
  136 6.697560685 35.165.72.110 → 172.31.22.196 SMPP 124 SMPP Query_sm
  137 6.711956370 153.90.129.147 → 172.31.22.196 TCP 66 47732 → 22 [ACK] Seq=1 Ack=1017 Win=1021 Len=0 TSval=2192891739 TSecr=3330232552
  138 6.712838939 172.31.22.196 → 153.90.129.147 SSH 126 Server: Encrypted packet (len=60)
  139 6.712848421 172.31.22.196 → 153.90.129.147 SSH 102 Server: Encrypted packet (len=36)
  140 6.714731310 172.31.22.196 → 35.165.72.110 TCP 66 56962 → 9092 [FIN, ACK] Seq=185 Ack=447 Win=28032 Len=0 TSval=3604459790 TSecr=2507506940
  141 6.718042896 172.31.22.196 → 153.90.129.147 SSH 190 Server: Encrypted packet (len=124)
  142 6.730860103 35.165.72.110 → 172.31.22.196 TCP 66 9092 → 56962 [FIN, ACK] Seq=447 Ack=186 Win=26848 Len=0 TSval=2507506974 TSecr=3604459790
  143 6.745988529 172.31.22.196 → 35.165.72.110 TCP 66 56962 → 9092 [ACK] Seq=186 Ack=448 Win=28032 Len=0 TSval=3604459822 TSecr=2507506974
  144 6.761735895 153.90.129.147 → 172.31.22.196 TCP 66 47814 → 22 [ACK] Seq=277 Ack=1017 Win=537 Len=0 TSval=2192891788 TSecr=3330232601
  145 6.761751106 153.90.129.147 → 172.31.22.196 TCP 66 47814 → 22 [ACK] Seq=277 Ack=1053 Win=537 Len=0 TSval=2192891788 TSecr=3330232601
  146 6.766844552 153.90.129.147 → 172.31.22.196 TCP 66 47814 → 22 [ACK] Seq=277 Ack=1177 Win=537 Len=0 TSval=2192891794 TSecr=3330232607
  147 7.073278148 153.90.129.147 → 172.31.22.196 SSH 110 Client: Encrypted packet (len=44)
  148 7.088547172 172.31.22.196 → 153.90.129.147 SSH 126 Server: Encrypted packet (len=60)
  149 7.137454312 153.90.129.147 → 172.31.22.196 TCP 66 47814 → 22 [ACK] Seq=321 Ack=1237 Win=537 Len=0 TSval=2192892164 TSecr=3330232977
  150 7.175096062 172.31.22.196 → 153.90.129.147 SSH 110 Server: Encrypted packet (len=44)
  151 7.224084405 153.90.129.147 → 172.31.22.196 TCP 66 47732 → 22 [ACK] Seq=1 Ack=1061 Win=1021 Len=0 TSval=2192892251 TSecr=3330233064
  152 7.361047971 153.90.129.147 → 172.31.22.196 SSH 102 Client: Encrypted packet (len=36)
  153 7.376260737 172.31.22.196 → 153.90.129.147 SSH 102 Server: Encrypted packet (len=36)
  154 7.402677454 172.31.22.196 → 35.165.72.110 TCP 74 56964 → 9092 [SYN] Seq=0 Win=26883 Len=0 MSS=8961 SACK_PERM=1 TSval=3604460478 TSecr=0 WS=128
  155 7.418669218 35.165.72.110 → 172.31.22.196 TCP 74 9092 → 56964 [SYN, ACK] Seq=0 Ack=1 Win=26847 Len=0 MSS=1460 SACK_PERM=1 TSval=2507507661 TSecr=3604460478 WS=2
  156 7.425110991 153.90.129.147 → 172.31.22.196 TCP 66 47814 → 22 [ACK] Seq=357 Ack=1273 Win=537 Len=0 TSval=2192892452 TSecr=3330233265
  157 7.433775068 172.31.22.196 → 35.165.72.110 TCP 66 56964 → 9092 [ACK] Seq=1 Ack=1 Win=27008 Len=0 TSval=3604460509 TSecr=2507507661
  158 7.671888013 172.31.22.196 → 35.165.72.110 TCP 91 56964 → 9092 [PSH, ACK] Seq=1 Ack=1 Win=27008 Len=25 TSval=3604460509 TSecr=2507507661
  159 7.686969137 172.31.22.196 → 153.90.129.147 SSH 110 Server: Encrypted packet (len=44)
  160 7.687949777 35.165.72.110 → 172.31.22.196 TCP 66 9092 → 56964 [ACK] Seq=1 Ack=26 Win=26848 Len=0 TSval=2507507931 TSecr=3604460509
  161 7.688513696 35.165.72.110 → 172.31.22.196 SMPP 344 SMPP Bind_receiver
  162 7.703594496 172.31.22.196 → 35.165.72.110 TCP 66 56964 → 9092 [ACK] Seq=26 Ack=279 Win=28032 Len=0 TSval=3604460779 TSecr=2507507931
  163 7.735819075 153.90.129.147 → 172.31.22.196 TCP 66 47732 → 22 [ACK] Seq=1 Ack=1105 Win=1021 Len=0 TSval=2192892762 TSecr=3330233576
  164 8.183904615 172.31.22.196 → 35.165.72.110 TCP 99 56964 → 9092 [PSH, ACK] Seq=26 Ack=279 Win=28032 Len=33 TSval=3604460779 TSecr=2507507931
  165 8.198989959 172.31.22.196 → 153.90.129.147 SSH 110 Server: Encrypted packet (len=44)
  166 8.200896801 35.165.72.110 → 172.31.22.196 TCP 176 9092 → 56964 [PSH, ACK] Seq=279 Ack=59 Win=26848 Len=110 TSval=2507508444 TSecr=3604460779
  167 8.216137299 172.31.22.196 → 35.165.72.110 SMPP 192 SMPP Replace_sm
  168 8.233615597 35.165.72.110 → 172.31.22.196 SMPP 124 SMPP Query_sm
  169 8.247924140 153.90.129.147 → 172.31.22.196 TCP 66 47732 → 22 [ACK] Seq=1 Ack=1149 Win=1021 Len=0 TSval=2192893275 TSecr=3330234088
  170 8.248860515 172.31.22.196 → 153.90.129.147 SSH 126 Server: Encrypted packet (len=60)
  171 8.248865780 172.31.22.196 → 153.90.129.147 SSH 102 Server: Encrypted packet (len=36)
  172 8.250791049 172.31.22.196 → 35.165.72.110 TCP 66 56964 → 9092 [FIN, ACK] Seq=185 Ack=447 Win=28032 Len=0 TSval=3604461326 TSecr=2507508476
  173 8.254058699 172.31.22.196 → 153.90.129.147 SSH 190 Server: Encrypted packet (len=124)
  174 8.266938139 35.165.72.110 → 172.31.22.196 TCP 66 9092 → 56964 [FIN, ACK] Seq=447 Ack=186 Win=26848 Len=0 TSval=2507508510 TSecr=3604461326
  175 8.282021412 172.31.22.196 → 35.165.72.110 TCP 66 56964 → 9092 [ACK] Seq=186 Ack=448 Win=28032 Len=0 TSval=3604461358 TSecr=2507508510
  176 8.297750746 153.90.129.147 → 172.31.22.196 TCP 66 47814 → 22 [ACK] Seq=357 Ack=1333 Win=537 Len=0 TSval=2192893324 TSecr=3330234138
  177 8.297767091 153.90.129.147 → 172.31.22.196 TCP 66 47814 → 22 [ACK] Seq=357 Ack=1369 Win=537 Len=0 TSval=2192893324 TSecr=3330234138
  178 8.302955277 153.90.129.147 → 172.31.22.196 TCP 66 47814 → 22 [ACK] Seq=357 Ack=1493 Win=537 Len=0 TSval=2192893330 TSecr=3330234143
  179 8.593176785 153.90.129.147 → 172.31.22.196 SSH 110 Client: Encrypted packet (len=44)
  180 8.608452951 172.31.22.196 → 153.90.129.147 SSH 126 Server: Encrypted packet (len=60)
  181 8.657427823 153.90.129.147 → 172.31.22.196 TCP 66 47814 → 22 [ACK] Seq=401 Ack=1553 Win=537 Len=0 TSval=2192893684 TSecr=3330234497
  182 8.711127302 172.31.22.196 → 153.90.129.147 SSH 110 Server: Encrypted packet (len=44)
  183 8.760230495 153.90.129.147 → 172.31.22.196 TCP 66 47732 → 22 [ACK] Seq=1 Ack=1193 Win=1021 Len=0 TSval=2192893787 TSecr=3330234600
  184 8.849095970 153.90.129.147 → 172.31.22.196 SSH 102 Client: Encrypted packet (len=36)
  185 8.864308382 172.31.22.196 → 153.90.129.147 SSH 102 Server: Encrypted packet (len=36)
  186 8.889915472 172.31.22.196 → 35.165.72.110 TCP 74 56966 → 9092 [SYN] Seq=0 Win=26883 Len=0 MSS=8961 SACK_PERM=1 TSval=3604461966 TSecr=0 WS=128
  187 8.905918183 35.165.72.110 → 172.31.22.196 TCP 74 9092 → 56966 [SYN, ACK] Seq=0 Ack=1 Win=26847 Len=0 MSS=1460 SACK_PERM=1 TSval=2507509149 TSecr=3604461966 WS=2
  188 8.913173929 153.90.129.147 → 172.31.22.196 TCP 66 47814 → 22 [ACK] Seq=437 Ack=1589 Win=537 Len=0 TSval=2192893940 TSecr=3330234753
  189 8.921028173 172.31.22.196 → 35.165.72.110 TCP 66 56966 → 9092 [ACK] Seq=1 Ack=1 Win=27008 Len=0 TSval=3604461997 TSecr=2507509149
  190 9.207875383 172.31.22.196 → 35.165.72.110 TCP 91 56966 → 9092 [PSH, ACK] Seq=1 Ack=1 Win=27008 Len=25 TSval=3604461997 TSecr=2507509149
  191 9.222954373 172.31.22.196 → 153.90.129.147 SSH 110 Server: Encrypted packet (len=44)
  192 9.223844269 35.165.72.110 → 172.31.22.196 TCP 66 9092 → 56966 [ACK] Seq=1 Ack=26 Win=26848 Len=0 TSval=2507509467 TSecr=3604461997
  193 9.224213392 172.31.22.196 → 35.165.72.110 TCP 91 [TCP Spurious Retransmission] 56966 → 9092 [PSH, ACK] Seq=1 Ack=1 Win=27008 Len=25 TSval=3604462300 TSecr=2507509149
  194 9.224443694 35.165.72.110 → 172.31.22.196 SMPP 344 SMPP Bind_receiver
  195 9.239540775 172.31.22.196 → 35.165.72.110 TCP 66 56966 → 9092 [ACK] Seq=26 Ack=279 Win=28032 Len=0 TSval=3604462315 TSecr=2507509467
  196 9.240128696 35.165.72.110 → 172.31.22.196 TCP 78 [TCP Dup ACK 192#1] 9092 → 56966 [ACK] Seq=279 Ack=26 Win=26848 Len=0 TSval=2507509483 TSecr=3604462300 SLE=1 SRE=26
  197 9.271787388 153.90.129.147 → 172.31.22.196 TCP 66 47732 → 22 [ACK] Seq=1 Ack=1237 Win=1021 Len=0 TSval=2192894298 TSecr=3330235112
  198 9.719964376 172.31.22.196 → 35.165.72.110 TCP 99 56966 → 9092 [PSH, ACK] Seq=26 Ack=279 Win=28032 Len=33 TSval=3604462315 TSecr=2507509467
  199 9.735061879 172.31.22.196 → 153.90.129.147 SSH 110 Server: Encrypted packet (len=44)
  200 9.735958257 35.165.72.110 → 172.31.22.196 TCP 66 9092 → 56966 [ACK] Seq=279 Ack=59 Win=26848 Len=0 TSval=2507509979 TSecr=3604462315
  201 9.736837893 35.165.72.110 → 172.31.22.196 TCP 176 9092 → 56966 [PSH, ACK] Seq=279 Ack=59 Win=26848 Len=110 TSval=2507509980 TSecr=3604462315
  202 9.752089988 172.31.22.196 → 35.165.72.110 SMPP 192 SMPP Replace_sm
  203 9.769498690 35.165.72.110 → 172.31.22.196 SMPP 124 SMPP Query_sm
  204 9.784041205 153.90.129.147 → 172.31.22.196 TCP 66 47732 → 22 [ACK] Seq=1 Ack=1281 Win=1021 Len=0 TSval=2192894811 TSecr=3330235624
  205 9.784738206 172.31.22.196 → 153.90.129.147 SSH 126 Server: Encrypted packet (len=60)
  206 9.784743621 172.31.22.196 → 153.90.129.147 SSH 102 Server: Encrypted packet (len=36)
  207 9.786627420 172.31.22.196 → 35.165.72.110 TCP 66 56966 → 9092 [FIN, ACK] Seq=185 Ack=447 Win=28032 Len=0 TSval=3604462862 TSecr=2507510012
  208 9.789954211 172.31.22.196 → 153.90.129.147 SSH 190 Server: Encrypted packet (len=124)
  209 9.802752772 35.165.72.110 → 172.31.22.196 TCP 66 9092 → 56966 [FIN, ACK] Seq=447 Ack=186 Win=26848 Len=0 TSval=2507510046 TSecr=3604462862
  210 9.817852017 172.31.22.196 → 35.165.72.110 TCP 66 56966 → 9092 [ACK] Seq=186 Ack=448 Win=28032 Len=0 TSval=3604462893 TSecr=2507510046
  211 9.833682477 153.90.129.147 → 172.31.22.196 TCP 66 47814 → 22 [ACK] Seq=437 Ack=1649 Win=537 Len=0 TSval=2192894860 TSecr=3330235673
  212 9.833692114 153.90.129.147 → 172.31.22.196 TCP 66 47814 → 22 [ACK] Seq=437 Ack=1685 Win=537 Len=0 TSval=2192894860 TSecr=3330235673
  213 9.838975463 153.90.129.147 → 172.31.22.196 TCP 66 47814 → 22 [ACK] Seq=437 Ack=1809 Win=537 Len=0 TSval=2192894866 TSecr=3330235679
  214 10.113340282 153.90.129.147 → 172.31.22.196 SSH 110 Client: Encrypted packet (len=44)
  215 10.128727511 172.31.22.196 → 153.90.129.147 SSH 126 Server: Encrypted packet (len=60)
  216 10.177648351 153.90.129.147 → 172.31.22.196 TCP 66 47814 → 22 [ACK] Seq=481 Ack=1869 Win=537 Len=0 TSval=2192895204 TSecr=3330236017
  217 10.247155883 172.31.22.196 → 153.90.129.147 SSH 110 Server: Encrypted packet (len=44)
  218 10.296148174 153.90.129.147 → 172.31.22.196 TCP 66 47732 → 22 [ACK] Seq=1 Ack=1325 Win=1021 Len=0 TSval=2192895323 TSecr=3330236136
  219 10.353242781 153.90.129.147 → 172.31.22.196 SSH 102 Client: Encrypted packet (len=36)
  220 10.368414252 172.31.22.196 → 153.90.129.147 SSH 102 Server: Encrypted packet (len=36)
  221 10.394218501 172.31.22.196 → 35.165.72.110 TCP 74 56968 → 9092 [SYN] Seq=0 Win=26883 Len=0 MSS=8961 SACK_PERM=1 TSval=3604463470 TSecr=0 WS=128
  222 10.410210402 35.165.72.110 → 172.31.22.196 TCP 74 9092 → 56968 [SYN, ACK] Seq=0 Ack=1 Win=26847 Len=0 MSS=1460 SACK_PERM=1 TSval=2507510653 TSecr=3604463470 WS=2
  223 10.417184574 153.90.129.147 → 172.31.22.196 TCP 66 47814 → 22 [ACK] Seq=517 Ack=1905 Win=537 Len=0 TSval=2192895444 TSecr=3330236257
  224 10.425317816 172.31.22.196 → 35.165.72.110 TCP 66 56968 → 9092 [ACK] Seq=1 Ack=1 Win=27008 Len=0 TSval=3604463501 TSecr=2507510653
  225 10.743872743 172.31.22.196 → 35.165.72.110 TCP 91 56968 → 9092 [PSH, ACK] Seq=1 Ack=1 Win=27008 Len=25 TSval=3604463501 TSecr=2507510653
  226 10.758937078 172.31.22.196 → 153.90.129.147 SSH 110 Server: Encrypted packet (len=44)
  227 10.759838408 35.165.72.110 → 172.31.22.196 TCP 66 9092 → 56968 [ACK] Seq=1 Ack=26 Win=26848 Len=0 TSval=2507511003 TSecr=3604463501
  228 10.760433874 35.165.72.110 → 172.31.22.196 SMPP 344 SMPP Bind_receiver
  229 10.775527605 172.31.22.196 → 35.165.72.110 TCP 66 56968 → 9092 [ACK] Seq=26 Ack=279 Win=28032 Len=0 TSval=3604463851 TSecr=2507511003
  230 10.807820593 153.90.129.147 → 172.31.22.196 TCP 66 47732 → 22 [ACK] Seq=1 Ack=1369 Win=1021 Len=0 TSval=2192895834 TSecr=3330236648
  231 11.255877686 172.31.22.196 → 35.165.72.110 TCP 99 56968 → 9092 [PSH, ACK] Seq=26 Ack=279 Win=28032 Len=33 TSval=3604463851 TSecr=2507511003
  232 11.270960846 172.31.22.196 → 153.90.129.147 SSH 110 Server: Encrypted packet (len=44)
  233 11.272841935 35.165.72.110 → 172.31.22.196 TCP 176 9092 → 56968 [PSH, ACK] Seq=279 Ack=59 Win=26848 Len=110 TSval=2507511516 TSecr=3604463851
  234 11.288101699 172.31.22.196 → 35.165.72.110 SMPP 192 SMPP Replace_sm
  235 11.305446334 35.165.72.110 → 172.31.22.196 SMPP 124 SMPP Query_sm
  236 11.319845654 153.90.129.147 → 172.31.22.196 TCP 66 47732 → 22 [ACK] Seq=1 Ack=1413 Win=1021 Len=0 TSval=2192896346 TSecr=3330237160
  237 11.320721777 172.31.22.196 → 153.90.129.147 SSH 126 Server: Encrypted packet (len=60)
  238 11.320727253 172.31.22.196 → 153.90.129.147 SSH 102 Server: Encrypted packet (len=36)
  239 11.322717391 172.31.22.196 → 35.165.72.110 TCP 66 56968 → 9092 [FIN, ACK] Seq=185 Ack=447 Win=28032 Len=0 TSval=3604464398 TSecr=2507511548
  240 11.326030253 172.31.22.196 → 153.90.129.147 SSH 190 Server: Encrypted packet (len=124)
  241 11.338824845 35.165.72.110 → 172.31.22.196 TCP 66 9092 → 56968 [FIN, ACK] Seq=447 Ack=186 Win=26848 Len=0 TSval=2507511582 TSecr=3604464398
  242 11.353938695 172.31.22.196 → 35.165.72.110 TCP 66 56968 → 9092 [ACK] Seq=186 Ack=448 Win=28032 Len=0 TSval=3604464430 TSecr=2507511582
  243 11.369575229 153.90.129.147 → 172.31.22.196 TCP 66 47814 → 22 [ACK] Seq=517 Ack=1965 Win=537 Len=0 TSval=2192896396 TSecr=3330237209
  244 11.369586175 153.90.129.147 → 172.31.22.196 TCP 66 47814 → 22 [ACK] Seq=517 Ack=2001 Win=537 Len=0 TSval=2192896396 TSecr=3330237209
  245 11.374992354 153.90.129.147 → 172.31.22.196 TCP 66 47814 → 22 [ACK] Seq=517 Ack=2125 Win=537 Len=0 TSval=2192896402 TSecr=3330237215
  246 11.633231555 153.90.129.147 → 172.31.22.196 SSH 110 Client: Encrypted packet (len=44)
  247 11.648503126 172.31.22.196 → 153.90.129.147 SSH 126 Server: Encrypted packet (len=60)
  248 11.697376100 153.90.129.147 → 172.31.22.196 TCP 66 47814 → 22 [ACK] Seq=561 Ack=2185 Win=537 Len=0 TSval=2192896724 TSecr=3330237537
  249 11.783097022 172.31.22.196 → 153.90.129.147 SSH 110 Server: Encrypted packet (len=44)
  250 11.832005518 153.90.129.147 → 172.31.22.196 TCP 66 47732 → 22 [ACK] Seq=1 Ack=1457 Win=1021 Len=0 TSval=2192896859 TSecr=3330237672
  251 11.889077354 153.90.129.147 → 172.31.22.196 SSH 102 Client: Encrypted packet (len=36)
  252 11.904290199 172.31.22.196 → 153.90.129.147 SSH 102 Server: Encrypted packet (len=36)
  253 11.930032525 172.31.22.196 → 35.165.72.110 TCP 74 56970 → 9092 [SYN] Seq=0 Win=26883 Len=0 MSS=8961 SACK_PERM=1 TSval=3604465006 TSecr=0 WS=128
  254 11.945994355 35.165.72.110 → 172.31.22.196 TCP 74 9092 → 56970 [SYN, ACK] Seq=0 Ack=1 Win=26847 Len=0 MSS=1460 SACK_PERM=1 TSval=2507512189 TSecr=3604465006 WS=2
  255 11.953292969 153.90.129.147 → 172.31.22.196 TCP 66 47814 → 22 [ACK] Seq=597 Ack=2221 Win=537 Len=0 TSval=2192896980 TSecr=3330237793
  256 11.961085721 172.31.22.196 → 35.165.72.110 TCP 66 56970 → 9092 [ACK] Seq=1 Ack=1 Win=27008 Len=0 TSval=3604465037 TSecr=2507512189
  257 12.279839894 172.31.22.196 → 35.165.72.110 TCP 91 56970 → 9092 [PSH, ACK] Seq=1 Ack=1 Win=27008 Len=25 TSval=3604465037 TSecr=2507512189
  258 12.294922689 172.31.22.196 → 153.90.129.147 SSH 110 Server: Encrypted packet (len=44)
  259 12.295869332 35.165.72.110 → 172.31.22.196 TCP 66 9092 → 56970 [ACK] Seq=1 Ack=26 Win=26848 Len=0 TSval=2507512539 TSecr=3604465037
  260 12.297731613 35.165.72.110 → 172.31.22.196 SMPP 344 SMPP Bind_receiver
  261 12.312830422 172.31.22.196 → 35.165.72.110 TCP 66 56970 → 9092 [ACK] Seq=26 Ack=279 Win=28032 Len=0 TSval=3604465388 TSecr=2507512541
  262 12.343836052 153.90.129.147 → 172.31.22.196 TCP 66 47732 → 22 [ACK] Seq=1 Ack=1501 Win=1021 Len=0 TSval=2192897370 TSecr=3330238184
  263 12.791861715 172.31.22.196 → 35.165.72.110 TCP 99 56970 → 9092 [PSH, ACK] Seq=26 Ack=279 Win=28032 Len=33 TSval=3604465389 TSecr=2507512541
  264 12.806947502 172.31.22.196 → 153.90.129.147 SSH 110 Server: Encrypted packet (len=44)
  265 12.808785947 35.165.72.110 → 172.31.22.196 TCP 176 9092 → 56970 [PSH, ACK] Seq=279 Ack=59 Win=26848 Len=110 TSval=2507513052 TSecr=3604465389
  266 12.824027484 172.31.22.196 → 35.165.72.110 SMPP 192 SMPP Replace_sm
  267 12.841456876 35.165.72.110 → 172.31.22.196 SMPP 124 SMPP Query_sm
  268 12.855961717 153.90.129.147 → 172.31.22.196 TCP 66 47732 → 22 [ACK] Seq=1 Ack=1545 Win=1021 Len=0 TSval=2192897883 TSecr=3330238696
  269 12.856735218 172.31.22.196 → 153.90.129.147 SSH 126 Server: Encrypted packet (len=60)
  270 12.856741260 172.31.22.196 → 153.90.129.147 SSH 102 Server: Encrypted packet (len=36)
  271 12.858724328 172.31.22.196 → 35.165.72.110 TCP 66 56970 → 9092 [FIN, ACK] Seq=185 Ack=447 Win=28032 Len=0 TSval=3604465934 TSecr=2507513084
  272 12.862083459 172.31.22.196 → 153.90.129.147 SSH 190 Server: Encrypted packet (len=124)
  273 12.874955436 35.165.72.110 → 172.31.22.196 TCP 66 9092 → 56970 [FIN, ACK] Seq=447 Ack=186 Win=26848 Len=0 TSval=2507513118 TSecr=3604465934
  274 12.890082745 172.31.22.196 → 35.165.72.110 TCP 66 56970 → 9092 [ACK] Seq=186 Ack=448 Win=28032 Len=0 TSval=3604465966 TSecr=2507513118
  275 12.905660785 153.90.129.147 → 172.31.22.196 TCP 66 47814 → 22 [ACK] Seq=597 Ack=2281 Win=537 Len=0 TSval=2192897932 TSecr=3330238745
  276 12.905676332 153.90.129.147 → 172.31.22.196 TCP 66 47814 → 22 [ACK] Seq=597 Ack=2317 Win=537 Len=0 TSval=2192897932 TSecr=3330238745
  277 12.911002978 153.90.129.147 → 172.31.22.196 TCP 66 47814 → 22 [ACK] Seq=597 Ack=2441 Win=537 Len=0 TSval=2192897937 TSecr=3330238751
  278 13.153414937 153.90.129.147 → 172.31.22.196 SSH 110 Client: Encrypted packet (len=44)
  279 13.168676410 172.31.22.196 → 153.90.129.147 SSH 126 Server: Encrypted packet (len=60)
  280 13.217631169 153.90.129.147 → 172.31.22.196 TCP 66 47814 → 22 [ACK] Seq=641 Ack=2501 Win=537 Len=0 TSval=2192898244 TSecr=3330239057
  281 13.319113225 172.31.22.196 → 153.90.129.147 SSH 110 Server: Encrypted packet (len=44)
  282 13.367957723 153.90.129.147 → 172.31.22.196 TCP 66 47732 → 22 [ACK] Seq=1 Ack=1589 Win=1021 Len=0 TSval=2192898395 TSecr=3330239208
  283 13.377139402 153.90.129.147 → 172.31.22.196 SSH 102 Client: Encrypted packet (len=36)
  284 13.392340528 172.31.22.196 → 153.90.129.147 SSH 102 Server: Encrypted packet (len=36)
  285 13.418356886 172.31.22.196 → 35.165.72.110 TCP 74 56972 → 9092 [SYN] Seq=0 Win=26883 Len=0 MSS=8961 SACK_PERM=1 TSval=3604466494 TSecr=0 WS=128
  286 13.434391424 35.165.72.110 → 172.31.22.196 TCP 74 9092 → 56972 [SYN, ACK] Seq=0 Ack=1 Win=26847 Len=0 MSS=1460 SACK_PERM=1 TSval=2507513677 TSecr=3604466494 WS=2
  287 13.441251820 153.90.129.147 → 172.31.22.196 TCP 66 47814 → 22 [ACK] Seq=677 Ack=2537 Win=537 Len=0 TSval=2192898468 TSecr=3330239281
  288 13.449510187 172.31.22.196 → 35.165.72.110 TCP 66 56972 → 9092 [ACK] Seq=1 Ack=1 Win=27008 Len=0 TSval=3604466525 TSecr=2507513677
  289 13.815873602 172.31.22.196 → 35.165.72.110 TCP 91 56972 → 9092 [PSH, ACK] Seq=1 Ack=1 Win=27008 Len=25 TSval=3604466525 TSecr=2507513677
  290 13.830955069 172.31.22.196 → 153.90.129.147 SSH 110 Server: Encrypted packet (len=44)
  291 13.831833761 35.165.72.110 → 172.31.22.196 TCP 66 9092 → 56972 [ACK] Seq=1 Ack=26 Win=26848 Len=0 TSval=2507514075 TSecr=3604466525
  292 13.833512458 35.165.72.110 → 172.31.22.196 SMPP 344 SMPP Bind_receiver
  293 13.848607218 172.31.22.196 → 35.165.72.110 TCP 66 56972 → 9092 [ACK] Seq=26 Ack=279 Win=28032 Len=0 TSval=3604466924 TSecr=2507514076
  294 13.879927067 153.90.129.147 → 172.31.22.196 TCP 66 47732 → 22 [ACK] Seq=1 Ack=1633 Win=1021 Len=0 TSval=2192898906 TSecr=3330239720
  295 14.327872648 172.31.22.196 → 35.165.72.110 TCP 99 56972 → 9092 [PSH, ACK] Seq=26 Ack=279 Win=28032 Len=33 TSval=3604466924 TSecr=2507514076
  296 14.342956083 172.31.22.196 → 153.90.129.147 SSH 110 Server: Encrypted packet (len=44)
  297 14.345188631 35.165.72.110 → 172.31.22.196 TCP 176 9092 → 56972 [PSH, ACK] Seq=279 Ack=59 Win=26848 Len=110 TSval=2507514588 TSecr=3604466924
  298 14.348232772 172.31.22.196 → 35.165.72.110 TCP 99 [TCP Spurious Retransmission] 56972 → 9092 [PSH, ACK] Seq=26 Ack=279 Win=28032 Len=33 TSval=3604467424 TSecr=2507514076
  299 14.360421391 172.31.22.196 → 35.165.72.110 SMPP 192 SMPP Replace_sm
  300 14.364204972 35.165.72.110 → 172.31.22.196 TCP 78 [TCP Dup ACK 297#1] 9092 → 56972 [ACK] Seq=389 Ack=59 Win=26848 Len=0 TSval=2507514607 TSecr=3604467424 SLE=26 SRE=59
  301 14.376407461 35.165.72.110 → 172.31.22.196 TCP 66 9092 → 56972 [ACK] Seq=389 Ack=185 Win=26848 Len=0 TSval=2507514619 TSecr=3604467436
  302 14.378333170 35.165.72.110 → 172.31.22.196 SMPP 124 SMPP Query_sm
  303 14.391930611 153.90.129.147 → 172.31.22.196 TCP 66 47732 → 22 [ACK] Seq=1 Ack=1677 Win=1021 Len=0 TSval=2192899418 TSecr=3330240232
  304 14.393593439 172.31.22.196 → 153.90.129.147 SSH 126 Server: Encrypted packet (len=60)
  305 14.393599610 172.31.22.196 → 153.90.129.147 SSH 102 Server: Encrypted packet (len=36)
  306 14.395526671 172.31.22.196 → 35.165.72.110 TCP 66 56972 → 9092 [FIN, ACK] Seq=185 Ack=447 Win=28032 Len=0 TSval=3604467471 TSecr=2507514621
  307 14.398856442 172.31.22.196 → 153.90.129.147 SSH 190 Server: Encrypted packet (len=124)
  308 14.411685033 35.165.72.110 → 172.31.22.196 TCP 66 9092 → 56972 [FIN, ACK] Seq=447 Ack=186 Win=26848 Len=0 TSval=2507514654 TSecr=3604467471
  309 14.426796969 172.31.22.196 → 35.165.72.110 TCP 66 56972 → 9092 [ACK] Seq=186 Ack=448 Win=28032 Len=0 TSval=3604467502 TSecr=2507514654
  310 14.442507916 153.90.129.147 → 172.31.22.196 TCP 66 47814 → 22 [ACK] Seq=677 Ack=2597 Win=537 Len=0 TSval=2192899469 TSecr=3330240282
  311 14.442521361 153.90.129.147 → 172.31.22.196 TCP 66 47814 → 22 [ACK] Seq=677 Ack=2633 Win=537 Len=0 TSval=2192899469 TSecr=3330240282
  312 14.447725907 153.90.129.147 → 172.31.22.196 TCP 66 47814 → 22 [ACK] Seq=677 Ack=2757 Win=537 Len=0 TSval=2192899474 TSecr=3330240288
  313 14.689301488 153.90.129.147 → 172.31.22.196 SSH 110 Client: Encrypted packet (len=44)
  314 14.704566301 172.31.22.196 → 153.90.129.147 SSH 126 Server: Encrypted packet (len=60)
  315 14.753432531 153.90.129.147 → 172.31.22.196 TCP 66 47814 → 22 [ACK] Seq=721 Ack=2817 Win=537 Len=0 TSval=2192899780 TSecr=3330240593
  316 14.855200114 172.31.22.196 → 153.90.129.147 SSH 110 Server: Encrypted packet (len=44)
  317 14.904164669 153.90.129.147 → 172.31.22.196 TCP 66 47732 → 22 [ACK] Seq=1 Ack=1721 Win=1021 Len=0 TSval=2192899931 TSecr=3330240744
  318 14.929058213 153.90.129.147 → 172.31.22.196 SSH 102 Client: Encrypted packet (len=36)
  319 14.944246207 172.31.22.196 → 153.90.129.147 SSH 102 Server: Encrypted packet (len=36)
  320 14.970099076 172.31.22.196 → 35.165.72.110 TCP 74 56974 → 9092 [SYN] Seq=0 Win=26883 Len=0 MSS=8961 SACK_PERM=1 TSval=3604468046 TSecr=0 WS=128
  321 14.986090079 35.165.72.110 → 172.31.22.196 TCP 74 9092 → 56974 [SYN, ACK] Seq=0 Ack=1 Win=26847 Len=0 MSS=1460 SACK_PERM=1 TSval=2507515229 TSecr=3604468046 WS=2
  322 14.993100409 153.90.129.147 → 172.31.22.196 TCP 66 47814 → 22 [ACK] Seq=757 Ack=2853 Win=537 Len=0 TSval=2192900020 TSecr=3330240833
  323 15.001204227 172.31.22.196 → 35.165.72.110 TCP 66 56974 → 9092 [ACK] Seq=1 Ack=1 Win=27008 Len=0 TSval=3604468077 TSecr=2507515229
  324 15.351876514 172.31.22.196 → 35.165.72.110 TCP 91 56974 → 9092 [PSH, ACK] Seq=1 Ack=1 Win=27008 Len=25 TSval=3604468077 TSecr=2507515229
  325 15.366964808 172.31.22.196 → 153.90.129.147 SSH 110 Server: Encrypted packet (len=44)
  326 15.367933595 35.165.72.110 → 172.31.22.196 TCP 66 9092 → 56974 [ACK] Seq=1 Ack=26 Win=26848 Len=0 TSval=2507515611 TSecr=3604468077
  327 15.368512965 35.165.72.110 → 172.31.22.196 SMPP 344 SMPP Bind_receiver
  328 15.383587396 172.31.22.196 → 35.165.72.110 TCP 66 56974 → 9092 [ACK] Seq=26 Ack=279 Win=28032 Len=0 TSval=3604468459 TSecr=2507515611
  329 15.383596092 172.31.22.196 → 35.165.72.110 TCP 99 56974 → 9092 [PSH, ACK] Seq=26 Ack=279 Win=28032 Len=33 TSval=3604468459 TSecr=2507515611
  330 15.400634698 35.165.72.110 → 172.31.22.196 TCP 176 9092 → 56974 [PSH, ACK] Seq=279 Ack=59 Win=26848 Len=110 TSval=2507515643 TSecr=3604468459
  331 15.415912447 172.31.22.196 → 35.165.72.110 SMPP 192 SMPP Replace_sm
  332 15.415922487 153.90.129.147 → 172.31.22.196 TCP 66 47732 → 22 [ACK] Seq=1 Ack=1765 Win=1021 Len=0 TSval=2192900442 TSecr=3330241256
  333 15.433265359 35.165.72.110 → 172.31.22.196 SMPP 124 SMPP Query_sm
  334 15.448522129 172.31.22.196 → 153.90.129.147 SSH 126 Server: Encrypted packet (len=60)
  335 15.448527994 172.31.22.196 → 153.90.129.147 SSH 102 Server: Encrypted packet (len=36)
  336 15.450476905 172.31.22.196 → 35.165.72.110 TCP 66 56974 → 9092 [FIN, ACK] Seq=185 Ack=447 Win=28032 Len=0 TSval=3604468526 TSecr=2507515676
  337 15.453801387 172.31.22.196 → 153.90.129.147 SSH 190 Server: Encrypted packet (len=124)
  338 15.466874045 35.165.72.110 → 172.31.22.196 TCP 66 9092 → 56974 [FIN, ACK] Seq=447 Ack=186 Win=26848 Len=0 TSval=2507515710 TSecr=3604468526
  339 15.481987130 172.31.22.196 → 35.165.72.110 TCP 66 56974 → 9092 [ACK] Seq=186 Ack=448 Win=28032 Len=0 TSval=3604468558 TSecr=2507515710
  340 15.497421127 153.90.129.147 → 172.31.22.196 TCP 66 47814 → 22 [ACK] Seq=757 Ack=2913 Win=537 Len=0 TSval=2192900524 TSecr=3330241337
  341 15.497437271 153.90.129.147 → 172.31.22.196 TCP 66 47814 → 22 [ACK] Seq=757 Ack=2949 Win=537 Len=0 TSval=2192900524 TSecr=3330241337
  342 15.502766461 153.90.129.147 → 172.31.22.196 TCP 66 47814 → 22 [ACK] Seq=757 Ack=3073 Win=537 Len=0 TSval=2192900529 TSecr=3330241342
  343 15.879159164 172.31.22.196 → 153.90.129.147 SSH 110 Server: Encrypted packet (len=44)
  344 15.889458111 153.90.129.147 → 172.31.22.196 SSH 110 Client: Encrypted packet (len=44)
  345 15.904715472 172.31.22.196 → 153.90.129.147 SSH 126 Server: Encrypted packet (len=60)
  346 15.928096386 153.90.129.147 → 172.31.22.196 TCP 66 47732 → 22 [ACK] Seq=1 Ack=1809 Win=1021 Len=0 TSval=2192900955 TSecr=3330241768
  347 15.953892392 153.90.129.147 → 172.31.22.196 TCP 66 47814 → 22 [ACK] Seq=801 Ack=3133 Win=537 Len=0 TSval=2192900980 TSecr=3330241793
  348 16.209176725 153.90.129.147 → 172.31.22.196 SSH 102 Client: Encrypted packet (len=36)
  349 16.224394867 172.31.22.196 → 153.90.129.147 SSH 102 Server: Encrypted packet (len=36)
  350 16.249898535 172.31.22.196 → 35.165.72.110 TCP 74 56976 → 9092 [SYN] Seq=0 Win=26883 Len=0 MSS=8961 SACK_PERM=1 TSval=3604469326 TSecr=0 WS=128
  351 16.265959765 35.165.72.110 → 172.31.22.196 TCP 74 9092 → 56976 [SYN, ACK] Seq=0 Ack=1 Win=26847 Len=0 MSS=1460 SACK_PERM=1 TSval=2507516509 TSecr=3604469326 WS=2
  352 16.273222568 153.90.129.147 → 172.31.22.196 TCP 66 47814 → 22 [ACK] Seq=837 Ack=3169 Win=537 Len=0 TSval=2192901300 TSecr=3330242113
  353 16.281073203 172.31.22.196 → 35.165.72.110 TCP 66 56976 → 9092 [ACK] Seq=1 Ack=1 Win=27008 Len=0 TSval=3604469357 TSecr=2507516509
  354 16.375801939 172.31.22.196 → 35.165.72.110 TCP 91 56976 → 9092 [PSH, ACK] Seq=1 Ack=1 Win=27008 Len=25 TSval=3604469357 TSecr=2507516509
  355 16.390911276 172.31.22.196 → 153.90.129.147 SSH 110 Server: Encrypted packet (len=44)
  356 16.392970929 35.165.72.110 → 172.31.22.196 TCP 66 9092 → 56976 [ACK] Seq=1 Ack=26 Win=26848 Len=0 TSval=2507516635 TSecr=3604469357
  357 16.392982448 35.165.72.110 → 172.31.22.196 SMPP 344 SMPP Bind_receiver
  358 16.408056045 172.31.22.196 → 35.165.72.110 TCP 66 56976 → 9092 [ACK] Seq=26 Ack=279 Win=28032 Len=0 TSval=3604469484 TSecr=2507516635
  359 16.408062265 172.31.22.196 → 35.165.72.110 TCP 99 56976 → 9092 [PSH, ACK] Seq=26 Ack=279 Win=28032 Len=33 TSval=3604469484 TSecr=2507516635
  360 16.425229093 35.165.72.110 → 172.31.22.196 TCP 176 9092 → 56976 [PSH, ACK] Seq=279 Ack=59 Win=26848 Len=110 TSval=2507516668 TSecr=3604469484
  361 16.439880804 153.90.129.147 → 172.31.22.196 TCP 66 47732 → 22 [ACK] Seq=1 Ack=1853 Win=1021 Len=0 TSval=2192901466 TSecr=3330242280
  362 16.440469596 172.31.22.196 → 35.165.72.110 SMPP 192 SMPP Replace_sm
  363 16.457850946 35.165.72.110 → 172.31.22.196 SMPP 124 SMPP Query_sm
  364 16.473162873 172.31.22.196 → 153.90.129.147 SSH 126 Server: Encrypted packet (len=60)
  365 16.473174499 172.31.22.196 → 153.90.129.147 SSH 102 Server: Encrypted packet (len=36)
  366 16.475191137 172.31.22.196 → 35.165.72.110 TCP 66 56976 → 9092 [FIN, ACK] Seq=185 Ack=447 Win=28032 Len=0 TSval=3604469551 TSecr=2507516701
  367 16.478489188 172.31.22.196 → 153.90.129.147 SSH 190 Server: Encrypted packet (len=124)
  368 16.491372729 35.165.72.110 → 172.31.22.196 TCP 66 9092 → 56976 [FIN, ACK] Seq=447 Ack=186 Win=26848 Len=0 TSval=2507516734 TSecr=3604469551
  369 16.506492120 172.31.22.196 → 35.165.72.110 TCP 66 56976 → 9092 [ACK] Seq=186 Ack=448 Win=28032 Len=0 TSval=3604469582 TSecr=2507516734
  370 16.522020086 153.90.129.147 → 172.31.22.196 TCP 66 47814 → 22 [ACK] Seq=837 Ack=3229 Win=537 Len=0 TSval=2192901549 TSecr=3330242362
  371 16.522031705 153.90.129.147 → 172.31.22.196 TCP 66 47814 → 22 [ACK] Seq=837 Ack=3265 Win=537 Len=0 TSval=2192901549 TSecr=3330242362
  372 16.527371427 153.90.129.147 → 172.31.22.196 TCP 66 47814 → 22 [ACK] Seq=837 Ack=3389 Win=537 Len=0 TSval=2192901554 TSecr=3330242367
  373 16.903249054 172.31.22.196 → 153.90.129.147 SSH 110 Server: Encrypted packet (len=44)
  374 16.952131434 153.90.129.147 → 172.31.22.196 TCP 66 47732 → 22 [ACK] Seq=1 Ack=1897 Win=1021 Len=0 TSval=2192901979 TSecr=3330242792
  375 17.153239074 153.90.129.147 → 172.31.22.196 SSH 110 Client: Encrypted packet (len=44)
  376 17.168508479 172.31.22.196 → 153.90.129.147 SSH 126 Server: Encrypted packet (len=60)
  377 17.217352312 153.90.129.147 → 172.31.22.196 TCP 66 47814 → 22 [ACK] Seq=881 Ack=3449 Win=537 Len=0 TSval=2192902244 TSecr=3330243057
  378 17.393231137 153.90.129.147 → 172.31.22.196 SSH 102 Client: Encrypted packet (len=36)
  379 17.408442750 172.31.22.196 → 153.90.129.147 SSH 102 Server: Encrypted packet (len=36)
  380 17.414778826 172.31.22.196 → 153.90.129.147 SSH 110 Server: Encrypted packet (len=44)
  381 17.434821091 172.31.22.196 → 35.165.72.110 TCP 74 56978 → 9092 [SYN] Seq=0 Win=26883 Len=0 MSS=8961 SACK_PERM=1 TSval=3604470510 TSecr=0 WS=128
  382 17.450802913 35.165.72.110 → 172.31.22.196 TCP 74 9092 → 56978 [SYN, ACK] Seq=0 Ack=1 Win=26847 Len=0 MSS=1460 SACK_PERM=1 TSval=2507517694 TSecr=3604470510 WS=2
  383 17.457311052 153.90.129.147 → 172.31.22.196 TCP 66 47814 → 22 [ACK] Seq=917 Ack=3485 Win=537 Len=0 TSval=2192902484 TSecr=3330243297
  384 17.463763473 153.90.129.147 → 172.31.22.196 TCP 66 47732 → 22 [ACK] Seq=1 Ack=1941 Win=1021 Len=0 TSval=2192902490 TSecr=3330243303
  385 17.465912742 172.31.22.196 → 35.165.72.110 TCP 66 56978 → 9092 [ACK] Seq=1 Ack=1 Win=27008 Len=0 TSval=3604470542 TSecr=2507517694
  386 17.911843419 172.31.22.196 → 35.165.72.110 TCP 91 56978 → 9092 [PSH, ACK] Seq=1 Ack=1 Win=27008 Len=25 TSval=3604470542 TSecr=2507517694
  387 17.926936444 172.31.22.196 → 153.90.129.147 SSH 110 Server: Encrypted packet (len=44)
  388 17.927831027 35.165.72.110 → 172.31.22.196 TCP 66 9092 → 56978 [ACK] Seq=1 Ack=26 Win=26848 Len=0 TSval=2507518171 TSecr=3604470542
  389 17.928405616 35.165.72.110 → 172.31.22.196 SMPP 344 SMPP Bind_receiver
  390 17.943535284 172.31.22.196 → 35.165.72.110 TCP 66 56978 → 9092 [ACK] Seq=26 Ack=279 Win=28032 Len=0 TSval=3604471019 TSecr=2507518171
  391 17.976074597 153.90.129.147 → 172.31.22.196 TCP 66 47732 → 22 [ACK] Seq=1 Ack=1985 Win=1021 Len=0 TSval=2192903002 TSecr=3330243816
  392 18.423867940 172.31.22.196 → 35.165.72.110 TCP 99 56978 → 9092 [PSH, ACK] Seq=26 Ack=279 Win=28032 Len=33 TSval=3604471019 TSecr=2507518171
  393 18.438955500 172.31.22.196 → 153.90.129.147 SSH 110 Server: Encrypted packet (len=44)
  394 18.441518736 35.165.72.110 → 172.31.22.196 TCP 176 9092 → 56978 [PSH, ACK] Seq=279 Ack=59 Win=26848 Len=110 TSval=2507518684 TSecr=3604471019
  395 18.456640132 172.31.22.196 → 35.165.72.110 TCP 99 56978 → 9092 [PSH, ACK] Seq=59 Ack=389 Win=28032 Len=33 TSval=3604471532 TSecr=2507518684
  396 18.473616176 35.165.72.110 → 172.31.22.196 SMPP 176 SMPP Query_sm
  397 18.487873842 153.90.129.147 → 172.31.22.196 TCP 66 47732 → 22 [ACK] Seq=1 Ack=2029 Win=1021 Len=0 TSval=2192903514 TSecr=3330244328
  398 18.488724953 172.31.22.196 → 35.165.72.110 SMPP 192 SMPP Replace_sm
  399 18.506541680 35.165.72.110 → 172.31.22.196 TCP 124 9092 → 56978 [PSH, ACK] Seq=499 Ack=218 Win=26848 Len=58 TSval=2507518749 TSecr=3604471564
  400 18.521833684 172.31.22.196 → 153.90.129.147 SSH 126 Server: Encrypted packet (len=60)
  401 18.521841344 172.31.22.196 → 153.90.129.147 SSH 102 Server: Encrypted packet (len=36)
  402 18.523736146 172.31.22.196 → 35.165.72.110 TCP 66 56978 → 9092 [FIN, ACK] Seq=218 Ack=557 Win=28032 Len=0 TSval=3604471599 TSecr=2507518749
  403 18.527056262 172.31.22.196 → 153.90.129.147 SSH 190 Server: Encrypted packet (len=124)
  404 18.539854511 35.165.72.110 → 172.31.22.196 TCP 66 9092 → 56978 [FIN, ACK] Seq=557 Ack=219 Win=26848 Len=0 TSval=2507518783 TSecr=3604471599
  405 18.554959311 172.31.22.196 → 35.165.72.110 TCP 66 56978 → 9092 [ACK] Seq=219 Ack=558 Win=28032 Len=0 TSval=3604471631 TSecr=2507518783
  406 18.570777892 153.90.129.147 → 172.31.22.196 TCP 66 47814 → 22 [ACK] Seq=917 Ack=3545 Win=537 Len=0 TSval=2192903597 TSecr=3330244411
  407 18.570794344 153.90.129.147 → 172.31.22.196 TCP 66 47814 → 22 [ACK] Seq=917 Ack=3581 Win=537 Len=0 TSval=2192903597 TSecr=3330244411
  408 18.575994515 153.90.129.147 → 172.31.22.196 TCP 66 47814 → 22 [ACK] Seq=917 Ack=3705 Win=537 Len=0 TSval=2192903603 TSecr=3330244416
  409 18.929550654 153.90.129.147 → 172.31.22.196 SSH 110 Client: Encrypted packet (len=44)
  410 18.944817286 172.31.22.196 → 153.90.129.147 SSH 126 Server: Encrypted packet (len=60)
  411 18.951120443 172.31.22.196 → 153.90.129.147 SSH 110 Server: Encrypted packet (len=44)
  412 18.993637696 153.90.129.147 → 172.31.22.196 TCP 66 47814 → 22 [ACK] Seq=961 Ack=3765 Win=537 Len=0 TSval=2192904020 TSecr=3330244834
  413 18.999991518 153.90.129.147 → 172.31.22.196 TCP 66 47732 → 22 [ACK] Seq=1 Ack=2073 Win=1021 Len=0 TSval=2192904026 TSecr=3330244840
  414 19.249197188 153.90.129.147 → 172.31.22.196 SSH 102 Client: Encrypted packet (len=36)
  415 19.264406381 172.31.22.196 → 153.90.129.147 SSH 102 Server: Encrypted packet (len=36)
  416 19.290336081 172.31.22.196 → 35.165.72.110 TCP 74 56980 → 9092 [SYN] Seq=0 Win=26883 Len=0 MSS=8961 SACK_PERM=1 TSval=3604472366 TSecr=0 WS=128
  417 19.306333569 35.165.72.110 → 172.31.22.196 TCP 74 9092 → 56980 [SYN, ACK] Seq=0 Ack=1 Win=26847 Len=0 MSS=1460 SACK_PERM=1 TSval=2507519549 TSecr=3604472366 WS=2
  418 19.313346975 153.90.129.147 → 172.31.22.196 TCP 66 47814 → 22 [ACK] Seq=997 Ack=3801 Win=537 Len=0 TSval=2192904340 TSecr=3330245153
  419 19.321445412 172.31.22.196 → 35.165.72.110 TCP 66 56980 → 9092 [ACK] Seq=1 Ack=1 Win=27008 Len=0 TSval=3604472397 TSecr=2507519549
  420 19.447823106 172.31.22.196 → 35.165.72.110 TCP 91 56980 → 9092 [PSH, ACK] Seq=1 Ack=1 Win=27008 Len=25 TSval=3604472397 TSecr=2507519549
  421 19.462910408 172.31.22.196 → 153.90.129.147 SSH 110 Server: Encrypted packet (len=44)
  422 19.463760618 35.165.72.110 → 172.31.22.196 TCP 66 9092 → 56980 [ACK] Seq=1 Ack=26 Win=26848 Len=0 TSval=2507519707 TSecr=3604472397
  423 19.464292825 35.165.72.110 → 172.31.22.196 SMPP 344 SMPP Bind_receiver
  424 19.479387122 172.31.22.196 → 35.165.72.110 TCP 66 56980 → 9092 [ACK] Seq=26 Ack=279 Win=28032 Len=0 TSval=3604472555 TSecr=2507519707
  425 19.511769630 153.90.129.147 → 172.31.22.196 TCP 66 47732 → 22 [ACK] Seq=1 Ack=2117 Win=1021 Len=0 TSval=2192904538 TSecr=3330245352
  426 19.959998386 172.31.22.196 → 35.165.72.110 TCP 99 56980 → 9092 [PSH, ACK] Seq=26 Ack=279 Win=28032 Len=33 TSval=3604472555 TSecr=2507519707
  427 19.975079305 172.31.22.196 → 153.90.129.147 SSH 110 Server: Encrypted packet (len=44)
  428 19.977043943 35.165.72.110 → 172.31.22.196 TCP 176 9092 → 56980 [PSH, ACK] Seq=279 Ack=59 Win=26848 Len=110 TSval=2507520220 TSecr=3604472555
  429 19.992299664 172.31.22.196 → 35.165.72.110 SMPP 192 SMPP Replace_sm
  430 20.009705270 35.165.72.110 → 172.31.22.196 SMPP 124 SMPP Query_sm
  431 20.024023268 153.90.129.147 → 172.31.22.196 TCP 66 47732 → 22 [ACK] Seq=1 Ack=2161 Win=1021 Len=0 TSval=2192905050 TSecr=3330245864
  432 20.025010089 172.31.22.196 → 153.90.129.147 SSH 126 Server: Encrypted packet (len=60)
  433 20.025015665 172.31.22.196 → 153.90.129.147 SSH 102 Server: Encrypted packet (len=36)
  434 20.027110929 172.31.22.196 → 35.165.72.110 TCP 66 56980 → 9092 [FIN, ACK] Seq=185 Ack=447 Win=28032 Len=0 TSval=3604473103 TSecr=2507520253
  435 20.030532061 172.31.22.196 → 153.90.129.147 SSH 190 Server: Encrypted packet (len=124)
  436 20.043218418 35.165.72.110 → 172.31.22.196 TCP 66 9092 → 56980 [FIN, ACK] Seq=447 Ack=186 Win=26848 Len=0 TSval=2507520286 TSecr=3604473103
  437 20.058326970 172.31.22.196 → 35.165.72.110 TCP 66 56980 → 9092 [ACK] Seq=186 Ack=448 Win=28032 Len=0 TSval=3604473134 TSecr=2507520286
  438 20.074129752 153.90.129.147 → 172.31.22.196 TCP 66 47814 → 22 [ACK] Seq=997 Ack=3861 Win=537 Len=0 TSval=2192905100 TSecr=3330245914
  439 20.074142358 153.90.129.147 → 172.31.22.196 TCP 66 47814 → 22 [ACK] Seq=997 Ack=3897 Win=537 Len=0 TSval=2192905100 TSecr=3330245914
  440 20.079569385 153.90.129.147 → 172.31.22.196 TCP 66 47814 → 22 [ACK] Seq=997 Ack=4021 Win=537 Len=0 TSval=2192905106 TSecr=3330245919
  441 20.487117835 172.31.22.196 → 153.90.129.147 SSH 110 Server: Encrypted packet (len=44)
  442 20.535990522 153.90.129.147 → 172.31.22.196 TCP 66 47732 → 22 [ACK] Seq=1 Ack=2205 Win=1021 Len=0 TSval=2192905562 TSecr=3330246376
  443 20.609318580 153.90.129.147 → 172.31.22.196 SSH 110 Client: Encrypted packet (len=44)
  444 20.624613210 172.31.22.196 → 153.90.129.147 SSH 126 Server: Encrypted packet (len=60)
  445 20.673613555 153.90.129.147 → 172.31.22.196 TCP 66 47814 → 22 [ACK] Seq=1041 Ack=4081 Win=537 Len=0 TSval=2192905700 TSecr=3330246513
  446 20.945115542 153.90.129.147 → 172.31.22.196 SSH 102 Client: Encrypted packet (len=36)
  447 20.960328879 172.31.22.196 → 153.90.129.147 SSH 102 Server: Encrypted packet (len=36)
  448 20.986655339 172.31.22.196 → 35.165.72.110 TCP 74 56982 → 9092 [SYN] Seq=0 Win=26883 Len=0 MSS=8961 SACK_PERM=1 TSval=3604474062 TSecr=0 WS=128
  449 20.998917283 172.31.22.196 → 153.90.129.147 SSH 110 Server: Encrypted packet (len=44)
  450 21.002641364 35.165.72.110 → 172.31.22.196 TCP 74 9092 → 56982 [SYN, ACK] Seq=0 Ack=1 Win=26847 Len=0 MSS=1460 SACK_PERM=1 TSval=2507521246 TSecr=3604474062 WS=2
  451 21.009203871 153.90.129.147 → 172.31.22.196 TCP 66 47814 → 22 [ACK] Seq=1077 Ack=4117 Win=537 Len=0 TSval=2192906036 TSecr=3330246849
  452 21.017753622 172.31.22.196 → 35.165.72.110 TCP 66 56982 → 9092 [ACK] Seq=1 Ack=1 Win=27008 Len=0 TSval=3604474093 TSecr=2507521246
  453 21.047957141 153.90.129.147 → 172.31.22.196 TCP 66 47732 → 22 [ACK] Seq=1 Ack=2249 Win=1021 Len=0 TSval=2192906074 TSecr=3330246888
  454 21.495872694 172.31.22.196 → 35.165.72.110 TCP 91 56982 → 9092 [PSH, ACK] Seq=1 Ack=1 Win=27008 Len=25 TSval=3604474094 TSecr=2507521246
  455 21.510954190 172.31.22.196 → 153.90.129.147 SSH 110 Server: Encrypted packet (len=44)
  456 21.511908301 35.165.72.110 → 172.31.22.196 TCP 66 9092 → 56982 [ACK] Seq=1 Ack=26 Win=26848 Len=0 TSval=2507521755 TSecr=3604474094
  457 21.512465241 35.165.72.110 → 172.31.22.196 SMPP 344 SMPP Bind_receiver
  458 21.527573090 172.31.22.196 → 35.165.72.110 TCP 66 56982 → 9092 [ACK] Seq=26 Ack=279 Win=28032 Len=0 TSval=3604474603 TSecr=2507521755
  459 21.559953497 153.90.129.147 → 172.31.22.196 TCP 66 47732 → 22 [ACK] Seq=1 Ack=2293 Win=1021 Len=0 TSval=2192906586 TSecr=3330247400
  460 22.007857849 172.31.22.196 → 35.165.72.110 TCP 99 56982 → 9092 [PSH, ACK] Seq=26 Ack=279 Win=28032 Len=33 TSval=3604474603 TSecr=2507521755
  461 22.022949371 172.31.22.196 → 153.90.129.147 SSH 110 Server: Encrypted packet (len=44)
  462 22.024729592 35.165.72.110 → 172.31.22.196 TCP 176 9092 → 56982 [PSH, ACK] Seq=279 Ack=59 Win=26848 Len=110 TSval=2507522268 TSecr=3604474603
  463 22.039836900 172.31.22.196 → 35.165.72.110 TCP 99 56982 → 9092 [PSH, ACK] Seq=59 Ack=389 Win=28032 Len=33 TSval=3604475116 TSecr=2507522268
  464 22.056811154 35.165.72.110 → 172.31.22.196 SMPP 176 SMPP Query_sm
  465 22.071820116 153.90.129.147 → 172.31.22.196 TCP 66 47732 → 22 [ACK] Seq=1 Ack=2337 Win=1021 Len=0 TSval=2192907098 TSecr=3330247912
  466 22.071900912 172.31.22.196 → 35.165.72.110 SMPP 192 SMPP Replace_sm
  467 22.089107514 35.165.72.110 → 172.31.22.196 TCP 124 9092 → 56982 [PSH, ACK] Seq=499 Ack=218 Win=26848 Len=58 TSval=2507522332 TSecr=3604475148
  468 22.104388045 172.31.22.196 → 153.90.129.147 SSH 126 Server: Encrypted packet (len=60)
  469 22.104395085 172.31.22.196 → 153.90.129.147 SSH 102 Server: Encrypted packet (len=36)
  470 22.106410344 172.31.22.196 → 35.165.72.110 TCP 66 56982 → 9092 [FIN, ACK] Seq=218 Ack=557 Win=28032 Len=0 TSval=3604475182 TSecr=2507522332
  471 22.109766032 172.31.22.196 → 153.90.129.147 SSH 190 Server: Encrypted packet (len=124)
  472 22.122537323 35.165.72.110 → 172.31.22.196 TCP 66 9092 → 56982 [FIN, ACK] Seq=557 Ack=219 Win=26848 Len=0 TSval=2507522365 TSecr=3604475182
  473 22.137658154 172.31.22.196 → 35.165.72.110 TCP 66 56982 → 9092 [ACK] Seq=219 Ack=558 Win=28032 Len=0 TSval=3604475213 TSecr=2507522365
  474 22.153272490 153.90.129.147 → 172.31.22.196 TCP 66 47814 → 22 [ACK] Seq=1077 Ack=4177 Win=537 Len=0 TSval=2192907180 TSecr=3330247993
  475 22.153284488 153.90.129.147 → 172.31.22.196 TCP 66 47814 → 22 [ACK] Seq=1077 Ack=4213 Win=537 Len=0 TSval=2192907180 TSecr=3330247993
  476 22.158707885 153.90.129.147 → 172.31.22.196 TCP 66 47814 → 22 [ACK] Seq=1077 Ack=4337 Win=537 Len=0 TSval=2192907185 TSecr=3330247998
  477 22.449383547 153.90.129.147 → 172.31.22.196 SSH 110 Client: Encrypted packet (len=44)
  478 22.464645251 172.31.22.196 → 153.90.129.147 SSH 126 Server: Encrypted packet (len=60)
  479 22.513592504 153.90.129.147 → 172.31.22.196 TCP 66 47814 → 22 [ACK] Seq=1121 Ack=4397 Win=537 Len=0 TSval=2192907540 TSecr=3330248353
  480 22.535133539 172.31.22.196 → 153.90.129.147 SSH 110 Server: Encrypted packet (len=44)
  481 22.584146586 153.90.129.147 → 172.31.22.196 TCP 66 47732 → 22 [ACK] Seq=1 Ack=2381 Win=1021 Len=0 TSval=2192907610 TSecr=3330248424
  482 22.753093997 153.90.129.147 → 172.31.22.196 SSH 102 Client: Encrypted packet (len=36)
  483 22.768310218 172.31.22.196 → 153.90.129.147 SSH 102 Server: Encrypted packet (len=36)
  484 22.794480431 172.31.22.196 → 35.165.72.110 TCP 74 56984 → 9092 [SYN] Seq=0 Win=26883 Len=0 MSS=8961 SACK_PERM=1 TSval=3604475870 TSecr=0 WS=128
  485 22.810530931 35.165.72.110 → 172.31.22.196 TCP 74 9092 → 56984 [SYN, ACK] Seq=0 Ack=1 Win=26847 Len=0 MSS=1460 SACK_PERM=1 TSval=2507523053 TSecr=3604475870 WS=2
  486 22.817385870 153.90.129.147 → 172.31.22.196 TCP 66 47814 → 22 [ACK] Seq=1157 Ack=4433 Win=537 Len=0 TSval=2192907844 TSecr=3330248657
  487 22.825645580 172.31.22.196 → 35.165.72.110 TCP 66 56984 → 9092 [ACK] Seq=1 Ack=1 Win=27008 Len=0 TSval=3604475901 TSecr=2507523053
  488 23.031828989 172.31.22.196 → 35.165.72.110 TCP 91 56984 → 9092 [PSH, ACK] Seq=1 Ack=1 Win=27008 Len=25 TSval=3604475901 TSecr=2507523053
  489 23.046915171 172.31.22.196 → 153.90.129.147 SSH 110 Server: Encrypted packet (len=44)
  490 23.047824868 35.165.72.110 → 172.31.22.196 TCP 66 9092 → 56984 [ACK] Seq=1 Ack=26 Win=26848 Len=0 TSval=2507523291 TSecr=3604475901
  491 23.048405005 35.165.72.110 → 172.31.22.196 SMPP 344 SMPP Bind_receiver
  492 23.063494399 172.31.22.196 → 35.165.72.110 TCP 66 56984 → 9092 [ACK] Seq=26 Ack=279 Win=28032 Len=0 TSval=3604476139 TSecr=2507523291
  493 23.098257772 153.90.129.147 → 172.31.22.196 TCP 66 47732 → 22 [ACK] Seq=1 Ack=2425 Win=1021 Len=0 TSval=2192908122 TSecr=3330248936
  494 23.543938006 172.31.22.196 → 35.165.72.110 TCP 99 56984 → 9092 [PSH, ACK] Seq=26 Ack=279 Win=28032 Len=33 TSval=3604476139 TSecr=2507523291
  495 23.559030375 172.31.22.196 → 153.90.129.147 SSH 110 Server: Encrypted packet (len=44)
  496 23.560820670 35.165.72.110 → 172.31.22.196 TCP 176 9092 → 56984 [PSH, ACK] Seq=279 Ack=59 Win=26848 Len=110 TSval=2507523804 TSecr=3604476139
  497 23.576055982 172.31.22.196 → 35.165.72.110 SMPP 192 SMPP Replace_sm
  498 23.593841029 35.165.72.110 → 172.31.22.196 SMPP 124 SMPP Query_sm
  499 23.607946481 153.90.129.147 → 172.31.22.196 TCP 66 47732 → 22 [ACK] Seq=1 Ack=2469 Win=1021 Len=0 TSval=2192908634 TSecr=3330249448
  500 23.609141512 172.31.22.196 → 153.90.129.147 SSH 126 Server: Encrypted packet (len=60)
  501 23.609147469 172.31.22.196 → 153.90.129.147 SSH 102 Server: Encrypted packet (len=36)
  502 23.611101786 172.31.22.196 → 35.165.72.110 TCP 66 56984 → 9092 [FIN, ACK] Seq=185 Ack=447 Win=28032 Len=0 TSval=3604476687 TSecr=2507523837
  503 23.614439647 172.31.22.196 → 153.90.129.147 SSH 190 Server: Encrypted packet (len=124)
  504 23.627241976 35.165.72.110 → 172.31.22.196 TCP 66 9092 → 56984 [FIN, ACK] Seq=447 Ack=186 Win=26848 Len=0 TSval=2507523870 TSecr=3604476687
  505 23.642368183 172.31.22.196 → 35.165.72.110 TCP 66 56984 → 9092 [ACK] Seq=186 Ack=448 Win=28032 Len=0 TSval=3604476718 TSecr=2507523870
  506 23.658193935 153.90.129.147 → 172.31.22.196 TCP 66 47814 → 22 [ACK] Seq=1157 Ack=4493 Win=537 Len=0 TSval=2192908685 TSecr=3330249498
  507 23.658211982 153.90.129.147 → 172.31.22.196 TCP 66 47814 → 22 [ACK] Seq=1157 Ack=4529 Win=537 Len=0 TSval=2192908685 TSecr=3330249498
  508 23.663307998 153.90.129.147 → 172.31.22.196 TCP 66 47814 → 22 [ACK] Seq=1157 Ack=4653 Win=537 Len=0 TSval=2192908690 TSecr=3330249503
  509 24.071159088 172.31.22.196 → 153.90.129.147 SSH 110 Server: Encrypted packet (len=44)
  510 24.097348242 153.90.129.147 → 172.31.22.196 SSH 110 Client: Encrypted packet (len=44)
  511 24.112618568 172.31.22.196 → 153.90.129.147 SSH 126 Server: Encrypted packet (len=60)
  512 24.120085451 153.90.129.147 → 172.31.22.196 TCP 66 47732 → 22 [ACK] Seq=1 Ack=2513 Win=1021 Len=0 TSval=2192909146 TSecr=3330249960
  513 24.161581958 153.90.129.147 → 172.31.22.196 TCP 66 47814 → 22 [ACK] Seq=1201 Ack=4713 Win=537 Len=0 TSval=2192909188 TSecr=3330250001
  514 24.417194583 153.90.129.147 → 172.31.22.196 SSH 102 Client: Encrypted packet (len=36)
  515 24.432400557 172.31.22.196 → 153.90.129.147 SSH 102 Server: Encrypted packet (len=36)
  516 24.458679372 172.31.22.196 → 35.165.72.110 TCP 74 56986 → 9092 [SYN] Seq=0 Win=26883 Len=0 MSS=8961 SACK_PERM=1 TSval=3604477534 TSecr=0 WS=128
  517 24.474650871 35.165.72.110 → 172.31.22.196 TCP 74 9092 → 56986 [SYN, ACK] Seq=0 Ack=1 Win=26847 Len=0 MSS=1460 SACK_PERM=1 TSval=2507524718 TSecr=3604477534 WS=2
  518 24.481324287 153.90.129.147 → 172.31.22.196 TCP 66 47814 → 22 [ACK] Seq=1237 Ack=4749 Win=537 Len=0 TSval=2192909508 TSecr=3330250321
  519 24.489768831 172.31.22.196 → 35.165.72.110 TCP 66 56986 → 9092 [ACK] Seq=1 Ack=1 Win=27008 Len=0 TSval=3604477565 TSecr=2507524718
  520 24.567833165 172.31.22.196 → 35.165.72.110 TCP 91 56986 → 9092 [PSH, ACK] Seq=1 Ack=1 Win=27008 Len=25 TSval=3604477566 TSecr=2507524718
  521 24.582917674 172.31.22.196 → 153.90.129.147 SSH 110 Server: Encrypted packet (len=44)
  522 24.583813946 35.165.72.110 → 172.31.22.196 TCP 66 9092 → 56986 [ACK] Seq=1 Ack=26 Win=26848 Len=0 TSval=2507524827 TSecr=3604477566
  523 24.584322572 35.165.72.110 → 172.31.22.196 SMPP 344 SMPP Bind_receiver
  524 24.599414919 172.31.22.196 → 35.165.72.110 TCP 66 56986 → 9092 [ACK] Seq=26 Ack=279 Win=28032 Len=0 TSval=3604477675 TSecr=2507524827
  525 24.631808991 153.90.129.147 → 172.31.22.196 TCP 66 47732 → 22 [ACK] Seq=1 Ack=2557 Win=1021 Len=0 TSval=2192909658 TSecr=3330250472
  526 25.079957986 172.31.22.196 → 35.165.72.110 TCP 99 56986 → 9092 [PSH, ACK] Seq=26 Ack=279 Win=28032 Len=33 TSval=3604477675 TSecr=2507524827
  527 25.095038969 172.31.22.196 → 153.90.129.147 SSH 110 Server: Encrypted packet (len=44)
  528 25.102019670 35.165.72.110 → 172.31.22.196 TCP 176 9092 → 56986 [PSH, ACK] Seq=279 Ack=59 Win=26848 Len=110 TSval=2507525344 TSecr=3604477675
  529 25.117291778 172.31.22.196 → 35.165.72.110 SMPP 192 SMPP Replace_sm
  530 25.138315022 35.165.72.110 → 172.31.22.196 SMPP 124 SMPP Query_sm
  531 25.143858106 153.90.129.147 → 172.31.22.196 TCP 66 47732 → 22 [ACK] Seq=1 Ack=2601 Win=1021 Len=0 TSval=2192910170 TSecr=3330250984
  532 25.153604631 172.31.22.196 → 153.90.129.147 SSH 126 Server: Encrypted packet (len=60)
  533 25.153610921 172.31.22.196 → 153.90.129.147 SSH 102 Server: Encrypted packet (len=36)
  534 25.155565270 172.31.22.196 → 35.165.72.110 TCP 66 56986 → 9092 [FIN, ACK] Seq=185 Ack=447 Win=28032 Len=0 TSval=3604478231 TSecr=2507525381
  535 25.158851781 172.31.22.196 → 153.90.129.147 SSH 190 Server: Encrypted packet (len=124)
  536 25.171689133 35.165.72.110 → 172.31.22.196 TCP 66 9092 → 56986 [FIN, ACK] Seq=447 Ack=186 Win=26848 Len=0 TSval=2507525415 TSecr=3604478231
  537 25.186805144 172.31.22.196 → 35.165.72.110 TCP 66 56986 → 9092 [ACK] Seq=186 Ack=448 Win=28032 Len=0 TSval=3604478263 TSecr=2507525415
  538 25.202519179 153.90.129.147 → 172.31.22.196 TCP 66 47814 → 22 [ACK] Seq=1237 Ack=4809 Win=537 Len=0 TSval=2192910229 TSecr=3330251042
  539 25.202534492 153.90.129.147 → 172.31.22.196 TCP 66 47814 → 22 [ACK] Seq=1237 Ack=4845 Win=537 Len=0 TSval=2192910229 TSecr=3330251042
  540 25.207603983 153.90.129.147 → 172.31.22.196 TCP 66 47814 → 22 [ACK] Seq=1237 Ack=4969 Win=537 Len=0 TSval=2192910234 TSecr=3330251048
  541 25.607109176 172.31.22.196 → 153.90.129.147 SSH 110 Server: Encrypted packet (len=44)
  542 25.649278050 153.90.129.147 → 172.31.22.196 SSH 110 Client: Encrypted packet (len=44)
  543 25.656114467 153.90.129.147 → 172.31.22.196 TCP 66 47732 → 22 [ACK] Seq=1 Ack=2645 Win=1021 Len=0 TSval=2192910682 TSecr=3330251496
  544 25.664538698 172.31.22.196 → 153.90.129.147 SSH 126 Server: Encrypted packet (len=60)
  545 25.713427287 153.90.129.147 → 172.31.22.196 TCP 66 47814 → 22 [ACK] Seq=1281 Ack=5029 Win=537 Len=0 TSval=2192910740 TSecr=3330251553
  546 25.985105339 153.90.129.147 → 172.31.22.196 SSH 102 Client: Encrypted packet (len=36)
  547 26.000314352 172.31.22.196 → 153.90.129.147 SSH 102 Server: Encrypted packet (len=36)
  548 26.026620026 172.31.22.196 → 35.165.72.110 TCP 74 56988 → 9092 [SYN] Seq=0 Win=26883 Len=0 MSS=8961 SACK_PERM=1 TSval=3604479102 TSecr=0 WS=128
  549 26.042674780 35.165.72.110 → 172.31.22.196 TCP 74 9092 → 56988 [SYN, ACK] Seq=0 Ack=1 Win=26847 Len=0 MSS=1460 SACK_PERM=1 TSval=2507526286 TSecr=3604479102 WS=2
  550 26.049130595 153.90.129.147 → 172.31.22.196 TCP 66 47814 → 22 [ACK] Seq=1317 Ack=5065 Win=537 Len=0 TSval=2192911076 TSecr=3330251889
  551 26.057785850 172.31.22.196 → 35.165.72.110 TCP 66 56988 → 9092 [ACK] Seq=1 Ack=1 Win=27008 Len=0 TSval=3604479134 TSecr=2507526286
  552 26.103790705 172.31.22.196 → 35.165.72.110 TCP 91 56988 → 9092 [PSH, ACK] Seq=1 Ack=1 Win=27008 Len=25 TSval=3604479134 TSecr=2507526286
  553 26.118870946 172.31.22.196 → 153.90.129.147 SSH 110 Server: Encrypted packet (len=44)
  554 26.119860947 35.165.72.110 → 172.31.22.196 TCP 66 9092 → 56988 [ACK] Seq=1 Ack=26 Win=26848 Len=0 TSval=2507526363 TSecr=3604479134
  555 26.120398719 35.165.72.110 → 172.31.22.196 SMPP 344 SMPP Bind_receiver
  556 26.135490269 172.31.22.196 → 35.165.72.110 TCP 66 56988 → 9092 [ACK] Seq=26 Ack=279 Win=28032 Len=0 TSval=3604479211 TSecr=2507526363
  557 26.167671247 153.90.129.147 → 172.31.22.196 TCP 66 47732 → 22 [ACK] Seq=1 Ack=2689 Win=1021 Len=0 TSval=2192911194 TSecr=3330252008
  558 26.615948582 172.31.22.196 → 35.165.72.110 TCP 99 56988 → 9092 [PSH, ACK] Seq=26 Ack=279 Win=28032 Len=33 TSval=3604479211 TSecr=2507526363
  559 26.631028801 172.31.22.196 → 153.90.129.147 SSH 110 Server: Encrypted packet (len=44)
  560 26.632836952 35.165.72.110 → 172.31.22.196 TCP 176 9092 → 56988 [PSH, ACK] Seq=279 Ack=59 Win=26848 Len=110 TSval=2507526876 TSecr=3604479211
  561 26.648100007 172.31.22.196 → 35.165.72.110 SMPP 192 SMPP Replace_sm
  562 26.665494420 35.165.72.110 → 172.31.22.196 SMPP 124 SMPP Query_sm
  563 26.679903140 153.90.129.147 → 172.31.22.196 TCP 66 47732 → 22 [ACK] Seq=1 Ack=2733 Win=1021 Len=0 TSval=2192911706 TSecr=3330252520
  564 26.680740272 172.31.22.196 → 153.90.129.147 SSH 126 Server: Encrypted packet (len=60)
  565 26.680745550 172.31.22.196 → 153.90.129.147 SSH 102 Server: Encrypted packet (len=36)
  566 26.682706528 172.31.22.196 → 35.165.72.110 TCP 66 56988 → 9092 [FIN, ACK] Seq=185 Ack=447 Win=28032 Len=0 TSval=3604479758 TSecr=2507526908
  567 26.686053531 172.31.22.196 → 153.90.129.147 SSH 190 Server: Encrypted packet (len=124)
  568 26.698760130 35.165.72.110 → 172.31.22.196 TCP 66 9092 → 56988 [FIN, ACK] Seq=447 Ack=186 Win=26848 Len=0 TSval=2507526942 TSecr=3604479758
  569 26.713894774 172.31.22.196 → 35.165.72.110 TCP 66 56988 → 9092 [ACK] Seq=186 Ack=448 Win=28032 Len=0 TSval=3604479790 TSecr=2507526942
  570 26.729660977 153.90.129.147 → 172.31.22.196 TCP 66 47814 → 22 [ACK] Seq=1317 Ack=5125 Win=537 Len=0 TSval=2192911756 TSecr=3330252569
  571 26.729686042 153.90.129.147 → 172.31.22.196 TCP 66 47814 → 22 [ACK] Seq=1317 Ack=5161 Win=537 Len=0 TSval=2192911756 TSecr=3330252569
  572 26.734836184 153.90.129.147 → 172.31.22.196 TCP 66 47814 → 22 [ACK] Seq=1317 Ack=5285 Win=537 Len=0 TSval=2192911761 TSecr=3330252575
  573 27.073905757 153.90.129.147 → 172.31.22.196 SSH 110 Client: Encrypted packet (len=44)
  574 27.089185635 172.31.22.196 → 153.90.129.147 SSH 126 Server: Encrypted packet (len=60)
  575 27.138042476 153.90.129.147 → 172.31.22.196 TCP 66 47814 → 22 [ACK] Seq=1361 Ack=5345 Win=537 Len=0 TSval=2192912164 TSecr=3330252978
  576 27.143129156 172.31.22.196 → 153.90.129.147 SSH 110 Server: Encrypted packet (len=44)
  577 27.192148968 153.90.129.147 → 172.31.22.196 TCP 66 47732 → 22 [ACK] Seq=1 Ack=2777 Win=1021 Len=0 TSval=2192912218 TSecr=3330253032
  578 27.349501234 153.90.129.147 → 172.31.22.196 SSH 102 Client: Encrypted packet (len=36)
  579 27.364710994 172.31.22.196 → 153.90.129.147 SSH 102 Server: Encrypted packet (len=36)
  580 27.390990596 172.31.22.196 → 35.165.72.110 TCP 74 56990 → 9092 [SYN] Seq=0 Win=26883 Len=0 MSS=8961 SACK_PERM=1 TSval=3604480467 TSecr=0 WS=128
  581 27.406945872 35.165.72.110 → 172.31.22.196 TCP 74 9092 → 56990 [SYN, ACK] Seq=0 Ack=1 Win=26847 Len=0 MSS=1460 SACK_PERM=1 TSval=2507527650 TSecr=3604480467 WS=2
  582 27.413594400 153.90.129.147 → 172.31.22.196 TCP 66 47814 → 22 [ACK] Seq=1397 Ack=5381 Win=537 Len=0 TSval=2192912440 TSecr=3330253253
  583 27.422058166 172.31.22.196 → 35.165.72.110 TCP 66 56990 → 9092 [ACK] Seq=1 Ack=1 Win=27008 Len=0 TSval=3604480498 TSecr=2507527650
  584 27.639824886 172.31.22.196 → 35.165.72.110 TCP 91 56990 → 9092 [PSH, ACK] Seq=1 Ack=1 Win=27008 Len=25 TSval=3604480498 TSecr=2507527650
  585 27.654911600 172.31.22.196 → 153.90.129.147 SSH 110 Server: Encrypted packet (len=44)
  586 27.655820441 35.165.72.110 → 172.31.22.196 TCP 66 9092 → 56990 [ACK] Seq=1 Ack=26 Win=26848 Len=0 TSval=2507527899 TSecr=3604480498
  587 27.656398961 35.165.72.110 → 172.31.22.196 SMPP 344 SMPP Bind_receiver
  588 27.671494114 172.31.22.196 → 35.165.72.110 TCP 66 56990 → 9092 [ACK] Seq=26 Ack=279 Win=28032 Len=0 TSval=3604480747 TSecr=2507527899
  589 27.703794679 153.90.129.147 → 172.31.22.196 TCP 66 47732 → 22 [ACK] Seq=1 Ack=2821 Win=1021 Len=0 TSval=2192912730 TSecr=3330253544
  590 28.151931174 172.31.22.196 → 35.165.72.110 TCP 99 56990 → 9092 [PSH, ACK] Seq=26 Ack=279 Win=28032 Len=33 TSval=3604480747 TSecr=2507527899
  591 28.167015772 172.31.22.196 → 153.90.129.147 SSH 110 Server: Encrypted packet (len=44)
  592 28.168767460 35.165.72.110 → 172.31.22.196 TCP 176 9092 → 56990 [PSH, ACK] Seq=279 Ack=59 Win=26848 Len=110 TSval=2507528412 TSecr=3604480747
  593 28.184015928 172.31.22.196 → 35.165.72.110 SMPP 192 SMPP Replace_sm
  594 28.201480082 35.165.72.110 → 172.31.22.196 SMPP 124 SMPP Query_sm
  595 28.215925171 153.90.129.147 → 172.31.22.196 TCP 66 47732 → 22 [ACK] Seq=1 Ack=2865 Win=1021 Len=0 TSval=2192913242 TSecr=3330254056
  596 28.216750929 172.31.22.196 → 153.90.129.147 SSH 126 Server: Encrypted packet (len=60)
  597 28.216756469 172.31.22.196 → 153.90.129.147 SSH 102 Server: Encrypted packet (len=36)
  598 28.218705090 172.31.22.196 → 35.165.72.110 TCP 66 56990 → 9092 [FIN, ACK] Seq=185 Ack=447 Win=28032 Len=0 TSval=3604481294 TSecr=2507528444
  599 28.222023239 172.31.22.196 → 153.90.129.147 SSH 190 Server: Encrypted packet (len=124)
  600 28.234825810 35.165.72.110 → 172.31.22.196 TCP 66 9092 → 56990 [FIN, ACK] Seq=447 Ack=186 Win=26848 Len=0 TSval=2507528478 TSecr=3604481294
  601 28.249914830 172.31.22.196 → 35.165.72.110 TCP 66 56990 → 9092 [ACK] Seq=186 Ack=448 Win=28032 Len=0 TSval=3604481326 TSecr=2507528478
  602 28.265579200 153.90.129.147 → 172.31.22.196 TCP 66 47814 → 22 [ACK] Seq=1397 Ack=5441 Win=537 Len=0 TSval=2192913292 TSecr=3330254105
  603 28.265602583 153.90.129.147 → 172.31.22.196 TCP 66 47814 → 22 [ACK] Seq=1397 Ack=5477 Win=537 Len=0 TSval=2192913292 TSecr=3330254106
  604 28.270826651 153.90.129.147 → 172.31.22.196 TCP 66 47814 → 22 [ACK] Seq=1397 Ack=5601 Win=537 Len=0 TSval=2192913297 TSecr=3330254111
  605 28.561313214 153.90.129.147 → 172.31.22.196 SSH 110 Client: Encrypted packet (len=44)
  606 28.576572217 172.31.22.196 → 153.90.129.147 SSH 126 Server: Encrypted packet (len=60)
  607 28.625476210 153.90.129.147 → 172.31.22.196 TCP 66 47814 → 22 [ACK] Seq=1441 Ack=5661 Win=537 Len=0 TSval=2192913652 TSecr=3330254465
  608 28.679142938 172.31.22.196 → 153.90.129.147 SSH 110 Server: Encrypted packet (len=44)
  609 28.728074362 153.90.129.147 → 172.31.22.196 TCP 66 47732 → 22 [ACK] Seq=1 Ack=2909 Win=1021 Len=0 TSval=2192913754 TSecr=3330254568
  610 28.801255436 153.90.129.147 → 172.31.22.196 SSH 102 Client: Encrypted packet (len=36)
  611 28.816471991 172.31.22.196 → 153.90.129.147 SSH 102 Server: Encrypted packet (len=36)
  612 28.842431348 172.31.22.196 → 35.165.72.110 TCP 74 56992 → 9092 [SYN] Seq=0 Win=26883 Len=0 MSS=8961 SACK_PERM=1 TSval=3604481918 TSecr=0 WS=128
  613 28.858455970 35.165.72.110 → 172.31.22.196 TCP 74 9092 → 56992 [SYN, ACK] Seq=0 Ack=1 Win=26847 Len=0 MSS=1460 SACK_PERM=1 TSval=2507529101 TSecr=3604481918 WS=2
  614 28.865343248 153.90.129.147 → 172.31.22.196 TCP 66 47814 → 22 [ACK] Seq=1477 Ack=5697 Win=537 Len=0 TSval=2192913892 TSecr=3330254705
  615 28.873569496 172.31.22.196 → 35.165.72.110 TCP 66 56992 → 9092 [ACK] Seq=1 Ack=1 Win=27008 Len=0 TSval=3604481949 TSecr=2507529101
  616 29.175911988 172.31.22.196 → 35.165.72.110 TCP 91 56992 → 9092 [PSH, ACK] Seq=1 Ack=1 Win=27008 Len=25 TSval=3604481949 TSecr=2507529101
  617 29.190995931 172.31.22.196 → 153.90.129.147 SSH 110 Server: Encrypted packet (len=44)
  618 29.191909175 35.165.72.110 → 172.31.22.196 TCP 66 9092 → 56992 [ACK] Seq=1 Ack=26 Win=26848 Len=0 TSval=2507529435 TSecr=3604481949
  619 29.192496773 35.165.72.110 → 172.31.22.196 SMPP 344 SMPP Bind_receiver
  620 29.207594416 172.31.22.196 → 35.165.72.110 TCP 66 56992 → 9092 [ACK] Seq=26 Ack=279 Win=28032 Len=0 TSval=3604482283 TSecr=2507529435
  621 29.240228765 153.90.129.147 → 172.31.22.196 TCP 66 47732 → 22 [ACK] Seq=1 Ack=2953 Win=1021 Len=0 TSval=2192914267 TSecr=3330255080
  622 29.687860319 172.31.22.196 → 35.165.72.110 TCP 99 56992 → 9092 [PSH, ACK] Seq=26 Ack=279 Win=28032 Len=33 TSval=3604482283 TSecr=2507529435
  623 29.702924312 172.31.22.196 → 153.90.129.147 SSH 110 Server: Encrypted packet (len=44)
  624 29.706001555 35.165.72.110 → 172.31.22.196 TCP 176 9092 → 56992 [PSH, ACK] Seq=279 Ack=59 Win=26848 Len=110 TSval=2507529948 TSecr=3604482283
  625 29.721240406 172.31.22.196 → 35.165.72.110 SMPP 192 SMPP Replace_sm
  626 29.738977926 35.165.72.110 → 172.31.22.196 SMPP 124 SMPP Query_sm
  627 29.752189238 153.90.129.147 → 172.31.22.196 TCP 66 47732 → 22 [ACK] Seq=1 Ack=2997 Win=1021 Len=0 TSval=2192914778 TSecr=3330255592
  628 29.754244292 172.31.22.196 → 153.90.129.147 SSH 126 Server: Encrypted packet (len=60)
  629 29.754249806 172.31.22.196 → 153.90.129.147 SSH 102 Server: Encrypted packet (len=36)
  630 29.756152891 172.31.22.196 → 35.165.72.110 TCP 66 56992 → 9092 [FIN, ACK] Seq=185 Ack=447 Win=28032 Len=0 TSval=3604482832 TSecr=2507529982
  631 29.759541648 172.31.22.196 → 153.90.129.147 SSH 190 Server: Encrypted packet (len=124)
  632 29.772274871 35.165.72.110 → 172.31.22.196 TCP 66 9092 → 56992 [FIN, ACK] Seq=447 Ack=186 Win=26848 Len=0 TSval=2507530015 TSecr=3604482832
  633 29.787380280 172.31.22.196 → 35.165.72.110 TCP 66 56992 → 9092 [ACK] Seq=186 Ack=448 Win=28032 Len=0 TSval=3604482863 TSecr=2507530015
  634 29.803102924 153.90.129.147 → 172.31.22.196 TCP 66 47814 → 22 [ACK] Seq=1477 Ack=5757 Win=537 Len=0 TSval=2192914829 TSecr=3330255643
  635 29.803115031 153.90.129.147 → 172.31.22.196 TCP 66 47814 → 22 [ACK] Seq=1477 Ack=5793 Win=537 Len=0 TSval=2192914829 TSecr=3330255643
  636 29.808274214 153.90.129.147 → 172.31.22.196 TCP 66 47814 → 22 [ACK] Seq=1477 Ack=5917 Win=537 Len=0 TSval=2192914835 TSecr=3330255648
  637 30.081388414 153.90.129.147 → 172.31.22.196 SSH 110 Client: Encrypted packet (len=44)
  638 30.096671011 172.31.22.196 → 153.90.129.147 SSH 126 Server: Encrypted packet (len=60)
  639 30.145521112 153.90.129.147 → 172.31.22.196 TCP 66 47814 → 22 [ACK] Seq=1521 Ack=5977 Win=537 Len=0 TSval=2192915172 TSecr=3330255985
  640 30.215144499 172.31.22.196 → 153.90.129.147 SSH 110 Server: Encrypted packet (len=44)
  641 30.264246718 153.90.129.147 → 172.31.22.196 TCP 66 47732 → 22 [ACK] Seq=1 Ack=3041 Win=1021 Len=0 TSval=2192915290 TSecr=3330256104
  642 30.321177536 153.90.129.147 → 172.31.22.196 SSH 102 Client: Encrypted packet (len=36)
  643 30.336388876 172.31.22.196 → 153.90.129.147 SSH 102 Server: Encrypted packet (len=36)
  644 30.362660763 172.31.22.196 → 35.165.72.110 TCP 74 56994 → 9092 [SYN] Seq=0 Win=26883 Len=0 MSS=8961 SACK_PERM=1 TSval=3604483438 TSecr=0 WS=128
  645 30.378677151 35.165.72.110 → 172.31.22.196 TCP 74 9092 → 56994 [SYN, ACK] Seq=0 Ack=1 Win=26847 Len=0 MSS=1460 SACK_PERM=1 TSval=2507530622 TSecr=3604483438 WS=2
  646 30.385225085 153.90.129.147 → 172.31.22.196 TCP 66 47814 → 22 [ACK] Seq=1557 Ack=6013 Win=537 Len=0 TSval=2192915412 TSecr=3330256225
  647 30.393796415 172.31.22.196 → 35.165.72.110 TCP 66 56994 → 9092 [ACK] Seq=1 Ack=1 Win=27008 Len=0 TSval=3604483470 TSecr=2507530622
  648 30.711890821 172.31.22.196 → 35.165.72.110 TCP 91 56994 → 9092 [PSH, ACK] Seq=1 Ack=1 Win=27008 Len=25 TSval=3604483470 TSecr=2507530622
  649 30.726957976 172.31.22.196 → 153.90.129.147 SSH 110 Server: Encrypted packet (len=44)
  650 30.727917334 35.165.72.110 → 172.31.22.196 TCP 66 9092 → 56994 [ACK] Seq=1 Ack=26 Win=26848 Len=0 TSval=2507530971 TSecr=3604483470
  651 30.728508328 35.165.72.110 → 172.31.22.196 SMPP 344 SMPP Bind_receiver
  652 30.743584065 172.31.22.196 → 35.165.72.110 TCP 66 56994 → 9092 [ACK] Seq=26 Ack=279 Win=28032 Len=0 TSval=3604483819 TSecr=2507530971
  653 30.743589365 172.31.22.196 → 35.165.72.110 TCP 99 56994 → 9092 [PSH, ACK] Seq=26 Ack=279 Win=28032 Len=33 TSval=3604483819 TSecr=2507530971
  654 30.761085974 35.165.72.110 → 172.31.22.196 TCP 176 9092 → 56994 [PSH, ACK] Seq=279 Ack=59 Win=26848 Len=110 TSval=2507531004 TSecr=3604483819
  655 30.775952794 153.90.129.147 → 172.31.22.196 TCP 66 47732 → 22 [ACK] Seq=1 Ack=3085 Win=1021 Len=0 TSval=2192915802 TSecr=3330256616
  656 30.776339304 172.31.22.196 → 35.165.72.110 SMPP 192 SMPP Replace_sm
  657 30.793760794 35.165.72.110 → 172.31.22.196 SMPP 124 SMPP Query_sm
  658 30.809033419 172.31.22.196 → 153.90.129.147 SSH 126 Server: Encrypted packet (len=60)
  659 30.809039927 172.31.22.196 → 153.90.129.147 SSH 102 Server: Encrypted packet (len=36)
  660 30.810946004 172.31.22.196 → 35.165.72.110 TCP 66 56994 → 9092 [FIN, ACK] Seq=185 Ack=447 Win=28032 Len=0 TSval=3604483887 TSecr=2507531037
  661 30.814313011 172.31.22.196 → 153.90.129.147 SSH 190 Server: Encrypted packet (len=124)
  662 30.827066825 35.165.72.110 → 172.31.22.196 TCP 66 9092 → 56994 [FIN, ACK] Seq=447 Ack=186 Win=26848 Len=0 TSval=2507531070 TSecr=3604483887
  663 30.842167680 172.31.22.196 → 35.165.72.110 TCP 66 56994 → 9092 [ACK] Seq=186 Ack=448 Win=28032 Len=0 TSval=3604483918 TSecr=2507531070
  664 30.858267456 153.90.129.147 → 172.31.22.196 TCP 66 47814 → 22 [ACK] Seq=1557 Ack=6073 Win=537 Len=0 TSval=2192915885 TSecr=3330256698
  665 30.858281333 153.90.129.147 → 172.31.22.196 TCP 66 47814 → 22 [ACK] Seq=1557 Ack=6109 Win=537 Len=0 TSval=2192915885 TSecr=3330256698
  666 30.863163971 153.90.129.147 → 172.31.22.196 TCP 66 47814 → 22 [ACK] Seq=1557 Ack=6233 Win=537 Len=0 TSval=2192915889 TSecr=3330256703
  667 31.239186772 172.31.22.196 → 153.90.129.147 SSH 110 Server: Encrypted packet (len=44)
  668 31.288111112 153.90.129.147 → 172.31.22.196 TCP 66 47732 → 22 [ACK] Seq=1 Ack=3129 Win=1021 Len=0 TSval=2192916314 TSecr=3330257128
  669 31.750881830 172.31.22.196 → 153.90.129.147 SSH 110 Server: Encrypted packet (len=44)
  670 31.799751616 153.90.129.147 → 172.31.22.196 TCP 66 47732 → 22 [ACK] Seq=1 Ack=3173 Win=1021 Len=0 TSval=2192916826 TSecr=3330257640
  671 32.262935217 172.31.22.196 → 153.90.129.147 SSH 110 Server: Encrypted packet (len=44)
  672 32.311838050 153.90.129.147 → 172.31.22.196 TCP 66 47732 → 22 [ACK] Seq=1 Ack=3217 Win=1021 Len=0 TSval=2192917338 TSecr=3330258152
